"판시사항","공익사업의 시행자가 이주대책대상자들에게 주택을 특별공급하면서 분양대금에 포함되는 택지비를 생활기본시설 설치비용에 대한 고려 없이 택지조성원가 이상으로 정한 경우, 생활기본시설 설치비용 전액이 이주대책대상자에게 전가되었다고 볼 수 있는지 여부"
"판시사항","공익사업지구 안에 설치된 도로가 사업지구 내 주택단지 등의 기능 달성 및 전체 주민들의 통행을 위한 필수적인 시설이라고 볼 수 없는 경우, 공익사업의 시행자가 이주대책대상자에게 제공하여야 하는 생활기본시설에 포함되는지 여부"
"판시사항","택지조성원가 중 조성비에 계상된 항목의 비용이 생활기본시설 설치비용에 포함되기 위한 요건과 범위 및 증명책임의 소재"
"이유","한편 사업시행자가 이주대책대상자들에게 주택을 특별공급하면서 분양대금에 포함되는 택지비를 생활기본시설 설치비용에 대한 고려 없이 택지조성원가 이상으로 정한 경우에는 생활기본시설 설치비용 전액이 이주대책대상자에게 전가되었다고 볼 수 있다."
"이유","위 법리에 비추어 보면, 원고들이 특별공급받은 주택의 분양대금에 생활기본시설 설치비용이 전가되었음을 원인으로 하여 부당이득반환을 구하는 이 사건에서, 원심이 유상공급면적 1㎡당 생활기본시설 설치비용에 원고들이 특별공급받은 주택의 대지권 면적을 곱하는 방식으로 부당이득액을 산정한 것은 정당하다."
"이유","위와 같은 부당이득액 산정 방식에 따르면 택지조성원가는 부당이득액 산정의 요소가 되지 아니할 뿐만 아니라 택지조성원가를 구성하는 비용 항목 중 일부를 택지조성원가에서 제외하는 경우 제외된 비용 항목은 생활기본시설 설치비용에서도 제외되어 오히려 부당이득액이 감소되는 결과가 된다."
"이유","따라서 택지조성원가에서 예비비, 일부 지하차도·교량·터널 공사비가 제외되어야 한다는 이 부분 상고이유의 주장은 판결 결과에 영향을 미칠 수 없는 사유를 주장하는 것에 불과할 뿐만 아니라 도리어 자기에게 불리한 주장에 해당하여 받아들일 수 없다."
"이유","사업지구 내 주택단지 등의 기능 달성 및 전체 주민들의 통행을 위한 필수적인 시설이라고 볼 수 없는 특별한 사정이 있으면 생활기본시설에 포함되지 아니한다."
"이유","원심판결 이유를 이러한 법리와 기록에 비추어 살펴보면, 원심의 이유 설시에 다소 적절하지 아니한 점이 있기는 하나 이 사건 사업지구 내에 설치된 국가지원지방도 및 분당-내곡간 고속화도로가 생활기본시설인 도로에 해당한다."
"이유","경부고속도로와 용인서울고속도로는 생활기본시설인 도로에 해당하지 않는다고 본 원심의 결론은 정당한 것으로 수긍할 수 있고, 거기에 원고들 및 피고들의 각 상고이유 주장과 같은 생활기본시설의 범위 및 부당이득에 관한 법리오해, 이유모순, 대법원판례 위반 등으로 판결에 영향을 미친 위법이 있다고 할 수 없다."
"이유","택지조성공사비에 계상된 도로 및 포장공·가로등공·지하차도·터널·교량·교량 공사비 중 이 사건 사업지구 내의 총 도로면적에 대한 생활기본시설인 도로면적의 비율에 해당하는 금액만이 생활기본시설 설치비용에 포함된다고 판단하였다."
"이유","원심이 적법하게 채택한 증거 등에 의하면 ① 광역교통대책 중 재원부담부분에는 용인서울고속도로로 명칭이 변경된 ‘영덕-양재도로’를 이 사건 사업시행자가 아닌 다른 민간사업자가 건설하되 피고들을 비롯한 이 사건 사업의 공동시행자들은 그 건설비용 중 4,400억 원을 부담하는 것으로 기재되어 있는 점이다."
"이유","그 내역에 따르면 경부고속도로와 용인서울고속도로에는 위 지하차도 등 항목의 공사비가 전혀 사용되지 아니한 점 등의 사정을 알 수 있다. 이러한 사정을 종합하면, 도로 관련 조성공사비는 경부고속도로와 용인서울고속도로의 설치와는 무관한 비용으로서 그 전액이 생활기본시설인 도로의 설치비용에 해당할 여지가 크다고 할 것이다."
"이유","그럼에도 원심은 이에 관하여 제대로 살피지 아니한 채 그 판시와 같은 이유만을 들어 도로 관련 조성공사비 중 일부만이 생활기본시설 설치비용에 포함된다고 판단하였다."
"이유","다만 실제 택지조성공사비를 산정하면서 ‘도로 및 포장공·가로등공’ 설치비용은 전체 도로면적에 대한 생활기본시설인 도로면적의 비율에 해당하는 금액만 산입한 반면, ‘지하차도·터널·교량·교량 공사비’는 설치비용 전액을 산입하였다."
"이유","이러한 원심의 판단에는 생활기본시설 설치비용의 범위에 관한 법리를 오해하여 필요한 심리를 다하지 아니함으로써 판결에 영향을 미친 위법이 있다."
"이유","택지조성원가 중 조성비에 계상된 항목의 비용은 그 비용 지출과 생활기본시설 설치와의 관련성, 즉 생활기본시설 설치를 위하여 해당 비용이 지출된 것으로 인정되어야만 그 전부 또는 총사업면적에 대한 생활기본시설 설치면적의 비율 범위 내에서 생활기본시설 설치비용에 포함된다."
"이유","위 법리에 비추어 기록을 살펴보면, 원심이 그 판시와 같은 이유로 구조물공, 문화재조사·발굴비, 야생수목이식공사, 건설폐기물처리 항목의 비용이 생활기본시설 설치비용에 포함되지 아니한다고 판단한 것은 정당한 것으로 수긍할 수 있다."
"이유","거기에 원고들의 상고이유 주장과 같은 생활기본시설 설치비용의 범위에 관한 법리오해 등의 위법이 있다고 볼 수 없다."
"이유","다만 원심은 예비비 항목의 비용도 생활기본시설 설치비용에 포함되지 아니한다고 판단하였으나, 이러한 원심의 판단은 다음과 같은 이유로 수긍하기 어렵다."
"이유","따라서 이 부분 원심판결에는 생활기본시설 설치비용의 범위에 관한 법리를 오해하여 판결에 영향을 미친 위법이 있다."
"이유","그러므로 원심판결 중 원고들 패소 부분을 파기하고, 이 부분 사건을 다시 심리·판단하도록 원심법원에 환송하며, 피고들의 상고를 각 기각하기로 하여, 관여 대법관의 일치된 의견으로 주문과 같이 판결한다."
