"판결요지","공공용지의취득및손실보상에관한특례법에 의한 협의취득은 토지수용법상의 수용과 달리 사법상의 매매에 해당하고 그 효력은 당사자에게만 미치므로, 무권리자로부터 협의취득이 이루어졌다고 하더라도 진정한 권리자는 권리를 상실하지 아니한다."
"판결요지","무권리자가 타인의 권리를 자기의 이름으로 또는 자기의 권리로 처분한 경우에, 권리자는 후일 이를 추인함으로써 그 처분행위를 인정할 수 있다."
"판결요지","특별한 사정이 없는 한 이로써 권리자 본인에게 위 처분행위의 효력이 발생함은 사적 자치의 원칙에 비추어 당연하고, 이 경우 추인은 명시적으로뿐만 아니라 묵시적인 방법으로도 가능하며 그 의사표시는 무권대리인이나 그 상대방 어느 쪽에 하여도 무방하다."
"이유","결국 피고는 위 임야의 등기명의자임을 기화로 법률상 원인 없이 위 금원 상당의 이득을 얻고 원고는 원인무효인 피고 명의의 등기로 인하여 위 금원 상당의 손해를 입었다 할 것이어서, 피고는 원고에게 위 금원 상당을 부당이득으로 반환할 의무가 있다고 판단하였다."
"이유","부산광역시 동래구가 무권리자인 피고로부터 원고의 지분에 해당하는 이 사건 임야 중 6/25지분을 협의취득하였다고 하더라도 이는 원인무효가 되어 원고가 그 지분에 대한 소유권을 상실하지 아니함은 상고이유의 주장과 같다."
"이유","부산광역시 동래구가 피고로부터 1997. 2. 11. 이 사건 임야를 협의취득한 것은 공공용지의취득및손실보상에관한특례법에 의한 것으로 보인다."
"이유","무권리자가 타인의 권리를 자기의 이름으로 또는 자기의 권리로 처분한 경우에, 권리자는 후일 이를 추인함으로써 그 처분행위를 인정할 수 있다."
"이유","이러한 경우 특별한 사정이 없는 한 권리자 본인에게 위 처분행위의 효력이 발생함은 사적 자치의 원칙에 비추어 당연하다 할 것이다."
"이유","이 경우 추인은 명시적으로뿐만 아니라 묵시적인 방법으로도 가능하며 그 의사표시는 무권대리인이나 그 상대방 어느 쪽에 하여도 무방하다 할 것이다."
"이유","이는 원고가 무권리자인 피고의 위 처분행위를 묵시적으로 추인한 것이라고 봄이 상당하고 그렇다면 부산광역시 동래구는 이 사건 임야 중 원고의 지분에 대하여도 소유권을 적법하게 취득하게 되었다 할 것이다."
"이유","피고는 원고에게 위 협의취득으로 수령한 손실보상금 중 원고 지분 상당액을 부당이득으로서 반환할 의무가 있다고 할 것이다."
"이유","한편, 상고이유에서 들고 있는 판례들은 그 사안을 달리하거나 공공용지의취득및손실보상에관한특례법에 의하여 협의취득한 이 사건에 적용될 수 없는 토지수용법상의 수용을 전제로 한 것이어서 모두 적절한 것이라고 할 수 없다."
"이유","앞서 본 바와 같은 이유로 원고가 피고에 대하여 그 손실보상금 상당의 부당이득반환을 구할 수 있다고 보는 이상, 피고가 부당이득의 반환을 거절하는 것이 신의성실의 원칙에 비추어 허용될 수 없다고 한 원심 판단의 당부에 관한 상고이유에 대하여는 더 나아가 판단할 필요가 없다."
