"이유","소외 1은 위 피고 2에게 앞서 소외 5에게 제시한 바 있던 위조된 소외 2 명의의 근저당권설정용 인감증명서를 교부한다."
"이유","이에 반하는 듯한 갑 제4호증의 일부기재, 을 제1호증의 10, 11의 각 기재는 믿지 아니하며 달리 반증 없다."
"이유","이에 부합하는 갑 제3호증의 3, 갑 제3호증의 4의 각 기재, 당심증인 소외 5의 증언은 믿기 어렵고 달리 이를 인정할 증거가 없으므로 이를 전제로 한 원고의 주장은 이유 없다."
"이유","이러한 사실관계와 위 제1항에서 인정한 바와 같이 위 피고 2가 인감증명서와 경로우대증으로 소외 2 본인 여부를 확인하고 경로우대증 사본에 무인을 받아 놓는 등 등기위촉인 본인 여부 확인을 위한 주의를 기울였다."
"이유","그렇다면, 피고들에게 소외 2의 본인 여부를 확인함에 있어 과실이 있음을 전제로 하는 원고의 청구는 더 나아가 살필 필요 없이 이유 없어 기각할 것인 바이다."
"이유","이와 결론을 같이 한 원심판결은 정당하므로 원고의 항소는 이유 없어 이를 기각하고 항소비용은 패소한 원고의 부담으로 하여 주문과 같이 판결한다."
