"판시사항","구 주택건설촉진법 시행령 제43조의5 제1항 제2호 소정의 하자보수보증계약의 약관상 보증대상이 되는 ‘사용검사 이후에 발생한 하자’의 의미"
"판시사항","법원의 착오로 선서를 누락한 감정인이 작성한 감정 결과의 서면이 당사자에 의하여 서증으로 제출된 경우, 법원이 이를 사실인정의 자료로 삼을 수 있는지 여부"
"판결요지","구 주택건설촉진법 제17조에 따른 하자보수보증금 예치의무를 이행하기 위하여, 주택사업공제조합과 사이에 아파트 신축공사에 관하여 보증기간을 정하여 구 주택건설촉진법 시행령 제43조의5 제1항 제2호 소정의 하자보수보증계약이 체결되었다."
"판결요지","조합은 보증기간 동안 발생한 하자에 대하여 공동주택관리령에서 정한 절차에 따라 그 보수이행청구를 받았음에도 조합원이 이를 이행하지 아니함으로써 입주자대표회의가 입은 손해를 보상한다."
"판결요지","증거의 취사와 사실의 인정은 사실심의 전권에 속하는 것으로서 이것이 자유심증주의의 한계를 벗어나지 않는 한 적법한 상고이유로 삼을 수 없다. "
"이유","구 주택건설촉진법 제38조 제15항, 구 공동주택관리령 제17조에 따른 하자보수보증금 예치의무를 이행하기 위하여, 주택사업공제조합과 사이에 아파트 신축공사에 관하여 보증기간을 정하여 구 주택건설촉진법 시행령 제43조의5 제1항 제2호 소정의 하자보수보증계약이 체결되었다."
"이유","조합은 보증기간 동안 발생한 하자에 대하여 공동주택관리령에서 정한 절차에 따라 그 보수이행청구를 받았음에도 조합원이 이를 이행하지 아니함으로써 입주자대표회의가 입은 손해를 보상한다."
"이유","그 보증대상이 되는 손해는 공동주택관리령에 따라 하자보수를 청구할 수 있는 하자로 인한 손해이어야 할 것이다."
"이유","그 보증대상이 되는 하자는 공동주택관리령 제16조 제1항 및           공동주택관리규칙 제11조 제1항에서 규정하고 있는 하자이어야 한다."
"이유","결국 보증대상이 되는 하자는 미시공, 변경시공 그 자체가 아니라, ‘공사상의 잘못으로 인하여 건축물 또는 시설물 등의 기능상ㆍ미관상 또는 안전상 지장을 초래할 수 있는 균열ㆍ처짐 등의 현상이 발생한 것’을 의미한다고 보아야 할 것이다."
"이유","그와 같은 균열 등이 실제로 나타나서 기능상ㆍ미관상 또는 안전상 지장을 초래하게 되었을 때 하자가 발생하였다고 보아야 할 것이다."
"이유","한편, 그 보증대상이 되는 하자가 되기 위해서는 보증계약에서 정한 보증기간 동안에 발생한 하자로서 사용검사일 이후에 발생한 하자이어야 한다."
"이유","공사상의 잘못으로 주택의 기능상ㆍ미관상 또는 안전상 지장을 초래하는 균열 등이 사용검사 후에 비로소 나타나야만 한다 할 것이다."
"이유","사용검사 이전에 나타난 균열 등은 그 상태가 사용검사 이후까지 지속되어 주택의 기능상·미관상 또는 안전상 지장을 초래한다 할지라도 이는 위 의무하자보수보증계약의 보증대상이 되지 못한다 할 것이다."
"이유","위 각 하자는 이 사건 보증계약의 보증대상이 되는 하자의 범위에 포함될 수 없다고 판단하였는 바이다."
"이유","거기에 채증법칙을 위배하여 사실을 오인하였거나 하자보수보증계약 약관상 보증대상이 되는 ‘사용검사 이후에 발생한 하자’의 의미에 관한 법리를 오해한 위법 등이 있다 할 수 없다."
"이유","민사소송법 제202조가 선언하고 있는 자유심증주의는 형식적·법률적인 증거규칙으로부터의 해방을 뜻할 뿐 법관의 자의적인 판단을 인용한다는 것이 아니므로 적법한 증거조사절차를 거친 증거능력 있는 적법한 증거에 의하여 사회정의와 형평의 이념에 입각하여 논리와 경험의 법칙에 따라 사실주장의 진실 여부를 판단하여야 할 것이다."
"이유","사실인정이 사실심의 전권에 속한다 하더라도 이같은 제약에서 벗어날 수 없는 것인 이상, 선서하지 아니한 감정인에 의한 감정 결과는 증거능력이 없다."
"이유","기록에 의하면, 제1심법원은 건축사 소외 1을 감정인으로 지정하였으나 그로부터 선서를 받지 아니한 채 민사소송법 제341조에 의한 감정의 촉탁을 하고 말았다."
"이유","그 후 소외 1이 이 사건 아파트 1,800세대에 관한 하자감정 결과를 기재한 감정서를 위 법원에 제출하였다."
"이유","피고가 이에 대하여 선서하지 아니한 감정인에 의한 감정 결과라는 이유로 그 증거능력이 없다고 주장하자, 원고가 갑 제13호증으로 위 감정서를 위 법원에 제출하였음을 알 수 있다."
"이유","앞서 본 법리에 비추어 보면, 위와 같이 원심이 갑 제13호증인 위 감정서를 이 사건 아파트 1,800세대의 하자의 존부의 판단 및 그 보수비의 산정에 있어 증거자료로 삼은 것은 옳은 것으로 수긍이 간다."
"이유","증거의 취사와 사실의 인정은 사실심의 전권에 속하는 것으로서 이것이 자유심증주의의 한계를 벗어나지 않는 한 적법한 상고이유로 삼을 수 없는 것인 바이다."
"이유","위 법리와 기록에 비추어 살펴보면, 원심이 갑 제13호증인 위 감정서를 참작하여 이 사건 아파트 각 세대, 공용부분, 부속동, 토목분야 등의 균열보수에 대한 보수공사비용을 산정한 조치는 옳은 것으로 수긍이 간다."
"이유","원심은, 그 채용 증거들을 종합하여 판시와 같은 사실을 인정한 다음, 이 사건 원심판결의 별지 하자내역표 중 부속동 하자내역 다.의 3항 법면 시공 불량의 하자는 사용검사 이후에 발생한 하자로서 이 사건 하자보수보증계약에 따른 보증대상인 하자라고 판단한다."
"이유","거기에 채증법칙을 위배하여 사실을 오인하였거나 하자보수보증계약 약관상 보증대상이 되는 ‘사용검사 이후에 발생한 하자’의 의미에 관한 법리를 오해한 위법 등이 있다 할 수 없다."
"이유","2004. 9.경의 우천시 법면의 일부가 붕괴한 하자는 이에 관하여 원고가 소외 2에 대하여 일정한 기간을 정한 하자보수통지를 하지 아니한 이상 하자보수보증계약 약관상의 ‘보증사고’가 발생하였다고 할 수 없다."
"이유","따라서 위 2004. 9.경의 법면 붕괴 사고는 위 법면 시공 불량의 하자에 포함되는 것에 지나지 않으므로, 위 상고이유의 주장은 받아들일 수 없다."
