"판시사항","가등기에 의하여 순위 보전의 대상이 되어 있는 물권변동청구권이 양도된 경우, 그 가등기상의 권리의 이전등기를 가등기에 대한 부기등기의 형식으로 경료할 수 있는지 여부"
"이유","계약 당일 위 계약금만을 지급받은 상태에서 위 소외 2에게 위 6/20 지분에 관한 소유권이전등기를 경료하여 주었다."
"이유","이를 양도한 경우에는 양도인과 양수인의 공동신청으로 그 가등기상의 권리의 이전등기를 가등기에 대한 부기등기의 형식으로 경료할 수 있다고 보아야 할 것이다."
"이유","이와 달리 가등기를 한 자가 아직 본등기를 하기 전에 그 가등기 명의자를 등기의무자로 하여 다시 그 부동산에 관한 등기이전의 부기등기를 할 수 없다는 취지로 판시한 대법원 1972. 6. 2.자 72마399 결정의 견해는 이를 변경하기로 한다."
"이유","따라서 피고에게 위 1985. 10. 22.자 양도약정을 원인으로 하여 원고에 대하여 이 사건 부동산지분에 관하여 경료된 소유권이전청구권가등기의 이전등기절차의 이행을 명한 원심의 조치는 정당하다."
"이유","위 명의신탁약정 및 그에 터잡은 피고 명의의 위 가등기도 부동산실권리자명의등기에관한법률 제11조 소정의 유예기간 내에 실명등기를 하지 아니하여 무효로 되었으므로 이 사건 청구는 실체관계를 따질 필요 없이 이유 없다는 데에 있다."
"이유","그러나 기록에 의하면 이 주장은 피고가 상고심에 이르러 비로소 내세우는 사유이고 원심에서는 주장한 바가 없음이 명백하므로 원심판결에 대한 적법한 상고이유가 될 수 없다. "
"이유","소론이 들고있는 대법원 1997. 5. 1.자 97마384 결정은 이 사건과는 사안을 달리하는 것으로 여기에 원용하기에 적절치 않다."
"이유","그러므로 상고를 기각하고 상고비용은 패소자의 부담으로 하기로 하여 관여 법관의 일치된 의견으로 주문과 같이 판결한다."
