"판시사항","부동산 매수 당시 근저당권회복등기의 예고등기가 경료되어 있은 경우, 매수인에게 그 이해관계자들의 이해관계 및 계속중인 소송의 진행사항들을 제대로 조사하지 않은 채 만연히 근저당권말소등기가 유효한 것으로 믿고 적절한 조치를 취하지 않은 과실이 있다는 이유로 과실상계를 인정한 사례."
"이유","피고는 서울 강서구 화곡동에서 법무사 사무실을 운영하던 중, 소외 1로부터 1992. 1.경 이 사건 각 부동산에 관하여 경료되어 있는 근저당권설정등기에 관하여 근저당권설정계약해지를 원인으로 하여 말소하여 줄 것을 의뢰받고, 이를 위 사무소 사무원인 소외 2로 하여금 처리하게 하였다."
"이유","소외 2는 그 위임 여부에 관하여 이를 확인하지 아니한 채 만연히 근저당권자인 위 여정대가 이 사건 근저당권의 말소등기신청을 소외 1에게 위임한 것으로 속단하였다."
"이유","이 사건 근저당권설정등기의 말소등기신청을 하여 이 사건 근저당권설정등기는 1992. 1. 23.자로 같은 달 22. 근저당권설정계약해지를 원인으로 하여 각 말소되었다."
"이유","한편, 소외 OOO은 소외 1로부터 이 사건 각 부동산을 금 1억 원에 매수하여, 위와 같이 이 사건 근저당권설정등기가 말소되기 하루 전인 1992. 1. 22. 증여를 원인으로 소유권 및 지분권이전등기를 경료하였다."
"이유","원고는 1996. 12. 28. 위 OOO으로부터 이 사건 각 부동산을 금 1억 원에 매수하여 1997. 2. 15. 증여를 원인으로 이 사건 각 부동산에 관하여 소유권 및 지분권이전등기를 경료하였다."
"이유","그런데 위 여정대가 근저당권자인 자신의 동의가 없었는데도 자신의 의사 및 실체관계에 반하여 이 사건 근저당권설정등기가 위법하게 말소되었음을 이유로 대전지방법원 93가단20532호로 위 말소된 근저당권설정등기의 회복등기청구의 소를 제기하여 승소함으로써, 위와 같이 말소되었던 이 사건 근저당권에 관하여 1997. 11. 19. 말소회복등기가 경료되었다."
"이유","구 법무사법제23조에 의하면, 법무사가 사건의 위촉을 받은 경우에는 위촉인에게 법령에 의하여 작성된 인감증명서나 주민등록증 등을 제출 또는 제시하게 하거나 기타 이에 준하는 확실한 방법으로 위촉인이 본인 또는 그 대리인임이 상위 없음을 확인하여야 한다고 규정하고 있는바이다."
"이유","위에서 인정한 사실에 의하면, 피고의 직원인 소외 2로서는 이 사건 근저당권설정등기의 말소등기절차를 근저당권자인 위 여정대 본인으로부터 위촉받은 것이 아니라, 이해관계가 대립되고 있는 근저당권설정자인 소외 1로부터 위촉받았을 뿐만이 아니다."
"이유","이에 피고는, 원고가 1997. 2. 15. 위 OOO으로부터 이 사건 각 부동산에 관하여 소유권 및 지분권이전등기를 경료받기 이전인 1993. 7. 29. 이 사건 각 부동산에 관하여 말소된 위 근저당권설정등기에 대하여 이미 근저당권회복의 예고등기가 경료되어 있었다."
"이유","비록 예고등기가 있은 후에 그 사실을 알고 권리를 취득하여도 그 권리에 영향이 없다고 할 것인 즉, 원고가 이 사건 각 부동산을 취득할 당시 이에 관하여 이미 말소된 근저당권설정등기에 관하여 그 근저당권회복의 예고등기가 경료되어 있었다."
"이유","원고가 이러한 사실을 알고서 이 사건 각 부동산을 취득하였다고 하여 원고의 권리취득에 하등의 장애사유가 될 수 없어, 피고의 손해배상책임이 성립하는 데는 아무런 지장이 없다 할 것이어서 피고의 이 부분 주장은 이유 없다 할 것이다."
"이유","그러나 한편, 원고로서는 이 사건 부동산을 매수할 당시 위 근저당권회복등기의 예고등기가 경료되어 있었던 이상 위 근저당권말소등기의 회복의 소가 제기되었다는 사실을 알고 있었다고 추정된다."
"이유","이러한 상태에서 원고로서는 이해관계자들의 이해관계 및 계속중인 위 소송의 진행사항들을 주의깊게 조사하여 불측의 손해를 입지 아니하도록 조치를 강구하여야 함에도 불구하고, 만연히 위 근저당권의 말소등기를 유효한 것으로 경신하고 이 사건 부동산을 매수한 과실이 있다 할 것이다."
"이유","이러한 원고의 과실은 이 사건 손해발생의 한 원인이 되었다 할 것이므로 피고가 배상하여야 할 손해액을 정함에 있어 이를 참작하기로 하되, 그 비율은 앞서 본 사실관계에 비추어 20% 정도로 정함이 상당하다 할 것이다."
"이유","나아가 피고가 원고에게 배상하여야 할 손해액에 관하여 보건대, 원고로서는 이 사건 근저당권설정등기가 적법하게 말소되었다고 믿고 이 사건 부동산을 매수하였으나, 그 후 앞서 본 바와 같이 위 말소된 근저당권이 회복되었다."
"이유","앞서 본 원고의 과실을 참작하면 결국 피고가 원고에게 배상하여야 할 금원은 금 80,000,000원이 된다고 할 것이다."
"이유","이와 결론을 일부 달리한 원심판결 중 위 인용 부분을 초과하여 지급을 명한 피고 패소 부분은 부당하므로 이를 취소하고, 그 취소 부분에 해당하는 원고의 청구를 기각하기로 하며, 피고의 나머지 항소는 이유 없어 이를 기각하기로 하여 주문과 같이 판결한다."
