"판결요지","‘징발재산 정리에 관한 특별조치법’ 제20조의2에 따라 피징발자 또는 그 상속인이 수의계약에 의하여 국가로부터 징발재산을 매수할 수 있는 지위는 국가가 수의계약에 의한 매각의 통지를 하여야 비로소 행사할 수 있는 잠재적 지위에 불과한 것이기는 하나, 이는 자유롭게 양도할 수 있다."
"판결요지","위와 같이 매수할 수 있는 지위가 양도된 경우에는 양도원인이 되는 매매·증여 기타의 채권계약에서 달리 약정한 것이 없는 한, 양도인은 원인계약에 기하여 양수인이 양도목적물인 환매지위에 관하여 완전한 이익을 누릴 수 있도록 협력할 의무를 진다."
"판결요지","그리고 양수인이 징발재산을 취득하려면 징발재산특조법규정에 좇아 국가로부터 매각의 통지를 받고 그로부터 3월 이내에 매수의 신청을 하여야 하므로, 양도인은 앞에서 본 협력의무의 일환으로 양수인이 국가와 사이에서 매각절차를 밟을 수 있도록 국가에 대하여 환매지위를 양수인에게 양도하였다는 사실을 통지할 의무가 있다고 봄이 타당하다."
"이유","‘징발재산 정리에 관한 특별조치법’ 제20조의2는 제1항에서 그 법에 의하여 매수한 징발재산이 그 후 군사상 필요가 없게 된 경우에 관하여 국가는 국유재산법의 규정에 불구하고 수의계약에 의하여 매각 당시의 시가로 피징발자 또는 그 상속인에게 매각할 수 있다고 한다."
"이유","제4항에서는 피징발자 또는 그 상속인이 제3항의 규정에 의한 통지를 받은 날로부터 3월 이내에 매수신청을 하지 아니한 때에는 그 매수를 포기한 것으로 본다고 정하고 있다."
"이유","피징발자 또는 그 상속인이 수의계약에 의하여 국가로부터 징발재산을 매수할 수 있는 지위는 국가가 수의계약에 의한 매각의 통지를 하여야 비로소 행사할 수 있는 잠재적 지위에 불과한 것이기는 하나, 이는 자유롭게 양도할 수 있다."
"이유","위와 같이 매수할 수 있는 지위가 양도된 경우에는 그 양도원인이 되는 매매·증여 기타의 채권계약에서 달리 약정한 것이 없는 한, 양도인은 그 원인계약에 기하여 양수인이 양도목적물인 환매지위에 관하여 완전한 이익을 누릴 수 있도록 협력할 의무를 진다고 할 것이다."
"이유","법 제20조의2 제4항에서 정한 기간 내에 매수통지를 하였으나 이후 이를 철회하였고, 피고 4는 위 통보를 받고도 위 기간 내에 매수통지를 하지 아니한 사실 등을 알 수 있다."
"이유","소외 2와 소외 1 사이의 양도양수계약에 따라 소외 1에게 양도되었다 할 것이므로, 소외 2의 상속인들인 피고들은 대한민국에 대하여 위와 같은 양도사실을 통지할 의무가 있다."
"이유","그리고 이는 위와 같이 매각 결정 통보를 받고도 적법한 매수통지를 하지 아니한 피고 2, 4의 경우에도 마찬가지이다."
"이유","이 부분 원고들의 청구를 배척하고 말았으니, 이러한 원심판결에는 관련 법리를 오해하여 판결 결과에 영향을 미친 위법이 있다."
"이유","피고 1, 3의 상고이유에 대하여 이 부분 상고이유의 주장은 결국 사실심인 원심의 전권에 속하는 증거의 취사선택과 사실인정을 다투는 취지에 불과하여 적법한 상고이유로 보기 어렵다."
"이유","원심의 이 부분 판단을 기록에 비추어 살펴보더라도 논리와 경험칙에 위반하여 자유심증주의의 한계를 벗어나는 등의 잘못이 있다고 볼 수도 없다."
"이유","이에 원심판결 중 원고들 패소 부분을 파기하고 이 부분 사건을 다시 심리·판단하도록 원심법원에 환송하며, 피고 1, 3의 상고를 기각하고, 이 부분 상고비용은 패소자들이 부담하도록 하여, 관여 대법관의 일치된 의견으로 주문과 같이 판결한다."
