"이유","피고는 인천시 부평구 부개3동에 있는 OOO아파트 14개 동 1240세대를 건축하여 분양한 사업주체이고, 보조참가인들은 이 사건 아파트의 시공자이며, 원고는 주택법 및 주택법 시행령에 따라 이 사건 아파트의 관리를 위하여 입주자들에 의해 구성된 자치관리기구이다."
"이유","보조참가인들이 이 사건 아파트를 신축하면서 설계도면에 따라 시공하여야 할 부분을 시공하지 아니하거나 부실시공하거나 또는 설계도면과 다르게 변경하여 시공하는 등으로, 이 사건 아파트의 공용부분과 전유부분에는 건물 외벽 및 내부 균열, 누수, 백화, 철근노출 등의 하자가 발생하였다."
"이유","이에 원고는 구분소유자들의 요청에 따라 피고 등에게 하자보수공사를 지속적으로 요청하여 피고측이 일부 보수공사가 실시하기도 하였으나, 이 사건 아파트에는 여전히 별지 각 하자내역표 ‘하자 항목’란 각 기재와 같은 하자가 남아 있다."
"이유","2008. 4.경까지 이 사건 아파트 1240세대 중 1031세대의 구분소유자들로부터 이 사건 아파트 하자보수에 갈음하는 손해배상청구권을 양수하였고, 위 구분소유자들은 피고에게 채권양도 통지를 하였다. "
"이유","위와 같이 채권을 양도한 구분소유자들이 소유하는 세대의 전유면적 합계는 87,418.49㎡로서 총 전유면적 105,139.60㎡의 83.14%에 해당한다."
"이유","원고는 이 사건 아파트의 구분소유자들이 피고에 대하여 가지는 하자보수에 갈음하는 손해배상채권의 양수를 청구권원으로 하여, 이 사건 아파트의 하자보수에 갈음하는 손해배상을 구한다."
"이유","제1조 또는 제1조의 2의 건물을 건축하여 분양한 자의 담보책임에 관하여는 민법 제667조 내지 제671조의 규정을 준용한다."
"이유","부칙 제6조 집합주택의 관리방법과 기준에 관한 주택건설촉진법의 특별한 규정은 그것이 이 법에 저촉하여 구분소유자의 기본적인 권리를 해하지 않는 한 효력이 있다."
"이유","건축법 제8조의 규정에 의하여 건축허가를 받아 분양을 목적으로 하는 공동주택을 건축한 건축주 및 제42조 제2항 제2호의 행위를 한 시공자를 포함한다. 이하 이 조에서 같다."
"이유","제1항의 규정에 의한 사업주체는 공동주택의 내력구조부에 중대한 하자가 발생한 때에는 사용검사일부터 10년 이내의 범위에서 이를 보수하고, 그로 인한 손해를 배상할 책임이 있다."
"이유","구 주택법시행령 제59조 ① 법 제46조제1항의 규정에 의하여 사업주체가 보수책임을 부담하는 하자의 범위, 시설구분에 따른 하자보수책임기간 등은 [별표 6]과 같다. "
"이유","입주자·입주자대표회의·관리주체 또는「집합건물의 소유 및 관리에 관한 법률」에 의하여 구성된 관리단은 제1항의 규정에 의한 하자보수책임 기간 내에 공동주택의 하자가 발생한 경우에는 사업주체에 대하여 그 하자의 보수를 요구할 수 있다."
"이유","구 주택건설촉진법 및 구 공동주택관리령에서 정한 규정들은 행정적인 차원에서 공동주택의 하자보수 절차·방법 및 기간 등을 정하고 하자보수보증금으로 신속하게 하자를 보수할 수 있도록 하는 기준을 정한 것으로만 해석하였다."
"이유","집합건물법 부칙 제6조 집합주택의 관리방법과 기준에 관한 주택법의 특별한 규정은 그것이 이 법에 저촉하여 구분소유자의 기본적인 권리를 해하지 않는 한 효력이 있다."
"이유","건축법 제8조의 규정에 의하여 건축허가를 받아 분양을 목적으로 하는 공동주택을 건축한 건축주 및 제42조 제2항 제2호의 행위를 한 시공자를 포함한다."
"이유","사업주체는 제1항의 규정에 의한 담보책임기간 안에 공동주택의 내력구조부에 중대한 하자가 발생한 때에는 하자발생으로 인한 손해를 배상할 책임이 있다."
"이유","담보책임 및 하자보수에 관한 경과조치) 이 법 시행 전에 「주택법」 제29조의 규정에 의한 사용검사 또는 「건축법」 제18조의 규정에 의한 사용승인을 얻은 공동주택의 담보책임 및 하자보수에 관하여는 제46조의 개정규정을 적용한다."
"이유","개정 주택법과 집합건물법은, 공동주택의 담보책임 및 하자보수에 관하여 집합건물법과 그에 의하여 준용되던 민법 제667조 내지 제671조의 규정의 적용을 명문으로 배제하고 통일적으로 개정 주택법 제46조의 규정만이 적용되도록 하였다."
"이유","헌법재판소는 2008. 7. 31. 2005헌가16 결정으로, 개정 주택법 시행 전에 주택법 제29조의 규정에 의한 사용검사 또는 건축법 제18조의 규정에 의한 사용승인을 얻은 공동주택의 담보책임 및 하자보수에 관하여 주택법 제46조의 개정규정을 적용하도록 한 개정 주택법 부칙 제3항이 위헌이라고 결정하였다."
"이유","이 사건 아파트는 개정 주택법 시행 전인 1997. 10. 21. 사용검사를 받았으므로, 이에 대하여는 개정 주택법 제46조가 아니라 종전과 같이 집합건물법과 그에 의하여 준용되는 민법 제667조 내지 671조가 적용되어야 한다."
"이유","따라서 이 사건 아파트를 분양한 피고는 이 사건 아파트 구분소유자들로부터 아파트 하자로 인한 손해배상채권을 양수한 원고에게 집합건물법 제9조에 의하여 하자보수에 갈음하는 손해배상금을 지급할 의무가 있다."
"이유","위 인정사실 및 변론 전체의 취지를 종합하면, 피고는 특별한 사정이 없는 한 원고에게 별지 각 하자내역표 기재와 같이 이 사건 아파트에 현존하는 각 하자의 보수에 필요한 비용 중 원고가 채권을 양수받은 부분 및 이에 대한 지연손해금을 지급할 의무가 있다."
"이유","다만, 이 사건 아파트는 준공 후 입주가 완료되어 실제 하자감정이 시행된 날까지도 이미 9년 7개월 이상의 시간이 흘렀으므로 자연발생적인 노화현상에 기인한 하자가 포함되어 있을 수 있는 점이다."
"이유","피고가 시공업체인 보조참가인을 통하여 그동안 원고 요청에 따라 여러 차례 하자보수를 시행하였던 점, 원고의 아파트 관리상의 잘못으로 인하여 하자가 확대된 사정도 배제할 수 없는 점이다."
"이유","뒤에서 보는 바와 같이 하자보수로 인정하는 균열의 범위와 그 수리방법인 도장의 범위를 다소 넓게 인정하여 손해배상액의 산정이 커졌다."
"이유","피고가 배상하여야 할 손해의 범위는 공평의 원칙에 따라 일부 제한하는 것이 타당하고 그 범위는 이 사건 변론에 나타난 제반 사정을 종합적으로 고려하여 전체 보수비용의 70% 정도로 제한함이 상당하다고 할 것이다."
"이유","살피건대, 구분소유자의 하자보수에 갈음한 손해배상청구권은 집합건물법 제9조에 의하여 인정되는 법정책임이므로, 하자보수에 갈음하는 손해배상청구권은 5년의 상사 소멸시효가 아니라 민법 제162조 제1항에 따라 10년의 소멸시효가 적용된다고 보아야 한다."
"이유","한편, 소멸시효는 채권자가 권리를 행사할 수 있는 때로부터 진행하는바, 이 사건 소는, 소멸시효 기산점을 사용검사일로부터 계산하더라도 그 때부터 10년의 소멸시효 기간이 경과하기 전인 2006. 12. 21. 제기되었으므로, 소멸시효는 이로써 중단되었다고 보아야 한다."
"이유","원고가 이 사건 아파트의 사용검사일 이후 수회에 걸쳐서 피고에게 하자의 보수를 요구하였으나 피고의 보수가 미흡하여 구분소유자들이 권리행사를 하려고 하였던 점이다."
"이유","그런데 하자의 존부 및 범위의 입증 및 소송수행의 어려움 등으로 구분소유자 개개인이 소송을 제기하기는 실질적으로 어려웠으므로 이 사건 아파트의 관리·운영을 맡고 있는 원고가 구분소유자들을 대표하여 이 사건 소를 제기하였던 점이다."
"이유","이 사건 소제기 당시 원고와 같은 입주자대표회의가 하자보수에 갈음한 손해배상청구권을 행사할 주체가 될 수 없다고 하는 법적 판단이 명확하게 확립되어 있지 아니하였고, 아파트 입주자대표회의가 시공사를 상대로 하자보수에 갈음하는 손해배상을 구하는 소를 제기하여 승소판결은 받은 사례가 주류를 이루고 있었던 점이다."
"이유","구분소유자가 직접 피고를 상대로 소를 제기하지 않고 원고를 통하여 소를 제기하였다가 나중에 자신들의 피고에 대한 채권을 원고에게 양도한 이 사건과 같은 경우에도, 원고의 소 제기 당시에 원고를 통하여 자신들의 권리를 행사하였다고 보는 것이 타당하다."
"이유","피고측은, 주택법 분류상 5년차 이하 하자에 대하여는 피고측이 하자보수를 마치고 원고로부터 하자보수완료확인서 및 하자보수청구권 포기 확약서를 받았으므로 원고는 피고에 대하여 하자의 존재를 이유로 하는 손해배상을 구할 수 없다고 주장한다."
"이유","피고보조참가인들이 원고의 하자보수요청에 따라 보수를 한 후 원고로부터 이에 대한 하자보수만료 확인서를 작성 받은 사실은 인정된다. 그러나 위 인정사실만으로는 이 사건 아파트의 하자에 대한 보수가 완료되었다거나, 구분소유자들이 이후 하자보수청구 또는 이에 갈음한 손해배상청구권을 포기하였다고 볼 수는 없다."
"이유","피고측은, 콘크리트에 발생하는 균열 중 0.3㎜ 이하의 균열은 구조체에 영향이 전혀 없는 통상적인 현상으로서 공사상의 잘못과는 무관하게 콘크리트라는 재료가 가지는 고유한 특성 때문이거나 자연발생적 또는 외적인 요인에 의하여 불가피하게 발생하는 것이므로 이를 하자로 볼 수 없다고 주장한다."
"이유","살피건대, 집합건물법에 따라 준용되는 민법 제667조의 담보책임은 무과실책임으로 시공상의 잘못이 없다 하더라도 거래관념상 통상 건축물이 갖추어야 할 품질을 갖추고 있지 않다면 하자가 있는 것인 점이다."
"이유","건설교통부가 제정한 콘크리트구조설계기준은 건물의 허용 균열폭을 습윤환경에서 0.3㎜, 건조환경에서 0.4㎜로 규정하고 있으나, 건설교통부 고시 ‘시설물의 안전점검 및 정밀안전진단지침’에 의하면 0.1㎜ 이상 0.7㎜ 미만의 콘크리트의 균열을 중간균열로 중요하게 보아 보고서에 기록하여 추적조사가 이루어지도록 한 점이다."
"이유","0.3㎜ 이하의 균열이라 하더라도 빗물의 침투 등으로 철근이 부식되고 균열이 확산됨에 따라 구조체의 내구력이 감소하는 등 건조물의 기능상, 안정상 지장을 초래할 수 있다."
"이유","발생된 균열을 아무런 보수조치 없이 방치할 경우 균열 폭이 점점 확대되어 열화 및 노후화가 촉진되고 기능저하나 내구성에 문제를 발생시킬 우려가 있는 점이다."
"이유","계절별 온도변화가 심한 우리나라의 특성상 균열이 확대될 가능성이 농후한 점, 하자의 여부 판단에서는 건축물의 안전성뿐만 아니라 건물의 미관 등 다른 요소도 고려하여야 하는 점이다."
"이유","도장 자체의 하자에 기한 보수와 균열로 인한 미관상의 하자를 없애기 위한 도장은 구별되는 것일 뿐만 아니라, 균열 부분에 대한 부분도장만을 한다면 나머지 부분과의 색상 및 무늬가 달라지는 등으로 외관상 보수의 흔적이 남게 된다."
"이유","이 사건 아파트 외벽의 균열 보수 후 미관이 보기 흉하게 되는 것을 막기 위해서는 전체도장이 불가피하다고 할 것이므로, 피고측의 위 주장도 이유 없다."
"이유","피고측은 건설공사에서 통상적으로 적용되는 이윤율은 5% 내지 10%정도인데, 이 사건 감정결과에서 하자보수비를 산출함에 있어 이윤율을 15%로 적용한 것은 부당하다고 주장한다."
"이유","신축공사와 달리 연속적인 공사가 불가능한 점을 고려하여 위 감정인이 이윤율을 15%로 적용한 사실, 위와 같은 이윤율은 원가계산에 의한 예정가격 작성준칙을 초과하지 아니한 점을 인정할 수 있다."
"이유","그렇다면 감정인의 위와 같은 이윤율 적용은 건축물의 하자보수에 대한 관련 법규 및 관행에 비추어 객관적으로 타당한 범위 내의 것이라고 보이므로, 피고측의 위 주장 역시 이유 없다."
"이유","피고측은 표준품셈 등의 일위대가에 따르면 균열보수비 산정에 별도의 바탕만들기 비용이 포함되어 있지 아니함에도 불구하고 이 사건 감정인이 일위대가에서 균열보수 비용을 계상하면서 바탕만들기 비용을 추가함으로써 이를 이중으로 계상하였으므로 이 부분이 제외되어야 한다고 주장한다."
"이유","피고측이 문제 삼고 있는 감정서 제2권 729, 730, 733, 734, 736, 737면 중 ‘바탕만들기‘ 항목은 감정인이 위 바탕처리공정을 계산하기 위해 이를 도장공사비용의 일위대가 계산에 포함시킨 것이고 따라서 이는 도장공사비용의 산정에는 별도로 계상되지 아니한 사실이 인정된다."
