"판시사항","산업재해보상보험법시행령 제3조 제1항 제7호 소정의 '상시 5인 미만의 근로자를 사용하는 사업'의 의미 및 그 판단 기준"
"판시사항","사업장의 근로자 수가 원래 5인이었다가 사고 직전인 1998. 3. 2. 그 중 1인이 퇴직함으로써 일시적으로 4인이 되었으나 같은 달 7일 그 후임 근로자가 곧바로 입사한 경우, 근로자의 수가 상시 5인 이상인 사업장으로서 산업재해보상보험법의 적용을 받는다고 한 사례"
"이유","거기에 상고이유에서 지적하는 바와 같은 채증법칙 위배, 근로기준법상의 근로자의 범위에 관한 법리오해 등의 위법이 없다. 이 점에 관한 피고 및 피고보조참가인의 상고이유는 모두 받아들일 수 없다."
"이유","산업재해보상보험법 제5조, 같은법시행령 제3조 제1항 제7호는 '상시 5인 미만의 근로자를 사용하는 사업'을 산업재해보상보험법의 적용이 배제되는 사업으로 규정하고 있는 바이다."
"이유","여기에서 '상시'라고 함은 '상태'라는 의미라 할 것이므로 근로자의 수가 때때로 5인 미만이 되는 경우가 있어도 상태적으로 보아 5인 이상이 되는 경우에는 동법의 적용이 배제되지 아니한다 할 것이다."
"이유","피고가 경영하는 주식회사 ○○○○ 충북대리점의 근로자 수는 원래 5인이었다가 이 사건 사고 직전인 1998. 3. 2. 그 중 1인이 퇴직함으로써 일시적으로 4인이 되기는 하였으나 같은 달 7일 그 후임 근로자가 입사함으로써 곧바로 다시 5인이 되었음을 알아 볼 수 있다."
"이유","그렇다면 피고가 사용하는 근로자의 수는 상태적으로 보아 5인이라 할 것이므로, 다른 적용제외사유가 없는 한 위 충북대리점은 산업재해보상보험법의 적용이 배제되는 사업에 해당하지 아니한다 할 것이다."
"이유","상고이유에서 지적하는 바와 같이 근로자 수가 최초로 5인 이상이 된 날부터 기산하여 30일 동안에 사용한 연인원을 30으로 나누어 산출한 1일 평균 사용 근로자 수가 5인 미만이 되는지의 여부에 따라 계량적으로 결정되어야 하는 것이 아니다."
