"판시사항","당사자가 주장한 사항에 대한 구체적·직접적인 판단이 표시되어 있지 않지만 판결 이유의 전반적인 취지에 비추어 주장의 인용 여부를 알 수 있는 경우 또는 판결에서 실제로 판단을 하지 않았지만 주장이 배척될 것임이 분명한 경우, 판단누락의 잘못이 있다고 할 수 있는지 여부"
"판결요지","채권자가 배당이의의 소를 제기하여 승소판결이 확정되면 그가 이의한 부분에 대한 배당표가 확정되고, 특별한 사정이 없는 한 그의 채권은 배당액으로 충당되는 범위에서 배당표의 확정 시에 소멸한다."
"판결요지","그러나 배당이의의 소 수소법원이 피고에 대한 배당액을 삭제하면서 채권자인 원고가 배당받을 금액을 정하지 않고 배당표를 다시 만들고 다른 배당절차를 밟도록 명한 경우에는, 그 판결에 따라 배당법원이 실시한 재배당절차에서 재조제한 배당표가 확정되어야 원고의 채권이 소멸한다."
"판결요지","법원의 판결에 당사자가 주장한 사항에 대한 구체적·직접적인 판단이 표시되어 있지 않더라도 판결 이유의 전반적인 취지에 비추어 그 주장을 인용하거나 배척하였음을 알 수 있는 정도라면 판단누락이라고 할 수 없다."
"판결요지","설령 판결에서 실제로 판단을 하지 않았더라도 그 주장이 배척될 것이 분명하다면 판결 결과에 영향이 없어 판단누락의 잘못이 있다고 할 수 없다."
"이유","남은 돈을 원고와 제1심 공동피고 OOO주식회사에 채권액에 안분하여 배당함으로써, 제1심 공동피고에게는 1,187,020,255원, 원고에게는 5,784,476원을 배당하는 것으로 배당표가 작성되었다."
"이유","원고는 배당받지 못한 채권액 565,646,126원만큼 피고와 제1심 공동피고의 배당액을 줄이고 원고의 배당액을 늘려 달라는 이 사건 배당이의의 소를 제기하였다."
"이유","원심판단에는 상고이유 주장과 같이 배당이의의 소의 이익에 관한 법리를 오해하거나 이유를 갖추지 않은 등의 잘못이 없다."
"이유","원심판단에는 상고이유 주장과 같이 논리와 경험의 법칙을 위반하여 자유심증주의의 한계를 벗어나거나 소멸시효에 관한 법리를 오해한 잘못이 없다."
"이유","그러나 원심이 피고에 대한 소의 이익을 인정하는 판단에는 위 주장을 간접적으로 배척하는 판단이 포함되었다고 볼 수 있다."
