"판시사항","영업양도 전후의 상호인 '주식회사 OOO레미콘'과 'OOO콘크리트 주식회사'가 주요 부분에서 공통된다고 보아 상호 속용에 따른 영업양수인의 책임을 인정한 사례."
"이유","영업양도가 있다고 볼 수 있는지의 여부는 양수인이 유기적으로 조직화된 수익의 원천으로서의 기능적 재산을 이전받아 양도인이 하던 것과 같은 영업적 활동을 계속하고 있다고 볼 수 있는지의 여부에 따라 판단되어야 한다."
"이유","영업양도인이 사용하던 상호와 양수인이 사용하는 상호가 동일할 것까지는 없고, 다만 전후의 상호가 주요 부분에 있어서 공통되기만 하면 상호를 계속 사용한다고 볼 것이다."
"이유","상호 또한 동일성 인식의 주된 부분인 'OOO'라는 명칭을 유지하면서 콘크리트의 일종인 '레미콘' 대신 '콘크리트'로 변경한 사실 등을 인정하고 있는 바이다."
"이유","기록에 비추어 살펴보면, 원심의 이러한 사실인정은 옳고, 거기에 상고이유의 주장과 같은 사실오인 등의 위법이 없다."
"이유","사실관계가 이와 같다면, 앞에서 본 법리에 비추어 피고 회사는 OOO레미콘의 영업을 양수하여 상호를 계속 사용하고 있다고 보아야 할 것이므로, 같은 취지의 원심 판단은 정당하고, 거기에 상고이유의 주장과 같은 법리오해의 위법이 없다."
"이유","그리고 기록에 의하면, 피고 회사가 이 사건 수표금 중 일부를 변제하였다고 주장한 바 없을 뿐 아니라 이를 인정할 만한 자료도 없으므로, 원심판결에 상고이유의 주장과 같은 판단유탈의 위법도 없다."
