"이유","OOO건설은 1997. 9. 19. 원고와 사이에, 보증금액 한도 19억 2,540만 원의 신용보증약정을 체결하였고 , 원고가 이에 기하여 1997. 10. 8. OOO은행에게 피보증인을 국부건설로 하는 보증금액 19억 2,540만 원의 신용보증서를 발행하였다."
"이유","OOO은행은 1차 신용보증을 담보로 하여 1997. 10. 8. OOO건설에게 28억 8,000만 원을 대출하기로 하면서, 그 중 90%를 먼저 대출하였고, 나머지 10%인 2억 8,800만 원은 위 임대연립주택 준공시에 대출하기로 하였다."
"이유","OOO건설은 1차 대출 채무의 담보를 위하여 이 사건 대지 및 천안시 안서동 OOO-OOO 임야 474㎡에 관해 OOO은행 앞으로 채권최고액 37억 4,400만 원의 근저당권 설정등기를 마쳐 주었다."
"이유","그 후 1999. 3. 2. OOO건설이 이 사건 대지에 관해 OOO건설 주식회사 앞으로 소유권이전등기를 마쳐 주었고, 1999. 9. 14. OOO은행과 OOO건설 및 OOO건설이 계약인수약정을 체결하여, 1차 대출의 채무자 지위를 OOO건설이 승계하고, OOO건설은 계약관계에서 탈퇴하기로 하였다."
"이유","당시 OOO건설과 OOO은행은 1차 대출 채무의 담보를 위하여 OOO은행 앞으로 마쳐 주었던 근저당권 설정등기의 설정자를 OOO건설로 변경하는 내용의 근저당권설정 변경계약도 함께 체결하였다."
"이유","OOO건설은 1999. 9. 14. 원고와 사이에, 1차 신용보증약정에 기한 모든 채무를 OOO건설이 OOO건설로부터 인수하기로 약정하였다."
"이유","OOO건설은 위 임대연립주택의 규모를 230세대로 늘리고자 하면서 1999. 11. 2. 원고와 사이에, 1차 신용보증약정의 보증금액 한도 19억 2,540만 원을 7억 890만 원만큼 늘려서 26억 3,430만 원으로 증액하기로 약정하였다."
"이유","당시 피고 OOO건설 주식회사 가 2차 신용보증약정에 기한 모든 채무에 관하여 OOO건설을 위한 연대보증을 하였다."
"이유","원고는 1999. 11. 9. OOO은행에게 보증금액 5억 7,000만 원의 신용보증 승인확인서를 송부하고, 1999. 11. 10.부터 1999. 12. 28.까지 사이에 OOO은행에게 피보증인을 OOO건설로 하는 보증금액 3억 1,000만 원, 8,900만 원, 5,700만 원, 5,700만 원 합계 5억 1,300만 원의 신용보증서를 각 발행하였다."
"이유","OOO은행은 2차 신용보증을 담보로 하여 OOO건설에게 5억 7,000만 원을 대출하기로 하면서, 그 중 90%인 5억 1,300만 원을 위 각 신용보증서 발행 당시 대출하였고, 나머지 10%인 5,700만 원은 위 임대연립주택 준공시에 대출하기로 하였다."
"이유","OOO건설은 이러한 2차 대출에 따라, 1차 대출 채무의 담보를 위하여 위와 같이 이 사건 대지에 관해 OOO은행 앞으로 설정해 준 근저당권의 채권최고액을 44억 8,500만 원으로 증액해 주었고, 이와 아울러 1억 3,900만 원의 정기예금에 관해 OOO은행 앞으로 질권을 설정해 주었다."
"이유","그 후 2000. 1. 10. OOO건설이 이 사건 대지에 관해 피고 회사 앞으로 소유권이전등기를 마쳐 주었다."
"이유","2000. 7. 10. OOO은행과 OOO건설 및 피고 회사가 계약인수약정을 체결하여, 1차 및 2차 대출 합계 34억 5,000만 원(28억 8,000만 원 + 5억 7,000만 원)의 채무자 지위를 피고 회사가 승계하고, OOO건설은 계약관계에서 탈퇴하기로 하였다."
"이유","위 계약인수약정 당시 OOO건설과 OOO은행은 위와 같이 설정자를 OOO건설로 변경하였던 근저당권의 설정자를 피고 회사로 다시 변경하는 내용의 근저당권설정 변경계약을 체결하였다."
"이유","피고 회사는 그 무렵 원고와 사이에, 1차 및 2차 신용보증약정에 따른 모든 채무를 피고 회사가 OOO건설로부터 인수하기로 약정하였다."
"이유","당시 피고 2는 1차 및 2차 신용보증약정에 기한 모든 채무에 관하여 피고 회사를 위한 연대보증을 하였다."
"이유","2000. 8. 30.경 이 사건 대지에 위 임대연립주택이 준공되었고 , OOO은행은 앞서 본 바와 같이 준공시에 대출하기로 하였던 나머지 10%의 금액을 피고 회사에게 대출하였다."
"이유","피고 회사는 2000. 8. 30. 이 사건 건물에 관해 OOO은행 앞으로 채권최고액 44억 8,500만 원의 근저당권 설정등기를 앞으로 마쳐주었다."
"이유","그런데 피고 회사는 1차 및 2차 대출 합계 34억 5,000만 원에 대한 2004. 12. 9. 이후의 이자를 연체함으로써 은행여신거래 기본약관에 따라 1차 및 2차 대출 원리금 채무 전부에 관하여 기한의 이익을 상실하였다."
"이유","이에 OOO은행은 2005. 5. 17. 원고에게 피고 회사의 원리금 연체를 이유로 한 신용보증 사고 통지를 하였다."
"이유","1차 및 2차 신용보증약정에서는, 원고 소정의 요율에 따른 보증료 및 그에 대한 연체이자인 과태료를 피고 회사가 원고에게 지급하기로 약정하였다."
"이유","원고는 OOO은행의 위와 같은 신용보증 사고 통지에 따라 위와 같은 사전구상금 채권의 보전을 위하여 2005. 4. 20.경 피고 2 소유의 부동산에 대하여 서울중앙지방법원 OOO카단OOO호로 가압류신청을 하면서 등록세 등으로 439만 5,930원을 지출하였다."
"이유","피고 회사는 이 사건 제1심 판결 선고 이후인 2007. 3. 14. OOO은행에게 1차 및 2차 대출 원리금 전액을 변제하였다."
"이유","피고 회사는 위와 같이 원고에게 보증료를 지급하기로 약정하였는데, 현재 피고 회사가 원고에게 지급하지 않고 있는 보증료는 아래 표 기재와 같다."
"이유","위 인정사실에 의하면, 피고들은 연대하여 원고에게, 미지급 보증료 합계 52,664,190원 과 이에 대한 연체이자인 과태료를 지급할 의무가 있고, 또한 대지급금 4,395,930원을 지급할 의무가 있다."
"이유","원고가 제1심에서 사전구상금 청구 및 대지급금 청구를 청구하다가 당심에 이르러 보증료 및 과태료 청구와 대지급금 청구를 하는 것은 청구의 동일성이 인정되지 않아 부적법하다."
"이유","원고는 제1심에서 OOO보증 사고 통지를 원인으로 하는 사전구상금 청구와 대지급금 청구를 하였는데, 제1심 판결 선고 후 피고들이 대출원리금을 모두 변제하자, 원고가 당심에서 사전구상금 청구를 보증료 및 과태료 청구로 변경하였다."
"이유","이러한 경우, 사전구상금 청구와 보증료 및 과태료 청구는 모두 동일한 OOO보증약정에 기한 것으로서, 청구의 기초가 바뀌지 아니하였다고 할 것이므로, 피고들의 위 주장은 이유 없다."
"이유","위 대출금 채무에 대한 담보는 보증금액 19억 2,500만 원의 1차 신용보증, 정기예금 1억 3,900만 원에 설정된 질권, 이 사건 대지의 유효담보가격 9억 5,500만 원 등 합계 30억 1,900만 원에 달하여, 결국 피고 회사의 채무인수 당시 모자라는 담보액은 8,600만 원에 불과하였다."
"이유","원고는 2000. 2. 7. 피고 회사 소유의 천안시 안서동 OOO-OOO 전 258㎡에 청구금액을 2억 원으로 하는 가압류등기를 마쳐 두었으므로, 피고 회사는 OOO건설로부터 2차 신용보증약정에 기한 채무를 인수할 필요가 없었다고도 주장한다."
"이유","가압류 청구금액을 담보금액에 포함시켜야 된다고 볼 근거도 없으므로, 위와 같이 피고들이 주장하는 사정들이나 을 제14호증의 1, 2, 3 , 을 제15호증의 각 기재만으로는 위에서 본 바와 같이 피고 회사가 2차 신용보증약정에 기한 채무를 OOO건설로부터 인수하였다는 인정을 뒤집을 수 없다."
"이유","순담보 가격은 최우선 변제 대상인 임대보증금 채무 1,840,000,000원 을 공제한 5,004,085,540원이 되며, OOO은행이 평가한 4,223,000,000원은 그 자체가 순담보 가격이므로, OOO은행이 이 사건 건물에 대하여 근저당권을 설정한 이상 ‘우선해지 특약’에 의하여 피고 회사는 면책되어야 한다."
"이유","1차 및 2차 대출 채무의 담보물을 평가하여 그 평가액만큼 1차 및 2차 신용보증을 해지하도록 약정한 사실이 인정된다."
"이유","이러한 우선해지 특약은, 당해 시설에 대하여 금융기관이 담보를 취득함으로써 대출의 주채무자가 원래 부담하는 주채무 중 적어도 당해 시설의 담보가치에 상당하는 부분의 변제가 확실시되기 때문에 그 부분을 제외한 나머지 금액에 대하여만 최종적인 신용보증을 하겠다는 의미이다."
"이유","OOO은행이 담보를 평가함에 있어 사용한 ‘기술 및 가격 조사 업무편람’ 은 1996년부터 2000년까지 표준공사비에 변동이 없어 비합리적이라는 점 등을 들고 있다."
"이유","위에서 든 각 증거와 당심 법원의 OOO은행 대표이사에 대한 사실조회결과에 의하면, 아래와 같은 사실이 인정된다."
"이유","OOO은행은 OOO건설로부터 신축건물의 38세대 증가에 따른 5억 7,000만 원의 추가 대출요청을 받고 1999. 10. 7. 증가된 세대수를 반영하여 담보평가를 실시하였다."
"이유","다만 보증해지금액 산정의 편의를 위하여 건물에 대한 일괄평가액을 3,203,554,000원에서 3,203,500,000원으로 조정하여 합계 4,223,000,000원 으로 평가하였다."
"이유","업무편람에 따르면, 면적사정에 관해 각 세대의 대지 지분면적은 대출신청자가 제출한 토지분양계획서의 면적을 기준으로 사정하되 현장조사시 불용지로 판단되는 대지 등이 있으면 이를 차감하여 산정한다."
"이유","건물면적은 건축물대장 등에 의한 면적을 기준으로 하며, 대지가격은 공시지가 적용법을 원칙으로 하고, 건물가격은 OOO은행 표준공사비를 기준으로 주택종류별로 등급에 따라 평가하도록 되어 있다."
"이유","이 금액에서 세대당 최우선 변제대상인 임대보증금 8,000,000원을 공제한 나머지 금액을 산출한 다음, 1998. 6. 18.자로 부동산 담보물에 대한 대출비율이 순담보 가격의 80% 이내로 조정됨에 따라, 실제 낙찰대금 수준 등을 감안하여 80% 상당인 1,909,000,000원 을 순담보 가격으로 평가하였다."
"이유","OOO은행은 이러한 평가에 따라, 1차 및 2차 대출에 관한 담보 가운데 정기예금 1억 3,900만 원에 대한 질권, 2차 신용보증 금액 5억 7,000만 원, 19억 2,540만 원의 1차 신용보증 금액 중 3억 8,440만 원에 부분 합계 10억 9,340만 원의 담보를 해지하였다."
"이유","위에서 본 바에 의하면, 국민은행은 국부건설 등에게 대출함에 있어 국토해양부가 승인한 업무편람에 따라 대상 부동산의 가격을 평가하여 근저당권을 설정한 후, 담보가치가 부족하다고 본 액수만큼에 대하여는 원고로부터 추가로 신용보증을 받는 절차를 취하였다."
"이유","2000. 8. 1. 이후의 표준건축비는 714,600원임에도 국민은행이 그보다 낮은 단가를 적용하는 등 건물가격 평가가 잘못되었다는 취지의 주장도 한다."
"이유","그러나, 을 제8, 13, 19호증의 각 기재에 의하면, 위 규정 별표 등에 기재된 건축비는 국민주택 분양가격 또는 공공건설 임대주택의 분양전환가격의 산정방식에 관한 것일 뿐, 이 사건 대지 및 이 사건 건물의 담보가치 평가에 직접적으로 적용되어야 하는 규정이라고는 볼 수 없다."
"이유","피고들은 또한 위 규정 제23조 제2항은 “OOO주택 건설자금의 호당 융자액은 순담보 가격 에서 제5항의 담보물에 대한 대출비율로 산정한 금액 을 초과할 수 없다”라고 규정한다."
"이유","OOO은행의 평가방법과 같이 이 사건 대지 및 이 사건 건물의 최종평가액이 1,909,000,000원 밖에 되지 않는데도 3,450,000,000원을 대출하였다고 한다면 OOO은행은 위 규정을 어긴 셈이 되므로, 이러한 점에서도 담보해지시의 평가방법이 잘못되었다고 주장한다."
"이유","이 사건의 경우에도 OOO은행은 주택가격이 융자가능액에 모자라는 부분에 관하여 원고의 신용보증을 받아 대출을 실행한 것이므로, OOO은행의 대출금이 부동산 평가액보다 많은 것은 위 규정의 취지에 비추어 당연한 결과라고 할 것이다."
"이유","원고의 주장과 같이 이 사건 대지 및 이 사건 건물의 최종평가액이 1,909,000,000원이라고 하더라도, 변제충당의 법리에 따라 1차 신용보증이 모두 해지되었으므로, 피고들로서는 면책된 보증에 대한 보증료 등을 지급할 의무가 없다."
"이유","즉, OOO은행과 피고 회사 사이에서 담보해지 순서에 대한 합의가 없었고 그 순서의 지정도 없었으므로, 변제이익이 더 큰 1차 신용보증이 해지되어야 하는 바이다."
"이유","질권이 설정된 정기예금 1억 3,900만 원과 원고가 주장하는 이 사건 대지 및 이 사건 건물의 담보가격 1,909,000,000원을 합하면 2,048,000,000원이 되어 1차 신용보증 금액 19억 2,500만 원을 상회하므로, 1차 신용보증이 전부 해지된 것으로 보아야 한다."
"이유","OOO은행이 1차 신용보증을 담보로 1차 대출을 하고, 이어서 2차 신용보증을 담보로 하여 2차 대출을 하였는데, 2차 대출 당시 그 담보로서 정기예금 1억 3,900만 원에 관해 질권을 설정받았음은 앞서 기초사실에서 본 바와 같다."
"이유","그렇다면, 위 정기예금이 1차 신용보증을 담보로 하여 이루어진 1차 대출에 관하여 OOO은행이 취득한 담보라고 할 수 없어, 위 정기예금을 이유로 1차 신용보증을 먼저 해지해야 한다고는 할 수 없으므로, 피고들의 이 부분 주장은 이유 없다."
"이유","1차 대출은 1차 신용보증 금액의 90%인 1,732,860,000원, 2차 대출은 2차 신용보증 금액의 90%인 513,000,000원에 대하여만 실행되었으므로, 이와 같이 대출이 이루어지지 않은 합계 249,540,000원에 대하여는 보증료 및 연체료를 납부할 의무가 없다."
"이유","1차 및 2차 대출에 있어 90%의 금액을 먼저 대출하고 나머지 10%는 이 사건 건물의 준공시에 대출하기로 하였고, 이에 따라 이 사건 건물의 준공시 나머지 10%가 대출된 사실은 앞서 기초사실에서 본 바와 같으므로, 피고들의 이 부분 주장도 이유 없다."
"이유","피고 회사는 1차 및 2차 대출 34억 5,000만 원의 채무는 전액 인수하였으나, 보증금액 5억 7,000만 원의 2차 신용보증약정에 기한 채무는 인수하지 아니하였다. 또한   우선해지 특약에 의하여 1차 및 2차 신용보증은 전부 해지되었다."
"이유","그럼에도 OOO은행은 1차 신용보증을 전부 해지해 주지 않음으로써 결과적으로 피고 회사가 원고에게 보증료와 과태료를 계속 지급하게 되었다."
"이유","피고 회사가 2차 신용보증약정에 기한 채무를 인수하였음과 우선해지 특약에 의하여 1차 신용보증 전부가 해지되었다고 할 수 없음은 앞서 본 바와 같으므로, 피고 회사의 주장은 이유 없다."
"이유","원고의 청구가 당심에서 일부 교환적으로 변경되었으므로, 이와 같이 변경된 청구를 포함하여 제1심 판결을 위와 같이 변경하고, 당심에서 제기된 피고 회사의 반소청구는 이유 없어 이를 기각하기로 하여 주문과 같이 판결한다."
"이유"," 또한 피고 회사의 채권자가 신용보증 사고 통지를 한 경우에는 별도의 통지가 없더라도 원고의 신용보증금액 전부를 사전구상금으로 피고 회사가 원고에게 지급한다."
