"이유","소외 2는 1922. 7. 10. 경기 연천군 군남면 왕림리 임야 5정 6900보를 사정받았는데, 별지 부동산목록 기재 1 부동산은 1971. 4. 6. 위 임야에서 분할되었고, 별지 부동산목록 기재 2 부동산은 1988. 1. 16. 별지 부동산목록 기재 1 부동산에서 분할되었다."
"이유","한편, 별지 부동산목록 기재 1, 2 부동산에 관하여 망 소외 1은 의정부지방법원 연천등기소 1965. 3. 16. 접수 제1530호로 소유권보존등기를 경료하였다."
"이유","소외 3 외 5명은 1922. 7. 15. 연천국 미산면 유촌리 임야 1정 1300보를 사정받았는데, 위 임야는 별지 부동산목록 기재 3 부동산으로 지적복구 되었다."
"이유","한편, 피고 대한민국은 별지 부동산목록 기재 3 부동산에 관하여 의정부지방법원 연천등기소 1996. 10. 7. 접수 제11005호로 소유권보존등기를 경료하였다."
"이유","망 소외 4는 1990. 8. 6. 사망하여 처 망 소외 5, ‘자 망 소외 6의 대습상속인인 망 소외 11,소외 7, 소외 8, 소외 9, 소외 10’, 자 소외 12, 망 소외 13, 원고, 소외 18, 소외 19, 소외 20이 공동상속하였다."
"이유","망 소외 1은 1969. 12. 25. 사망하여 피고 1 내지 17이 별지 상속지분표 기재와 같이 상속하였다."
"이유","위 인정사실에 의하면, 별지 부동산목록 기재 1, 2 부동산의 사정인인 소외 2는 원고의 선대인 망 소외 2와 동일인이라고 할 것인 바이다."
"이유","별지 부동산목록 기재 1, 2 부동산의 사정인이 아닌 망 소외 1 명의의 소유권보존등기는 특별한 사정이 없는 한 원인 없이 경료된 것으로 말소되어야 한다."
"이유","위 피고들은, 망 소외 1이 소유자로부터 이 사건 부동산을 매수하여 1965. 3. 16.부터 20년간 소유의 의사로 평온, 공연하게 점유하였으므로 이를 시효취득하였다고 주장한다."
"이유","점유 여부에 관하여 보건대, 물건에 대한 점유란 사회관념상 어떤 사람의 사실적 지배에 있다고 보여지는 객관적 관계를 말하는 것으로서 사실상의 지배가 있다고 하기 위하여는 반드시 물건을 물리적, 현실적으로 지배하는 것만을 의미하는 것이 아니다."
"이유","물건과 사람과의 시간적, 공간적 관계와 본권관계, 타인지배의 배제 가능성 등을 고려하여 사회통념에 따라 합목적적으로 판단하여야 할 것이다."
"이유","대지의 소유자로 등기한 자는 보통의 경우 등기할 때에 그 대지의 인도를 받아 점유를 얻은 것으로 보아야 할 것이므로 등기사실을 인정하면서 특별한 사정의 설시 없이 점유사실을 인정할 수 없다고 판단할 수는 없다."
"이유","한편 점유자가 점유 개시 당시에 소유권취득의 원인이 될 수 있는 법률행위 기타 법률요건이 없이 그와 같은 법률요건이 없다는 사실을 잘 알면서 타인 소유의 부동산을 무단점유한 것임이 입증된 경우에는 자주점유 추정을 번복할 수 있을 것이다."
"이유","그렇다면, 망 소외 1의 상속인들은 1965. 3. 16.부터 20년이 지난 시점에 점유취득시효 완성에 의하여 별지 부동산목록 기재 1, 2, 부동산의 소유권을 각 취득하였다고 할 것이므로, 위 피고들의 점유취득시효완성 항변은 이유 있다."
"이유","피고 대한민국은, 원고의 말소청구가 인정되어도 원고의 지분을 제외한 나머지 부분은 다시 무주의 토지가 되어 피고가 새로이 취득할 것이어서 원고의 지분에 대한 소유권보존등기를 신청할 수 없으므로, 청구의 이익이 없다고 본안전 항변을 한다."
"이유","공유자 중 1인은 공유물의 보존행위로서 등기명의자에게 말소등기청구를 할 수 있는 것이어서 이 사건 청구의 이익이 있는 것이기에, 피고 대한민국의 본안 전 항변은 이유 없다."
"이유","위 인정사실에 의하면 별지 부동산목록 기재 3 부동산의 사정인이 따로 있는 이상 피고 대한민국 명의의 소유권보존등기는 특별한 사정이 없는 한 원인 없이 경료된 것이므로 말소되어야 한다."
"이유","따라서, 피고 대한민국은 원고에게 별지 부동산목록 기재 3 부동산에 관하여 의정부지방법원 연천등기소 1996. 10. 7. 접수 제11005호로 마친 소유권보존등기의 말소등기절차를 이행할 의무가 있다."
"이유","그렇다면, 원고의 피고 대한민국에 대한 청구는 이유 있어 이를 인용하고 피고 1 내지 17에 대한 청구는 이유 없어 이를 기각하기로 하여, 주문과 같이 판결한다."
