"판시사항","산업기술연수생인 외국인이 대상 업체의 사업장에서 실질적으로 업체의 지시·감독을 받으면서 근로를 제공하고 수당 명목의 금품을 수령한 경우, 근로기준법 제14조에 정한 근로자로 볼 수 있는지 여부"
"이유","근로기준법상의 근로자에 해당하는지 여부를 판단함에는 그 계약의 형식이 민법상의 고용계약인지 또는 도급계약인지에 관계없이 그 실질면에서 근로자가 사업 또는 사업장에 임금을 목적으로 종속적인 관계에서 사용자에게 근로를 제공하였는지 여부에 따라 판단하여야 한다."
"이유","산업기술연수사증을 발급받은 외국인이 정부가 실시하는 외국인 산업기술연수제도의 국내 대상 업체에 산업기술연수생으로 배정되어 대상 업체와 사이에 연수계약을 체결하였다 하더라도 그 계약의 내용이 단순히 산업기술의 연수만으로 그치는 것이 아니고 대상 업체가 지시하는 바에 따라 소정시간 근로를 제공한다."
"이유","그 대가로 일정액의 금품을 지급받으며 더욱이 소정시간 외의 근무에 대하여는 근로기준법에 따른 시간외 근로수당을 지급받기로 하는 것이다."
"이유","이에 따라 당해 외국인이 대상 업체의 사업장에서 실질적으로 대상 업체의 지시·감독을 받으면서 근로를 제공하고 수당 명목의 금품을 수령하여 왔다면 당해 외국인도 근로기준법 제14조 소정의 근로자에 해당한다 할 것이다."
"이유","그에 의하면 중화인민공화국 국적이며 피고 회사가 전액 투자하여 설립한 현지법인인 청도이화섬유 유한공사와 사이에 연수계약을 체결하고 산업연수생이라는 명목으로 입국하였으나 피고 회사의 공장에서 임금을 목적으로 근로를 제공한 원고들이 피고 회사의 근로자라고 판단한 것은 위에서 본 법리와 기록에 비추어 정당하다."
"이유","거기에 상고이유의 주장과 같은 채증법칙 위배로 인한 사실오인이나 근로기준법 및 최저임금법상의 근로자의 인정 또는 출입국관리법상의 산업연수생의 지위에 관한 법리오해 등의 위법이 없다."
