"이유","원고는 위 규정이 시행되기 전에 이 사건 토지를 취득하였으므로 이 사건에서는 위 규정이 적용될 수 없다고 판단하였다."
"이유","위 소득세법시행령 제170조 제4항 제2호 (마)목에 의하면, 국세청장이 정한 일정 규모 이상의 부동산을 취득 또는 양도함에 있어서 다른 사람 명의의 사용, 허위계약서의 작성, 주민등록의 허위이전 등 부정한 방법에 의하거나 관계 법령에 위반한 경우에는 실지거래가액에 의하여 양도차익을 산정함을 원칙으로 하고 있다."
"이유","원심이 위 규정은 그 시행일 이후에 가중요건이 충족되는 경우에 한하여 적용할 수 있다고 하여 이 사건 토지의 취득시에는 위 규정이 적용될 수 없다고 판단한 것은 당원의 판례에 따른 것으로서 적법하다."
"이유","그 양도시에도 채권자였던 이 사건 토지의 양수인의 권유에 못이겨 시가보다 싼 값에 이를 처분하여 차입금의 변제와 당시 자금압박에 몰려 있던 사업체의 운영자금에 사용한 점 등이 인정된다."
"이유","이와 같은 구체적인 사정을 종합하여 보면 원고의 이 사건 토지의 양도를 투기거래라 할 수는 없을 것이어서 이 사건의 경우에도 위 단서규정에 의하여 기준시가 과세원칙이 적용됨이 옳다 할 것이다."
"이유","따라서 원심이 기준시가에 의하여 양도차익을 산정하여야 한다고 한 판단은 결과에 있어서는 타당한 것이므로 원심의 위에서 본 바의 법리오해의 위법은 판결결과에 영향을 미치는 것은 아니다."
"이유","부동산의 취득이나 양도 중 어느 한 쪽의 거래가 위 유형의 거래가 아니거나 위 규정이 시행되기 전의 거래인 경우에도 다른 한 쪽의 거래가 위 규정에서 정하고 있는 유형의 거래에 해당되면 위 규정이 적용되어야 할 것이다."
