"판시사항","신축중인 연립주택 중 1층 소재 주택의 임차인이 주민등록 이전시 잘못된 현관문의 표시대로 ‘1층 201호’라고 전입신고를 마쳤는데, 준공 후 그 주택이 공부상‘1층 101호’로 등재된 경우, 주택임대차보호법상의 대항력이 없다고한 사례"
"판결요지","신축중인 연립주택 중 1층 소재 주택의 임차인이 주민등록 이전시 잘못된 현관문의 표시대로 ‘OOO호’라고 전입신고를 마쳤는데, 준공 후 그 주택이 공부상‘OOO호’로 등재된 경우, 주택임대차보호법상의 대항력이 없다고 한 사례."
"이유","등기부 작성시에도 ‘1층 OOO호’로 표시되어 위 소외 1 앞으로 소유권보존등기가 경료되었으며, 이어서 이 사건 주택에 관하여 1992.2.17. 피고 은행 앞으로 1순위의 근저당권설정등기가 경료되었다."
"이유","원고가 한 위 주민등록은 이 사건 주택의 표시와 달라 이 사건 임대차를 공시하는 효력이 없어 이를 전제로 하여 원고에게 우선변제권이 있다는 원고의 주장은 이유 없다고 판단하였다."
"이유","기록에 의하여 살펴보면, 원심의 위와 같은 사실인정이나 원고에게 이 사건 주택의 경매대금에서 임대차보증금을 우선변제받을 권리가 없다고 본 원심의 판단은 모두 정당한 것으로 수긍이 간다."
"이유","그러므로 상고를 기각하고 상고비용은 패소자의 부담으로 하기로 하여 관여 법관의 일치된 의견으로 주문과 같이 판결한다."
