"판시사항","자연발생적 도로에 관하여 그 소유자가 사용수익권을 포기하고 스스로 도로로 제공한 것으로 보기 어렵다고 한 원심판결을 수긍한 사례"
"판시사항","국가 또는 지방자치단체가 사유 토지를 도로 부지로 사실상 점유하는 경우, 그 토지에 대한 부당이득액의 산정 방법"
"이유","그 이후 원고가 위 분할 전 토지 중 이 사건 토지를 제외한 나머지 토지들을 여러 필지의 토지로 분할하여 타에 매각하였지만 원고가 직접 택지를 조성하여 분할 매각하지는 아니한 점이다."
"이유","원고가 이 사건 도로 부분에 관한 사용수익권을 포기하고 스스로 도로로 제공한 것으로 추단하기에는 부족하다 할 것이다."
"이유","거기에 논하는 바와 같이 부당이득의 법리 또는 사용수익권의 포기에 관한 법리를 오해한 위법이 있다고 볼 수 없다."
"이유","그러므로 원심판결 중 피고 패소 부분을 파기하여 이 부분 사건을 원심법원에 환송하기로 하여 관여 법관의 일치된 의견으로 주문과 같이 판결한다."
