"판시사항","신탁법상 신탁으로 수탁자 앞으로 부동산 소유권이전등기를 마친 경우, 대내적으로 소유권이 위탁자에게 유보되는지 여부 [2] 약관 해석에서 작성자 불이익의 원칙"
"이유","부동산의 신탁에 있어서 수탁자 앞으로 소유권이전등기를 마치게 되면 대내외적으로 소유권이 수탁자에게 완전히 이전되고, 위탁자와의 내부관계에서 소유권이 위탁자에게 유보되어 있는 것은 아니다."
"이유","예비적 피고 1이 피고 회사의 승낙 없이 체결된 임대차계약은 피고 회사에 대하여 효력이 없다는 점 등에 대한 설명의무를 위반함으로 인하여 원고들이 임차보증금 및 피고 회사에 반환한 부당이득금 상당의 손해를 입었다고 판단하였다."
"이유","거기에 상고이유에서 주장하는 바와 같은 담보신탁의 법적 성격 또는 신탁에 따른 소유관계와 임대차계약의 체결권한, 공인중개사의 과실과 중개의뢰인이 입은 손해 사이의 인과관계 및 손해배상책임에서의 입증책임 등에 관한 법리오해의 위법이 없다."
"이유","위와 같은 해석을 거친 후에도 약관 조항이 객관적으로 다의적으로 해석되고 그 각각의 해석이 합리성이 있는 등 당해 약관의 뜻이 명백하지 아니한 경우에는 고객에게 유리하게 해석해야 한다."
"이유","이러한 약관해석의 원칙에 의하면 “피고 한국공인중개사협회가 보상하는 금액은 공제가입금액을 한도로 합니다.”라고 규정하고 있는 피고 협회의 공제약관 제2조 제1항은 이를 ‘공제사고 1건당 보상한도’를 정한 것으로 해석함이 상당하다."
"이유","따라서 피고 협회의 공제약관 제2조 제1항이 ‘공제사고 1건당 보상한도’를 정한 것으로 본 원심의 결론은 정당하고, 거기에 상고이유에서 주장하는 바와 같은 공제금 보상한도에 관한 법리오해의 위법이 없다."
"이유","그러므로 상고를 모두 기각하고, 상고비용은 패소자가 부담하도록 하여 관여 대법관의 일치된 의견으로 주문과 같이 판결한다."
