"판시사항","비법인사단이 준총유관계에 속하는 채권·채무관계에 관한 소를 제기하기 위하여는 사원총회의 결의를 거쳐야 하는지 여부 및 화해권고결정에 의하여 채무를 부담하게 된 비법인사단이 화해권고결정에 대하여 준재심을 제기하는 경우에도 마찬가지인지 여부"
"이유","비법인사단이 준총유관계에 속하는 채권·채무관계에 관한 소를 제기하기 위하여서는 달리 특별한 사정이 없는 한 민법 제276조 제1항이 정하는 바에 따라 사원총회의 결의를 거쳐야 한다."
"이유","비법인사단인 피고가 원고에게 금전을 지급한다는 화해권고결정에 대한 이 사건 준재심은 사원총회의 결의 없이 제기된 것이어서 부적법하다고 판단하였다."
"이유","원심판결 이유를 위에서 본 법리에 비추어 보면, 이러한 원심의 판단에 상고이유 주장과 같이 총유물의 관리·처분행위에 관한 법리를 오해하거나 판단을 누락한 잘못이 없다."
"이유","이 사건 준재심에 대한 ‘위원회’의 추인 결의는 효력이 없을 뿐만 아니라 결의를 위한 의사정족수도 충족되지 않았다고 판단하였다."
"이유","관련 법리와 기록에 비추어 살펴보면, 이러한 원심의 판단은 정당하고, 거기에 상고이유 주장과 같이 비법인사단의 소송행위 추인 권한 및 의사정족수에 관한 법리를 오해한 잘못이 없다."
