"이유","이 사건 각 아파트에는 2008. 10. 27. 피고 조합 명의의 소유권보존등기와 동시에 수원지방법원 안양지원 안양등기소 접수 제82546호로 구 주택법제40조에 따른 금지사항 부기등기 가 마쳐졌다."
"이유","류택현은 2010. 9. 11. 사망하였는데 사망 당시 상속인으로는 처인 소외 2, 자녀들인 원고, 소외 3, 4, 5가 있었다."
"이유","위 상속인들은 2010. 10. 4. 별지 2 목록 순번 4 기재 아파트에 관한 모든 권리를 원고가 갖기로 상속재산분할협의를 하였다."
"이유","피고 조합은 이 사건 각 분양계약에 따라 원고들에게 위 등기절차이행내역표 동·호수란 기재 각 아파트에 관하여 위 등기절차이행내역표 소유권이전등기원인란 기재 각 분양계약을 원인으로 한 소유권이전등기절차를 이행할 의무가 있다."
"이유","피고 조합은 이 사건 각 분양계약에 기한 소유권이전등기청구권자인 원고들에게 위 등기절차이행내역표 회복대상등기란 기재 각 금지사항등기의 회복등기절차를 이행할 의무가 있다."
"이유","피고 조합은 이 사건 각 분양계약에 따라 원고들에게 이 사건 각 아파트에 관하여 소유권이전등기절차를 이행할 의무가 있고 피고들은 이러한 사정을 잘 알고서도 각 금지사항등기를 말소하거나 말소되도록 방치한 후 피고 OO산업은 이 사건 각 아파트에 처분금지가처분결정을 받아 집행하였는바이다."
"이유","금지사항등기 말소 후 이 사건 각 아파트에 관하여 피고 조합 채권자들에 의한 거액의 가압류가 이루어져 피고 조합의 원고들에 대한 소유권이전등기의무가 이행불능이 되었다."
"이유","따라서 피고들은 공동불법행위자로서 연대하여 원고들에게 원고들이 입은 손해인 일반 분양가와 조합원 분양가의 차액 및 피고 조합에 지급한 분양대금을 배상할 책임이 있다."
"이유","피고 OO산업은 등록사업자로서 조합과 함께 조합원이 입은 손해를 배상할 책임이 있다는 주택법에 따라 또는 공동불법행위자로서 연대하여 원고들에게 원고들이 입은 손해인 일반 분양가와 조합원 분양가의 차액 및 피고 조합에 지급한 분양대금을 배상할 책임이 있다."
"이유","원고들은 피고 조합에 대하여 이 사건 각 분양계약이 유효함을 전제로 소유권이전등기청구, 말소된 금지사항등기의 회복등기를 주위적 청구로, 피고들에 대하여 이 사건 각 분양계약의 무효 내지 소유권이전등기의무의 이행불능을 전제로 불법행위에 기한 손해배상을 예비적 청구로 구하고 있다. "
"이유","예비적 청구는 주위적 청구의 기각에 대비하여 병합하는 것이고 청구에 대한 당부 판단 이외의 조건을 들어 병합할 수는 없는 것인데 위 예비적 청구는 소유권이전등기청구를 주위적 청구로 하여 병합되어 있음이 논리적으로 명백하다."
"이유","아래에서 보는 바와 같이 주위적 청구인 원고들의 피고 조합에 대한 소유권이전등기청구를 인용하는 이상, 이와 논리적으로 양립할 수 없는 원고들의 피고들에 대한 각 예비적 청구는 별도로 판단하지 않기로 한다."
"이유","조합원 전원의 총유에 속하는 재산의 관리 및 처분에 관하여 조합의 정관이나 규약에 정한 바가 있으면 이에 따라야 하다."
"이유","이 사건의 경우 조합재산의 처분에 관하여 별도의 조합 규정이 있는지에 관하여 보건대, 갑 제1호증의 기재에 의하면 피고 조합의 규약에는 조합 업무의 효율성을 위해 새로본을 조합의 ‘업무대행사’로 하다."
"이유","대행사는 조합업무 전반에 걸친 업무를 집행한다 고 규정하고 있는가 하면, 피고 조합은 조합의 회의체로서 ‘운영위원회’를 두다."
"이유","위 인정사실에 더하여 앞서 채택한 증거들을 종합하여 인정할 수 있는 다음과 같은 사정, 즉 피고 조합은 조합원 총회가 피고 조합의 의사결정 기구로서 기능을 하지 아니한 반면, 조합의 업무 집행에 관한 일체의 권한을 위임받은 새로본이 피고 조합의 업무를 시행대행사로서 집행한 점이다."
"이유","사실상 임의분양분에 관하여 수의계약에 따라 원고들에게 아파트를 공급해 주기로 하면서 체결하게 된 점 등을 종합해 보면, 피고 조합은 위와 같은 정관규정에 따라 임의분양분 아파트를 처분하는 권한을 운영위원회 및 새로본에 위임하였다고 봄이 상당하다."
"이유","따라서 피고 조합의 대표자 및 새로본의 대표자가 원고들로부터 이 사건 주택사업의 부지를 매수하면서 이 사건 각 분양계약을 체결한 행위는 피고 조합에 대하여 유효하다."
"이유","살피건대, 구 주택법령은 조합원의 교체, 신규 가입 등을 금하면서 결원이 있는 경우에 한하여 해당 관청의 승인을 받아 조합원을 추가 모집할 수 있다."
"이유","조합이 구 주택법령에 위반하여 조합원 미분양분을 조합원 자격이 없는 자에게 공개모집이 아닌 수의계약의 방법으로 분양하는 계약을 체결하였다고 하더라도 그 분양계약의 사법적 효력이 부인된다고 단정할 수 없다."
"이유","이 사건 각 분양계약에 별도로 조합원 총회의 결의를 요하는 것이 아님은 앞서 본 바와 같으다."
"이유","피고 조합은, 원고 1, 2, 3, 10은 이 사건 각 분양계약의 대금을 피고 조합에 지급하지 않았고 피고 OO산업에 입금한 금원을 반환받았다."
"이유","원고 5, 6, 7, 8, 9, 11, 12, 13은 소외 1이 임의로 개설한 피고 조합 명의의 통장에 입금하여 소외 1이 이를 횡령함으로써 피고 조합이 분양대금을 수령하지 못하였다."
"이유","이 사건 각 분양계약이 유효한 이상 피고 조합의 위 주장 사유만으로는 원고들의 피고 조합에 대한 소유권이전등기청구를 저지할 수 없다."
"이유","피고 조합의 소유권이전등기의무가 이행불능인지 여부 이 사건 각 아파트에 관하여 피고 OO산업의 처분금지가처분등기 및 채권액 합계 약 180억 원의 가압류가 되어 있는 사정은 앞서 본 바와 같다."
"이유","피고 조합의 자력이 가압류 또는 가처분 집행을 모두 해제할 수 있는 정도에는 미치지 못하는 것으로 보이더라도 이러한 사정만으로는 피고 조합이 소유하고 있는 이 사건 각 아파트에 관한 피고 조합의 소유권이전등기의무가 이행불능이 되었다고 단정할 수 없다."
"이유","따라서 피고 조합은 원고들에게 위 등기절차이행내역표 동·호수란 기재 각 아파트에 관하여 위 등기절차이행내역표 소유권이전등기원인란 기재 각 분양계약을 원인으로 한 소유권이전등기절차를 이행하여야 한다."
"이유","저당권설정 등의 제한을 함에 있어서 사업주체는 입주예정자의 동의 없이는 양도하거나 제한물권을 설정하거나 압류·가압류·가처분 등의 목적물이 될 수 없는 재산임을 소유권등기에 부기등기하여야 하다."
"이유","다만, 대통령령이 정하는 경우에는 그러하지 아니한데,부기등기는 주택건설대지에 대하여는 입주자모집공고승인 신청과 동시에, 건설된 주택에 대하여는 소유권보존등기와 동시에 하여야 하다."
"이유","부기등기일 이후에 당해 대지 또는 주택을 양수하거나 제한물권을 설정받은 경우 또는 압류·가압류·가처분 등의 목적물로 한 경우에는 그 효력을 무효로 하고 있다."
"이유","구 주택법 제40조의 문언 등에 비추어 볼 때, 그 규정은 건설교통부령이 정하는 입주자모집조건·방법·절차 등에 따라 입주자자격 등을 갖춘 자로서 입주자모집공고승인 후에 주택을 공급받는 입주예정자들을 보호하기 위한 규정으로 해석되는바이다."
"이유","원고들이 위 법에 따른 입주자자격을 갖추지 못한 것은 앞서 본 바와 같으므로 원고들은 구 주택법 제40조의 입주예정자에 해당하지 아니하여 피고 조합에 대하여 금지사항등기를 하도록 할 권원이 없다고 할 것이다."
"이유","그렇다면, 원고들의 피고 조합에 대한 당심에서 교환적으로 변경된 주위적 청구는 위 인정범위 내에서 이유 있어 이를 인용하고 나머지는 이유 없어 기각할 것인바이다."
"이유","이와 같이 위 주위적 청구를 인용하는 이상 제1심 판결의 예비적 청구 중 원고들에 대한 피고 비산동대림지역주택조합 패소부분을 취소하다."
"이유","예비적 청구에 대한 원고들의 피고OO산업에 대한 항소 및 피고 조합의 원고들에 대한 항소에 관하여는 따로 판단하지 아니하기로 하여, 주문과 같이 판결한다."
"이유"," 주위적, 예비적 청구 병합의 형태로 제소된 경우, 주위적 청구가 인용되는 경우에는 논리적으로 양립할 수 없는 예비적 청구는 판단할 필요가 없는바이다."
"이유","사업주체는 제16조 제1항의 규정에 의한 사업계획승인을 얻어 시행하는 주택건설사업에 의하여 건설된 주택 및 대지에 대하여는 입주자모집공고승인 신청일 이후부터 입주예정자가 당해 주택 및 대지의 소유권이전등기를 신청할 수 있는 날 이후 60일까지의 기간 동안 입주예정자의 동의 없이 저당권 등을 설정하여서는 아니되다."
