"이유","제80조 제1항, 제2항에서 심판청구에 대한 결정의 효력에 관하여 제81조에서 준용하는 제65조에 따른 결정은 관계 행정청을 기속한다."
"이유","제65조 제1항 제3호에서 심사청구가 이유 있다고 인정될 때에는 그 청구의 대상이 된 처분의 취소·경정 결정을 하거나 필요한 처분의 결정을 한다고 규정하고 있다."
"이유","과세처분에 관한 불복절차에서 그 불복사유가 옳다고 인정하고 이에 따라 필요한 처분을 하였을 경우에는 불복제도와 이에 따른 시정방법을 인정하고 있는 위 법 규정의 취지에 비추어 동일 사항에 관하여 특별한 사유 없이 이를 번복하고 다시 종전의 처분을 되풀이할 수는 없다."
"이유","코스닥 상장법인인 주식회사 OOO은 2005. 12. 5. 비상장법인인 주식회사 OOO의 주식을 전부 인수하면서 OOO의 주주들에게 OOO의 신주를 발행해 주는 주식의 포괄적 교환계약을 체결하였다."
"이유","이 사건 교환계약에 따라 OOO의 주주들인 원고 1은 OOO 163,556주의 교환대가로 OOO 2,904,904주를, 원고 2는 OOO 11,520주의 교환대가로 OOO 204,605주를 각 취득하였다."
"이유","피고는 구 상속세 및 증여세법 제42조 제1항 제3호에 근거하여 이 사건 교환계약으로 원고들이 얻은 이익을 증여재산가액으로 보고 원고들에게 증여세를 결정·고지하는 종전 처분을 하였다."
"이유","이에 대하여 원고들이 제기한 심판청구에서 조세심판원은 2012. 12. 27. ‘이 사건 교환계약과 같은 주식의 포괄적 교환에 대하여 상증세법 제35조가 정한 저가·고가 양도에 따른 이익의 증여 등 규정을 적용하여 과세하는 것은 별론으로 한다."
"이유","이에 따라 피고는 2013. 10. 1. 상증세법 제35조에 근거하여 원고들에게 증여세를 부과하는 이 사건 처분을 하였다."
"이유","그런데 대법원은 2014. 4. 24. ‘상법상 주식의 포괄적 교환에 의하여 완전자회사가 되는 회사의 주주가 얻은 이익에 대하여는 상증세법 제35조가 아닌 상증세법 제42조 제1항 제3호를 적용하여 과세하여야 한다’는 판결을 선고하였다."
"이유","먼저 위 대법원 2011두23047 판결에 따라 상증세법 제35조를 근거로 하여 원고들에게 증여세를 부과할 수 없다."
"이유","증여세 과세의 기초가 되는 사정에 아무런 변경이 없는데도 이 사건 조항을 처분사유로 하는 것은 불복과정에서 취소된 종전 처분을 번복하여 이를 되풀이하는 것일 뿐만 아니라 이 사건 조항에 근거한 종전 처분을 취소한 조세심판결정의 기속력에 저촉된다."
"이유","원심의 판단은 정당하고 상고이유 주장과 같이 과세처분 취소 후 재처분의 제한, 처분사유의 추가·변경이나 재결의 기속력 등에 관한 법리를 오해한 잘못이 없다."
"이유","그러므로 상고를 모두 기각하고 상고비용은 패소자가 부담하도록 하여, 관여 대법관의 일치된 의견으로 주문과 같이 판결한다."
