"판시사항","매매의 목적물인 토지의 현황이 지적공부상의 경계와 다르게 표시된 경우 매매 대상이 되는 토지 소유권의 범위"
"판시사항","당사자가 사실상의 경계대로 토지를 매매할 의사로 매매하였는데 지적도상의 경계표시와 사실상의 경계표시 사이에 차이가 나고, 그 부분이 제3자 앞으로 소유권이전등기가 된 경우 그 부분에 대한 매도인의 소유권이전등기의무가 이행불능이 되었다고 볼 것인지 여부"
"이유","특별한 사정이 없는 한 위 계쟁토지부분에 대한 매도인의 소유권이전등기의무는 이행불능이 된 것으로 볼 수밖에 없다."
"이유","달리 원고에게 이 사건 계쟁토지부분을 점유할 정당한 권원이 있다고 볼 만한 아무런 자료도 없는 이 사건에 있어서 원고는 그 각 소유자들인 피고들에게 그가 점유 중인 이 사건 각 계쟁토지부분을 인도할 의무가 있다고 판단하였다."
"이유","원심판시와 같이 망 소외 1이 사실상 경계인 탱자나무 울타리를 경계로 하여 이 사건 계쟁토지부분까지 망 소외 2에게 매도한 것이라면 위 분할 전 토지의 지적분할은 잘못된 것임이 명백하다."
"이유","적어도 위 소외 1 및 그 상속인들과 위 소외 2 및 소외 4 사이에 있어서는 사실상의 경계에 의하여 이 사건 각 계쟁토지를 매매한 것으로 볼 것이므로 이 부분에 관한 원심판결의 이유 설시는 적절하지 못하다."
"이유","피고들 명의의 각 소유권이전등기가 경료됨에 따라 이 사건 각 계쟁토지부분의 소유권은 피고들에게 귀속되고 망 소외 1이나 그 상속인들의 원고에 대한 소유권이전등기의무는 이행불능이 되었다고 할 것이다."
"이유","결국 원고의 본소청구를 배척하고 피고들의 반소청구를 받아들인 원심판결은 정당하고 소론과 같은 위법이 없으므로 논지는 모두 이유 없다."
