"판시사항","피담보채권이 소멸한 담보가등기의 말소를 구함에 있어 가등기명의자가 아닌 채권자 또는 가등기의 실질적 권리자의 동의를 구할 소의 이익이 있는지 여부"
"판시사항","담보물의 적정가격이 피담보채권액을 초과하는데도 양도담보권자가 담보물을 적정가격보다 저렴한 가격에 환가처분하여 그 환가금이 채권액에 미치지 못한 경우 피담보채권의 소멸 여부"
"판결요지","등기원인에 관하여 제3자의 동의를 필요로 하는 경우라 함은 등기원인이 제3자의 동의를 유효요건으로 하여 그러한 요건을 갖추지 않으면 그 등기가 실효될 염려가 있을 때라 할 것이다."
"판결요지","피담보채권이 소멸한 담보가등기의 말소에 있어서 가등기명의자가 아닌 채권자 또는 실질적 가등기권리자의 동의는 유효요건이라고 할 수 없다."
"판결요지","따라서 피담보채권이 소멸한 가등기는 담보물의 소유자가 피담보채권이 소멸을 이유로 그 말소를 구하는 경우 그 실질적 권리자가 따로 있느냐에 관계없이 가등기명의자만을 상대로 하면 족하므로 가등기의 실질적 권리자임을 이유로 그에게 위 가등기말소등기의 동의를 구하는 소송은 소의 이익이 없다."
"이유","원고 OOO은, 주문 제3항 기재의 가등기는 그가 피고 OOO로부터 금원을 차용하면서 피고 OOO의 요구에 따라 담보목적으로 피고 OOO 명의로 경료된 가등기인데 그 피담보채권이 소멸되었으므로 위 가등기의 실질적 권리자인 피고 OOO에게 피고 OOO 명의의 가등기등기말소에 대하여 동의를 구한다고 주장하므로 살핀다."
"이유","등기원인에 관하여 제3자의 동의를 필요로 하는 경우라함은 등기원인이 제3자의 동의를 유효요건으로 하여 그러한 요건을 갖추지 않으면 그 등기가 실효될 염려가 있을 때라 할 것이다."
"이유","피담보채권이 소멸한 담보가등기의 말소에 있어서 가등기명의자가 아닌 채권자 또는 실질적 가등기권리자의 동의는 유효요건이라고 할 수 없다."
"이유","갑 제1호증의 1,2,3,4,5, 갑 제2호증의 1,2,3,4,5, 갑 제3호증의 1,2, 갑 제4,5호증, 을 제3,4호증의 각 기재 및 증인 김성곤의 증언에 변론의 진취지에 의하여 인정되는 사실과 당사자들 사이에 다툼이 없는 사실은 다음과 같다."
"이유","그러므로 살피건대, 양도담보권자가 피담보채권의 만족을 얻기 위하여 담보목적물을 환가 내지 평가처분한 경우 정산의무가 있다할 것이다."
"이유","그 환가나 평가도 언제나 객관적으로 공정한 가격에 하여야 할 의무가 있으므로 이에 의하지 않은 경우에는 정산의무불이행이 된다."
"이유","나아가 원고들이 입게 된 손해액에 관하여 보건대, 원고들이 피고 김명규의 담보물 부당환가로 인하여 입은 손해는 담보물 매도 당시의 적정가격이라고 할 수 있는 위 감정가격 금 31,202,680원과 잔존 차용원리금 21,874,855원과의 차액인 금 9,327,825원이라 할 것이다."
"이유","위 각 임야에 관한 소외 OOO 명의의 소유권이전등기 당시인 같은 해 7.22. 현재 원고 OOO이 피고 OOO에게 변제하여야 할 잔존채무가 금 21,831,323원인 사실은 위에서 본 바와 같다."
"이유","위 인정사실에 의하면 피고 OOO가 담보물인 위 상시리 각 임야의 적정가격이 위 각 차용원리금을 초과함에도 이를 적정가격보다 저렴한 가격에 환가하였다 할 것이다."
"이유","양도담보권자가 담보목적으로 소유권이전된 담보물을 환가처분하는 경우 객관적으로 공정한 가격에 처분하여야 할 의무가 있음은 물론 담보물의 적정가격이 피담보채권의 원리금을 초과한 때에는 담보물의 소유자에게 그 차액을 반환하여야 할 정산의무만이 남고 피담보채권은 소멸한다 할 것이다."
"이유","위와 같은 법리는 양도담보권자가 그 의무에 반하여 담보물을 적정가격보다 저렴한 가격에 환가 하였거나, 가사 그 환가금이 채권원리금에 미치지 못한다 하여도 동일하게 적용된다 할 것이므로 피고 OOO의 원고 OOO에 대한 위 차용원리금 채권은 모두 소멸되었다고 할 것이다."
"이유","따라서 피고 OOO은 원고 OOO에게 위 제1차용금의 담보목적으로 경료된 이 사건 부동산에 관한 주문 제3항 기재의 가등기를 말소하여야 할 의무가 있다 할 것이다."
"이유","위 약정에 따라 피고 OOO가 원고 OOO에게 위 계약금과 중도금을 각 지급하였는데 위 환매기간이 경과하였으므로 원고 OOO에게 이 사건 부동산에 관한 1980.8.4. 매매를 원인으로 한 소유권이전등기절차의 이행을 구한다고 주장하므로 살핀다."
"이유","그렇다면 원고 OOO의 이 사건 청구 중 가등기말소등기절차에 동의를 구하는 청구부분은 그 소가 부적법하다고 할 것이므로 이를 각하한다."
