"판시사항","등기의 일괄신청을 허용하지 않던 구 부동산등기법을 위반하여 등기의무자가 甲부동산과 동일한 등기원인, 접수일, 접수번호로 乙부동산에 관한 소유권이전등기를 마친 사안에서, 乙부동산에 관한 등기의 추정력이 깨어졌다고 본 사례이다."
"이유","위 법리와 기록에 비추어 살펴보면, 원심의 위와 같은 판단은 정당한 것으로 수긍이 가고, 거기에 상고이유에서 지적하는 바와 같은 소유권이전등기의 추정력에 관한 법리오해의 위법이 없다."
"이유","원심은 그 채용 증거들을 종합하여 그 판시와 같은 사실을 인정한 다음, 원고가 이 사건 토지를 경작하는 대가로 소외 1에게 도지를 주었다는 사실 및 이 사건 소유권이전등기의 경료사실을 처음부터 알고 있었다는 사실을 인정할 증거가 없다."
"이유","원고가 단지 부동산 소유권이전등기 등에 관한 특별조치법에 의하여 소유권이전등기의 신청을 시도하였다는 점만으로는 이 사건 소유권이전등기가 실체적 권리관계에 부합한다는 피고의 주장을 받아들일 수 없다고 판단하였다."
"이유","원심판결 이유를 관련증거와 기록에 비추어 살펴보면, 원심의 위와 같은 사실인정과 판단은 정당한 것으로 수긍이 간다."
"이유","거기에 상고이유에서 지적하는 바와 같은 소유권이전등기의 실체적 권리관계 부합 여부에 관한 법리오해 또는 채증법칙 위배 등의 위법이 없다."
