"판시사항","교통사고 피해자가 교통사고 발생에 기여한 자신의 과실 유무나 다과와 관계없이 자동차손해배상 보장법 시행령 제3조 제1항 제2호 단서에 따른 진료비 해당액을 책임보험금으로 청구할 수 있는지 여부"
"판시사항","甲 회사는 피해자가 자동차손해배상 보장법 시행령 제3조 제1항 제2호 단서에 따라 乙 OOO에 대하여 가지는 진료비 해당액의 책임공제금 청구권을 동일성을 그대로 유지한 채로 취득하였음에도, 이와 달리 본 원심판결에 법리오해의 위법이 있다고 한 사례"
"이유","자동차손해배상 보장법 시행령 제3조 제1항 제2호 단서는 피해자에게 발생한 손해액이 자동차손해배상 보장법 제15조 제1항의 규정에 의한 자동차보험 진료수가기준에 따라 산출한 진료비 해당액에 미달하는 경우에는 [별표 1]에서 정하는 금액의 범위에서 그 진료비 해당액을 책임보험금으로 지급하도록 규정하고 있는 바이다."
"이유","원고의 보험약관은 원고가 피보험자에게 보험금을 지급한 경우 그 보험금의 한도 내에서 피보험자의 제3자에 대한 권리를 취득한다고 정하고 있는 사실 등을 알 수 있다."
"이유","이러한 사실관계를 앞에서 본 법리에 비추어 살펴보면, 원고는 위 각 피해자에게 위 ‘청구내역’ 기재 각 치료비를 지급함으로써 위 각 피해자가 피고에 대하여 가지는 책임공제금 청구권을 각 지급액의 한도 내에서 취득하였다 할 것인 바이다."
"이유","결국 원고는 위 각 피해자가 위 제2호 단서에 따라 피고에 대하여 가지는 진료비 해당액의 책임공제금 청구권을 그 동일성을 그대로 유지한 채로 취득하였다 할 것이다."
"이유","그렇다면, 원심으로서는 위 각 피해자별 상해의 정도가 자동차손해배상 보장법 시행령 제3조 제1항 제2호에 따라 규정된 [별표 1]의 어디에 해당하는지를 살펴 그 책임공제금의 한도를 확정한다."
"이유","위 각 피해자별 과실비율에 해당하는 금액을 공제한 손해액이 자동차보험 진료수가기준에 의하여 산출된 진료비 해당액에 미치는지 여부를 심리하여 만약 위 손해액이 위 진료비 해당액에 미달하는 경우에는 그 진료비 해당액을 책임공제금으로 인정하였어야 할 것이다."
"이유","원고가 원고 차량의 동승자인 교통사고 피해자에 대한 공동불법행위자 중 1인의 보험자로서 자기 부담 부분을 초과하여 공동면책을 하였음을 주장·증명하지 않았다는 등의 이유로 원고의 피고에 대한 이 사건 구상금 청구를 모두 배척하였다."
"이유","원심의 이러한 조치에는 자동차손해배상 보장법 시행령 제3조 제1항 제2호 단서의 해석, 보험자대위의 효력 등에 관한 법리를 오해하거나 판단을 누락함으로써 판결에 영향을 미친 위법이 있다."
"이유","그러므로 원심판결을 파기하고, 사건을 다시 심리·판단하게 하기 위하여 원심법원에 환송하기로 하여 관여 대법관의 일치된 의견으로 주문과 같이 판결한다."
