"판시사항","상표 ""OOO""이 저명한 고인과의 관계를 허위로 표시한 상표에 해당하는지 여부 [2] 저명한 고인의 이름을 사용한 상표가 공공의 질서 또는 선량한 풍속을 문란하게 할 염려가 있다거나 수요자를 기만할 염려가 있는 상표가 아니라고 한 사례"
"판결요지","위 상표를 상표법 제7조 제1항 제4호 소정의 공공의 질서 또는 선량한 풍속을 문란하게 할 염려가 있는 상표라거나 상표법 제7조 제1항 제11호 소정의 수요자를 기만할 염려가 있는 상표라고도 볼 수 없다고 한 사례.      "
"이유","원심심결 이유에 의하면, 원심은, 이 사건 출원상표""OOO""은 1955. 9. 30. 사망한 세계적으로 유명한 미국의 영화배우 OOO의 영문성명으로 구성된 것으로 OOO과 특정한 관계가 없음에도 관계가 있는 것처럼 OOO의 성명을 허위로 표시한 상표에 해당한다."
"이유","일반 수요자로 하여금 위 고인의 성명 등의 상표화 등 상업적 사용권한을 가진 자와 특정한 관계에 있는 것으로 상품의 출처의 오인·혼동을 유발할 우려가 있다는 이유로 상표법 제7조 제1항 제2호, 제4호 및 제11호에 의하여 본원상표의  등록을 거절한 원사정을 유지하였다."
"이유","기록과 관련 법규에 의하여 살펴보면, 본원상표는 단순히 고인의 성명 그 자체를 상표로 사용한 것에 지나지 아니할 뿐 동인과의 관련성에 관한 아무런 표시가 없어 이를 가리켜 상표법 제7조 제1항 제2호 소정의 고인과의 관계를 허위로 표시한 상표에 해당한다고 볼 수 없다."
"이유","본원상표를 상표법 제7조 제1항 제4호 소정의 공공의 질서 또는 선량한 풍속을 문란하게 할 염려가 있는 상표라거나 상표법 제7조 제1항 제11호 소정의 수요자를 기만할 염려가 있는 상표라고도 볼 수 없다."
"이유","그러므로 원심심결을 파기하고, 사건을 다시 심리·판단하게 하기 위하여 특허청 항고심판소에 환송하기로 하여 관여 법관의 일치된 의견으로 주문과 같이 판결한다."
