"판결요지","합필로 인하여 부동산등기용지가 폐쇄된 경우에는 비록 그 폐쇄가 위법하게 하여진 경우라도 부동산등기법상 그 회복절차를 정한 규정이 없고, 피고가 그 말소등기절차나 회복등기절차를 이행할 등기의무자의 지위에 있다고 볼 수도 없어 합병등기의 말소 및 폐쇄등기의 회복을 구하는 소는 부적법하다."
"이유","피고 소송대리인은 본안전항변으로서 원고는 당심에 이르러 청구취지를 정정하여 손해배상청구를 추가한바, 원고는 원판결에 대하여 항소를 제기하지도 아니 하였다."
"이유","이와 같은 청구의 변경은 심판의 기초가 되는 사실자료가 공통되어 청구의 기초가 동일한 소의 추가적 변경으로서 적법한 것이라고 할 것이므로 위 본안전항변은 그 이유없다."
"이유","이에 부합하는 듯한 갑 제3호증, 동 제5 내지 9호증의 각 기재내용과, 원심증인 OOO의 증언은 다음에 설시하는 각 증거에 비추어 이를 믿지아니하는 바이고 원심 각 검증결과만으로는 원고 소송대리인의 위 주장사실을 인정하기에 부족하다."
"이유","원고의 부로서 그 법정대리인인 소외 OOO이 그 형되는 소외 OOO에게 이건 토지의 처분을 위임하여 이에따라 위 OOO은 1965.2.12. 원고를 대리하여 피고에게 이건 토지를 대금 971,100원에 매도했다."
"이유","다음 합병등기의 말소등기절차이행과 폐쇄등기의 회복등기절차이행을 구하는 부분에 관하여 보건대,이건 토지의 7필토지가 1970.6.17. 부산시 명장동 300 대 1,200평에 합병되어 동년 8.1. 그 등기가 경료되고, 이건 토지에 관한 등기용지가 폐쇄되었음은 앞서 본 바와 같은 바이다."
"이유","피고가 그 말소등기절차나 회복등기절차를 이행하여야 할 등기의무자의 지위에 있다고 볼 수는 없는 것이므로 위 각 청구부분에 대한 원고의 소는 부적법하다고 할 것이다."
"이유","그렇다면 원고의 이건 청구중 소유권이전등기의 말소등기절차이행, 변전소시설철거, 토지인도 및 손해배상 청구부분은 모두 그 이유없으므로 이를 기각하고,위 합병등기의 말소등기절차이행과, 폐쇄등기의 회복등기절차이행을 구하는 부분은 부적법한 소이므로 이를 각하할 것이다."
"이유","원판결은 이와 결론을 달리하여 부당하므로 민사소송법 제386조에 의하여 이를 취소하고, 소송비용의 부담에 관하여는 동법 제96조, 제89조를 적용하여 주문과 같이 판결한다."
