"이유","소외인이 원고에게 조합가입을 권유하는 과정에서 원고가 출자한 대지에 관하여 실제면적 이상의 할증보상을 하여 주겠다고 약정한 사실을 인정할 수 있다고 판단한 것은 정당하다."
"이유","소외인이 원고와 이 사건 약정을 체결한 행위는 비법인사단인 피고가 가지고 있는 총유물 그 자체에 관한 관리 및 처분행위에 해당하지 아니하고 단순한 채무부담행위에 불과하므로, 이 사건 약정은 비록 피고의 총회결의를 거치지 않았다고 하더라도 무효로 볼 수 없다고 판단하였다."
"이유","주택건설촉진법에 의하여 설립된 재건축조합은 민법상의 비법인사단에 해당하고, 총유물의 관리 및 처분에 관하여는 정관이나 규약에 정한 바가 있으면 이에 따라야 한다."
"이유","정관이나 규약에 정함이 없는 이상, 사원 총회의 결의를 거치지 않은 총유물의 관리 및 처분행위는 무효라고 할 것이다."
"이유","여기서 총유물의 관리 및 처분행위라 함은 비록 단순한 채무부담행위는 포함하지 아니하나, 총유물 그 자체에 관한 법률적·사실적 처분행위와 이용·개량행위는 모두 포함한다고 할 것이다."
"이유","그런데 기록에 의하면, 이 사건 약정은 원고가 출자한 대지에 관하여 다른 조합원들과는 달리 실제면적 이상의 할증보상을 하여 주겠다는 내용임을 인정할 수 있는 바이다."
"이유","이는 결국 원고에게 조합원들이 출자하여 형성된 전체 조합재산에 대하여 다른 조합원들보다 더 많은 지분을 인정하여 주겠다는 취지 또는 재건축사업의 시행으로 인하여 발생한 아파트, 수익금 등의 결과물을 다른 조합원들보다 더 많이 분배하여 주겠다는 취지와 다를 바 없다고 할 것이다."
"이유","이 사건 약정을 체결하는 행위는 피고가 가지고 있는 총유물 그 자체에 관한 관리 및 처분행위라고 보지 않을 수 없다."
"이유","원고는 무효인 이 사건 약정에 기하여 피고로부터 원심이 인정한 금액을 초과하는 청산금을 지급받을 권리는 없다고 할 것이다."
"이유","그렇다면 원심이 원고의 주위적 청구 중 일부를 배척한 것은 그 이유 설시에는 미흡한 점이 있으나 결과적으로 정당하다."
"이유","거기에 원고의 부대상고이유의 주장과 같은 판결 결과에 영향을 미친 채증법칙 위배로 인한 사실오인, 이 사건 약정의 해석이나 자백에 관한 법리오해 등의 위법이 없다."
"이유","이 부분 사건을 다시 심리·판단하게 하기 위하여 원심법원으로 환송하며, 원고의 부대상고를 기각하기로 하여 관여 법관의 일치된 의견으로 주문과 같이 판결한다."
