"이유","원심판결 이유에 의하면 원심은, 1961년경 정부는 도시 실업자들의 취업과 식량증산 등을 목적으로 희망자를 모집하여 전국 8개도 24개 지역에 걸쳐 귀농 정착사업을 시행키로 한다."
"이유","위 인정사실에 의하면 원정착민들이 1961.11.30. 이 사건 임야를 분배받아 점유한 이래 원고들 및 위 소외인 등이 그 점유를 승계하여 20년 이상 계속 점유하였다."
"이유","이 사건 임야에 대한 각 18분의 1 지분에 관하여 위 일자 취득시효 완성을 원인으로 한 소유권이전등기를 구하는 원고들의 이 부분 청구를 모두 인용하였다."
"이유","물건에 대한 점유란 사회관념상 어떤 사람의 사실적 지배에 있다고 보이는 객관적 관계를 말하는 것으로서 사실상 지배가 있다고 하기 위하여는 반드시 물건을 물리적, 현실적으로 지배하는 것만을 의미하는 것이 아니다."
"이유","물건과 사람과의 시간적, 공간적 관계와 본권관계, 타인 지배의 가능성 등을 고려하여 사회관념에 따라 합목적적으로 판단하여야 할 것인 바이다."
"이유"," 부락민들이 군 소유의 임야를 자연상태 그대로 주변 경작지에 대한 방풍림으로 이용하고 있다거나 그 임야에서 화목 등 땔감을 채취하여 온 사실만으로는 그 임야를 부락민 중 경작지를 전득한 자들이 배타적으로 점유하여 온 것이라고 단정할 수 없다고 할 것이다."
"이유","위 각 사진만으로는 원고들이 이 사건 임야에 조림사업을 실시하여 방풍림으로 점유관리하여 온 것임을 인정하기에는 부족하다."
"이유","위 증인은 이 사건 임야 등의 구체적인 지번조차도 잘 모르면서 막연하게 위와 같은 진술을 하고 있음에 불과하다."
"이유","이 사건 임야 중 위 현장검증 등이 실시된 이후에 원고들이 청구를 확장한 부분인 위 , 등 2필지의 임야에 대하여는 기록상 그 임야의 조림 상태나 점유 현황 등을 확정할 만한 아무런 자료가 없다."
"이유","기록에 의하면 1961년도 당시 정부가 실시한 귀농정착 사업에 있어 그 분배 대상 토지는 매 세대당 2정보씩을 한도로 하여 개간 농지와 대지를 그 대상으로 한 것이었다."
"이유"," 피고 이외의 다른 군에서도 원정착민들이나 그 전득자들에게 개간 농지와 대지 외에 임야나 하천 등을 분배대상으로 인정한 적은 없는 것으로 보이며, 전득자들인 원고 등이 제출한 매매계약서 등 관련증거를 살펴보아도 가옥과 대지 및 전답에 관한 권리만을 목적물로 하였을 뿐이다."
"이유","그 외에 이 사건 임야에 관한 권리를 원고 등이 원정착민들로부터 매수하였다거나 또는 증여받았음을 인정할 자료는 보이지 아니한다."
"이유","또한 기록에 의하면 피고가 1989.12.30.경 이 사건 임야 일대에 대한 원고 등의 점유 현황별 분할 측량을 실시하던 당시에도 원고 등이 이 사건 임야에 대한 점유를 주장한 흔적은 없다."
"이유","특히 이 사건 임야 중 위 , 임야에 대하여는 이 사건 제소 당시에도 아무런 권리주장이 없다가 원심에 이르러서야 뒤늦게 청구를 확장하면서 그 점유를 주장하기 시작하였음을 알 수 있다."
"이유","결국 임야의 점유에 관한 법리를 오해하였거나 증거가치에 대한 판단을 그르치고 필요한 심리를 다하지 아니한 잘못을 저지른 것이라고 할 것이다."
"이유","그러므로 원심판결 중 이 사건 임야에 관한 부분을 파기하고 이 부분 사건을 다시 심리.판단하게 하기 위하여 원심법원에 환송하기로 하며, 나머지 토지 부분에 관한 상고를 기각한다."
"이유","이 부분에 관한 상고비용은 패소자의 부담으로 하기로 하여 관여 법관의 일치된 의견으로 주문과 같이 판결한다."
