"이유","아래 사실은 당사자 사이에 다툼이 없거나, 소외인의 하자감정결과에 변론 전체의 취지를 종합하여 이를 인정할 수 있다."
"이유","제1심 공동피고였던 OOO건설 주식회사 는 이 사건 아파트를 건축하여 분양한 사업주체이며, 피고는 아래에서 보는 바와 같이 OOO건설이 건축하여 분양한 이 사건 아파트에 대한 하자보수보증계약을 체결한 자이다."
"이유","2003. 6. 5. 은평구청장으로부터 이 사건 아파트에 관한 사용검사를 받아 주민들을 입주시켰으며, 그 무렵 이 사건 아파트의 입주자대표회의인 원고가 구성되자, 은평구청장은 위 하자보수보증서의 보증채권자를 원고로 변경하였다."
"이유","이 사건 하자보수보증서 특기사항란에는 ‘1. 이 보증서에 의한 보증책임은 뒷면에 첨부된 하자보수보증내역서에 구분기재된 내역에 따라 각 공종별로 이를 부담합니다. 2. 이 보증서에 의한 보증책임은 주택건설촉진법 및 공동주택관리령에서 정하고 있는 하자가 발생한 경우에 한하여 보증책임을 부담합니다.’라는 내용이 기재되어 있다."
"이유","OOO건설은 이 사건 아파트를 시공함에 있어 설계도면에 따라 적정하게 시공하였어야 함에도, 일부를 미시공하거나, 변경 또는 부실시공함으로써, 이 사건 아파트에는 건물내ㆍ외벽 균열, 누수 등 전용부분 및 공용부분에 걸쳐 다수의 하자가 발견되었다. "
"이유","OOO건설이 이에 응하여 하자를 보수하였으나 이 사건 아파트에는 2006. 10. 30. 현재 여전히 별지 ‘하자 책임기간별 공사비 집계표 1 내지 4’ 기재와 같은 하자가 존재한다."
"이유","한편 입주자대표회의는 구 공동주택관리령 제16조 제6항에 근거하여 아파트를 건설ㆍ공급하는 자에 대하여 하자보수를 요구할 수 있다."
"이유","하자보수가 이행되지 아니할 경우 하자보수보증금으로 직접 보수하거나 제3자에게 대행시킬 수 있는바, 하자보수보증서가 예치된 경우 입주자대표회의는 그 보증인에게 직접 하자보수보증금을 청구할 수 있다 할 것인데 원고가 OOO건설에 대하여 하자보수를 수차례에 걸쳐 청구한 사실은 앞서 본 바와 같은 바이다."
"이유","이에 대하여 피고는, 이 사건 하자보수보증계약을 체결할 당시 당사자 사이에 보증대상인 계약명 을 특정한 이상 해당 하자보수보증금을 다른 공종에 전용할 수는 없다고 주장한다."
"이유","사업주체와 건설공제조합 사이에 하자의 내용을 정하지 않고 단지 보증기간만을 정하는 경우에는 그 보증계약상의 보증금액에 의하여 보증되는 하자는 그의 보증기간 내에 발생한 하자보수책임기간 내의 모든 하자를 의미한다고 할 것이나, 특별히 보증계약으로 보증하고자 하는 하자의 내용을 정한 경우에는 달리 보아야 할 것이다."
"이유","이 보증서에 의한 보증책임은 주택건설촉진법 및 공동주택관리령에서 정하고 있는 하자가 발생한 경우에 한하여 보증책임을 부담한다는 내용이 각 기재되어 있으며, 이 사건 하자보수보증서에 첨부된 하자보수보증내역서에 보증기간과 함께 그 기간에 따른 계약명 이 특정되어 기재되어 있는 사실은 앞서 본 바와 같다."
"이유","피고는 먼저, 사용검사 전에 발생한 하자에 대해서는 피고의 하자보수보증약관에 따라 보증책임이 없다고 주장하므로 살피건대, 원고가 피고에 대해서는 사용검사 전에 발생한 하자 부분을 제외하고 사용검사 후에 발생한 하자 부분에 대해서만 그 보증책임을 구하고 있으므로, 피고의 위 주장은 이유 없다."
"이유","소외인의 하자감정결과에 대하여 보수단가 등이 적정하게 적용되지 않았으므로 적정한 보수단가를 적용하여 계산한 다음 순공사비에 간접비 를 적용하여야 한다고 주장하므로 살피건대, 을 제2호증의 기재만으로는 피고의 위 주장을 인정하기에 부족하다."
"이유","OOO건설이 그 동안 원고의 요청에 따라 수차례에 걸쳐 하자보수공사를 시행하였던 점 등 제반 사정을 참작하여 보면 손해의 공평분담 원칙 또는 신의칙에 터 잡아 OOO건설이 배상하여야 할 손해액을 그 하자보수비용의 80% 정도로 제한함이 상당하다 할 것이다."
"이유","이 사건 하자보수보증계약은 성질상 민법상 보증계약의 한 형태라 할 것이므로 보증계약의 부종성에 따라 하자보수보증금 역시 감액되어야 할 것이다."
"이유","그런데 보증기간 1년, 5년, 10년에 해당하는 각 하자보수비용에 위 20%의 비율에 의하여 손해배상액을 감액하여도 여전히 보증금액을 초과하므로 그 각 보증금액 전부에 대하여 책임이 인정된다."
"이유","다만, 보증기간 2년의 하자보수비용 27,230,329원에 대하여는 위 금액에 20%를 감액한 21,784,263원에 대해서만 책임이 인정된다 할 것인 바이다."
"이유","그렇다면, 원고의 피고에 대한 이 사건 청구는 위 인정범위 내에서 이유 있어 이를 인용하고 나머지 청구는 이유 없어 이를 기각할 것인 바이다."
"이유","이와 결론을 일부 달리한 제1심 판결의 피고에 대한 부분은 부당하므로 피고의 항소와 원고의 부대항소를 각 일부 받아들여 제1심 판결을 위와 같이 변경한다."
