"판결요지","소외인들이 개인사찰을 매수한 후 사찰의 건물과 부지인 부동산에 대한 등기명의를 그들의 의사나 사정에 따라 자신들 또는 사찰 명의로 하여 두고 부동산에 대한 소유권을 실질적으로 행사하면서 사찰을 운영하다가 피고 등에게 위 부동산에 관한 지분소유권이전등기를 경료하여 주었다."
"판결요지","명목상 위 사찰을 대한불교조계종 소속 사찰로 등록하였을 뿐 위 사찰의 건물 등 재산을 위 조계종에 귀속시킨 바 없다."
"이유","기록에 의하여 원심이 취사한 관계증거를 살펴보면, 소론이 지적하는 점에 관한 원심의 사실인정은 정당한 것으로 수긍할 수 있다."
"이유","명목상 위 사찰을 대한불교조계종 소속 사찰로 등록하였을 뿐 위 사찰의 건물 등 재산을 위 조계종에 귀속시킨바 없다."
"이유","같은 취지로 판단한 원심은 정당하고 거기에 소론과 같은 법리오해나 이유모순의 위법이 있다고 할 수 없다."
"이유","원심이 인정한 바와 같이 위 소외인들이 그들 사이의 분쟁을 해결하고 위 사찰을 공동관리하기 위한 목적으로 위와 같이 등기를 경료하였다면, 위와 같이 등기된 때 위 OOO가 권리능력 없는 재단이나 사단이 되었다고 볼 수는 없다."
"이유","그러므로 상고를 기각하고 상고비용은 원고 대표자로 되어 있는 소외 3의 부담으로 하여 관여 법관의 일치된 의견으로 주문과 같이 판결한다."
