"판시사항","甲 회사가 乙 회사의 컴퓨터프로그램저작권을 침해하였는지가 문제된 사안에서, 甲 회사는 乙 회사의 허락 없이 乙 회사의 컴퓨터프로그램을 개작한 2차적 프로그램을 사용하여 컴퓨터프로그램의 상당부분을 제작·판매함으로써 乙 회사의 개작권을 침해하였다고 본 원심판단을 수긍한 사례"
"이유","주식회사 OOO은행의 신종합온라인시스템은 원심판시 이 사건 제1 이용허락계약에 따라 프로그램저작권자인 원고 OOO 오스트레일리아 피티와이 엘티디로부터 사용허락을 받은 원심판결 별지 제1항 기재 컴퓨터프로그램의 일련의 지시·명령의 상당부분을 이용하여 창작된 OOO의 개작물이라 할 것이다."
"이유","데이터베이스 관리시스템을 CA-DB에서 오라클 DBMS로 전환하는 작업을 진행하는 과정에서 위 신종합온라인시스템의 원 프로그램인 OOO의 소스코드에 접근한 바 있다."
"이유","C언어로 작성된 위 OOO와 COBOL 언어로 작성된 위 OOO의 소스코드를 구성하는 파일에 대한 호출관계그래프를 도출한 다음 이들을 파일의 개수, 줄 수, 함수 수에 따라 정량적으로 비교한 결과 소스코드 중 50% 이상에서 유사성을 지니는 파일의 비율이 42.74% 정도이다."
"이유","원심판결 별지 제2항 기재 프로그램은 위와 같이 감정대상이 되었던 OOO에 모두 포함되어 있던 프로그램이거나 그 동일성을 해하지 않는 범위에서 이를 변형한 프로그램이다."
"이유","별지 제3항 기재 프로그램은 그 상당부분이 감정대상이 되었던 OOO 구동에 필요한 프로그램이므로, 이와 같은 제반 정황들에 비추어 OOO와 OOO 및 OOO 중 상당부분 사이에는 실질적 유사성이 있다고 볼 수 있다."
"이유","그렇다면 피고는 원고 OOO의 허락 없이 OOO의 2차적 프로그램인 신종합온라인시스템을 사용하여 OOO 및 OOO의 상당부분을 제작·판매함으로써 원고 OOO가 OOO에 대하여 가지는 개작권을 침해하였다고 할 것이다."
"이유","기록에 비추어 살펴보면, 원심의 위와 같은 판단은 정당하고, 거기에 상고이유로 주장하는 개작권 침해에 관한 법리오해 등의 위법이 없다."
"이유","기록에 비추어 살펴보면, OOO 중 OOO에 대한 개작권 침해부분을 특정하여 분리해낼 수 없다고 할 것이므로, 이와 같은 취지에서 원고 OOO의 OOO 전체에 대한 배포금지청구를 받아들인 원심의 판단은 정당하고, 거기에 상고이유로 주장하는 침해정지청구권의 범위에 관한 법리오해 등의 위법이 없다."
"이유","그와 같은 이유만으로 피고의 OOO 개작권 침해행위로 인하여 원고 OOO에게 손해가 발생하지 않았다고 할 수 없다."
"이유","같은 조 제5항에 따라 증거조사의 결과와 변론 전체의 취지에 의하여 밝혀진 간접사실들을 종합하여 피고의 OOO 개작권 침해행위로 인한 위 원고의 손해액을 산정하였다."
"이유","기록에 비추어 살펴보면 원심의 위와 같은 판단은 정당하고, 거기에 상고이유로 주장하는 손해액의 산정에 관한 법리오해 등의 위법이 없다."
"이유","피고가 OOO 자체를 복제·배포하거나 그럴 우려가 있다고 할 수 없으므로, 이와 같은 취지에서 원고 OOO의 OOO에 대한 복제 및 배포 금지청구를 받아들이지 아니한 원심판단은 정당하고, 거기에 상고이유로 주장하는 복제권 침해에 관한 법리오해 등의 위법이 없다."
"이유","원고 OOO가 청구에 대응하거나 화해할 경우에는 원고 OOO의 이름과 비용으로 이를 행하는 것으로 약정한 점 등에 비추어 볼 때, 원고 OOO이 원고 OOO로부터 OOO에 대한 프로그램배타적발행권을 설정받았다고 할 수 없다고 판단하였다."
"이유","기록에 비추어 살펴보면 원심의 위와 같은 판단은 정당하고, 거기에 상고이유로 주장하는 프로그램배타적발행권의 설정에 관한 법리오해 등의 위법이 없다."
"이유","피고에 의하여 위 권리가 침해되고 있다고 하더라도 그러한 사정만으로 바로 불법행위로 되는 것은 아니라 할 것이다."
"이유","같은 취지의 원심 판단은 정당하고, 거기에 상고이유로 주장하는 영업권 침해에 관한 법리오해 등의 위법이 없다."
"이유","여기서 채권침해의 위법성은 침해되는 채권의 내용, 침해행위의 태양, 침해자의 고의 내지 해의의 유무 등을 참작하여 구체적, 개별적으로 판단하되, 거래의 자유 보장의 필요성, 경제·사회정책적 요인을 포함한 공공의 이익, 당사자 사이의 이익균형 등을 종합적으로 고려하여 신중히 판단하여야 한다."
"이유","그러므로 상고를 모두 기각하고 상고비용은 패소자의 부담으로 하여, 관여 대법관의 일치된 의견으로 주문과 같이 판결한다."
