"판시사항","노동조합이 없는 경우 취업규칙에 규정된 기존의 근로조건을 종전보다 불리하게 변경하기 위하여 요구되는 근로자 측의 동의 방법 및 그 소극적 요건인  ‘사용자측의 개입이나 간섭’의 의미"
"판시사항","근로관계가 포괄적으로 승계되어 종전의 근로조건이 그대로 유지된 채 승계된 법인에서 근무하게 되는 근로자에 대하여는 종전의 취업규칙이 그대로 적용되는지 여부"
"판시사항","공기업 구조조정을 진행하면서 각 부서별, 사업소·지부별로 설명회를 개최하여 관련 사업의 포괄승계에 따른 근로조건의 변경 및 퇴직금지급률 변경 사항을 설명하고 근로자들의 동의를 받은 사안에서, 근로자의 집단적 의사결정방법에 의한 동의가 있었다고 본 사례"
"판시사항","근로자의 집단적 의사결정방법에 의한 동의 없이 근로자에게 불리하게 작성·변경된 취업규칙이라도 사회통념상 합리성이 있다고 인정되는 경우에는 그 적용이 가능한지 여부 및 사회통념상 합리성 유무의 판단 기준"
"판결요지","회의방식에 의한 동의라 함은 사업 또는 한 사업장의 기구별 또는 단위 부서별로 사용자측의 개입이나 간섭이 배제된 상태에서 근로자 간에 의견을 교환하여 찬반을 집약한 후 이를 전체적으로 취합하는 방식도 허용된다."
"판결요지","다만, 취업규칙을 근로자에게 불리하게 변경하는 경우에는 그 동의를 받도록 한 근로기준법을 사실상 배제하는 것이므로 제한적으로 엄격하게 해석하여야 한다."
"판결요지","여기서 사용자측의 개입이나 간섭이라 함은 사용자측이 근로자들의 자율적이고 집단적인 의사결정을 저해할 정도로 명시 또는 묵시적인 방법으로 동의를 강요하는 경우를 의미하고 사용자측이 단지 변경될 취업규칙의 내용을 근로자들에게 설명하고 홍보하는 데 그친 경우에는 사용자측의 부당한 개입이나 간섭이 있었다고 볼 수 없다."
"판결요지","이러한 동의 등이 없는 한 사용자가 일방적으로 종전의 근로조건을 근로자에게 불리하게 변경하거나 종전의 근로조건보다 불이익한 승계한 법인의 취업규칙을 적용할 수 없다."
"판결요지","이 경우 종전의 근로조건을 그대로 유지한 채 승계한 법인에서 근무하게 되는 근로자에 대하여는 종전의 취업규칙이 그대로 적용된다."
"판결요지","사용자측이 변경될 내용을 근로자들에게 설명하고 홍보하는 데에 지나쳐 사용자측의 부당한 개입이나 간섭이 있었다고 볼 수 없으므로, 근로자의 집단적 의사결정방법에 의한 동의가 있었다고 본 사례."
"이유","1998. 7. 31.자 포괄승계 및 1999. 12. 31.자 보수규정 개정에 있어서 근로자의 집단적 의사결정방법에 의한 동의가 있었는지 여부이다."
"이유","사용자가 취업규칙의 변경에 의하여 기존의 근로조건을 근로자에게 불리하게 변경하려면 종전 근로조건 또는 취업규칙의 적용을 받고 있던 근로자의 집단적 의사결정방법에 의한 동의를 요한다."
"이유","이러한 동의를 얻지 못한 취업규칙의 변경은 효력이 없으며, 그 동의의 방법은 노동조합이 없는 경우에는 근로자들의 회의방식에 의한 과반수의 동의를 요한다."
"이유","이러한 동의 등이 없는 한 사용자가 일방적으로 종전의 근로조건을 근로자에게 불리하게 변경하거나 종전의 근로조건보다 불이익한 승계한 법인의 취업규칙을 적용할 수 없다."
"이유","원심판결 이유와 기록에 의하면, OOO조합은 구 해양오염방지법에 의하여 해양에 배출된 기름 등 폐기물에 대한 효율적인 방제와 방제에 관한 교육·훈련 및 기술개발을 통하여 방제능력을 향상시킴으로써 해양환경을 보전하기 위하여 설립된 법인으로 방제조합의 운영 및 사업에 소요되는 자금은 정부로부터의 지원금 등을 재원으로 조성한다."
"이유","1998. 7. 31.자 예선사업 포괄인수 당시 부두공단의 취업규칙에는 직원의 정년에 관하여 일반직 2급 이상은 61세, 일반직 3급 이하 및 기능직은 59세로 규정되어 있다."
"이유","본인은 국내 경제의 어려움을 극복하기 위한 노력의 일환으로 추진하고 있는 근로조건의 개정에 대하여 본인의 자유의사로써 동의서를 제출합니다."
"이유","그 내용에 의하면, ‘퇴직금은 1년 이상 근속한 직원에게 지급하며, 근속 1년에 대하여 근로기준법에서 정한 1개월분의 평균임금을 퇴직금으로 지급한다."
"이유","이에 따라 본부 각 팀별, 각 지부별로 “임·직원 보수규정 개정 및 퇴직금 일괄정산실시”라는 제목의 용지의 ‘가, 부’란에 소속 근로자들의 서명을 받는 방법으로 동의서를 받았다."
"이유","원고 2는 부두공단 소속 근로자였다가 예선사업이 방제조합으로 포괄승계됨에 따라 1998. 7. 31.자로 방제조합 소속 근로자가 되었다."
"이유","원고들은 방제조합 또는 부두공단의 관리직 3급 이하 직원이며, 앞서 본 각서 및 동의서에 모두 동의하는 취지로 서명한 사실을 알 수 있다."
"이유","관련 사업의 통폐합, 정년단축, 퇴직금지급률  조정은 공기업 구조조정의 핵심 사항이었으므로, 당시 예인사업 포괄승계 및 방제조합의 구조조정 사실이 원고들에게도 모두 알려졌을 것으로 보이는 점이다."
"이유","예인사업이나 방제조합의 업무는 그 사업소 또는 지부가 전국 해안에 걸쳐 소규모로 산재해 있어 근로자 전체가 한자리에 모이는 것이 곤란하였던 점이다."
"이유","이러한 과정을 거쳐 원고들을 포함한 근로자들은 공기업 구조조정의 일환으로 진행된 정년단축 및 퇴직금지급률 변경의 필요성을 인식하고 이를 감수하는 입장에서 위 각서와 동의서에 서명하였다."
"이유","예선사업 및 방제조합의 각 부서별, 사업소·지부별로 근로자들의 의견 집약과 취합 및 근로자들의 협의가 근로자들의 자유로운 의사에 따라 이루어진 것으로 볼 것이다."
"이유","사용자측의 개입이나 간섭이 배제된 상태에서 근로자 상호간에 의견을 교환하여 찬반의견을 집약한 후 이를 취합하는 방식으로 동의가 이루어졌다고 인정하기에 부족하다고 판단한 것은 근로자의 집단적 의사결정방법에 의한 동의에 관한 법리를 오해하고 필요한 심리를 다하지 아니함으로써 판결 결과에 영향을 미친 위법이 있다."
"이유","취업규칙을 근로자에게 불리하게 변경하는 경우에는 그 동의를 받도록 한 근로기준법을 사실상 배제하는 것이므로 제한적으로 엄격하게 해석하여야 할 것이다."
"이유","원심판결 이유를 위 법리에 비추어 살펴보면, 원심이 판시와 같은 이유로 1998. 12. 31.자 인사규정 개정이 사회통념상 합리성이 있다고 보기 어렵다고 판단한 것은 정당한 것으로 수긍이 간다."
"이유","사건을 다시 심리·판단하게 하기 위하여 원심법원에 환송하기로 하여 관여 대법관의 일치된 의견으로 주문과 같이 판결한다."
"이유","이 경우 종전의 근로조건을 그대로 유지한 채 승계한 법인에서 근무하게 되는 근로자에 대하여는 종전의 취업규칙이 그대로 적용된다."
