"판시사항","주지확인청구의 소의 이익  나. 주지확인청구의 소에 있어서 불교종단의 원고적격  다. 주지직무집행방해금지청구의 성격과 당사자적격  라. 탈종 및 개종행위의 성격  마. 동일성이 없음에도 표시경정등기가 경료된 경우의 시정방법"
"판결요지","주지지위의 존부가 종교활동상의 지위를 넘어 법률상 기관으로서 구체적 법률관계를 둘러싼 분쟁에 관한 청구의 당부를 판단하는 전제문제로 되는 경우에는 사법적 심사의 대상이 된다."
"판결요지","종단과 그 소속 사찰은 내부적으로 관리, 감독관계에 있으나 대외적으로는 독립된 단체이므로 종단이 법률상 직접적이고, 구체적인 이해관계가 있음이 입증되지 아니하면 주지확인청구사건에 있어 종단은 당사자적격이 없다."
"판결요지","사찰이 처음부터 신도단체의 고유한 총유재산으로 구성된 사단이거나 개인소유 사찰이 아닌 이상, 이는 재단인 사찰소유로 귀속되고 임의로 처분할 수 없다."
"판결요지","등기명의인의 표시경정등기가 경료된 경우에 각 등기 사이의 동일성이 인정될 수 없는 경우에는 등기공무원의 이의처분으로 등기말소를 구할 수 없고, 경정등기말소는 소송으로 다룰 수밖에 없다."
"이유","피고들 소송대리인은 이 사건 계쟁사찰인 OOO의 대표자는 관할청인 의정부시에 주지로 등록한 피고 OOO이고, 원고 OOO은 그 대표자 자격이 없으므로 이사건 소는 부적법하여 각하되어야 한다고 항변한다."
"이유","뒤에서 보는 바와 같이 이 사건 OOO는 대한불교 조계종 소속으로 구 불교재산관리법에 따라 당국에 등록한 사찰로서의 실체를 갖춘 불교단체이고,위 OOO의 대표자는 대한불교 조계종으로부터 주지임명을 받은 원고 OOO이라 할 것이므로 피고들 소송대리인의 위 항변은 그 이유가 없어 받아들이지 아니한다."
"이유","특정인의 주지지위의 존부가 종교활동상의 지위를 넘어 법률상 기관의 지위로서 다른 구체적 법률관계를 둘러싼 분쟁에 관한 청구의 당부를 판단하는 전제문제로 되는 경우에 그 판단의 내용이 종교상의 교의해석에 그치는 경우가 아닌한 사법적 심사의 대상이 된다 할 것이다."
"이유","직권으로 계쟁사찰인 OOO주지확인청구의 당사자 적격이 피고 한국불교 OOO, 같은 한국불교 OOO OOO, 같은 OOO에게 있는지 여부에 관하여 살피건대,단체의 기관의 지위에 관하여 적극적 확인을 구하는 청구는 법률관계의 당사자인 당해 단체에 대하여 구하면 족하다."
"이유","당해 기관의 지위에 있는 개인이 단순히 대표자 지위를 다투고 있음에 불과한 경우에는 법률상 이해관계가 없으므로 개인은 당사자 적격이 없다 할 것이다."
"이유","이 사건의 경우에 있어 뒤에서 보는 바와 같이 피고 OOO은 원고들의 불교의 전법, 포교, 법요집행 등의 종교활동, 재산관리, 사찰기거권 등을 침해하면서 대표자의 업무집행을 방해하고 있다."
"이유","위와 같이 피고 OOO에 의한 구체적인 권리, 의무의 침해가 있으면 이자를 상대로 한 소를 제기할 수도 있다 할 것이다."
"이유","구 불교재산관리법 제3조,제9조 제1항,제12조,제13조의 각 규정을 종합해보면, 같은 법 소정의 사찰은 그 소속 종파별 전국단체인 종단과는 별개로 독립된 권리주체인 불교단체로서, 주지가 이를 대표한다."
"이유","그에게 사찰재산의 관리, 처분권이 일임되어 있음이 명백하므로,종헌에 종단대표자인 종정이 사찰의 주지를 임명하고,사찰재산의 관리 및 감독을 할 수 있다고 규정되어 있더라도 이는 종단과 소속사찰간의 내부관계를 규율하는 것에 그친다."
"이유","대외적으로는 완전히 독립된 단체이므로,달리 위 OOO종단이 원고들과 법률상 직접적이고,구체적인 이해관계가 있음이 입증되지 아니하는 이 사건의 경우에 있어, 원고들의 피고 한국불교 OOO에 대한 주지확인청구는 당사자 적격이 없는 자를 상대로 한 부적법한 소라 할 것이다."
"이유","원고들의 피고 한국불교 OOO, 같은 한국불교 000 000, 같은 OOO에 대한 주지직무집행방해금지청구에 소의 이익이 있는지 여부에 관하여 살피건대,계속적, 반복적으로 업무집행이 방해받고 있다."
"이유","피고 한국불교 OOO에 대하여는 앞에서 본 위 나항 기재와 같은 이유에서 당사자적격이 없는 자를 상대로 한 부적법한 소라 할 것이다."
"이유","각 성립에 다툼이 없는 갑 제1호증, 갑 제12호증, 을 제1호증, 갑 제5호증, 갑 제6호증의 1, 같은 호증의 2), 갑 제7호증, 갑 제8호증의 1, 같은 호증의 2, 같은 호증의 3, 갑 제9호증, 을 제3호증의 5, 6, 공성부분은 성립에 다툼이 없다."
"이유"," 위 OOO은 위 사찰에 지주하면서 그의 관리아래 불도봉행이 주재되어 오고 사찰이 관리되어온 사실, 한편 우리나라 불교계의 비구, 대처 양측은 반목과 대립을 거듭하다가 1962.3.22. 양측의 선출대표로 조직된 OOO회에서 새로운 통합종단인 OOO을 설립했다."
"이유","그 종헌을 제정, 공포함에 따라 위 통합종단인 OOO은 종래의 양OOO로부터 그 재산관리 및 사무일체를 승계받아 위 비구, 대처측 종단은 이에 흡수됬다."
"이유","양 종단은 소멸하게 된 사실, OOO은 1962.12.14.구 불교재산관리법 제6조에 따라 문교부에 불교단체등록을 하고,또한 대처승파에 속했던 일부사찰과 승려들은 통합종단인 OOO에 흡수, 통합되는 것을 반대하여 1970.1.15. 별도로 소외 OOO을 종정으로 한 한국불교 OOO을 창립하여 종헌을 제정하였다."
"이유","소외 대한불교 OOO 종단에서는 1962.10.13.이래 수뢰에 걸쳐 법륜, 도철, 만송, 화엄, 보진, 인덕을, 1982.7.13.에는 일면을 주지로 임명하여 OOO에 파견하였으나,피고 OOO 및 OOO신도들이 그때마다 주지취임 및 대한불교 OOO의 위 사찰에서의 종교활동을 방해하여 이들은 주지로 취임하지 못하게 되었다."
"이유"," 피고 OOO은 OOO 종단의 위와 같은 새로운 주지임명을 거부하다가 1986.4.5.경 신도 142명의 동의를 받아 OOO를 그 소속종단인 OOO에서 탈종하여 OOO으로 개종하였다."
"이유","피고 한국불교 OOO으로부터 OOO 주지로 임명받은 후 같은 해 5.26. 의정부시에 OOO 탈종 및 OOO에의 종단이종등록과 주지취임등록을 마쳤다."
"이유","OOO신도 400명 중 109명은 1988.3.18.에 이르러 OOO주지를 피고 OOO으로 추대함과 동시에 신도들은 한국불교 OOO으로 이종할 것을 다시 결의한 사실"
"이유","불교 OOO 종단도 종헌, 종법에 따라 1987.3.13. 원고 OOO을 OOO의 주지로 다시 임명하고,이에 따라 위 원고가 계쟁사찰에 주지로 취임하려 하였으나,피고 OOO 등의 방해를 받아 역시 주지취임을 하지 못하였다."
"이유","같은 해 4.16. 의정부시에 주지취임등록을 신청하였으나 OOO의 피고 OOO으로부터 종단이종 및 주지취임등록신청이 접수되어 있어, 종파간의 분쟁에는 개입할 수 없다는 이유로 주지취임등록신청이 반려된 사실 및  OOO 의하면, 총무원장은 종헌, 종법에 따라 사찰의 주지를 임면한다."
"이유","총무원장은 종헌, 종법이 정하는 바에 의하여 종단과 사찰에 속한 재산을 감독하여 그 처분에 있어서 승인권을 갖는라고 규정되어 있는 사실을 각 인정할 수 있다."
"이유","이에 배치되는 을 제3호증의 3의 일부 기재와 증인 OOO의 일부 증언은 믿을 수 없으며 달리 반증이 없다."
"이유","원고들은 이 사건 계쟁사찰인 OOO의 대표자인 주지는 원고 OOO임의 확인과 원고 OOO의 OOO주지로서의 직무집행방해금지를 구함에 대하여 피고들 소송대리인은 첫째, OOO의 모든 신도들이 피고 OOO을 위 사찰의 주지로 할 것을 결의하였다."
"이유","또 한 OOO에서 탈종하여 OOO으로 개종, 등록하였을 뿐 아니라, 피고 OOO이 의정부시에 OOO주지로 등록하였으므로 원고들의 청구에 응할 수 없다고 다툰다."
"이유","이건 계쟁사찰이 비구, 대처 양파가 통합될 당시 이에 반대하여 별도의 종단을 창설하거나 개종하지 아니하고 구 불교재산관리법 제6조에 따라 대한불교 OOO 소속의 사찰로 등록한 이상, 위 소속의 불교단체로 되었다 할 것이다."
"이유","이로부터 위 사찰은 위 OOO 종단으로부터 종헌, 종법에 따라 위 사찰의 주지로 임명된 이상, 관할관청으로부터 단지 종단간의 종교분쟁이라는 이유로 주지취임등록신청이 반려되어 등록을 하지 못하였고 또한, 실제로 주지로서 위 사찰에 취임하지 못하였다."
"이유","따라서 피고 OOO이가 일부 신도들과 더불어 대한불교 OOO을 탈퇴하여 한국불교 OOO으로 개종하는 결의를 하고,그 임의로 OOO를 그가 개종하는 종파사찰로 등록했다."
"이유","위 OOO이가 OOO 종단으로부터 OOO의 주지로 임명받았다 하더라도 이 또한 그들이 OOO 소속의 승려나 신도가 되는 것은 별론으로 한다."
"이유","피고 OOO의 위와 같은 계쟁사찰의 OOO 탈종 및 OOO에의 개종등록행위는 대표자로서의 권한을 가지지 아니한 자의 사찰등재에 불과할 뿐 아니라, 구 불교재산관리법이 규정하는 사찰의 개종에는 불교사찰재산의 처분이 반드시 따르는 행위이다."
"이유","OOO 종헌 제44조 제3항 소정의 처분승인도 얻지 아니하였으므로,결국 이건 사찰의 개종은 그 효력이 없고, OOO변경되었다고는 할 수 없다 할 것이다."
"이유","피고들 소송대리인은 둘째, 피고 OOO이 위 OOO를 OOO소속의 사찰로 등록한 것은 OOO 종단의 강압에 의한 것이었다."
"이유","을 제9호증의 1 내지 3의 각 기재만으로는 이를 인정하기 부족하고 달리 피고들 주장사실을 인정할만한 뚜렷한 증거가 없으며,오히려 위 절터는 우리나라 대부분 사찰들이 그러하듯이 구황실이나 관청으로부터 하사된 것으로 보여진다."
"이유","구 불교재산관리법은 불교사찰의 위와 같은 역사적 배경과 사찰재산을 보호육성하기 위하여 같은 법 제12조,제13조에 의하여 사찰이 소유하는 일정한 동산, 부동산은 당해 사찰의 동산 또는 부동산으로하고 있다."
"이유","사찰이 처음부터 신도단체의 고유한 총유재산으로 구성된 사단이거나 개인소유 사찰이 아닌 이상, 비록 신도들이 사찰재산을 조성, 증식하는데 공헌이 크다 할지라도 그 재산은 신도들의 총유로 되는 것이 아니라 사찰소유로 귀속된다할 것이다."
"이유","또한 이를 임의로 처분할 수는 없다 할 것이므로 피고들 소송대리인의 위 주장도 그 이유가 없어 받아들이지 아니한다."
"이유","따라서, 이 사건 계쟁사찰인 OOO는 여전히 OOO 소속이고, 그 주지는 OOO단에 의하여 적법히 임명된 원고 OOO이라 할 것이다."
"이유","위 인정사실에 의하면, 피고 OOO 등은 원고 OOO 등의 OOO OOO 주지취임 및 그 직무집행을 계속적, 반복적으로 방해하고 있다."
"이유","장래에도 이러한 종교활동을 비롯한 직무집행을 방해할 염려가 있어 원고들의 피고 한국불교 OOO OOO, 같은 OOO에 대하여 위와 같은 방해금지를 미리 청구할 필요도 있다 할 것이다."
"이유","위 경정등기는 등기명의인 주체 자체의 변경으로서 각 등기사이의 동일성을 인정할 수 없어 경정이 허용될 수 없음에도 사실상 경정등기가 경료된 무효의 등기이다."
"이유","이는 부동산등기법 제31조,제48조에 의한 경정등기의 신청 및 등기공무원의 처분에 대한 이의신청방법으로 그 등기의 말소는 구할 수 없다."
"이유","원고들의 피고 한국불교 OOO에 대한 이 사건 소는 부적법하여 이를 각하하고,원고들의 피고 한국불교 OOO OOO 같은 OOO에 대한 주지확인청구 및 직무방해금지청구는 이유있어 이를 각 인용하며,소송비용의 부담에 관하여는 민사소송법 제89조,제93조를 각 적용하여 주문과 같이 판결한다."
