"판결요지","그와 같은 법리는 등기공무원이 착오로 인하여 말소할 수 없는 등기를 잘못 말소한 경우에도 동일하게 적용된다."
"이유","당시 경매법원은 이 사건 토지 중 피고 3의 지분에 관한 원고 명의의 위 가압류등기를 경락인이 인수하지 아니한 부담으로 오인한 나머지 서대문등기소에 위 가압류등기의 말소등기를 촉탁하였고, 이에 같은 등기소 소속 등기공무원이 1992. 7. 18. 이를 말소한 사실을 알 수 있는 바이다."
"이유","사실관계가 위와 같다면 피고 1에 대하여 위 각 가압류등기 회복등기절차의 이행을 구하는 이 사건 소는 소의 이익이 없는 부적법한 것으로 보아야 할 것이다."
"이유","이 사건 대지에 관하여는 경매법원이 직권으로 위 가압류등기의 말소회복등기를 촉탁하도록 직권발동을 촉구하는 의미에서 회복등기의 촉탁신청을 할 수 있다."
"이유","집행법원이 이에 응하지 아니하는 경우에는 민사소송법 제504조가 정한 집행에 관한 이의신청을 할 수 있다 할 것이다."
"이유","피고 청운전자 및 피고 3에 대한 각 상고이유에 대하여 확인의 소는 권리 또는 법률관계에 현존하는 위험이나 불안이 있고 나아가 확인판결을 받는 것이 그 위험이나 불안을 제거하기 위하여 가장 유효 적절한 수단이 되는 때에 허용된다 할 것이다."
"이유","그런데 위에서 본 사실관계에 의하면, 피고 청운전자는 이 사건 토지 및 건물 중 원고가 가압류하지 아니한 위 소외 1의 지분을 취득하였을 뿐이다."
"이유","피고 3은 원고 명의의 위 각 가압류등기 당시에는 그 가압류의 목적 부동산의 지분권자였다가 위 각 가압류등기가 말소될 당시에는 그 지분권을 상실하였음이 명백하므로 원고의 위 피고들에 대한 이 사건 확인청구는 현존하는 위험이나 불안을 제거하기 위한 유효적절한 수단이 될 수 없다."
"이유","따라서 원고의 위 피고들에 대한 이 사건 확인의 소는 소의 이익이 없는 부적법한 것이라고 할 것이다."
"이유","이와 같은 취지의 원심판단은 정당하고, 소론과 같은 법리오해의 위법이 있다고 볼 수 없으므로 논지는 이유가 없다."
