"이유","이 사건은 주택건설사업계획 승인처분을 받은 원고가 사업부지 내에 토지를 소유하고 있는 피고에 대하여 구 주택법제18조의 2에 기초하여 매도청구권을 행사한다고 주장하면서 이를 원인으로 한 소유권이전등기절차의 이행을 구하는 사안이다."
"이유","원고는 주택공사업, 대지조성사업 등을 목적으로 하는 주식회사이고,피고는 1999. 5. 21. 광주 서구 ○○동 전 1,557㎡를 매수하여 소유하고 있는 사람이다."
"이유","주택법 제16조에 의하여 주택건설사업계획승인처분을 받았고, 광주광역시가 이를 고시함에 따라 원고의 사업부지에 이 사건 토지부분이 포함되었다."
"이유","원고는 사업계획 승인신청 당시 사업부지 42,803㎡ 중 24,580㎡에 대하여 소유권을 취득하고, 다음 표에 기재된 토지에 관해서는 공유지분권을 취득하였다."
"이유","원고는 2006. 3. 15.부터 사업계획 승인처분이 있기 전까지 여러 차례에 걸쳐 피고와 사이에 이 사건 토지부분을 매수하기 위한 협의를 하였으나, 피고가 매수대금으로 25억 원 이상을 요구하여 매수가격에 관하여 합의가 이루어지지 않았다."
"이유","그 후 원고가 이 사건 토지부분에 관하여 구 주택법 제18조의 2에 기초하여 매도청구권을 행사한다는 의사표시가 기재된 소변경신청서 부본이 2008. 1. 30. 피고에게 송달되었다."
"이유","원고는 2008. 2. 11. 피고에 대하여 토지매수대금의 지급으로 제1심법원의 시가감정 결과에 따른 금 282,176,000원을 변제공탁하였다."
"이유","원고는 사업계획 승인처분 당시 주택건설대지 중 일부 필지에 관한 공유지분권을 포함하여 주택건설대지 면적의 100분의 80 이상에 대한 소유권을 확보하였다."
"이유","그 이전부터 피고를 직접 만나거나 매수협의에 관한 내용증명을 발송하여 3개월 이상 협의하였으므로 사업계획 승인처분은 유효한 처분이다."
"이유","원고는 주택건설대지 중 일부 필지에 관하여 공유지분권의 일부만을 취득하고 다른 공유자의 동의를 얻지 못하여 주택건설대지 면적의 100분의 80 이상에 대한 사용 권원을 확보하지 못하였다."
"이유","또 원고는 사업계획 승인신청 이전에 피고와 3월 이상의 협의를 거치지 아니하여 사업계획 승인신청 당시 피고와 협의한 서류를 제출하지 아니하였다."
"이유","원고가 2006. 12. 5. 최초 사업계획신청서를 제출할 때에는 피고 소유인 이 사건 토지는 사업부지에 포함되지 않았다."
"이유","원고가 2007. 2. 15. 사업계획 신청서를 제출할 때에는 피고 소유인  이 사건 토지부분이 사업부지에 포함되었다."
"이유","원고는 피고의 신청서류 보완요청에 따라 2007. 8. 1. 피고와 3개월 이상 협의하였음을 증명하는 서류를 제출하였다."
"이유","그런데 지구단위계획의 결정이 필요한 주택건설사업으로서 주택건설사업계획 승인을 얻고자 하는 자는 당해 주택건설대지 면적의 100분의 80 이상을 사용할 수 있는 권원을 확보하여야 한다."
"이유","공유지분권도 공동소유권의 일종이고 공유자는 그 지분을 다른 공유자의 동의 없이 자유롭게 처분할 수 있으므로,사업주체가 주택건설대지인 공유지의 공유지분권을 취득하면 그 공유지 중 취득한 공유지분에 해당하는 면적에 대하여 사용 권원을 확보하였다고 봄이 상당하다."
"이유","주택법 제16조에 의하여 주택건설사업계획의 승인을 얻고자 하는 자는 매도청구의 대상이 되는 대지의 소유자와 매도청구를 하기 전에 3개월 이상 협의한 사실을 증명하는 서류를 제출하여야 한다."
"이유","원고는 사업계획승인신청 당시 공유지분권을 포함하여 주택건설대지의 면적 합계 42,803㎡ 중 35,065.55㎡에 대하여 사용 권원을 취득함으로써 주택건설대지 면적의  100분의 81.92에 관하여 사용 권원을 확보하였다."
"이유","따라서 특별한 사정이 없는 한 광주광역시 서구청장이 2007. 9. 18. 원고에 대하여 사업계획 승인처분은 중대하고 명백한 하자가 있는 무효의 처분이라고 볼 수 없으므로 유효한 처분이다."
"이유","주택법 제18조의 2 제3항은 주택법상의 매도청구권에 대하여 매도청구권의 최고절차와 행사기간에 관한집합건물의 소유 및 관리에 관한 법률 제48조를 준용하고 있다."
"이유","집합건물법 제48조에 의하면, 원고는 피고에게 매도청구에 응할 것인지 여부를 서면으로 최고하여 피고가 최고 수령일부터 2월 이내에 회답하지 아니하면 회답기간 만료일로부터 2월 이내에 매도청구권을 행사하여야 한다."
"이유","그런데 원고는 2007. 9. 21. 피고에 대하여 매도청구권 행사에 응할 것인지 여부를 최고하였으나 회답기간 2개월이 만료된 2007. 11. 21.부터 2개월 내에 매도청구권을 행사하지 아니하였으므로 원고의 매도청구권 행사는 효력이 없다."
"이유","집합건물법 제48조의 최고 절차는 재건축 결의에 찬성하지 아니한 구분소유자에게 2개월간 재건축 결의에 의한 재건축에 참가할 것인지 여부에 대하여 생각해 볼 수 있는 숙려기간을 부여한 것이다."
"이유","이 사건과 같이 주택건설사업 구역에 편입된 토지의 소유자에 대한 매도청구의 경우에는 재건축 결의나 토지 소유자의 재건축 참가 등을 생각할 수 없으므로 원고는 피고에 대하여 최고를 할 필요가 없다."
"이유","구 주택법 제32조 제1항에 의하여 인가를 받아 설립된 리모델링주택조합은 그 리모델링 결의에 찬성하지 아니하는 자의 주택 및 토지에 대하여 매도청구를 할 수 있다."
"이유","위 사업주체와 리모델링주택조합의 집합건물법 제48조를 집합건물법 제48조를 그런데집합건물법 제48조에서 재건축 결의가 있은 때 집회를 소집한 자는 지체없이 재건축 결의에 찬성하지 아니한 구분소유자에 대하여 그 결의내용에 따른 재건축에의 참가 여부를 회답할 것을 서면으로 최고한다."
"이유","또한 준용이라 함은 일반적으로 법률 중에 예정된 2가지의 유사한 사실에 관하여 하나의 조문을 다른 사실에도 직접 적용되는 경우에 사용하는 입법기술상의 용어이지만,유사한 2가지의 사실에서 서로 전혀 유사하지 않고 다른 사실에 관해서도 그대로 적용되는 것은 아니다."
"이유","집합건물법 제48조 제4항에서 재건축참가자 또는 매수지정자가 재건축 참여 여부에 대한 최고를 한 후 구분소유권에 관한 매매계약의 성립을 강제하는 것이다."
"이유","따라서 주택건설사업계획 승인처분을 받은 사업주체는 지체없이 매도청구의 대상이 되는 대지의 소유자와 3개월 이상의 기간 동안 매수협의를 하여야 한다."
"이유","집합건물법 제48조 제4항을 준용하여 협의기간 만료일로부터 2월 이내에 매수협의에 응하지 아니한 대지 소유자에 대하여 매수청구권을 행사하여야 한다고 해석함이 상당하다."
"이유","주택법 제18조의 2에 의한 매도청구에 응할 것인지 여부를 서면으로 최고함으로써 매도청구권 행사를 위한 사전협의를 시작한 다음, 2007. 10. 4. 이 사건 소송을 제기한 후에도 피고와 매수협의를 계속하여 매도청구권을 행사하기에 앞서 3개월 이상 매수협의를 하였다."
"이유","그리고 피고가 매수협의에 응하지 아니하자 원고가 매수협의기간 종료일인 2007. 12. 21.부터 2개월 내인 2008. 1. 30. 소변경신청서 부본의 송달로써 이 사건 토지부분에 관하여 매도청구권을 행사하여 매도청구권의 제척기간을 준수하였다."
"이유","이 사건에서 보면, 제1심법원의 시가 재감정결과는 원고의 매도청구권이 행사된 시점인 2008. 2. 무렵을 기준으로 하여 원고의 주택건설사업으로 인하여 발생될 것으로 예상되는 개발이익을 충분히 고려하여 산정된 감정가액으로 보이므로 피고의 주장은 받아들이지 아니한다."
"이유","구 주택법 제18조의 2에 기초한 매도청구권의 성질은 형성권이므로 매도청구권 행사의 의사표시가 상대방에게 도달하면 상대방의 승낙을 기다리지 않고 곧바로 매도대상인 목적물에 관하여 시가에 의한 매매계약이 성립하므로 그 매매계약의 효과로서 매도청구의 상대방은 매도청구자에게 매매를 원인으로 한 소유권이전등기절차와 그 인도의무를 부담한다."
"이유","그러므로 원고와 피고 사이에 2008. 1. 30. 이 사건 토지부분에 관하여 매매대금을 565,228,000원으로 하는 매매계약이 성립한다."
"이유","매도청구자인 원고는 이미 2008. 2. 11.과 2008. 3. 19. 2회에 걸쳐 피고에 대하여 목적물의 시가에 따른 매매대금 565,228,000원을 변제 공탁함으로써 토지매수대금을 모두 지급하였다."
"이유","그러므로 피고는 원고에게 이 사건 토지부분에 관하여 2008. 1. 30.자 매매를 원인으로 소유권이전등기절차를 이행할 의무가 있다."
