"이유","소유권의 시효취득에 준용되는 시효중단사유인 민법 제168조, 제170조에 규정된 재판상의 청구라 함은 시효취득의 대상인 목적물의 인도 내지는 소유권존부 확인이나 소유권에 관한 등기청구 소송은 말할 것도 없다."
"이유","소유권침해의 경우에 그 소유권을 기초로 하여 하는 방해배제 및 손해배상 혹은 부당이득 반환 청구 소송도 이에 포함된다고 해석되므로, 같은 취지의 환송 후 원심의 판단은 정당하고, 거기에 소론과 같이 취득시효에 관한 법리를 오해한 위법이 없다."
"이유","당원의 환송판결에 의하면 그 파기의 이유는, 환송전 원심은 원고가 1974. 4. 19.부터 이 사건 토지를 점유하여 오고 있으나 이 사건 제소일인 1993. 2. 22.까지는 20년이 경과하지 아니하였음이 역수상 명백하다 하여 이 사건 예비적 청구를 기각하였던 바이다."
"이유","취득시효가 완성되었는지 여부는 사실심 변론종결 당시를 기준으로 하여야 할 것이고, 1974. 4. 19.부터 환송전 원심 변론종결일인 1994. 5. 25.까지는 20년의 점유취득시효 기간이 완성되었음이 역수상 분명하므로 환송 전 원심판결에는 취득시효에 관한 법리를 오해한 위법이 있다는 것이었다."
"이유","환송 후 원심의 위와 같은 판단은 당원 환송판결의 파기이유에 따른 것으로서 환송 후의 원심이 피고의 시효중단 항변을 채용함으로써 환송 전의 원심판결과 동일한 결론을 가져왔다 하여 거기에 소론과 같이 환송판결의 기속력에 관한 법리를 오해한 위법이 있다고 할 수 없다."
"이유","그러므로 상고를 기각하고 상고비용은 패소자의 부담으로 하기로 하여 관여 법관의 일치된 의견으로 주문과 같이 판결한다."
