"판결요지","원고 명의로 소유권보존등기가 경료된 부동산에 대하여 위 등기가 실체적인 원인관계 없이 이루어진 것이라고 오인한 나머지 신청착오를 이유로 스스로 위 보존등기를 말소하였다."
"판결요지","같은날 제3자 명의로 그 부동산에 대한 소유권보존등기가 경료된 경우 위와 같은 말소등기는 실체상의 원인 없이 경료된 것으로서 무효이고 원고가 취득한 실체적인 소유권에는 아무런 소장이 없다."
"이유","원고가 주장하는 바와 같이 원고의 전신인 속초읍이 1953.3.경 소외 OOO의 선대인 OOO과 사이에 본거 대지로 분필되기 전의 속초시 중앙동 472의 3대 2,157평에 관하여 교환계약을 체결하였다."
"이유","이 토지가 미등기였던 관계로 소유권이전등기에 갈음하여 1961.4.29자로 속초읍 명의로 이에 관한 소유권보존등기를 경료한 다음, 지방자치에관한임시조치법 제8조에 의하여 속초읍의 재산이 양양군에 귀속됨에 따라 1962.2.17 양양군 명의로 소유권이전등기가 경료되었던 것이다."
"이유","1963.1.1 시행된 시설치와군의관할구역및명칭변경에관한법률에 의하여 양양군의 자산을 원고시가 승계하게된 것인데, 양양군은 위 등기가 실체적인 원인관계없이 이루어진 것이라고 오인한 나머지 1962.12.29 신청착오를 이유로 스스로 위 속초읍 및 양양군의 소유권보존등기와 이전등기를 말소하였다."
"이유","같은 날 OOO의 재산상속인인 OOO 명의로 소유권보존등기가 경료되었던 것이라고 한다면, 양양군에 의한 위와 같은 말소등기는 실체상의 원인없이 경료된 것으로서 무효임을 면치 못하여 속초읍이 취득한 실체적인 소유권에는 아무런 소장이 있다고 할 수 없다."
"이유","그런데 원심은 위와는 다른 견해서, 원고 주장과 같이 위 말소등기가 원인없이 착오에 의하여 이루어진 것이라고 하더라도 권리자 스스로가 이를 말소한 이상 이 말소등기를 무효라고는 할 수 없다."
"이유","그러므로 이 점을 논난하는 상고이유를 받아들여 원심판결을 파기하고, 사건을 원심법원에 환송하기로 하여 관여법관들의 일치한 의견으로 주문과 같이판결한다."
