"판시사항","강제경매의 채무자가 낙찰대금지급기일 직전에 선순위 근저당권을 소멸시켜 후순위 임차권의 대항력을 존속시키고도 이를 낙찰자에게 고지하지 아니하여 낙찰자가 대항력 있는 임차권의 존재를 알지 못한 채 낙찰대금을 지급한 경우, 채무자가 민법 제578조 제3항 소정의 손해배상책임을 부담하는지 여부"
"이유","같은 해 12. 23. 채권자 소외 2의 신청으로 서울지방법원 남부지원 99타경 55837호로 강제경매절차가 개시되어, 원고가 2000. 12. 13. 실시된 입찰기일에 최고가로 입찰하여 같은 달 20. 낙찰허가결정이 고지되었다."
"이유","대금지급기일이 2001. 1. 10.로 지정된 사실, 한편 소외 3은 1999. 6.경 피고로부터 이 사건 아파트를 임차보증금 7,000만 원에 임차하여 처인 소외 4를 비롯한 가족들과 함께 입주하였다."
"이유","피고는 소외 4로부터 임차보증금의 반환을 요구받고도 이에 응하지 못하고 있던 차에, 임차권의 대항력이라도 유지될 수 있도록 선순위 근저당권을 말소하여 달라는 간청에 못 이겨 대금지급기일 전인 2001. 1. 5.경 선순위 근저당권자인 수산업협동조합중앙회에 피담보채무를 변제하고 같은 달 6. 근저당권설정등기를 말소시켰다."
"이유","원고는 대금지급기일인 같은 달 10. 대금을 지급하고 이 사건 아파트의 소유권을 취득한 사실, 그 후 소외 4는 같은 해 3. 8. 원고를 상대로 서울지방법원 남부지원 2001가단10575호로 임차보증금 반환청구의 소를 제기하였다."
"이유","한편으로는 경매의 특성상 경매에 참가하고자 하는 자는 자신의 위험부담하에 경매목적물에 관한 권리관계를 분석하여 자신의 책임으로 입찰하는 것이라는 점에서도 피고에게 손해배상 책임을 물을 수 없다고 판단하였다."
"이유","경매기일이 지난 후에 발생한 위에서 본 바와 같은 사정변경에 대하여는 그로 인한 부담을 최고가매수신고인 또는 경락인에게 귀속시킬 수는 없다 할 것이다."
"이유","이와 달리 원심은 판시와 같은 이유로 피고에게 손해배상책임을 물을 수 없다고 판단하였으니, 거기에는 민법 제578조에 정한 경매와 매도인의 담보책임에 관한 법리를 오해한 위법이 있다."
"이유","사건을 다시 심리·판단하게 하기 위하여 원심법원에 환송하기로 하여 관여 법관의 일치된 의견으로 주문과 같이 판결한다."
