"이유","원심은, 피고가 1986. 10. 16.경부터 이 사건 토지를 도로로 점유·사용하여 왔다고 하더라도 토지조사부에 사정명의인의 기재가 있는 이 사건 토지에 관하여 적법한 취득절차를 밟았다는 구체적인 자료를 제출하지 못하고 있다."
"이유","그러한 자료의 제출을 기대하기 어려운 사정이 있다고 보기도 어렵다는 이유를 들어, 피고의 이 사건 토지에 관한 자주점유의 추정은 깨어졌다고 판단하고, 피고의 점유취득시효 항변을 배척하였다."
"이유","민사재판에 있어서 다른 민사사건 등의 판결에서 인정된 사실에 구속받는 것은 아니라 할지라도 이미 확정된 관련 민사사건에서 인정된 사실은 특별한 사정이 없는 한 유력한 증거가 된다 할 것이므로, 합리적인 이유 설시 없이 이를 배척할 수 없다."
"이유","피고는 소유의 의사로 이 사건 토지를 평온·공연하게 점유하여 왔으므로 이 사건 토지에 관하여 피고의 점유취득시효가 완성되었다고 주장하면서 원심법원에 서울중앙지방법원 2011. 1. 14. 선고 2009가단464301 소유권보존등기말소 등 사건 판결을 증거로 제출하였다."
"이유","위 관련 사건 제1심판결 중 이 사건 토지에 관한 부분에 대하여는 당사자들이 항소하지 아니하였고 항소심 변론종결 시까지 항소취지가 확장되거나 부대항소되지도 아니하여, 2011. 1. 14. 항소심인 서울중앙지방법원 2010나30989호 판결 선고로 그 부분 판결이 그대로 확정되었다."
"이유","위 대위신청 당시 시행 중이던 구 지적법 제23조는 1호부터 3호까지 각호 규정을 두고 있을 뿐 항을 두지 않았다."
"이유","제2호에서 ""국가 또는 지방자치단체가 매입 등으로 취득한 토지에 관하여 그 토지를 관리할 국가기관 또는 지방자치단체의 장이 토지소유자가 하여야 할 신청을 대위할 수 있다.""라고 규정하고 있었다."
"이유","피고는 ‘1986. 8. 6. 도로포장 8차공사가 준공되면서 이 사건 토지가 도로부지에 편입되었다.’는 취지로 주장하면서 위 도로포장공사의 준공검사조서를 제출하였다."
"이유","이 사건 토지는 위 지목변경 전부터 설치되어 있던 도로의 길어깨 부분에 연접하여 있고, 위 길어깨 부분을 따라 길게 뻗은 형상이다."
"이유","위와 같은 사실관계를 앞서 본 법리에 비추어 살펴보면, 피고가 1986년경 이 사건 토지를 점유·관리하면서 구 공특법이 정한 공시송달과 보상금 공탁 등 협의매수 절차를 밟았음은 합리적인 이유를 설시하지 않고는 배척할 수 없는 사실이다."
"이유","피고는 이 사건 토지에 관하여 구 공특법이 정한 협의매수 절차를 밟은 것으로 인식하고 소유의 의사로 이 사건 토지를 점유·관리하였을 가능성이 높다고 할 것이다."
"이유","이러한 원심판단에는 확정판결에서 인정된 사실의 증명력에 관한 법리를 오해하고 논리와 경험의 법칙을 위반하여 자유심증주의의 한계를 벗어나 사실을 인정함으로써 판결에 영향을 미친 잘못이 있다."
"이유","그러므로 나머지 상고이유에 대한 판단을 생략한 채 사건을 다시 심리·판단하도록 원심법원에 환송하기로 하여, 관여 대법관의 일치된 의견으로 주문과 같이 판결한다."
