"판결요지","동일 건물에 관하여 경료된 각 소유권보존등기가 등기부상의 건물의 구조 및 지번의 표시 등에 있어서 실제와 다른 점이 있으나 그 건물을 표상함에는 부족함이 없는 것으로 인정되는 경우, 그 각 등기는 모두 공시의 효력을 가지게 된다."
"판결요지","따라서 뒤에 이루어진 소유권보존등기는 중복등기에 해당하여 선등기에 원인무효의 사유가 없는 한 원인무효로 귀착될 수밖에 없다."
"이유","선등기인 위 소외인 명의의 소유권보존등기가 그 판시 경위로 경료된 유효한 등기이므로 후등기인 위 피고 회사 명의의 소유권보존등기는 무효이고, 이에 터잡아 그 후에 경료된 각 소유권이전등기 또한 모두 원인무효라고 판단하였음도 옳은 것으로 수긍된다."
"이유","이 사건 건물에 관하여 경료된 위 각 소유권보존등기는 등기부상의 건물의 구조 및 지번의 표시 등에 있어서 소론과 같이 실제와 다른 점이 있으나, 각각 이 사건 건물을 표상함에는 부족함이 없는 것으로 인정되므로, 위 각 등기는 모두 공시의 효력을 가지게 된다."
"이유","따라서, 뒤에 이루어진 피고 회사 명의의 소유권보존등기는 중복등기에 해당하여, 선등기에 원인무효의 사유가 없는 한, 원인무효로 귀착될 수밖에 없는 것이다."
"이유","위 연립주택 완공 전의 가처분결정에 따라 위 소외인 명의로 보존등기가 경료되었다 하여 그 등기가 원인 없는 것이라고는 할 수 없는 것이다."
"이유","원심의 사실인정이 을 제2호증의 13, 14, 15의 내용과 상치된다 하여 반드시 채증을 그르친 것이라 할 수 없다."
"이유","그러므로 상고를 모두 기각하고 상고비용은 패소자들의 부담으로 하기로 하여 관여 법관의 일치된 의견으로 주문과 같이 판결한다."
