"판시사항","외국인이 관할 관청에 부동산 취득 허가신청을 하기 위하여 그 부동산 취득에 관한 약정의 효력을 다투는 약정 의무자를 상대로 그 약정의 유효 확인을 구할 이익이 있다고 한 원심판결을 수긍한 사례"
"이유","피고는 형제자매들의 요청이 있을 때에는 원고에게 앞서 원고 및 위 소외 2 앞으로 분배하기로 한 위 제1 내지 3 부동산과 제 5, 6 부동산을 원고에게 소유권이전하여 주기로 약정한 사실을 인정하고 있는 바이다."
"이유","기록에 의하여 증거 관계를 살펴보면 원심의 이와 같은 사실인정은 옳게 수긍이 가고 거기에 소론과 같은 채증법칙 위배로 인한 사실오인이나 이유모순의 위법이 있다고 할 수 없다."
"이유","원심이, 원고의 강박이나 사기를 이유로 위 1992.9.14.자 약정을 취소한다는 피고의 주장을 배척함에 있어 거친 증거의 취사과정에 소론과 같은 위법이 있다고 할 수 없다."
"이유","피고는 원고와 피고 사이의 1992.9.14.자 원고에게 위 같은 목록 기재 부동산의 소유권을 이전하기로 한 약정은 유효하게 존속함을 확인한다."
"이유","이에 상고를 기각하고 상고비용은 패소한 피고의 부담으로 하기로 관여 법관의 의견이 일치되어 주문과 같이 판결한다."
"이유","피고가 원고 및 소외 2, 소외 3, 소외 4, 소외 5, 소외 6의 요청이 있을 때에는 위 제1 내지 3, 5, 6 부동산의 소유권을 원고에게 이전하여 주기로 한 원고와의 1992.9.14.자 약정이 유효함을 확인한다."
