"이유","원고들이 탈퇴한 조합원의 지위를 승계하여 피고 조합의 조합원으로서 새로본과 사이에 이 사건 각 분양계약을 체결하였다고 보기 어렵다는 취지로 판단하였다."
"이유","관련 법리 및 기록에 비추어 살펴보면, 원심의 위와 같은 사실인정과 판단은 정당한 것으로 수긍이 되고, 거기에 주장하는 바와 같은 법리오해나 논리와 경험의 법칙에 위배하여 자유심증주의의 한계를 벗어난 위법이 없다."
"이유","총유물의 관리 및 처분에 관하여 주택조합의 정관이나 규약에 정한 바가 있으면 이에 따라야 하고 그에 관한 정관이나 규약이 없으면 조합원 총회의 결의에 의하여야 할 것이며, 그와 같은 절차를 거치지 않은 행위는 무효라고 할 것이다."
"이유","피고 조합 및 새로본의 각 대표자가 조합규약에 따라 위임받은 범위 내에서 원고들과 사이에 이 사건 각 부동산에 관하여 이 사건 각 분양계약을 체결한 이상 별도로 조합원 총회의 결의를 거치지 아니하였다고 하더라도 이 사건 각 분양계약은 유효하다는 취지로 판단하였다."
"이유","위 법리 및 기록에 비추어 살펴보면, 원심의 위와 같은 판단은 정당한 것으로 수긍할 수 있다."
"이유","거기에 상고이유에서 주장하는 바와 같은 논리와 경험의 법칙에 위배하고 자유심증주의의 한계를 벗어나거나 민법 및 주택법에 관한 법리오해, 판단누락 등의 위법이 있다고 볼 수 없다."
"이유","상고를 모두 기각하고 상고비용은 패소자의 부담으로 하기로 하여, 관여 대법관의 일치된 의견으로 주문과 같이 판결한다."
