"판결요지","부동산 등기부에 소유권이전등기가 경료되어 있는 경우에 그 등기명의자는 등기원인에 의하여 적법한 소유권을 취득한 것으로 추정받고, 회복등기도 별다른 사정이 없는 한 등기공무원에 의하여 적법하게 수리되어 처리된 것으로 추정되다."
"판결요지","그와 같은 등기의 추정력에 관한 법리는 그 소유권이전등기가 등기부 멸실 후의 회복등기절차에 의하여 이루어진 경우에도 마찬가지로 적용된다."
"판결요지","멸실회복등기의 추정력은 회복등기가 된 당해 부동산에 대하여만 미치는 것일 뿐 그 부동산이 분할되기 전의 원래의 부동산에서 분할된 다른 부동산에 대하여까지 미치는 것은 아니다."
"이유","부동산 등기부에 소유권이전의 등기가 경료되어 있는 경우에 그 등기명의자는 등기원인에 의하여 적법한 소유권을 취득한 것으로 추정받다."
"이유","등기부의 멸실 후에 분할된 토지에 관하여 멸실회복등기를 하는 경우 분할된 각 토지에 관하여 따로 따로 회복등기를 하는 것이 불가능하다고 할 수 없다."
"이유","여러 필지의 부동산에 관하여 한꺼번에 회복등기를 하는 경우에 그 기재상의 편의를 위하여 일부 동일한 사항을 등사의 방법으로 동일하게 기재할 수도 있는 것이다."
"이유","분필된 토지 중의 한 토지에 대하여만 등기사항이 전사되었다든지 회복등기란 등 일부 기재사항이 한꺼번에 같이 등사되었다는 사유만으로는 위 회복등기가 적법하게 경료된 것이 아니라고 의심할 것은 아니라고 할 것이다. 이 점에 관한 상고이유는 받아들일 수 없다."
"이유","회복등기의 추정력은 회복등기가 된 당해 부동산에 대하여만 미치는 것일 뿐 그 부동산이 분할되기 전의 원래의 부동산에서 분할된 다른 부동산에 대하여까지 미치는 것은 아니라고 할 것이다."
"이유","원심이 위 회복등기의 등기명의자인 위 소외 2가 위 대 1,868평뿐만 아니라 같은 리 393 대 3,038평에서 분할되어 나온 이 사건 부동산에 관하여 소유권을 취득한 것으로 추정된다고 설시한 것은 회복등기의 효력에 관한 법리를 오해한 것으로 잘못이라고 아니할 수 없다."
"이유","아래에서 보는 바와 같이 이 사건 각 부동산에 관한 피고 1 명의의 각 소유권보존등기와 이에 터잡은 그 일부 부동산에 관한 피고 2 명의의 각 소유권이전등기는 결국 실체관계에 부합하는 등기로서 유효하다고 할 것이다."
"이유","원심의 위와 같은 잘못은 판결의 결과에 아무런 영향이 없어 이 점에 관한 상고이유는 결국 이유 없음에 돌아간다."
"이유","그 과정에 상고이유로 주장하는 바와 같은 심리미진, 이유불비, 채증법칙 위배의 위법이 있다고 할 수 없다."
"이유","그리고 사실관계가 이러하다면, 위 대 1,170평에서 분할되어 나온 이 사건 각 부동산에 관한 피고 1 명의의 각 소유권보존등기와 이에 터잡은 피고 2 명의의 각 소유권이전등기는 결국 실체관계에 부합하는 등기로서 유효하다고 할 것이다."
"이유","그러므로 상고를 모두 기각하고 상고비용은 패소자들의 부담으로 하기로 하여 관여 법관의 일치된 의견으로 주문과 같이 판결한다."
