"판시사항","대항력과 우선변제권을 겸유하고 있는 임차인이 임대인을 상대로 보증금반환청구소송을 제기하여 승소판결을 받고 그 확정판결에 기하여 강제경매를 신청하였으나 그 경매절차에서 보증금 전액을 배당받지 못한 경우, 후행 경매절차에서 우선변제권에 의한 배당을 받을 수 있는지 여부"
"판시사항","주택임대차보호법 제3조의5 단서에서 말하는 경락에 의하여 소멸하지 아니하는 임차권의 내용에 대항력뿐만 아니라, 우선변제권도 포함되는지 여부"
"판결요지","주택임대차보호법상의 대항력과 우선변제권의 두 가지 권리를 함께 가지고 있는 임차인이 우선변제권을 선택하여 제1경매절차에서 보증금 전액에 대하여 배당요구를 하였으나 보증금 전액을 배당받을 수 없었던 때에는 경락인에게 대항하여 이를 반환받을 때까지 임대차관계의 존속을 주장할 수 있을 뿐이다."
"판결요지","임대인을 상대로 보증금반환청구 소송을 제기하여 승소판결을 받은 뒤 그 확정판결에 기하여 1차로 강제경매를 신청한 경우에도 마찬가지이다."
"이유","주택임대차보호법상의 대항력과 우선변제권의 두 가지 권리를 함께 가지고 있는 임차인이 우선변제권을 선택하여 제1경매절차에서 보증금 전액에 대하여 배당요구를 하였으나 보증금 전액을 배당받을 수 없었던 때에는 경락인에게 대항하여 이를 반환받을 때까지 임대차관계의 존속을 주장할 수 있을 뿐이다."
"이유","따라서 일부라도 보증금을 변제받지 못하는 경우의 임차인은 보증금을 전액 반환받을 때까지 완전한 임차권을 보유한다는 것을 상고이유로 내세우고 있다."
"이유","대법원 2004. 8. 30. 선고 2003다23885 판결은 보증금 전액을 배당받을 수 있는 경우에 임차인의 배당요구로 임차권이 소멸하는 시점을 배당표가 확정될 때로 본 것으로서 본 사건과 판시사항이 다르다."
"이유","원고의 주장과 같이 일부라도 보증금을 변제받지 못할 경우의 임차인은 보증금을 전액 반환받을 때까지 완전한 임차권을 보유한다는 취지를 설시한 것도 아니므로 이 사건에 원용하기에 적절하지 아니하다."
