"판시사항","원고 종친회가 계쟁부동산에 관하여 편의상 죽촌백세 등 명의로 이전등기를 경료한 경우 위 등기가 무효인지의 여부"
"판결요지","원고 종친회가 계쟁부동산에 관한 소유권이전등기를 경료함에 있어 종친회 명의나 종손 명의로 등기하면 처분하기 쉽다는 이유로 선조들의 호에서 송자 또는 죽자 등을 따서 죽촌백세, 송하천대 등의 명칭으로 등기를 경료하였다고 하여 그 등기를 당연무효라고 할 수 없다."
"이유","위 토지들은 농지개혁법 시행당시에도 원고 종친회의 위토라는 이유로 분배에서 제외된 토지인데 피고는 위 등기 명의가 일본인 이름과 같다는 이유로 청구취지기재와 같이 각 피고 명의로 권리귀속을 원인으로 한 소유권이전등기를 경료한 사실을 인정할 수 있고 이를 뒤집을 아무런 자료가 없는 바이다."
"이유","피고가 자의로 귀속재산으로 처리하여 청구취지기재와 같은 소유권이전등기를 경료한 것은 아무런 원인없이 경료된 원인무효의 등기라고 할 것이다."
"이유","원고 종친회가 위와 같은 이름으로 등기하였다고 하여 동 등기가 당연무효라고는 할 수 없을 뿐 아니라 동 등기가 무효하고 하더라도 원고 종친회의 소유권에는 하등의 소장이 없다고 할 것이므로 위 주장은 그 이유없다."
"이유","그렇다면 원고가 위 부동산들에 관한 소유확인과 청구취지기재의 피고 명의로의 소유권이전등기의 말소를 구하는 본소 청구는 모두 그 이유있어 이를 인용할 것인 바이다."
"이유","원판결은 이와 결론을 같이하고 있어 정당하므로 피고의 항소를 기각하고 소송비용의 부담에 관하여는 민사소송법 95조 동89조를 적용하여 주문과 같이 판결한다."
