"이유","특별한 규정이 없는 한 신설회사에 대하여 분할하는 회사의 분할 전 법 위반행위를 이유로 과징금을 부과하는 것은 허용되지 않는다."
"이유","거기에 상고이유에서 주장하는 바와 같은 회사 분할 시 책임 승계에 관한 법리오해 등의 위법이 없다."
"이유","제61조 제1항 [별표 2]의 각 규정에 의하면, 사업자가 다른 사업자와 공동으로 부당한 공동행위를 한 경우에 공정거래위원회는 그 사업자에 대하여 해당 위반행위기간 동안의 관련 상품 또는 용역의 매출액을 기준으로 산정한 과징금을 부과할 수 있는 바이다."
"이유","매출액 산정의 전제가 되는 관련 상품 또는 용역의 범위는 부당한 공동행위를 한 사업자 간의 합의내용에 포함된 상품 또는 용역의 종류와 성질, 용도 및 대체가능성과 거래지역·거래상대방·거래단계 등을 고려하여 개별적·구체적으로 판단하여야 한다."
"이유","원심은, 채택 증거를 종합하여 판시 사실을 인정한 다음, 원고가 생산하는 고밀도 폴리에틸렌 제품 중 특수규격제품 5종은 범용제품에 대한 이 사건 가격담합 대상에 포함되어 있지 않다."
"이유","그 대체재를 생산·판매하는 데 지장을 받았음을 인정할 증거가 부족한 점 등에 비추어, 그 매출액은 이 사건 가격담합으로 인한 과징금 산정의 전제가 되는 관련 상품 또는 용역의 매출액에서 제외되어야 한다고 판단하였다."
"이유","제61조 제1항 [별표 2]의 각 규정에 의하면, 부당한 공동행위를 행한 사업자에 대한 과징금 산정의 전제가 되는 매출액은 사업자의 회계자료 등을 참고하여 정하는 것을 원칙으로 하되, 각각의 범위는 행위유형별로 개별적·구체적으로 판단하도록 하고 있는 바이다."
"이유","이를 부당한 공동행위를 한 사업자에 대한 과징금 산정의 전제가 되는 매출액에서 제외할 것은 아니라고 보아야 한다."
"이유","이 사건 시정명령이 가격담합의 대상이나 품목, 세부시장 등을 구체적으로 특정하지 않은 채 포괄적이고 일반적인 형태로 이루어져 위법하다는 취지의 원고의 부대상고이유 주장은, 원심에서 주장하지 아니하였다가 상고심에 이르러 비로소 이를 주장하고 있는 것으로 적법한 상고이유가 될 수 없다."
