"판시사항","일정한 토지가 지적공부에 1필의 토지로 복구 등록된 경우, 지적공부가 잘못 작성되었다는 점에 대한 입증책임의 소재"
"판시사항","임야의 일부에 선조의 분묘가 설치되어 있다거나 소유권보존등기가 경료되었다는 사정만으로 임야 전체를 배타적으로 점유·관리하였다고 볼 수 있는지 여부"
"판결요지","일정한 토지가 지적공부에 일필의 토지로 복구 등록된 경우, 그 토지의 소재·지번·지목·지적 및 경계는 지적공부의 복구 제재과정에서 관계 공무원이 사무착오로 지적공부를 잘못 작성하였다는 등의 특별한 사정이 없는 한, 지적복구 전 토지의 소재·지번·지목·지적 및 경계가 그대로 복구된 것으로 추정된다."
"판결요지","지적공부가 관계 공무원의 사무착오로 잘못 작성되었다는 등의 특별한 사정에 대한 입증책임은 이를 주장하는 당사자에게 있다."
"판결요지","임야의 일부에 선조의 분묘가 설치되어 있다거나 소유권보존등기를 경료하였다는 사정만으로는 임야 전체를 배타적으로 점유·관리하여 왔다고 볼 수 없다."
"이유","지적복구과정에서 속초시 조양동과 노학동 사이의 경계가 잘못 정하여지는 바람에 지적공부에 등재되지 못한 채 속초시 노학동에 속하는 토지로 남아 있다가, 뒤늦게 지적복구된 후 무주부동산으로 오인되어 피고 명의의 소유권보존등기가 경료되었다는 원고의 주장을 배척한 조치는 옳다."
"이유","그리고 일정한 토지가 지적공부에 일필의 토지로 복구 등록된 경우, 그 토지의 소재·지번·지목·지적 및 경계는 지적공부의 복구 제재과정에서 관계 공무원이 사무착오로 지적공부를 잘못 작성하였다는 등의 특별한 사정이 없는 한 지적복구 전 토지의 소재·지번·지목·지적 및 경계가 그대로 복구된 것으로 추정된다."
"이유","지적공부가 관계 공무원의 사무착오로 잘못 작성되었다는 등의 특별한 사정에 대한 입증책임은 이를 주장하는 당사자에게 있다."
"이유","임야의 일부에 선조의 분묘가 설치되어 있다거나 소유권보존등기를 경료하였다는 사정만으로는 그 임야 전체를 배타적으로 점유·관리하여 왔다고 볼 수 없다."
"이유","원심은, 이 사건 임야에 원고의 조부, 조모, 5대 조부, 숙모 등 4기의 묘소가 있지만 그와 같은 사정만으로 원고의 아버지 망 소외 1이나 원고가 이를 배타적으로 점유하고 있다고 할 수 없다."
"이유","달리 이를 인정할 만한 증거가 없다고 하여 원고의 이 사건 임야에 대한 점유 또는 등기부 취득시효 완성의 주장을 모두 배척하였는바, 기록에 비추어 보면 원심의 위와 같은 조치 또한 옳다."
"이유","그러므로 이 상고는 이유 없으므로 이를 기각하고 상고비용은 패소자의 부담으로 하기로 하여 주문과 같이 판결한다."
"이유","그러므로 이 사건 임야의 지적공부가 잘못 작성되었다는 특별한 사정을 찾아 볼 수 없는 이 사건에서 원고의 위 주장을 배척한 원심의 조치 또한 옳다."
