"판시사항","평균임금 산정의 기초가 되는 임금의 범위 및 어떤 금품이 근로 대상으로 지급된 것인지에 관한 판단 기준 [2] 甲 병원이 소속 의사들에게 지급한 진료포상비가 근로기준법상 평균임금 산정의 기초가 되는 임금총액에 포함되는 것으로 보아야 한다고 한 사례"
"이유","평균임금 산정의 기초가 되는 임금총액에는 사용자가 근로의 대상으로 근로자에게 지급하는 일체의 금품으로서, 근로자에게 계속적·정기적으로 지급되고 그 지급에 관하여 단체협약, 취업규칙 등에 의하여 사용자에게 지급의무가 지워져 있으면 그 명칭 여하를 불문하고 모두 포함된다."
"이유","한편 어떤 금품이 근로의 대상으로 지급된 것이냐를 판단함에 있어서는 그 금품지급의무의 발생이 근로제공과 직접적으로 관련되거나 그것과 밀접하게 관련된 것으로 볼 수 있어야 한다."
"이유","이러한 관련 없이 그 지급의무의 발생이 개별 근로자의 특수하고 우연한 사정에 의하여 좌우되는 경우에는 그 금품의 지급이 단체협약·취업규칙·근로계약 등이나 사용자의 방침 등에 의하여 이루어진 것이라 하더라도 그러한 금품은 근로의 대상으로 지급된 것으로 볼 수 없다."
"이유","원고 1의 경우 매월 230만 원의 기본포상비와 진료수익이나 실적에 따라 지급되는 위 나머지 각 포상비를 지급받아 왔다."
"이유","그에 대한 포상비는 근로의 대가로 지급된 것으로 보아야 할 것인 점 등 그 판시와 같은 사정들을 종합해 보면, 원고들에게 지급된 위와 같은 진료포상비는 모두 근로기준법상 평균임금 산정의 기초가 되는 임금총액에 포함되는 것으로 봄이 상당하다고 판단하였다."
"이유","앞서 본 법리와 기록에 비추어 살펴보면, 원심의 위와 같은 판단은 정당한 것으로 수긍할 수 있다."
"이유","상고장에 이유 기재가 없고 상고이유서에서도 나머지 피고 패소 부분에 대한 불복 이유의 기재를 찾아볼 수 없다."
"이유","그러므로 상고를 모두 기각하고 상고비용은 패소자가 부담하도록 하여, 관여 대법관의 일치된 의견으로 주문과 같이 판결한다."
