"판시사항","민법 제492조 제1항에서 정한 ‘채무의 이행기가 도래한 때’의 의미 및 상계에 따른 양 채권의 차액 계산 또는 상계 충당의 시기"
"이유","쌍방이 서로 같은 종류를 목적으로 한 채무를 부담한 경우 쌍방 채무의 이행기가 도래한 때에는 각 채무자는 대등액에 관하여 상계할 수 있다."
"이유","여기서 ‘채무의 이행기가 도래한 때’는 채권자가 채무자에게 이행의 청구를 할 수 있는 시기가 도래하였음을 의미하고 채무자가 이행지체에 빠지는 시기를 말하는 것이 아니다."
"이유","상계의 의사표시가 있는 경우 채무는 상계적상 시에 소급하여 대등액에 관하여 소멸하게 되므로, 상계에 따른 양 채권의 차액 계산 또는 상계 충당은 상계적상의 시점을 기준으로 한다."
"이유","부당이득반환채권은 이행기의 정함이 없는 채권으로서 채권의 성립과 동시에 언제든지 이행을 청구할 수 있으므로, 그 채권의 성립일에 상계적상에서 의미하는 이행기가 도래한 것으로 볼 수 있다."
"이유","원심은, 원고의 부당이득반환채권 23,205,480원을 자동채권으로 하여 피고의 임금 등 채권과 상계할 수 있다고 하면서, 양 채권이 대등액에서 소멸하는 효력이 발생하는 시기는 상계의 의사표시 겸 부당이득반환채무의 이행을 청구하는 의사표시가 피고에게 도달한 2021. 1. 21.이라고 본다."
"이유","이를 기준으로 위 23,205,480원을 피고의 임금 채권에 대한 지연손해금과 원금에 순차적으로 충당하여 차액을 계산한 결과 피고의 임금채권은 원금 13,832,182원이 남게 되었다고 판단하였다."
"이유","그러나 앞서 본 법리에 의하면, 원고의 부당이득반환채권은 그 성립일에 상계적상에서 의미하는 이행기가 도래하므로, 이를 기준으로 수동채권의 이행기와 비교하여 상계적상의 시점을 판단해야 한다."
"이유","그런데도 부당이득반환채권의 이행기의 도래 시기가 아니라 이행의 청구를 통해 피고가 이행지체에 빠지는 시기를 기준으로 상계적상의 시점을 판단한 원심판결에는 상계적상에 관한 법리를 오해하여 판결에 영향을 미친 잘못이 있다."
"이유","그러므로 원심판결 중 원고 패소 부분을 파기하고 이 부분 사건을 다시 심리·판단하도록 원심법원에 환송하기로 하여, 관여 대법관의 일치된 의견으로 주문과 같이 판결한다."
