"판시사항","주택건설사업자의 채권자가 그 채권에 대한 대물변제조로 위 사업자가 분양하는 아파트에 관한 분양계약을 체결한 경우, 주택건설촉진법시행령 소정의 주택분양을 보증한 주택사업공제조합이 보증책임을 부담하는지 여부"
"이유","거기에 상고이유에서 주장하는 바와 같이 채증법칙에 위배하여 사실을 잘못 인정하였거나 처분문서인 아파트공급계약서의 효력에 관한 법리를 오해하는 등의 위법이 있다고 할 수 없다."
"이유","수분양자들이 분양대금을 현실적으로 납부하는 통상의 분양계약과는 달리 위 분양계약이 채권담보 등의 목적으로 체결된 관계로 원고들이 그 분양대금을 현실적으로 납부한 바 없다는 취지이지, 원고들이 위 분양계약을 체결한 사실 자체를 인정하지 아니한 것이라고는 할 수 없다."
"이유","공제조합은 분양계획에 따라 이미 납부된 계약금 및 중도금의 환급이행 또는 당해 주택의 분양이행의 책임을 진다.""라고 규정한다."
"이유","이 사건 주택분양보증약관은, ""우리 조합은 조합원이 파산 등으로 분양계약에 따라 당해 주택의 분양이행을 하지 못하는 경우 기납부된 계약금 및 중도금의 환급이행 또는 당해 주택의 분양이행채무를 이 보증서에 기재된 사항과 약관에 따라 보상합니다.""라고 규정하고 있다."
"이유","주택분양보증을 한 주택사업공제조합은, '특별한 사정이 없는 한', 주택건설사업자로부터 주택을 분양받은 수분양자들이 계약금 및 중도금을 납부할 것을 전제로 그들이 납부한 분양대금의 환급 또는 주택의 분양에 대하여 보증책임을 부담한다고 봄이 상당하다 할 것인 바이다."
"이유","주택분양보증을 한 주택사업공제조합은 기존의 채권으로 충당된 분양대금 상당액의 환급이나 분양에 대한 보증책임을 부담한다고 할 수 없다."
"이유","원심이 적법하게 확정한 사실관계에 의하면, 소외인은 목재대금을 회수하기 위한 방편으로 원고들 명의로 이 사건 각 아파트를 분양받고 그 채권으로 위 아파트 분양대금의 일부 지급에 충당하기로 하였을 뿐 실제 분양대금은 전혀 지급하지 아니하였다는 것인 바이다."
"이유","거기에 상고이유에서 주장하는 바와 같이 주택건설촉진법시행령 제43조의5 제1항 제4호 목 소정의 주택분양보증에 관한 법리나 처분문서인 주택분양보증서의 해석에 관한 법리를 오해한 위법이 있다고 할 수 없다."
"이유","결과적으로 이러한 채무도 주택분양보증에 의하여 담보하는 것으로 되어 부당하다는 취지이지, 피고가 기타 지급보증을 하지 아니하였다는 이유로 원고들의 청구를 배척한 것이라고는 할 수 없다."
"이유","따라서 기타 지급보증계약의 체결 여부에 관한 석명권 불행사 내지는 심리미진 및 이유모순의 위법이 있다는 상고이유 역시 그 이유가 없다."
"이유","그러므로 상고를 모두 기각하고, 상고비용은 패소자들의 부담으로 하기로 하여 관여 법관의 일치된 의견으로 주문과 같이 판결한다."
