"판시사항","공무원연금법 제42조 제3호 소정의 유족급여 중 유족보상금의 법적 성질 및 급여의 사유가 제3자의 행위로 발생한 경우, 유족보상금을 지급한 공무원연금관리공단 또는 지방자치단체가 구상할 수 있는 대상채권의 범위"
"이유","같은 취지의 원심판결은 정당하고, 거기에 상고이유로 지적하는 바와 같은 법리오해의 위법이 있다고 할 수 없다."
"이유","원심판결 이유에 의하면, 원심은, 이 사건 구상권의 범위에 관하여 망 소외 1의 일실수입을 금 31,472,008원으로 산정한 다음 원고가 위 망인의 처 소외 2에게 지급한 유족보상금 63,507,600원 중 위 망인의 일실수입 중 소외 2의 법정상속분인 금 8,583,274원으로 제한된다고 판단하였다."
"이유","그러나 기록에 비추어 살펴보면, 원고는 망인의 피고에 대한 손해배상채권으로 일실퇴직연금과 일실퇴직수당도 주장하였는데 원심은 이에 관하여 아무런 판단을 하지 않고 있음이 명백한 바이다."
"이유","그렇다면 원심판결에는 판결에 영향을 미친 판단유탈 및 심리미진의 위법이 있다 할 것이므로 이 점을 지적하는 이 부분 상고이유의 주장은 이유 있다 할 것이다."
"이유","그러므로 원심판결 중 원고 패소 부분을 파기하고, 이 부분 사건을 원심법원에 환송하기로 하여 관여 법관의 일치된 의견으로 주문과 같이 판결한다."
