"이유","소외 1은 원고에게 위 도중회차행위에 관하여 자세한 시말서를 다시 작성하여 제출할 것을 지시하였으나 원고는 이에 불응하고 시말서를 제출하지 아니하였다."
"이유","그러자 참가인 회사에서는 별도의 징계절차 없이 일단 원고에 대하여 같은 달 15.부터 같은 달 24.까지 사이에 4일간 원고에게 배차를 하지 아니하여 원고로 하여금 승무를 하지 못하게 하였다."
"이유","그 후 참가인 회사에서는 1994. 12. 9. 징계위원회를 개최하여 원고의 위 도중회차 등을 이유로 단체협약 제64조, 취업규칙 제56조 제3항, 제9항, 상벌위원회규정 제21조 제4항 제6호, 제13호, 제35호의 규정에 따라 해고를 결의하고 같은 날 원고를 징계해고하였다."
"이유","한편 참가인 회사 대표이사 소외 2는 원고에 대한 위 부당승무정지 등으로 수원지방법원에서 1996. 5.경 벌금 300,000원의 약식명령을 선고받아 그 시경 확정되었다."
"이유","원심은 위와 같은 사실관계를 바탕으로 참가인 회사에서 원고의 위 도중회차행위 등을 이유로 1994. 11. 15.부터 같은 달 24.까지 사이에 4일간 원고에게 배차를 하지 아니하여 승무를 하지 못하게 한 것은 참가인 회사의 종업원에 대한 징계의 종류의 하나인 승무정지처분에 해당한다 할 것이다."
"이유","따라서 같은 해 12. 9. 다시 동일한 사유로 원고를 징계해고한 것은 이중징계에 해당하여 위법하다고 판단하였다."
"이유","그러나 참가인 회사의 단체협약상 징계의 종류로서 열거된 '승무정지'는 원래 승무정지가 출근의무까지 면제되는 것은 아니라는 점과 취업규칙이나 상벌위원회운영규정에서 '정직' 또는 '정직'이라고 규정하고 있는 점을 참작하여 보면 출근정지를 수반하는 승무정지 즉 '정직'을 의미한다고 보아야 할 것이다."
"이유","또한 운송사업체에 있어서의 승무정지처분은 사용자가 경영권 행사의 일환으로 업무수행을 위하여 근로자에 대하여 행하는 업무명령인 승무지시의 소극적 양태라 할 것이다."
"이유","이러한 승무정지처분이 경영상의 필요나 업무수행의 합리적인 이유에 기인한 경우에는 이는 정당한 업무명령에 속한다고 할 것이므로 비록 단체협약에 승무정지가 징계사유로 열거되어 있다고 하여도 징계로서의 승무정지와는 별도로 업무명령으로서의 승무정지도 가능하다고 할 것이다."
"이유","그렇다면 이는 업무수행의 합리적인 이유에 기인한 정당한 업무명령에 속한다고 할 것이고 도중회차에 대한 징계라고 볼 수는 없다고 할 것이다."
"이유","이 사건에서 원고에 대한 배차 배제조치는 운전사로서는 언제든지 확인할 수 있는 상태에 있었다고 보아야 할 것이므로 원고에 대한 배차 배제조치를 원고가 그 당시에 사실상 알고 있었느냐의 여부에 관계없이 업무명령으로서의 승무정지처분은 유효하게 성립하였다고 보아야 할 것이다."
"이유","그러므로 나머지 상고이유에 대한 판단을 생략한 채 원심판결을 파기하고 이 사건을 원심법원에 환송하기로 하여 관여 법관의 일치된 의견으로 주문과 같이 판결한다."
