"판결요지","특별공급 주택의 공급가격이 조성원가에 미치지 못하는 경우에는 조성원가의 일부분인 생활기본시설 설치비용 전부가 공급가격에 포함되었다고 볼 수 없고, 공급가격 중 ‘조성원가에서 생활기본시설 설치비용을 공제한 금액’을 초과하는 부분이 있다면 그 부분만이 공급가격에 포함된 생활기본시설 설치비용이라고 보아야 한다."
"이유","구 택지개발촉진법 제12조 제4항, 구 국민임대주택건설 등에 관한 특별조치법 제17조 제5항은 토지 등의 수용에 관하여는 각 법에 특별한 규정이 있는 경우를 제외하고는 ‘공익사업을 위한 토지 등의 취득 및 보상에 관한 법률’을 준용한다고 규정하고 있다. "
"이유","이와 같이 토지보상법령이 이주대책대상자의 범위를 정하고 이주대책대상자에게 시행할 이주대책의 수립 등의 내용에 관하여 규정하고 있으므로, 사업시행자는 이러한 법정 이주대책대상자를 법령이 예정하고 있는 이주대책의 수립 등의 대상에서 임의로 제외하여서는 아니 된다."
"이유","그런데 사업시행자가 이와 같이 이주대책의 수립 등의 시행 범위를 넓힌 경우 그 내용은 법정 이주대책대상자에 관한 것과 그 밖의 관계인에 관한 것으로 구분되고 그 밖의 관계인에 관한 이주대책의 수립 등은 법적 의무가 없는 시혜적인 것으로 보아야 한다."
"이유","따라서 시혜적인 이주대책대상자의 범위나 그들에 대한 이주대책의 수립 등의 내용을 어떻게 정할 것인지에 관하여 사업시행자에게 폭넓은 재량이 있다고 할 것이다."
"이유","이주대책의 내용으로서 생활기본시설 설치비용의 사업시행자 부담에 관한 토지보상법 제78조 제4항이나 그 밖의 이주대책의 수립 등의 내용에 관한 법령이 법정 이주대책대상자의 범위를 넘어 시혜적인 이주대책대상자에까지 적용된다고 볼 것은 아니다."
"이유","한편 이 사건 신내3지구의 이주대책대상자들은 해당 사업지구에 관하여 수립된 이주대책을 거부하였으므로 법정 이주대책대상자에 해당하지 아니한다는 상고이유 주장은 상고심에서 처음으로 주장된 것으로서 적법한 상고이유가 될 수 없다."
"이유","이러한 원심판단에는 사업시행자가 생활기본시설 설치의무를 부담하는 상대방인 이주대책대상자의 범위에 관한 법리를 오해하여 판결에 영향을 미친 위법이 있다."
"이유","원심판결 이유에 의하면, 원심은 피고가 구 토지보상법 시행령에 따라 특별공급을 실시한 이 사건 신내2지구 이주대책대상자에 대하여 생활기본시설 설치의무를 부담한다고 판단하였다."
"이유","앞에서 본 법리에 비추어 보면 원심의 이러한 판단은 정당하고, 거기에 상고이유 주장과 같이 구 토지보상법상 특별공급에서 생활기본시설 설치의무의 부담에 관한 법리를 오해한 위법이 없다."
"이유","원심은 같은 이유로, 가로등 및 교통신호등 공사비, 통신시설 및 전기시설 등의 이설비, 오수차집관로 공사비, 감리비, 부대비는 구 토지보상법령이 적용되는 이 사건 신내2지구 이주대책대상자와 개정 토지보상법령이 적용되는 이 사건 신내3지구 이주대책대상자에 대하여 모두 피고가 부담하여야 할 생활기본시설 설치비용에 해당한다고 판단하였다."
"이유","가로등 및 교통신호등 공사비, 통신시설 및 전기시설 등의 이설비, 오수차집관로 공사비, 감리비, 부대비는 구 토지보상법령이 적용되는 이 사건 신내2지구 이주대책대상자와 개정 토지보상법령이 적용되는 이 사건 신내3지구 이주대책대상자에 대하여 모두 피고가 부담하여야 할 생활기본시설 설치비용에 해당한다고 판단하였다."
"이유","앞서 본 법리와 관계 규정 및 기록에 비추어 살펴보면, 이 부분 원심의 판단은 정당한 것으로 수긍할 수 있고, 거기에 상고이유 주장과 같이 생활기본시설 설치비용의 범위에 관한 법리 등을 오해한 위법이 없다."
"이유","따라서 같은 취지의 원심판단은 정당하고, 이와 달리 ‘주택 공급가격 중 토지비는 조성원가와 무관한 감정가격을 기초로 산정되었으므로 그에 생활기본시설 설치비용이 포함되었다고 볼 수 없다."
"이유","이주대책대상자에게 유리한 감정가격으로 토지비를 산정하여 공급가격에는 이미 생활기본시설 설치비용에 상응하는 정도의 공급가격 인하 효과가 내재되어 있으므로 부당이득이 성립하지 않는다’는 취지의 상고이유 주장은 받아들일 수 없다."
"이유","한편 원심은 ‘생활기본시설 설치비용 ÷ 유상공급면적’의 산식으로 산정한 단위면적당 생활기본시설 설치비용에 원고들이 분양받은 특별공급 주택의 대지권 면적을 곱한 금액이 부당이득금액이 된다고 판단하였다."
"이유","공급가격 중 ‘조성원가에서 생활기본시설 설치비용을 공제한 금액’을 초과하는 부분이 있다면 그 부분만이 공급가격에 포함된 생활기본시설 설치비용이라고 볼 것이다."
"이유","이러한 법리에 비추어 보면, 원고 6, 원고 17, 원고 32, 원고 33에 대하여는 전용면적 59.99㎡형 주택의 공급가격 중 ‘조성원가에서 생활기본시설 설치비용을 공제한 금액’을 초과하는 부분으로서 공급가격에 포함되어 위 원고들에게 전가된 생활기본시설 설치비용만큼만 부당이득이 된다."
"이유","그러나 원심판단 중 전용면적 59.99㎡형 주택을 분양받은 원고 6, 원고 17, 원고 32, 원고 33에 대하여도 위와 같이 산정된 금액만큼 부당이득이 성립한다는 부분은 다음과 같은 이유로 그대로 수긍하기 어렵다."
"이유","위 사실관계를 앞에서 본 법리에 비추어 보면, 이 사건 신내2지구 안에 설치된 도로는 모두 사업지구 안의 주택단지 등의 입구와 사업지구 밖에 있는 도로를 연결하는 기능을 담당하는 도로로서 생활기본시설에 해당한다고 할 것이다."
"이유","그런데도 원심은 이와 달리 피고가 이 사건 신내2지구 내에 설치한 도로는 간선시설에 해당하지 아니할 뿐만 아니라 생활의 기본이 되는 도로라고 볼 수 없다고 판단하였다. 이러한 원심판결에는 생활기본시설인 도로의 범위에 관한 법리 등을 오해하여 판결에 영향을 미친 위법이 있다."
"이유","원심은 피고가 전기시설의 지중화 부담비용 및 하수도원인자부담금을 부담한 사실을 인정하면서도, 그 비용이 생활기본시설 설치비용에 포함되어야 한다는 원고들의 주장을 배척하였다."
"이유","전기시설을 지중화하는 추세에 비추어 전기시설의 지중화는 ‘당해 지역조건에 따른 생활기본시설’ 내지 ‘통상적인 수준의 생활기본시설’에 해당하고, 하수도원인자부담금은 생활기본시설인 하수도와 관련하여 하수도법에 따라 부담한 비용으로서 생활기본시설 설치비용에 해당한다고 봄이 타당하다."
"이유","그런데도 원심은 이와 달리 전기시설 지중화 부담비용, 하수도원인자부담금은 생활기본시설 설치비용에서 제외된다고 판단하였다. 이러한 원심판결에는 생활기본시설 설치비용의 범위에 관한 법리 등을 오해하여 판결에 영향을 미친 위법이 있다."
"이유","지구 외 도로사업비, 광역교통시설부담금, 생태계보전협력금, 대체산림자원조성비에 관하여 공익사업지구 밖에 설치하는 도로 등 시설에 관한 부담금 등의 비용은 특별한 사정이 없는 한 생활기본시설 설치비용에 포함되지 아니한다."
"이유","한편 광역교통시설부담금은 대도시권 광역교통관리에 관한 특별법에 따라 대규모개발사업의 시행자가 대도시권의 광역적인 교통수요를 처리하기 위한 광역도로, 광역철도 등 교통시설 설치와 관련하여 부담하는 비용이다."
"이유","생태계보전협력금은 자연환경보전법에 따라 일정한 개발사업의 시행자가 자연환경의 체계적 보전과 자연자산 관리·활용을 위한 생태계의 보전사업 등과 관련하여 부담하는 비용이다."
"이유","대체산림자원조성비는 산지관리법에 따라 산지전용허가 등을 받으려는 자가 산지전용과 산지일시사용에 따른 대체산림자원의 조성과 관련하여 부담하는 비용이므로 이 비용들은 생활기본시설 설치비용에 해당한다고 볼 수 없다."
"이유","원심이 지구 외 도로사업비, 광역교통시설부담금, 생태계보전협력금, 대체산림자원조성비는 생활기본시설 설치비용에 포함되지 않는다고 판단한 것은 앞서 본 법리에 비추어 정당하다."
"이유","직접인건비, 판매비, 일반관리비, 자본비용에 관하여 원심은 직접인건비, 판매비, 일반관리비, 자본비용은 생활기본시설 설치비용과는 관련이 없다는 이유를 들어 이에 관한 원고들의 주장을 배척하였다."
"이유","따라서 이 부분 원심판결에는 생활기본시설 설치비용의 범위에 관한 법리를 오해하여 판결에 영향을 미친 위법이 있다."
"이유","피고의 위 나머지 원고들에 대한 상고를 모두 기각하기로 하여, 관여 대법관의 일치된 의견으로 주문과 같이 판결한다."
"이유","사업시행자는 공익사업의 시행으로 인하여 주거용 건축물을 제공함에 따라 생활의 근거를 상실하게 되는 자를 위하여 대통령령이 정하는 바에 따라 이주대책을 수립·실시하거나 이주정착금을 지급하여야 한다."
