"이유","중재계약은 당해 계약서 자체에 중재조항이 명기되어 있는 경우에 한하지 아니하고 중재조항을 포함하는 일반거래약관 등 다른 문서를 인용하는 경우에도 당사자가 이를 계약의 내용으로 삼은 이상 허용된다 할 것이다."
"이유","OOO 입찰에 관한 일반약관 제14조 B항은 위 약관에서 규정하고 있지 않은 계약 내용과 조건은 축협의 입찰과 계약에 관한 일반조항이 적용된다고 규정하고 있다."
"이유","원고는 1993년경부터 OOO이 실시하는 곡물구매입찰에 여러 번 참여하여 2회 이상 낙찰자로 선정된 바 있는데 원고가 참여한 위 입찰에서도 위 일반약관과 일반조항이 적용되었고 그 내용도 이 사건에서와 동일하여 원고도 위 일반약관과 일반조항의 내용을 잘 알고 있었다고 보여진다."
"이유","이 사건 계약에 있어서도 당사자가 ""OOO의 조건""을 숙지하고 있다고 명시적으로 인정하고 있는 점 등에 비추어 보면, 이 사건 계약에서 말하는 ""OOO의 조건""이란 위 일반약관과 일반조항을 가리킨다고 볼 것이어서, 당사자는 위 일반약관과 일반조항을 이 사건 계약의 내용으로 삼았다고 봄이 상당하다고 판단하였다."
"이유","위에서 본 법리와 기록에 비추어 살펴보면, 원심의 위와 같은 사실인정과 판단은 정당한 것으로 수긍이 간다."
"이유","거기에 상고이유로 주장하는 바와 같은 중재합의의 성립에 관한 법리를 오해하였거나 채증법칙을 위반하여 사실을 오인한 위법이 있다고 할 수 없다."
"이유","실제 중재판정에서는 피고의 지연손해배상채권 부분을 외화채권으로 판단하여 원고에게 외화로 지급을 명한 사실, 이 사건 중재판정부는 ""원·피고 사이의 매매계약에 의하면 물건의 대금을 미화로 지급하기로 약정하고 있다."
"이유","이러한 중재판정이 준거법인 대한민국법에 반한다고 할 수 없어 중재절차가 중재계약에 의하지 아니한 때에 해당한다고 할 수 없다."
"이유","한편 중재판정에 이유를 붙이지 아니한 때라 함은 전혀 이유의 기재가 없거나 있더라도 불명료하기 때문에 판정이 어떤 사실상 또는 법률상 판단에 기인하고 있는가를 판명할 수 없는 경우와 이유가 모순인 경우를 말한다고 할 것이다."
"이유","단지 중재판정취소의 소가 제기된 것만으로는 집행판결을 구하는 소제기를 저지할 수 있는 사유가 되지 못한다고 할 것이다."
"이유","원심이 같은 취지에서 중재판정집행판결청구의 소에 있어서 법정기간 내에 중재판정취소의 소가 제기되지 아니할 것을 소송요건으로 인정할 아무런 근거가 없다고 본 것은 정당하다."
"이유","거기에 상고이유에서 주장하는 바와 같은 집행판결에 관한 법리오해의 위법이 있다고 할 수 없다.  "
