"판결요지","부동산소유권이전등기등에관한특별조치법에 의하여 할 수 있는 등기는 같은 법 제3조의 취지에 비추어 볼 때 그 원인행위인 매매, 증여, 교환 등 법률행위가 1974.12.31. 이전에 이루어진 것에 한한다고 해석되므로, 그 원인행위일자가 그 이후로 인정되는 경우에는 그 등기에 그 기재내용대로의 추정력이 없다. "
"판결요지","공유토지는 공유자 1인이 그 전부를 점유하고 있다고 하여도 달리 특별한 사정이 없는 한 다른 공유자의 지분비율의 범위 내에서는 타주점유라고 볼 수밖에 없다."
"이유","부동산소유권이전등기등에관한특별조치법에 의하여 경료된 등기는 실체적 권리관계에 부합하는 등기로 추정되고, 위 법 소정의 보증서나 확인서가 허위 또는 위조된 것이라거나 그 밖의 사유로 적법하게 등기된 것이 아니라는 입증이 없는 한 그 등기의 추정력이 번복되지 아니하다."
"이유","여기서 허위의 보증서나 확인서라 함은 권리변동의 원인에 관한 실체적 기재내용이 진실이 아닌 것을 의미하는 것으로서 변론에 나타난 자료에 의하여 그 실체적 기재내용이 진실이 아님을 의심할 만큼 증명이 된 때에는 그 등기의 추정력이 번복된다고 보아야 할 것이다."
"이유","한편 위 법에 의하여 할 수 있는 등기는 위 법 제3조의 취지에 비추어 볼 때 그 원인행위인 매매, 증여, 교환 등 법률행위가 1974.12.31. 이전에 이루어진 것에 한한다고 해석된다."
"이유","그 원인행위일자가 그 이후로 인정되는 경우에는 그 등기에 그 기재내용대로의 추정력이 있다 할 수 없을 것이다."
"이유","기록에 비추어 살펴 보면 원심의 사실인정이나 위와 같은 견해에 따른 그 판단은 모두 정당한 것으로 수긍이 간다."
"이유","거기에 소론과 같이 위 법에 의하여 경료된 등기의 추정력에 관한 법리를 오해하거나 채증법칙에 위반하여 사실을 잘못 인정하고 보증서나 확인서의 허위 여부에 대한 판단을 그르친 위법이 있다 할 수 없다."
"이유","그리고 공유토지는 공유자 1인이 그 전부를 점유하고 있다고 하여도 달리 특별한 사정이 없는 한 다른 공유자의 지분비율의 범위 내에서는 타주점유라고 볼 수밖에 없다 할 것인 바이다."
"이유","그러므로 상고를 모두 기각하고 상고비용은 패소자들의 부담으로 하기로 하여 관여 법관의 일치된 의견으로 주문과 같이 판결한다."
