"판시사항","주류제조면허의 양도인에게 자신의 면허취소신청을 하고 양수인이 면허를 얻는 데 필요한 협력을 하여야 할 의무가 있는지 여부와 양수인이 양도인에게 위 협력의무의 이행을 소로써 청구할 수 있는지 여부"
"판결요지","위 “다”항의 이행청구가 가능하다고 하더라도 양도인 명의의 면허를 양수인 명의로 직접 변경할 것의 이행을 구하는 것은, 주세법이 그러한 명의변경절차를 인정하고 있지 아니하므로 허용될 수 없는 것이고, 그 이행을 구하는 것은 부적법하다."
"판결요지","주세법 제16조 제1항 제5호에서 말하는 면허취소사유로서의 “제조의 면허를 사실상 타인에게 양도하였을 때”라 함은 사실상의 양도, 즉 제조의 면허는 여전히 양도인이 보유하고 있으면서 실제로 제조는 양수인이 하는 경우를 말한다."
"판결요지","제조의 면허까지 양수인에게 양도하여 양수인이 면허를 받기로 하는 내용의 계약까지 위 조항이 금지하는 취지라고 해석할 수는 없다."
"판결요지","주류제조면허의 양도인은 양수인이 면허신청을 하여 면허를 얻을 수 있도록 자신의 면허취소신청을 하고 그와 함께 양수인이 면허신청을 하여 면허를 얻는 데 필요한 협력을 하여야 할 의무가 있다."
"판결요지","이와 같이 주류제조면허의 양도인에게 양도계약에 따른 협력의무가 있다면 양수인이 그 의무의 이행을 소로써 청구하는 것도 허용되고 그러한 청구에 소의 이익이 없다고는 할 수 없다."
"이유","피고는 그 약정을 이행하지 않고 위면허를 계속 보유하고 있으면서 탁주제조판매 및 그에 부수하여 탁주판매용기의 제조판매로 인한 부당이득을 얻고 있다고 주장하여, 주위적으로는 이 사건 주류공동제조면허 중 피고 명의를 원고 명의로 변경하는 절차의 이행을 구하였다."
"이유","여기서 말하는 면허취소사유로서의 제조의 면허를 사실상 타인에게 양도하였을 때라 함은 사실상의 양도, 즉 제조의 면허는 여전히 양도인이 보유하고 있으면서 실제로 제조는 양수인이 하는 경우를 말한다."
"이유","제조의 면허까지 양수인에게 양도하여 양수인이 면허를 받기로 하는 내용의 계약까지 위 조항이 금지하는 취지라고 해석할 수는 없다."
"이유","오히려 이러한 주류제조면허의 양도계약은 특별한 사정이 없는 한 사적 자치의 원칙에 따라 유효하다고 보아야 할 것이다."
"이유","또 실제에 있어서도 원심이 판시한 바와 같이 주류제조면허의 양도양수가 있으면 양도인이 그 면허의 취소신청을 하고 양수인이 새로운 면허를 받는 이른바 보충면허의 방법에 의하여 사실상 주류면허의 양도가 이루어지고 있다."
"이유","그리고 이와 같이 주류제조면허의 양도인에게 양도계약에 따른 협력의무가 있다면 양수인이 그 의무의 이행을 소로써 청구하는 것도 허용되고 그러한 청구에 소의 이익이 없다고는 할 수 없다."
"이유","다만 이러한 이행청구가 가능하다고 하더라도 양도인 명의의 면허를 양수인 명의로 직접 변경할 것의 이행을 구하는 것은, 주세법이 그러한 명의변경절차를 인정하고 있지 아니하므로 허용될 수 없는 것이다."
"이유","따라서 원심이 위와 같은 명의변경절차의 이행을 구하는 원고의 주위적 청구를 각하한 결과는 정당하다고 보아야 할 것이다."
"이유","예비적 청구에 관한 원심의 판단에는 주류제조면허의 양도나 소의 이익에 관한 법리를 오해한 위법이 있다고 아니할 수 없다."
"이유","이와 같은 명의변경이 전적으로 불가능하다는 이유만으로 금원청구부분을 배척한 것도 옳다고 할 수 없으며, 논지는 이 범위 안에서 이유 있다."
"이유","다만 기록에 의하면 이 사건 주류제조면허는 피고 등 17인이 공동으로 면허명의자로 되어 있음을 알 수 있는 바이다."
"이유","원심으로서는 위 17인 사이의 관계는 어떠한 것인지, 원고가 그중 1인인 피고만을 상대로 위와 같은 청구를 하는것이 적법한 것인지 살펴보아야 할 것이다."
"이유","그러므로 상고이유의 나머지 점에 관한 판단을 할것 없이 원심판결 중 이 사건 주류제조면허의 명의변경을 구하는 주위적 청구부분에 관한 원고의 상고를 기각하고 이 부분 상고비용은 원고의 부담으로 한다."
"이유","나머지 원고 패소부분은 이를 파기하여 원심법원에 환송하기로 하여 관여 법관의 일치된 의견으로 주문과 같이 판결한다."
