"이유","직업안정법 제36조 제1항 제3호는 직업정보제공사업자가 공익을 해칠 우려가 있는 경우로서 ‘이 법 또는 이 법에 따른 명령을 위반한 경우’에는 6개월 이내의 기간을 정하여 그 사업을 정지하게 하거나 등록 또는 허가를 취소할 수 있다고 규정하고 있다."
"이유","직업안정법 제25조는 직업정보제공사업자는 ‘구인자가 구인신청 당시 근로기준법 제43조의2에 따라 명단이 공개 중인 체불사업주인 경우 그 사실을 구직자가 알수 있도록 게재할 것’, ‘최저임금법 제10조에 따라 결정ㆍ고시된 최저임금에 미달되는 구인정보를 제공하지 아니할 것’, ‘그 밖에 대통령령으로 정하는 사항’을 준수하여야 한다고 규정하고 있다."
"이유","직업정보제공사업자의 주소 또는 전화번호는 기재하지 아니할 것’, ‘최저임금법 제10조에 따라 결정 고시된 최저임금에 미달되는 구인정보, 「성매매알선 등 행위의 처벌에 관한 법률」제4조에 따른 금지행위가 행하여지는 업소에 대한 구인광고를 게재하지 아니할 것’등을 규정하고 있다."
"이유","‘침익적 행정처분 근거 규정 엄격해석의 원칙’이란 단순히 행정실무상의 필요나 입법정책적 필요만을 이유로 문언의 가능한 범위를 벗어나 처분상대방에게 불리한 방향으로 확장해석하거나 유추해석해서는 안 된다는 것이지, 처분상대방에게 불리한 내용의 법령해석은 일체 허용되지 않는다는 취지가 아니다."
"이유","또한 행정법규 위반에 대한 제재처분은 행정 목적의 달성을 위하여 행정법규 위반이라는 객관적 사실에 착안하여 가하는 제재이므로, 반드시 현실적인 행위자가 아니라도 법령상 책임자로 규정된 자에게 부과되고, 특별한 사정이 없는 한 위반자에게 고의나 과실이 없더라도 부과할 수 있다."
"이유","직업안정법 제25조와 그 위임에 따른 직업안정법 시행령 제28조가 구인자가 체불사업주인 경우에는 구직 근로자가 이를 알 수 있도록 구인광고에 게재하여야 한다."
"이유","구인자가 제시하는 임금이 최저임금에 미달하거나 성매매업소인 경우 그에 대한 구인광고를 게재하지 못하도록 규정한 것은 구직 근로자를 보호하기 위함이다."
"이유","이러한 입법 목적에 비추어 직업안정법 시행령 제28조 제1호, 제2호의 규정 내용을 살펴보면, 이는 구직 근로자로 하여금 구인자의 확실한 신원과 주소, 전화번호를 알 수 있도록 함으로써 자신의 신원을 숨기고 불법ㆍ유령 업체를 운영하는 구인자로부터 구직 근로자를 보호하기 위함임을 알 수 있다."
"이유","위와 같은 준수사항들은 직업정보제공사업자가 구인자의 구인광고를 직업정보제공매체에 게재하기 전에 구인자의 확실한 신원과 주소, 전화번호 등 연락처, 사업자등록 내용을 파악할 것을 전제로 한다."
"이유","여기에서 ‘의무위반을 탓할 수 없는 정당한 사유’가 있는지를 판단할 때에는 직업정보제공사업자 본인이나 그 대표자의 주관적인 인식을 기준으로 하는 것이 아니라, 그의 가족, 대리인, 피용인 등과 같이 본인에게 책임을 객관적으로 귀속시킬 수 있는 관계자 모두를 기준으로 판단하여야 한다."
"이유","원심판결 이유와 기록에 의하면, 원고가 운영하고 있는 직업정보제공매체인 ‘OOO’라는 인터넷 사이트에 2017. 11.경 게재된 6건의 구인광고의 구인자 업체명과 주소가 객관적으로 허위임을 알 수 있으므로, 이는 직업안정법 시행령 제28조 제1호에서 정한 직업정보제공사업자의 준수사항 위반에 해당한다."
"이유","이 사건 사이트의 운영방식에 의하면, 구인자가 구인광고를 하려면 회원가입을 하여야 하고, 회원가입 과정에서 휴대폰 통신사를 통해 회원가입자의 이름, 생년월일, 성별, 휴대폰 정보 및 인증번호를 입력하는 방법으로 회원가입자 본인임을 확인하는 것으로 보인다."
"이유","그러나 그것만으로는 구인자의 확실한 신원과 주소, 사업자등록 내용을 파악할 수 없으므로, 다른 특별한 사정이 없는 한 원고에게 의무위반을 탓할 수 없는 정당한 사유가 있다고 볼 수도 없다."
"이유","그러므로 원심판결을 파기하고, 사건을 다시 심리ㆍ판단하게 하기 위하여 원심법원에 환송하기로 하여, 관여 대법관의 일치된 의견으로 주문과 같이 판결한다."
