"판시사항","진정상속인이 주장하는 피상속인과는 다른 피상속인으로부터 상속받았음을 이유로 부동산소유권이전등기등에관한특별조치법에 의한 상속등기를 경료한 자에 대한 소유권이전등기말소청구가 상속회복청구의 소에 해당하지 않는다고 한 사례"
"판결요지","상속회복청구의 소는 진정상속인과 참칭상속인이 주장하는 피상속인이 동일인임을 전제로 하는 것이므로 진정상속인이 주장하는 피상속인과 참칭상속인이 주장하는 피상속인이 다른 사람인 경우에는 진정상속인의 청구원인이 상속에 의하여 소유권을 취득하였음을 전제로 한다고 하더라도 이를 상속회복청구의 소라고 할 수 없다."
"이유","위 소외 1이 사망하여 상속이 개시된 1944. 8. 15.로부터 제척기간인 20년이 경과한 1996. 11. 12.에야 제기된 것임이 기록상 명백한 이 사건 소는 제척기간이 지난 후에 제기된 것으로서 부적법하다고 하여 이를 각하한 제1심판결을 그대로 유지하였다."
"이유","비록 등기부상으로는 위 각 부동산에 관하여 위 OOO 명의로 위 특별조치법상의 상속등기가 경료되어 있지만 이는 OOO이 망 OOO로부터 위 각 부동산을 상속하였다는 등기로 볼 수는 없다."
"이유","따라서 위 OOO을 위 각 부동산에 관한 참칭상속인이라고는 볼 수 없다고 할 것이므로 위 각 부동산에 관한 이 사건 소는 상속회복청구의 소에는 해당되지 않는다고 할 것이다."
"이유","그러므로 원심판결을 파기하고, 이 사건을 다시 심리·판단하도록 하기 위하여 원심법원에 환송하기로 하여 관여 법관의 일치된 의견으로 주문과 같이 판결한다."
