"판결요지","주택건설촉진법 제38조의3 제1항에 의하면 국민주택에 관하여는 최초로 공급한 날로부터 일정기간 동안 전매행위가 금지되어 있고 이에 위반하여 그 전매행위를 한 매도인을 처벌하는 규정은 있어도 위 규정에 위반한 전매의 효력에 관하여는 아무런 정함이 없다."
"판결요지","또한 국민주택사업주체에 대하여 전매가 금지되는 시기까지 국민주택을 전매하지 않기로 약정하고 그 약정이 등기까지 되었는데 그 전매금지약정을 위반하여 매매계약을 체결하였다고 하더라도, 국민주택사업주체에 대하여 채무불이행의 책임을 지는 것은 별론으로 하고, 그 매매계약이 무효가 된다고도 할 수 없다."
"이유","피고가 소외인에게 자신이 소외 대한주택공사로부터 분양받아 아직 소유권이전등기는 마치지 아니한 이 사건 부동산을 피고를 대리하여 제3자에게 매도할 수 있는 대리권을 수여한 사실, 위 소외인이 피고를 대리하여 원고에게 위 부동산을 매도한 사실 등을 인정하였는 바이다."
"이유","관계증거를 기록과 대조하여 검토하여 보면 원심의 위와 같은 인정판단은 정당한 것으로 수긍이 되고, 원심판결에 소론과 같이 채증법칙을 위반한 위법이 있다고 볼 수 없으므로, 논지는 이유가 없다."
"이유","대통령령이 정하는 경우로서 당해 국민주택사업주체의 동의를 얻은 때를 제외하고는, 이를 타인에게 전매할 수 없다고 정하고 있으나,같은 법은 제52조 제2항에서 위 규정에 위반하여 전매를 한 매도인을 처벌한다고만 정하고 있을 뿐, 위 규정에 위반한 전매의 효력에 관하여는 아무런 정함이 없다."
"이유","제38조의3 제3항에서는 위 규정에 위반한 전매가 있는 경우에, 그 매수인에게 국민주택사업주체가 일정한 금액을 지급한 때에는 그 지급한 날에 국민주택사업주체가 당해 국민주택을 취득한 것으로 본다고 정하고 있는 바이다."
"이유","이러한 점에 비추어 볼 때 위 전매금지규정은 단속규정에 불과하고 효력규정은 아니라고 할 것이므로, 위 전매금지규정을 위반한 매매계약이 무효라고 할 수 없다."
"이유","또한 피고가 대한주택공사에 대하여 전매가 금지되는 1990.7.25.까지 이 사건 부동산을 전매하지 않기로 약정하고 그 약정이 등기까지 되었는데, 그 전매금지약정을 위반하여 매매계약을 체결하였다고 하더라도, 피고가 대한주택공사에 대하여 채무불이행의 책임을 지는 것은 별론으로 한다."
"이유","그 매매계약이 무효가 된다고도 할 수 없다고 판단하였는바, 관계법령의 규정 내용에 비추어 볼 때 원심의 위와 같은 판단은 정당한 것으로 수긍이 되고, 원심판결에 소론과 같이 법리를 오해한 위법이 있다고 볼 수 없으므로, 논지도 받아들일 수 없다."
"이유","그러므로 피고의 상고를 기각하고 상고비용은 패소자인 피고의 부담으로 하기로 관여 법관의 의견이 일치되어 주문과 같이 판결한다."
