"판결요지","특별한 경우를 제외하고는 임대주택의 임차인은 임차권을 다른 사람에게 양도하거나 임대주택을 다른 사람에게 전대할 수 없다고 규정하며, 거짓이나 그 밖의 부정한 방법으로 임대주택을 임대받은 자나 법에 위반하여 임대주택의 임차권을 양도하거나 임대주택을 전대한 자를 형사처벌하도록 규정하고 있다."
"이유","원심은 이 사건 임대차계약 제12조 제3항 제4호, 구 임대주택법 제21조 제1항 제4호에서 정한 이 사건 아파트의 우선분양전환자격에 관하여, 아래의 사실과 사정 등을 종합하여 원고는 선착순의 방법으로 입주자로 선정되어 분양전환 당시까지 거주한 무주택자인 임차인에 해당한다고 본 제1심판결의 판단을 그대로 유지하였다."
"이유","원고는 부친인 소외 2가 회원으로 가입하여 원고 명의의 가족카드로 발급된 신용카드를 이 사건 아파트가 위치한 세종특별자치시에서 사용해 온 것으로 보인다."
"이유","적법한 증거조사절차를 거친 증거능력 있는 적법한 증거에 의하여 사회정의와 형평의 이념에 입각하여 논리와 경험의 법칙에 따라 사실 주장의 진실 여부를 판단하여야 할 것이며, 비록 사실의 인정이 사실심의 전권에 속한다고 하더라도 이와 같은 제약에서 벗어날 수 없다."
"이유","이 사건 임대차계약 제12조 제3항 제4호는 공공건설 임대주택인 이 사건 아파트의 분양전환자격에 관하여, 원고가 선착순의 방법으로 입주자로 선정된 경우에는 ‘분양전환 당시까지 거주한 무주택자인 임차인’에 해당하여야 함을 정하고 있는데, 이는 구 임대주택법 제21조 제1항 제4호에서 규정한 내용과 다르지 않다."
"이유","원고는 1993. 12.생으로 2001. 11. 30. 대전 유성구 (주소 1 생략)에 전입신고되어 가족들과 함께 거주하다가, 2014. 7. 14. 대전 유성구 (주소 2 생략)으로 전입신고하였다. "
"이유","2014. 8. 28. 주식회사 영무건설과 사이에 이 사건 아파트를 임대차보증금 1억 7,200만 원에 임차하는 임대차계약을 체결하고 2014. 11. 4. 이 사건 아파트를 주소지로 하여 전입신고를 마쳤다."
"이유","어릴 때부터 장기간 거주해 오던 주거지에서 가족들과 떨어져 20세의 나이에 대전 유성구으로 전입신고를 하였다가 다시 불과 약 1개월 만에 그곳에서 상당한 거리에 위치한 이 사건 아파트를 임대차보증금 1억 7,200만 원에 임차하게 된 동기나 목적, 경위에 대하여는 구체적으로 밝히지 않았다."
"이유","원고는 입주자카드 작성 당시 소외 3을 가족사항란에 기재한 이유나 경위 및 소외 3이 구체적으로 원고와 어떤 관계가 있는 사람인지 등에 대하여 구체적으로 밝히지 않은 채 단지 ‘원고와 소외 3은 배우자, 직계존속, 직계비속의 관계가 없다."
"이유","아파트관리사무소의 담당자, 반장, 과장 또는 소장 등이 결재한「이사 세대 전입·전출내역서」에 의하면, 이 사건 아파트에서는 (1) 2017. 6. 6. 08:00경부터 11:40경까지 탑차와 사다리차를 사용하여 전출이사를 하다."
"이유","같은 날 12:00경부터 15:10경까지 탑차와 사다리차를 사용하여 전입이사를 하면서, 이 사건 아파트의 관리비는 전입자와 전출자 사이에서 승계한 것으로 나타나고, 2018. 6. 1. 07:30경부터 10:50경까지 화물용달차와 탑차, 사다리차를 사용하여 전출이사를 한 내역이 나타난다."
"이유","‘어떠한 경위에서 그러한 전입·전출내역서가 작성된 것인지 알 수 없다.’는 등의 답변만 하였을 뿐 이 부분에 관하여서도 설득력 있는 해명을 하지 못하였다."
"이유","위 휴대전화번호는 원고가 이 사건 아파트에 관한 입주자카드 작성 시 기재했던 원고의 휴대전화번호와는 다르다. 그리고 2017년 2/4분기 이후에는 위 4대의 차량은 더 이상 출입한 기록이 없고, 그 대신 휴대전화번호을 사용하는 사람의 차량이 등록되어 출입한 것으로 나타난다."
"이유","그런데 원고는 이 사건 아파트에 위와 같은 기간 동안 상당히 이례적으로 다섯 대의 차량이 등록되어 출입한 경위나 위 차량 등록 이후 출입한 사람들과 원고의 관계에 관하여서도 ‘원고가 이러한 차량 등록에 대하여 확인한 바 없다."
"이유","임차인과는 무관하게 제3자가 임의로 등록한 경우도 있고, 관리자들의 과실로 다른 아파트 호실로 바뀌어 등록된 경우도 있다.’는 등의 취지로 막연한 답변을 하였을 뿐이다."
"이유","이 사건 아파트에 관한 2017. 6. 이후부터 2018. 5.까지의 1년간 월별 수도, 전기 사용요금 발생액을 살펴보면, 위 기간 해당 월의 금액은 전년 동월 금액과 대비할 때 2018. 1. 및 같은 해 2월경을 제외하고는 대체로 감소한 것으로 나타난다."
"이유","그리고 2018. 6. 이후부터 같은 해 10월까지의 수도 사용요금은 전년도 동월 금액과 대비할 때 현저하게 줄어들거나 발생요금이 아예 0원인 경우도 있다."
"이유","원고는 이 사건 아파트가 위치한 세종특별자치시에서 신용카드를 사용하였다고 주장하면서 신용카드 거래내역을 제출하였으나, 그 자료에 의하더라도 2018. 10.경부터의 거래내역에 불과하여 그 이전에 원고가 이 사건 아파트에 실제 거주하였는지 여부를 뒷받침하기에는 부족하다."
"이유","이러한 사실관계와 여러 사정을 앞에서 본 법리에 비추어 살펴보면, 비록 원고가 2014. 10. 30. 이 사건 아파트에 관한 입주자카드를 작성하여 관리사무소장에게 제출하다."
"이유","원심으로서는 원고의 석연치 않은 여러 답변과 해명에 관하여 추가로 필요한 심리를 진행하고 당사자들의 주장과 증거를 면밀히 대조하여 원고가 이 사건 아파트를 유일하고도 단일한 거주지로 하여 임대차계약기간 개시일 무렵부터 분양전환 당시까지 직접 계속 거주하였는지 여부를 보다 신중하게 판단하였어야 한다."
"이유","그런데도 원심은, 그 판시와 같은 사정만을 들어 원고가 선착순의 방법으로 입주자로 선정되어 분양전환 당시까지 거주한 무주택자인 임차인에 해당된다고 보아, 이 사건 임대차계약 제12조 제3항 제4호, 구 임대주택법 제21조 제1항 제4호에서 정한 우선분양전환자격이 인정된다고 판단하였는 바이다."
"이유","이러한 원심의 판단에는 필요한 심리를 다하지 아니한 채 논리와 경험의 법칙에 반하여 자유심증주의의 한계를 벗어나는 등으로 판결에 영향을 미친 잘못이 있다."
"이유","그러므로 원심판결을 파기하고, 사건을 다시 심리·판단하도록 원심법원에 환송하기로 하여, 관여 대법관의 일치된 의견으로 주문과 같이 판결한다."
