"이유","원고는 1995. 7. 14. OOO 주식회사와 사이에 경남 고성군 아파트에 관하여 임대차보증금 1,260만 원, 월 임차료 21,000원, 임대차기간 2년으로 정하여 임대차계약을 체결하였다."
"이유","원고는 2000. 2. 8. OOO에게 임대차기간 만료를 이유로 임대차보증금을 반환하여 줄 것을 요구하는 내용증명우편을 발송한 후 2000. 3. 11. 소외 1과 사이에 이 사건 아파트에 관하여 보증금 1,000만 원으로 정하여 전대차계약을 체결하였다."
"이유","소외 1은 2000. 4. 10. 그 아들인 소외 2를 세대주로 하여 전입신고를 하였다가 2002. 1. 10. 자신을 세대주로 하여 이 사건 아파트로 주민등록 전입신고를 마쳤다."
"이유","한편 피고는 이 사건 아파트를 포함한 위 아파트 A동 및 B동 전체에 대한 근저당권자로서 창원지방법원 통영지원 2003타경8505호로 부동산임의경매를 신청함에 따라 2003. 6. 27. 부동산임의경매절차가 개시되었다."
"이유","원고는 이 사건 아파트에 관하여 주택임대차보호법 제8조, 제3조 제1항 소정의 우선변제권 있는 소액임차인으로서의 지위를 그대로 유지한다고 할 것이므로, 피고에게 배당된 713,802,262원 중 500만 원은 원고에게 배당되어야 한다고 주장한다."
"이유","이 사건에서 원고가 OOO로부터 전대차에 관한 동의를 받았는지 여부에 관하여, OOO이 원고로부터 임대차기간 만료 이후 임대차보증금의 반환을 요구하는 내용증명을 받고도 이 사건 전대 당시까지 그에 대한 아무런 회답을 하지 않은 사정만으로 이 사건 전대차를 묵시적으로 동의하였다고 보기 어렵다."
"이유","그렇다면, 원고의 이 사건 청구는 이유 없으므로 이를 기각하여야 할 것인바, 제1심 판결은 이와 결론을 달리하여 부당하므로, 이를 취소하기로 하여 주문과 같이 판결한다."
