"판결요지","민법 제294조는 지역권은 계속되고 표현된 것에 한하여 민법 제245조의 규정을 준용한다고 규정하고 있으므로, 요역지의 소유자가 승역지에 통로를 개설하여 그 통로를 사용하는 상태가 민법 제245조에 규정된 기간 계속된 경우에 한하여 통행지역권의 시효취득을 인정할 수 있는 것이다. "
"이유","피고가 1991. 11. 26. 위 건물을 양수한 후 이 사건 계쟁토지 부분에 대한 위 소외 2의 점유를 승계하여 피고 및 피고로부터 위 주택의 일부를 임차하여 거주하고 있는 임차인들만이 독점적, 배타적으로 위 주택의 안채에서 공로로 통하는 통행로로 점유, 사용하고 있다고 인정한다."
"이유","원고는 이러한 통행지역권의 시효취득자인 피고에 대하여 이 사건 계쟁토지의 인도를 구할 수 없다고 판단하여 원고의 이 사건 청구를 배척하였다."
"이유","민법 제294조는 지역권은 계속되고 표현된 것에 한하여 민법 제245조의 규정을 준용한다고 규정하고 있으므로, 요역지의 소유자가 승역지에 통로를 개설하여 그 통로를 사용하는 상태가 민법 제245조에 규정된 기간 계속된 경우에 한하여 통행지역권의 시효취득을 인정할 수 있는 것이다."
"이유","1978년경 위 토지 소유자이던 소외 3이 벽돌로 담을 쌓아 통행로를 차단함으로써 그 후로는 피고만이 공로로 통행하는 통행로로 사용하여 왔다”고 주장하였는 바이다."
"이유","따라서 피고의 주장 자체에 의하더라도 피고는 이 사건 계쟁토지에 관하여 위  대지를 요역지로 하는 통행지역권을 시효취득할 수 없다고 할 것인데도 불구하다."
"이유","원심은 피고의 전 점유자인 위 소외 2가 1971. 10. 21.경부터 이 사건 계쟁토지를 배타적으로 점유, 사용하였다고 잘못 인정하여 피고가 이 사건 계쟁토지에 관하여 통행지역권을 시효취득하였다고 판단하였으므로, 원심에는 채증법칙을 위배하여 사실을 잘못 인정한다."
"이유","나아가 지역권의 시효취득에 관한 법리를 오해하여 판결 결과에 영향을 미친 위법이 있다고 할 것이고, 이를 지적하는 논지는 이유 있다."
