"판시사항","토지거래 신고 당시 당해 토지가 신고구역에 해당하여 그 신고를 하였다가 거부된 후 신고구역에서 해제된 경우, 그 후 위 토지거래에 터잡아 소유권이전등기를 신청하는 데에도 토지거래 신고필증을 제출해야 하는지 여부 및 당해 토지거래신고의 수리거부처분에 대한 취소소송의 소의 이익 유무"
"판결요지","국토이용관리법 소정의 토지거래신고구역에 관한 규정은 단속법규에 불과한 것으로 이에 위반한 거래계약의 사법적 효력까지 부인되는 것은 아니다."
"판결요지","그렇게 된 이상 이제는 당해 토지거래신고의 수리거부처분에 대하여 그 취소를 구하는 당해 소는 그 소의 이익이 없다."
"이유","기록에 의하면 건설교통부장관은 1997. 12. 20.자로 국토이용관리법 제21조의7 제5항에 의하여 기 지정한 전국의 모든 토지거래신고구역을 해제하는 공고를 함으로써 그 전에 토지거래신고구역으로 지정되어 있던 이 사건 토지도 그에 따라 토지거래신고구역에 해당되지 않게 되었음을 알 수 있다."
"이유","그 후 신고구역에서 해제된 경우에 있어서는 그 해제 이후 신고대상이 된 토지거래에 터잡아 소유권이전등기를 신청하는 데에는 위 특별조치법 제5조 제2항의 규정은 그 적용이 없어 토지거래의 신고필증을 제출할 필요가 없다고 할 것이다."
"이유","그러므로 이 사건 소에 관하여 소의 이익이 있다는 전제 아래 본안에까지 나아가 판단한 원심판결을 파기하다."
"이유","이 사건 소는 위와 같이 그 소의 이익이 인정되지 아니하여 부적법하므로, 이 법원이 스스로 판단하되 이를 각하하고, 소송총비용은 패소자의 부담으로 하기로 관여 법관의 의견이 일치되어 주문과 같이 판결한다."
