"판시사항","주택임대차보호법 제3조 제1항 소정의 대항요건으로서의 주민등록의 임대차공시방법으로서의 유효 여부에 관한 판단 기준 부동산등기부상 '에이동' 이라고 표시된 연립주택의 임차인이 '가'동이라고 전입신고를 한 경우, 임차인의 주민등록이 임대차의 공시방법으로 유효하다고 판단한 사례"
"이유","원심은 제1심판결 이유를 인용하여, 피고 1은, 1996. 10. 22. 제1심판결 별지 목록 기재 연립주택의 소유자인 소외인과 사이에, 서울 강서구 ○○2동 515의 3 '가동 □□□호'를 보증금 4,000만 원, 임대차기간 1996. 11. 22.부터 24개월로 정하여 위 소외인으로부터 임차하기로 하는 내용의 임대차계약을 체결한다."
"이유","이 사건 부동산에 대한 대항력 있는 임차인이라는 피고들의 항변을 배척하고 원고의 이 사건 명도 청구를 인용하였다."
"이유","주택임대차보호법 제3조 제1항에서 주택의 인도와 더불어 대항력의 요건으로 규정하고 있는 주민등록은 거래의 안전을 위하여 임차권의 존재를 제3자가 명백히 인식할 수 있게 하는 공시방법으로서 마련된 것이라고 볼 것이다."
"이유","주민등록이 어떤 임대차를 공시하는 효력이 있는지 여부는 일반사회 통념상 그 주민등록으로 당해 임대차건물에 임차인이 주소 또는 거소를 가진 자로 등록되어 있다고 인식할 수 있는지 여부에 따라 결정되어야 한다"
"이유","이 토지 위에는 위에서 본 2개 동의 연립주택 외에는 다른 건물이 전혀 없고 그 2개 동도 한 층당 세대수가 한 동은 4개 세대씩이고 다른 동은 6개 세대씩으로서 크기가 달라서 외관상 혼동의 여지도 없음을 알 수 있는바이다."
"이유","더욱이 경매가 진행되면서 원고를 포함하여 입찰에 참가하고자 한 사람들로서도, 경매기록에서 경매목적물의 표시가 '에이동'과 '가동'으로 병기되고 있었음이 기록상 분명한 이상, 피고들의 임대차를 대항력 있는 임대차로 인식하는 데에 아무런 어려움이 없었다고 하지 않을 수 없다."
"이유","원심이 위 주민등록상의 동수 표시와 이 사건 부동산 등기부상의 동수 표시가 형식적으로 일치하지 않는다는 점만으로 위 주민등록이 이 사건 임대차의 공시방법으로 유효하지 않다고 판단한 데에는 심리미진 또는 주택임대차보호법상의 임대차 공시방법에 대한 법리를 오해한 위법이 있다."
"이유","그리고 원심이 인용하고 있는 대법원 1999. 4. 13. 선고 99다4207 판결은 이 사건과 그 사안을 같이 한다고 할 수 없어 이 사건에서 선례로 삼기에 적절한 것이 아니다."
