"판시사항","감리자가 공정관리를 하면서 도급인에게 정기적으로 기성률을 산정하여 보고한 것이 위 일반조건에 정한 ‘기성검사를 필한 경우’에 해당하지 않는다고 본 사례"
"이유","이 사건 공사대금에는 순공사대금 외에 분양·홍보를 위한 비용, 모델하우스 건립 및 운영비, 설계비, 감리비, 하자보증수수료 등이 포함되었던바, 원고는 이 사건 아파트의 시공 및 분양을 일괄 책임지기로 하였다."
"이유","피고는 원고의 공사잔대금이 미분양세대의 총분양대금 이상일 때에 한하여 공사잔대금을 지급하기로 하였던 점, 일반조건 제18조의 기성검사는 도급인인 피고가 고용한 공사감독원이 한 기성검사를 가리키는 것으로 보이는데 감리자와 공사 감독원은 그 지위나 업무의 내용 등이 다른 점이다."
"이유","피고는 대기업인 원고에게 시공뿐 아니라 분양까지 일괄하여 위임하면서 미분양의 경우 공사대금 지급에 갈음하여 미분양 세대로 대물 변제 할 수 있도록 대비까지 해 둔 등의 이유로 통상의 공사도급 계약과는 달리 기성률의 산정, 확인에 거의 관심을 가지지 아니 하였다."
"이유","감리자의 본래 업무는 시공자가 법령에 정한 기준에 부합하는 건축자재를 사용하여 설계도서에 따라 적합하게 시공하는지 여부 등을 확인하는 데 있는 점 등을 종합하면, 비록 이 사건과 같은 주택건설공사의 경우 감리자가 공정관리까지 하면서 공정 현황을 확인·보고하도록 되어 있다."
"이유","실제로 감리자인 주식회사 OOO 건축사사무소가 매월 말 기성률을 산정하여 피고에게 보고하였다고 하더라도, 이와 같은 사정만으로는 위 기성률 산정, 보고를 일반조건 제18조에 정해진 도급인의 위험부담 요건인 ‘기성검사를 필한 경우’에 해당한다고 보기 어렵다는 이유로 원고의 주장을 배척하였다."
"이유","기록에 비추어 살펴보면, 위와 같은 원심의 사실인정과 판단은 옳은 것으로 수긍이 가고, 거기에 채증법칙 위배로 인한 사실오인 또는 구 주택건설촉진법 등에 관한 법리오해의 위법이 있다고 할 수 없다."
"이유","피고가 추가공사대금 액수가 협의 되지 아니하였다는 이유로 기존의 이 사건 계약상의 공사잔대금 지급을 거절한 것은 부당하고, 따라서 피고는 이 사건 공사잔대금 지급 채무의 이행 지체에 따른 지연 손해금을 지급할 의무가 있다고 판단하였다."
"이유","기록에 비추어 살펴보면, 위와 같은 원심의 사실인정과 판단도 옳고, 거기에 상고이유의 주장과 같은 심리미진 또는 채증법칙 위배로 인한 사실오인이나 공사대금의 지급시기에 관한 법리오해 등의 위법이 있다고 할 수 없다."
"이유","그러므로 상고를 각 기각하고, 상고 비용은 각자가 부담하도록 하여 관여 법관의 일치 된 의견으로 주문과 같이 판결한다."
