"판결요지","멸실회복등기는 6·25 사변 기타 재난으로 인하여 등기부의 전부 또는 일부가 물리적으로 멸실된 경우에 그로 말미암아 소멸한 등기의 회복을 목적으로 행하여지는 등기이므로 등기부 멸실 전에도 자기 명의로 등기부상에 기재되어 있어야 이를 할 수 있다."
"판결요지","전등기의 접수연월일, 접수번호, 등기원인이 각 불명으로 기재된 멸실회복등기라도, 특별한 사정이 없는 한, 멸실회복등기의 실시요강에 따라 등기공무원이 토지대장등본 등 전등기의 권리를 증명할 공문서가 첨부된 등기신청서에 의하여 적법하게 처리한 것이라고 추정할 것이다."
"이유","원고들이 위 분할 전 토지가 이 사건 각 토지로 분필등기된 분필에 관한 등기필증을 소지한 점 만으로는 원고들의 주장을 인정하기에 부족하다고 한 조치는 정당한 것으로 수긍이 간다."
"이유","논지는 모두 위 상고이유 제1점이 이유 있을 것을 전제로 하여 원심의 부가적인 판단을 탓하는 것인 바이다."
"이유","앞서 본 바와 같은 상고이유 제1점이 모두 이유 없으므로 논지의 옳고 그름은 판결 결과에 영향이 없는 것이다."
"이유","그러므로 상고를 모두 기각하고 상고비용은 패소자의 부담으로 하기로 하여 관여 법관의 일치된 의견으로 주문과 같이 판결한다."
