"판시사항","사찰이 소속 종단의 종헌에 따르지 아니하고 그 신도와 승려가 결합하여 소속 종단을 탈종한 경우, 사찰 자체의 종단 소속이 변경되는지 여부 및 사찰 자체의 분열이 인정되는지 여부"
"판시사항","위 부동산의 적법한 소유자는 OOO OOO사이고 변경된 OOO사라는 등기명의인 표시가 새로이 실체를 갖게 된 OOO사를 지칭하는 것이 아니라는 이유로, OOO OOO사는 위 표시변경등기의 경정등기를 하면 되고 말소등기를 구할 소의 이익이 없다고 한 사례"
"판결요지","등기명의인 표시변경등기는 등기명의인의 동일성이 유지되는 범위 내에서 등기부상의 표시를 실제와 합치시키기 위하여 행하여지는 것에 불과할 뿐 어떠한 권리변동을 가져오는 것은 아니다."
"판결요지","그 표시변경이 등기명의인의 동일성이 유지되는 범위 내에서 행하여진 것에 불과한 경우에는 그것이 잘못되었더라도 다시 소정의 서면을 갖추어 경정등기를 하면 되므로 소로써 그 표시변경등기의 말소를 구하는 것은 소의 이익이 없어 허용되지 아니한다."
"이유","이에 이 사건 사찰이 독립한 권리·의무의 귀속 주체로서 사찰부지와 건물인 원심판결 첨부 별지 목록 기재 각 부동산을 소유하게 되었으며, 한편 이 사건 사찰은 1973. 10. 22. OOO에 종단 소속 사찰로 등록된 바 있다."
"이유","피고 2는 그 후 매매를 가장하여 사찰 소유인 이 사건 부동산 중 일부를 사찰 자체의 명의에서 자기 개인 명의로 소유권이전등기하였다가 종단에서 이를 문제삼자 1997. 9. 19. 자신을 따르는 신도들과 함께 OOO을 탈종하였다."
"이유","이에 OOO 종단은 피고 2를 주지에서 해임하고 후임 주지를 임명하였으나, 피고 2는 자신이 여전히 이 사건 사찰의 대표자라고 주장하면서 이 사건 부동산에서 불교행사를 거행하고 있는 사실을 알아 볼 수 있다."
"이유","사찰이 일단 성립한 이상 사찰 그 자체의 분열도 인정되지 않는 것이므로 이 사건 사찰은 피고 2 등의 탈종에도 불구하고 여전히 태고종 사찰로 남아 있다고 할 것이다."
"이유","그 후 OOO에서 피고 2를 주지에서 해임하고 후임 주지를 임명한 이상 피고 2를 대표자로 내세운 피고 사찰은 그 후 별도로 사찰로서의 실체를 갖추어 이 사건 사찰과 별개의 종교단체로 따로 존재하게 되는 것은 별론으로 한다."
"이유","더 이상 이 사건 사찰과 동일한 사찰로서 존재할 수는 없는 것이며, 이 사건 사찰은 어디까지나 OOO이 임명한 소외 1이 대표자로 있는 원고 사찰로서만 존재할 뿐이라고 할 것이다."
"이유","거기에 상고이유에서 지적하는 바와 같은 채증법칙 위배나 이유모순 또는 사찰 재산의 소유권 귀속에 관한 법리오해 등의 위법이 없다."
"이유","따라서 피고들의 주장과 같이 변경된 '피고 1 사찰'이라는 등기명의인 표시가 피고 사찰명칭과 동일하게 되었다고 하더라도 그 표시변경등기에 의하여 이 사건 부동산의 소유권이 원고 사찰에서 피고 사찰로 이전되었다고 할 수는 없다고 할 것이다."
"이유","이 점에 관한 상고이유 및 상고이유서 제출기간 경과 후에 제출된 상고이유보충서 기재 중 상고이유를 보충하는 부분은 모두 받아들일 수 없다."
"이유","그 표시변경이 등기명의인의 동일성이 유지되는 범위 내에서 행하여진 것에 불과한 경우에는 그것이 잘못되었더라도 다시 소정의 서면을 갖추어 경정등기를 하면 되므로 소로써 그 표시변경등기의 말소를 구하는 것은 소의 이익이 없어 허용되지 아니한다고 할 것이다."
"이유","변경된 '피고 1 사찰'이라는 등기명의인 표시가 현재의 피고 사찰의 명칭과 동일하다는 것만을 가지고 그 표시가 피고 사찰을 지칭하는 것이라고 할 수는 없다."
"이유","기록상 달리 이 사건 사찰 외에 'OOO사'라는 사찰이 당시에 따로 존재하고 있었다고 인정할 만한 자료를 찾아볼 수 없으므로, 결국 '원고 사찰'이라는 등기명의인 표시와 '피고 1 사찰'라는 등기명의인 표시는 그 명칭에 소속 종단명을 표시하였느냐는 점에서 부분적으로 차이가 있을 뿐이다."
"이유","그렇다면 이 사건 표시변경등기는 등기명의인의 동일성을 해치지 않는 범위 내에서 행해진 것에 불과하여 소로써 그 말소를 구할 수는 없다고 할 것이므로, 원심이 같은 취지에서 그 표시변경등기의 말소를 구하는 원고의 청구 부분을 소의 이익이 없다는 이유로 각하한 조치는 수긍이 간다."
"이유","이 점에 관한 상고이유 및 상고이유서 제출기간 경과 후에 제출된 상고이유보충서 기재 중 상고이유를 보충하는 부분 또한 모두 받아들일 수 없다."
