"판결요지","폐쇄등기부에 기재되어 있는 등기는 현재의 등기로서의 효력이 없고 그 회복절차에 관해서 법률상 규정이 없으므로, 그 회복은 이를 구할 수 없다."
"판결요지","청구 목적물의 특정에 관한 특별한 사정을 찾아볼 수 없는 경우에는 구 지번과 지적의 표시만으로 청구의 목적물이 특정되었다고 할 수 있는지 불분명하다."
"이유","원심 판결이유에 의하면 원심은 그 거시의 증거에 의하여 합병전의 구 지번 및 지적인 광주시 내방동 164 대627평의 1945.8.9. 당시의 소유자인 길촌원차랑이 일본국인인 사실을 인정하고 있는 바이다."
"이유","기록을 정사하여 보아도 원심 변론종결시까지 피고 시가 이 건 토지를 적법절차에 의하여 원시취득하였다거나 취득시효가 완성되었다거나 하는 각 주장을 한 흔적을 찾아 볼 수 없으니 이를 전제로 하는 논지들은 받아들일 수 없다."
"이유","논지 제1점은 원심이 피고에게 이 건 토지에 관한 피고 명의의 근저당권설정청구권 보전을 위한 가등기의 말소등기절차이행을 명함에 있어서 이 건 토지가 특정되지 않았다는 것인 바이다."
"이유","이에 대한 판단은 위 각 공동피고들의 상고이유에 대한 판단에서 본 바와 같으므로 논지는 이유있고 논지 제2점은 피고 광주시의 이 건 토지에 대한 소유권 취득이 토지수용법에 의한 원시취득이라는 것인 바이다."
"이유","기록을 정사하여도 동 사실을 원심 변론종결시까지 주장한 흔적을 찾아볼 수 없으므로 이 점의 논지는 받아들일 바 못된다."
