"이유","피고 OOO이 위 형사고소가 제기된 이후에 위 부동산을 취득하였다는 사정만으로는 위 피고가 위와 같은 잔대금 미지급사정을 알면서 위 망인의 계약위반행위에 적극 가담하여 위 부동산을 취득하였다고 단정할 수 없고 당심증인 OOO의 증언만으로는 이를 인정하기에 부족하다."
"이유","달리 이를 인정할만한 증거가 없으므로 위 매매계약이 해제되었음을 이유로 하는 원고의 위 주장 또한 이유없다 할 것이다."
"이유","이에 대해 원고는 위 매매계약은 위 매매잔대금의 공탁이 있기 이전에 이미 적법히 해제되었으니 그 후에 이루어진 위 변제공탁은 무효라고 다투고 있다."
"이유","이 사건 제2부동산은 피고 OOO 명의로 임의로 소유권이전등기를 경료하여 버리자 1983.3.10. 위 망인을 상대로 강남경찰서에 형사고소를 제기하였다."
"이유","그 고소제기결과 위 망인은 1983.3.17.처음으로 경찰에 출두하여 피의자로서 신문을 받게 되었고 그로인해 원고의 위 고소사실을 알게 된 사실을 인정할 수 있는 바이다."
"이유","원심판결중 피고 OOO, 동 OOO, 동 OOO, 동 OOO에 대한 부분은 이와 결론을 달리하여 부당하므로 이를 취소하고 위 피고들에 대하여 위 각 의무의 이행을 명한다."
"이유","나머지 피고들에 대한 부분은 당원과 결론을 같이하여 정당하므로 원고의 나머지 피고들에 대한 각 항소를 기각하고 원고의 피고 OOO에 대한 당심에서의 추가된 청구를 기각한다."
