"이유","원래 피고 2 소유였던 별지 목록 기재 아파트에 관하여 2004. 12. 27. 전주지방법원 2004타경42154호로 임의경매개시결정이 있었다."
"이유","그에 따른 임의경매절차에서 2007. 1. 31. 소외 1이 이 사건 아파트를 낙찰 받아 그 명의로 소유권이전등기를 경료함과 동시에 OOO앞으로 채권최고액 1억 3,000만 원의 근저당권설정등기를 경료하였다."
"이유","이후 이 사건 아파트에 관하여 위 근저당권자인 OOO의 임의경매신청에 따라 2007. 10. 2. 같은 법원 2007타경20506호로 임의경매개시결정이 있었고, 원고는 2008. 9. 12. 그에 따른 경매절차에서 이 사건 아파트를 경락받아 경락대금을 완납하고 같은 날 그 소유권이전등기를 경료하였다."
"이유","피고 2는 2007. 2. 28.경 소외 1로부터 이 사건 아파트 중 (라)부분을 제외한 같은 도면 표시 (가), (나), (다), (마), (바) 부분 합계 126.47㎡를 임차하여 거주하고 있다."
"이유","원고가 이 사건 아파트에 관한 소유권을 취득한 날인 2008. 9. 12.부터 2010. 3. 11.까지 피고 1이 점유하고 있는 이 사건 아파트 중 (라) 부분에 관한 임료는 월 150,000원 상당이다."
"이유","피고 2가 위와 같이 점유·사용하고 있는 이 사건 아파트 중 (가), (나), (다), (마), (바) 부분에 관한 임료는 월 859,000원 상당이다."
"이유","원고는, 피고 1이 원고 소유인 이 사건 아파트 중 (라) 부분을 정당한 권원 없이 점유·사용하여 임료 상당의 부당이득을 취하였으므로, 원고에게 위 (라) 부분을 명도함과 아울러 위 (라) 부분의 점유·사용에 따른 부당이득을 반환할 의무가 있다."
"이유","피고 1이 2009. 5. 18.경 위 (라) 부분에서 이사를 한 이후부터는 부당이득 반환의무가 존재하지 않는다고 할지라도 불법점유를 통해 원고의 소유권 행사를 방해하고 있으므로, 이로 인한 손해를 배상할 의무가 있다고 주장한다."
"이유","피고 1은 위 (라) 부분을 점유할 수 있는 정당한 권원이 있다는 등의 특별한 사정이 없는 이상 이 사건 아파트의 소유자인 원고에게 위 점유 부분을 명도한다."
"이유","피고 1의 위 점유 부분에 대한 점유 개시일 이후로 원고가 이 사건 아파트에 관하여 소유권을 취득한 날인 2008. 9. 12.부터 피고 1이 위 (라) 부분에서 이사를 나간 2009. 5. 18.경까지 그 점유·사용으로 인한 임료 상당의 부당이득을 반환할 의무가 있다."
"이유","법률상 원인 없이 이득하였음을 이유로 한 부당이득반환청구에 있어서 이득이라 함은 실질적인 이익을 가리키는 것이므로 법률상 원인 없이 건물을 점유하고 있다 하여도 이를 본래의 용도대로 사용, 수익할 수 없었다면 본래의 용도에 따른 실질적인 이익을 얻은 것이라고 볼 수 없다고 할 것이다."
"이유","피고 1이 위 (라) 부분에서 이사를 간 2009. 5. 18. 이후부터는 피고 1이 위 (라) 부분을 본래의 용도대로 사용·수익하여 실질적인 이익을 얻었음을 인정할 만한 증거가 없으므로, 원고의 이 부분 청구는 이유 없다."
"이유","피고 1이 위 (라) 부분에서 이사를 간 2009. 5. 18. 이후부터 위 (라) 부분 명도 완료일까지 원고에게 불법점유로 인한 손해배상의무를 지게 되는지에 관하여 본다."
"이유","피고 1이 2009. 5. 18.경 위 (라) 부분에서 이사를 가면서 자기 소유의 옷장, 침대 등 가재도구을 위 (라) 부분에 남겨놓은 사실은 앞서 본 바와 같다."
"이유","피고 1에게 위 (라) 부분을 점유할 수 있는 정당한 권원이 있다는 등의 특별한 사정이 없는 이상 원고에게 위 2009. 5. 18. 이후부터 위 (라) 부분의 명도 완료일까지 이로 인한 원고의 손해를 배상할 의무가 있다."
"이유","주택임대차보호법상 대항력 있는 임차인으로서 이 사건 아파트를 낙찰받아 임대인의 지위를 승계한 원고로부터 임차보증금 3,300만 원을 반환받기 전에는 원고의 명도 청구에 응할 수 없다는 취지의 항변을 한다."
"이유","피고 1이 2006. 8. 16.경 이 사건 아파트로 전입신고 하고 이 사건 아파트에 거주하면서 이를 점유하고 있는 사실이 인정된다."
"이유","피고 1은 이 사건 아파트의 낙찰자인 소외 1과 2007. 1. 29. 임대차계약을 체결하였다고 주장하나, 소외 1은 당시 이 사건 아파트의 소유자가 아닌 최고가 매수신고인에 불과하였다."
"이유","이와 같은 불완전한 지위에 있는 사람과 임대차계약을 체결하고 계약 당일 그에게 계약금으로 무려 2,000만 원을 현금으로 지급하였다는 점은 일반 상식에 부합하지 않을 뿐만 아니라 그에 관한 뚜렷한 금융자료도 제출하지 못하고 있는 점이다."
"이유","③ 이에 대해 피고 1은 이 사건 2004년 경매절차에서 피고 2로부터 임차보증금 1,000만 원을 지급받고 이 사건 아파트에서 전출하였다가 2006. 8. 16. 다시 전입한 것이라고 주장하나,"
"이유","이 사건 아파트에 관한 2004년 경매절차 당시 이 사건 아파트의 소유자였던 피고 2의 인척인 소외 2, 3이 피고 2와의 허위의 임대차계약에 기하여 소액임차인으로서 배당요구를 하였다가 배당에서 제외된 사실이 있었던 점 등을 고려할 때 위 주장을 그대로 믿기 어렵다."
"이유","가사 위 주장이 사실이라고 하더라도 임차보증금을 반환받고 퇴거한 피고 1이 경매절차 진행 중인 이 사건 아파트에 다시 전입한 후 (라) 부분에 관하여 임대차보증금을 3,300만 원씩 지급하면서까지 임대차계약을 체결한 경위는 피고 1이 주장하는 가정불화 등의 사유만으로는 충분히 설명이 되지 않는 점이다."
"이유","피고 1은 소외 1과의 임대차계약 체결일로부터 3개월이 다 될 때까지 확정일자를 받지 않고 있다가 김제수협이 근저당권을 설정한 이후인 2007. 4. 12.경에야 확정일자를 받은 점이다."
"이유","위 인정사실만으로는 피고 1의 주장과 같이 소외 1과 사이에 실제 임대차계약 관계가 있었다고 인정하기에 부족하고, 달리 이를 인정할 증거가 없으므로, 결국 대항력 있는 임차인이라는 피고 1의 위 항변은 이유 없다."
"이유","그렇다면, 피고 1은 원고에 대하여 원고의 이 사건 아파트에 관한 소유권 취득일인 2008. 9. 12.부터 피고 1이 이 사건 아파트 중 (라) 부분에서 이사를 간 2009. 5. 18.경까지는 위 (라) 부분의 점유·사용으로 인한 부당이득을 반환할 의무가 있다."
"이유","그 이후부터 위 (라) 부분의 명도 완료일까지는 원고의 소유권 행사 방해에 따른 손해를 배상할 의무가 있다고 할 것이다."
"이유","피고 1이 이 사건 아파트 중 (라) 부분을 점유·사용함으로 인하여 취득하는 이득 및 원고가 입은 손해는 모두 위 점유부분의 임료 상당액이라고 할 것인 바이다."
"이유","2008. 9. 12.부터 2010. 3. 11.까지의 피고 1이 점유하고 있는 이 사건 아파트 중 (라) 부분에 관한 월 임료가 150,000원 상당임은 앞서 본 바와 같다."
"이유","피고 2는 원고에게 위 점유 부분을 명도하고, 그 점유·사용으로 인한 부당이득을 반환할 의무가 있다고 주장한다."
"이유","살피건대, 위 인정사실에 의하면, 피고 2는 이 사건 아파트 중 (가), (나), (다), (마), (바) 부분을 점유할 수 있는 정당한 권원이 있다는 등의 특별한 사정이 없는 이상 이 사건 아파트의 소유자인 원고에게 위 점유 부분을 명도하였다."
"이유","피고 2의 위 점유 부분에 대한 점유 개시일 이후로 원고가 이 사건 아파트에 관하여 소유권을 취득한 날인 2008. 9. 12.부터 위 점유 부분의 명도완료일까지 그 점유·사용으로 인한 임료 상당액을 부당이득으로 반환할 의무가 있다."
"이유","피고 2는 원고가 구하는 바에 따라 원고가 이 사건 아파트에 관하여 소유권을 취득할 날인 2008. 9. 12.부터 위 점유 부분의 명도완료일까지 그 점유로 인한 임료 상당액을 부당이득으로 반환할 의무가 있다."
"이유","위 공사로 인한 유익비를 상환받기 전까지는 이 사건 아파트를 유치할 권리가 있으므로 원고에게 이를 명도할 의무가 없다고 주장한다."
"이유"," 위 공사로 인하여 증가된 이 사건 아파트의 현존하는 객관적 가치는 13,001,901원 정도인 사실을 인정할 수 있다."
"이유","피고 2는 임대인인 소외 1에 대하여 이 사건 아파트의 리모델링 공사로 인한 유익비상환청구권 및 이에 기초한 유치권을 행사할 수 있다고 할 것인바, 경매목적 부동산이 경락된 경우 소멸된 선순위 저당권보다 뒤에 등기되었거나 대항력을 갖춘 임차권은 함께 소멸하는 것이다."
"이유","따라서 그 경락인은 주택임대차보호법 제3조에서 말하는 임차주택의 양수인 중에 포함된다고 할 수 없을 것이므로 경락인에 대하여 그 임차권의 효력을 주장할 수 없다."
"이유","임차인인 피고 2는 임대인인 소외 1로부터 위 유익비를 상환받을 때까지 이 사건 아파트의 경락인인 원고에 대하여 이 사건 아파트를 유치할 수 있는 권리는 있다고 할 것이므로, 피고 2의 위 항변은 이유 있다."
"이유","이에 대하여 원고는, 피고 2가 소외 1의 명의를 빌려 이 사건 아파트를 경락 받은 후 소외 1과 허위의 임대차 계약을 체결한 것이다."
"이유","갑 제4호증의 3, 갑 제4호증의 10, 갑 제4호증의 27, 갑 제4호증의 90, 을 제2호증의 4, 을 제18호증의 3의 각 기재만으로는 이를 인정하기에 부족하고, 달리 이를 인정할 만한 증거가 없으므로 원고의 위 주장은 이유 없다."
"이유","원고가 피고 2에 대하여 이 사건 아파트 중 (가), (나), (다), (마), (바) 부분의 점유·사용에 따른 임료 상당의 부당이득금 반환채권을 가지고 있고, 피고 2가 소외 1에 대하여 유익비상환청구권을 가지고 있음은 앞에서 본 바와 같다."
"이유","원고와 피고 2의 각 채권을 대등액에서 상계한다는 의사표시가 기재된 이 사건 2010. 7. 29.자 소변경신청서가 2010. 8. 4. 피고 2에게 송달된 사실은 기록상 명백하므로, 이로써 원고의 부당이득금 반환채권과 피고 2의 유익비상환청구권은 대등액의 범위 내에서 소멸한다고 할 것이다."
"이유","먼저, 피고 2가 원고에게 반환해야 할 부당이득의 액수에 관하여 보면, 통상의 경우 부동산의 점유·사용으로 인한 이득액은 그 부동산의 임료 상당액이라고 할 것이다."
"이유","이는 유치권에 기하여 점유·사용하고 있는 경우에도 마찬가지라고 할 것인바, 2008. 9. 12.부터 2010. 3. 11.까지의 피고 2가 점유·사용하고 있는 이 사건 아파트 중 (가), (나), (다), (마), (바) 부분의 월 임료가 859,000원 상당임은 앞서 본 바와 같다."
"이유","그 다음날부터 다 갚는 날까지는 소송촉진 등에 관한 특례법이 정한 연 20%의 각 비율에 의한 지연손해금과 2010. 7. 12.부터 위 (가), (나), (다), (마), (바) 부분의 명도완료일까지 월 859,000원의 비율에 의한 차임 상당의 부당이득금을 지급할 의무가 있다."
"이유","원고가 위 2010. 8. 4. 이전인 위 시점에 피고 2에 대하여 위 부당이득 반환채무의 이행을 청구하였음을 인정할 만한 증거가 없으므로, 원고의 이 부분 청구는 이유 없다."
"이유","유익비의 상환범위는 임차인이 유익비로 지출한 비용과 현존하는 증가액 중 임대인이 선택하는 바에 따라 정하여진다고 할 것이다."
"이유","피고 2가 이 사건 아파트의 리모델링 공사와 관련하여 지출한 공사비용은 36,109,670원이고, 위 리모델링 공사로 인하여 현존하는 이 사건 아파트의 객관적 가치 증가액은 13,001,901원인 사실은 앞서 본 바와 같다."
"이유","결국 피고 2가 상환을 청구할 수 있는 유익비 및 이 사건 상계의 수동채권은 13,001,901원이 된다고 할 것이고, 이는 원고의 위 부당이득금 반환 채권 중 2008. 9. 12.부터 2010. 7. 11.까지 사용이익인 18,898,000원과 대등액의 범위에서 소멸하였다고 할 것이다."
"이유","따라서, 피고 2의 유익비상환채권은 위와 같이 상계로 모두 소멸하여 그로 인한 유치권 또한 소멸하였으므로, 피고 2는 원고에게 이 사건 아파트 중 (가), (나), (다), (마), (바) 부분을 명도한다."
"이유","그 다음날부터 다 갚는 날까지는 연 20%의 각 비율에 의한 지연손해금과 2010. 7. 12.부터 위 (가), (나), (다), (마), (바) 부분의 명도완료일까지 월 859,000원의 비율에 의한 부당이득금을 반환할 의무가 있다고 할 것이다."
"이유","그렇다면, 원고의 피고 1에 대한 이 사건 아파트 중 (라) 부분의 명도청구는 이유 있어 이를 인용할 것인바, 제1심 판결은 이와 결론을 같이하여 정당하므로 피고 1의 항소는 이유 없어 이를 기각한다."
"이유","피고 1은 원고에게 위 인정범위 내에서 이 사건 아파트 중 (라) 부분의 점유로 인한 부당이득금 내지 손해배상금을 지급할 의무가 있다고 할 것이므로, 당심에서 부대항소에 의해 추가된 원고의 피고 1에 대한 부당이득반환 내지는 손해배상청구는 위 인정범위 내에서 이유 있어 이를 인용한다."
"이유","나머지 청구는 이유 없어 이를 기각하며, 피고 2는 원고에게 이 사건 아파트 중 (가), (나), (다), (마), (바) 부분을 명도할 의무가 있으므로 원고의 피고 2에 대한 명도청구는 이유 있어 이를 인용할 것인 바이다."
"이유","이와 결론을 달리하여 원고의 피고 2에 대한 명도청구를 배척한 제1심 판결은 부당하므로, 이를 취소하고 그 명도의무의 이행을 명하기로 한다."
"이유","당심에서 추가된 원고의 피고 2에 대한 부당이득반환청구는 위 인정범위 내에서 이유 있어 이를 인용하고, 나머지 청구는 이유 없어 이를 기각하기로 하여, 주문과 같이 판결한다."
