"이유","자경농지에 대한 양도소득세 면제에 관한 규정인 조세감면규제법 제55조 제1항의 위임에 따라 면제대상 농지를 규정하고 있는 구 조세감면규제법시행령 제54조 제1항은 면제대상 농지는 취득한 때로부터 양도할 때까지의 사이에 8년 이상 자기가 경작한 사실이 있는 농지이어야 한다."
"이유","다만 상속받은 농지에 대한 경작기간의 계산은 피상속인이 취득하여 경작한 때로부터 기산한다고 규정하고 있으므로 양도소득세가 면제되는 자경농지의 경작기간을 계산함에 있어서 상속의 경우를 제외하고는 양도인이 당해 토지를 취득한 이후의 경작기간만을 계산하는 것이다."
"이유","원고가 이 사건 토지를 취득한 때로부터 양도할 때까지의 기간이 8년에 미달함이 분명한 이상 이 사건 토지는 위 규정에 의한 양도소득세 면제대상에 해당하지 아니한다 할 것이다."
"이유","그리고 원심의 위와 같은 판단이 정당한 이상, 상고이유에서 지적한 바와 같이 원심이 다른 판단 부분에 잘못을 저질렀다고 하더라도 이는 부가적인 설시에 불과하여 판결 결과에 아무런 영향이 없다."
"이유","위 법 규정이 헌법상의 조세법률주의 및 포괄위임금지의 원칙에 위반된다고 볼 수 없다는 것이 대법원의 견해이다."
"이유","원심판결 이유를 기록에 비추어 살펴보면, 원고 주장의 서면을 과세표준확정신고서에 해당하는 것으로 볼 수 없다고 한 원심의 판단은 정당하다."
"이유","거기에 상고이유에서 지적한 바와 같은 심리미진 등의 잘못이 있다고 할 수 없다. 이 점을 지적하는 상고이유도 받아들일 수 없다."
"이유","그럼에도 불구하고 원심이, 가산세가 포함된 이 사건 부과처분 전체세액과 실지거래가액에 의한 양도차익을 비교하여 그 양도차익을 넘는 세액을 전부 취소한 것은 양도소득세액 산정에 관한 법리를 오해한 나머지 판결 결과에 영향을 미친 위법을 저지른 것이라고 하지 않을 수 없다."
"이유","이 부분 사건을 다시 심리·판단케 하기 위하여 원심법원에 환송하고, 원고의 상고를 기각하기로 관여 법관의 의견이 일치되어 주문과 같이 판결한다."
