"판결요지"," 주택임대차보호법 제7조의 규정은 임대차계약의 존속중 당사자 일방이 약정한 차임 등의 증감을 청구한 때에 한하여 적용되고, 임대차계약이 종료된 후 재계약을 하거나 또는 임대차계약 종료 전이라도 당사자의 합의로 차임 등이 증액된 경우에는 적용되지 않는다. "
"이유","주택임대차보호법 제7조는 약정한 차임 또는 보증금이 그 후의 사정변경으로 인하여 상당하지 아니하게 된 때에는 당사자는 장래에 대하여 그 증감을 청구할 수 있다."
"이유","증액의 경우에는 대통령령이 정하는 기준에 따른 비율을 초과하지 못한다고 규정하고 있으므로, 위 규정은 임대차계약의 존속중 당사자 일방이 약정한 차임등의 증감을 청구한 때에 한하여 적용된다."
"이유","임대차계약이 종료된 후 재계약을 하거나 또는 임대차계약 종료 전이라도 당사자의 합의로 차임 등이 증액된 경우에는 적용되지 않는 것이다."
"이유","원심의 설시에는 다소 미흡한 점이 있으나, 원심이 같은 취지에서 이 사건 차임의 증액은 매년 원고와 피고들이 임대차계약 종료 후 다시 임대차계약을 체결하면서 합의에 의하여 증액한 경우로 보아 위 규정의 적용을 배제한다."
"이유","피고들이 지급한 연차임 중 위 규정을 초과하여 증액, 지급된 부분의 반환과 동시이행을 구하는 피고들의 항변을 배척한 것은 옳고, 거기에 어떠한 위법이 있다고 할 수 없다."
"이유","또한 원심은 피고들의 부속물매수청구권 및 유익비상환청구권이 있다는 주장에 대하여 판시와 같은 이유에서 이를 모두 배척하였는바, 기록에 비추어 보면 원심의 위와 같은 사실인정과 판단은 수긍할 수 있다."
