"이유","가. 공동주택의 소유자 또는 점유자가 인접 토지에서 발생하는 소음 등으로 인하여 토지사용에 방해를 받거나 생활에 고통을 받고 있다."
"이유","이미 운영 중이거나 운영이 예정된 고속국도에 근접하여 거주를 시작한 경우의 참을 한도 초과 여부는 더 엄격한 기준에 의하여 판단하여야 할 것이다."
"이유","나아가 도로소음으로 인한 생활방해를 원인으로 소음의 예방 또는 배제를 구하는 방지청구와 금전배상을 구하는 손해배상청구는 서로 근거와 요건을 달리하는 것이어서 같은 사정이라도 청구의 내용에 따라 고려요소의 중요도에 차이가 있을 수 있다."
"이유","방지청구의 당부를 판단하는 법원으로서는 해당 청구가 인용될 경우에 방지청구를 구하는 당사자가 받게 될 이익과 상대방 및 제3자가 받게 될 불이익 등을 비교·교량하여야 한다."
"이유","나. 원심은 이 사건 도로소음으로 인한 생활방해를 원인으로 한 원고들의 손해배상청구에 대해, 구 환경정책기본법 제10조 제2항, 같은 법 시행령제2조가 정한 도로변 일반주거지역의 환경기준은 소음·진동공정시험방법에 의하여 측정한 실외소음도로 주간 65dB이다."
"이유","구 소음·진동규제법 제27조, 제26조, 같은 법 시행규칙제27조가 정한 소음·진동규제지역인 주거지역의 교통소음의 한도는 주간 실외소음도 68dB, 야간 실외소음도 58dB인 점이다."
"이유","그리고 원고들의 소음방지설비 시공청구에 대해서는, 위와 같은 사정들에 이 사건 도로소음으로 인한 피해가 생활방해에 그침에 반하여 이 사건 도로는 주요 공공시설의 일부인 점이다."
"이유","이 사건 도로에 소음방지설비를 시공할 경우 공사기간 동안 이용자에게 큰 불편을 초래할 것이고 설치에 소요될 것으로 예상되는 비용도 다액인 점이다."
"이유","일부 원고들에게는 각자의 주소를 기준으로 이 사건 도로로부터 발생하는 소음이 65dB이상 유입되지 않도록 조치를 할 의무가 있다고 판단하였다."
"이유","(1) 원심판결 이유 및 원심이 적법하게 채택한 증거들에 의하면, ① 도시화·산업화 및 이로 인한 주거의 과밀화로 인하여 도시에 거주하는 대부분의 거주자는 어느 정도의 소음이 존재하는 상황에서 특정 장소에 거주를 시작하게 된다."
"이유","이 사건 도로는 1992. 6. 18. 도로구역지정결정고시를 거쳐 1994. 6. 30.경 착공되어 1998. 7. 27.경 완공되었다."
"이유","원고들은 이 사건 아파트에 거주를 시작할 당시 이 사건 도로로 인한 일정한 정도의 도로소음의 발생과 증가를 알았거나 알 수 있었을 것으로 보이는 점이다."
"이유","이 사건 아파트의 대부분 동(棟)이 소음피해 감소를 위해 이 사건 도로와 수직 방향으로 배치되어 있다."
"이유","이 사건 아파트의 7층 이상 세대에 거주하는 원고들에 대하여 위 실외소음도를 원고들이 일상생활을 주로 영위하는 지점의 소음도로 보기 어려운 점이다."
"이유","이 사건 도로는 서울외곽순환고속도로의 일부로서 급증하는 수도권 지역의 교통난 해소 및 신도시 건설에 따른 교통수요에 대처하기 위하여 건설된 주요 공공시설이다."
"이유","그 건설목적에는 이 사건 아파트가 속한 부천상동택지개발지구의 교통문제의 해소도 포함되었던 것으로 보이는 점 등을 알 수 있다."
"이유","이와 같은 사정들을 앞서 본 법리에 비추어 보면, 이 사건 손해배상청구에 있어서 원심이 판시한 바와 같은 사정만으로 주간 실외소음도 65dB 또는 야간 실외소음도 55dB 이상의 소음이 있다고 하여 바로 참을 한도를 넘는 생활방해가 되어 불법행위가 성립한다고 단정하기는 어렵다고 할 것이다."
"이유","그로 인하여 원고들의 청구가 원고들과 피고 한국도로공사 그리고 이 사건 도로의 이용자들에게 미칠 이익·불이익에 대한 비교·교량을 행하지 아니하였다."
"이유","이를 위해서는 7년이 넘는 기간 동안 이 사건 도로 중 8.5km 구간의 도로 절반을 차단해야 하므로 이 사건 도로는 공사기간 동안 고속국도로서의 기능을 거의 상실할 것으로 보인다."
"이유","② 원심판단의 기준에 의할 경우, 피고 한국도로공사는 방음벽 설치로는 방음효과를 기대하기 어려운 중층 또는 고층 공동주택이 인접한, 환경정책기본법상 주간 환경기준을 만족시키지 못하는 모든 고속국도에 밀폐형 방음터널을 시공할 의무를 부담하게 될 것으로 보이는 점이다."
"이유","원심판단의 기준에 의할 경우 설령 피고 한국도로공사가 원심이 명한 의무를 이행하더라도 일부 원고들에 대하여는 도로소음으로 인한 손해배상책임을 계속 부담할 수밖에 없게 되는 점 등을 알 수 있다. "
"이유"," 이러한 사정들을 앞서 본 법리에 비추어 보면, 이 사건 방지청구에 있어서도 원심판시와 같은 사정만으로 주간 또는 야간 실외소음도 65dB 이상의 소음이 있다고 하여 바로 소음방지설비 시공의무가 발생한다고 단정하기는 어렵다고 할 것이다."
"이유","라. 이와 같이 원심은 피고 한국도로공사가 원고들에 대하여 손해배상책임 또는 소음방지설비 시공의무를 부담하는지를 판단함에 있어서, 원고들의 일상생활이 실제 주로 이루어지는 지점의 소음도를 측정하지 아니하였다."
"이유","이러한 원심의 판단에는 도로소음으로 말미암은 생활방해에서 참을 한도 및 손해배상책임과 소음방지설비 시공의무 등에 관한 법리를 오해하여 필요한 심리를 다하지 않음으로써 판결 결과에 영향을 미친 잘못이 있다."
"이유","방지청구에 있어서는 주간 또는 야간 실외소음도 65dB 이상인 원고들에게 그 이상의 소음이 유입되지 않도록 할 의무가 있다고 판단하였다."
"이유","구 주택건설촉진법 제31조 제1항은 “사업주체가 건설·공급하는 주택의 건설기준, 부대시설·복리시설의 설치기준, 주택의 규모 및 규모별 건설비율과 대지조성기준은 대통령령으로 정한다.”, 제2항은 “사업주체는 제1항에 의한 주택건설기준 등에 따라 주택건설사업 또는 대지조성사업을 시행하여야 한다.”고 규정한다."
"이유","구 주택건설기준 제1조, 제3조도 주택건설사업계획의 승인대상인 주택, 부대시설 및 복리시설의 설치기준과 대지조성사업계획의 승인대상인 대지의 조성기준을 구별하고 있는 점이다."
"이유","이는 구 주택건설기준 제9조 제1항이 주택건설사업자에 대한 의무를 규정한 조항임을 당연한 전제로 주택건설사업자가 도로에 근접해서도 공동주택을 건설할 수 있게 해주기 위한 것으로 보이는 점이다."
"이유","그중 장래 대지 지상에 건설될 건물 또는 그 거주자에 관한 의무는 포함되어 있지 않은 점 등을 종합하면, 구 주택건설기준 제9조 제1항은 주택건설사업자를 적용대상으로 한 규정으로서 특별한 사정이 없는 한 대지조성사업자에게는 적용되지 않는다고 봄이 타당하다."
"이유","이 부분 사건을 다시 심리·판단하도록 원심법원에 환송하기로 하여, 관여 대법관의 일치된 의견으로 주문과 같이 판결한다."
