"이유","근로기준법상 근로자에 해당하는지는 계약의 형식보다 근로제공 관계의 실질이 근로자가 사업 또는 사업장에 임금을 목적으로 종속적인 관계에서 사용자에게 근로를 제공하였는지에 따라 판단하여야 한다."
"이유","원심은 다음과 같은 사정을 들어 원고는 임금을 목적으로 종속적인 관계에서 피고에게 근로를 제공한 근로자라고 판단하였다."
"이유","보험회사인 피고는 원고를 위임직 지점장으로 위촉하는 계약을 체결하였고, 지점 운영 관련 업무의 기본적인 지침서로 활용하도록 원고에게 ‘지점 운영 매뉴얼’을 교부하였다."
"이유","원고는 위촉계약에 따른 의무를 이행하면서 정규직 지점장과 같이 ‘지점 운영 매뉴얼’을 준수하는 등으로 피고가 정한 업무를 수행하였던 것으로 보인다."
"이유","달리 원고가 피고의 근로자인 지점장의 업무와 비교하여 지점의 운영에 관한 독립적인 결정권이나 재량권을 가지고 독자적인 방법으로 업무를 수행하였다고 볼 만한 사정은 없다."
"이유","위촉계약 등에 수수료 지급, 근무지 등 취업규칙에 갈음할 만한 사항들을 다수 포함하면서 포괄적인 해지 또는 해촉 규정을 두고 있다."
"이유","원고는 피고가 일방적으로 제·개정하는 규정, 지침에 따를 의무를 부담하는 등 피고는 각종 규정과 지침 등을 통하여 원고의 업무 수행을 지휘·감독할 수 있었다."
"이유","피고가 제공한 ‘지점 운영 매뉴얼’, ‘조회 운영 매뉴얼’에는 시간대별로 지점 운영 일정이 기재되어 있었고, 정시 출근을 강조하고 있었던 점이다."
"이유","원고는 ‘지점 운영 기준’이 정한 원칙에 따라 피고의 사업단과 같은 건물이 있는 ○○○지점 사무실에 출근하였다."
"이유","피고는 원고의 ○○○지점에 피고 소속 직원을 배치하여 위 직원으로부터 지점장이나 지점 소속 보험설계사의 출근보고를 받았던 점 등에 비추어 보면, 원고는 재량에 따라 근무시간과 근무장소를 정하는 자유로운 상태에 있었다고 보이지 않는다."
"이유","오히려 피고의 근로자인 지점장과 마찬가지로 ‘지점 운영 매뉴얼’, ‘지점 운영 기준’ 등에서 피고가 정한 근무시간과 근무장소에 맞추어 업무를 수행할 수밖에 없었을 것으로 보인다."
"이유","피고는 원고에게 지점 운영에 필요한 사무실은 물론 컴퓨터 등 전산기기와 비품을 제공하고, 보험설계사 교육에 이용되는 교육장 등도 제공한 점이다."
"이유","피고가 피고 소속 직원을 원고의 ○○○지점에 배치하여 보험 관련 청약서를 전산에 입력하거나 보험료를 출금하고 청약서를 본사에 송부하는 등의 업무를 수행하도록 한 점이다."
"이유","나아가 피고가 원고에게 지점 운영비 등의 명목으로 법인카드를 제공하면서 피고가 정한 기준과 용도에 따라 사용하도록 한 점 등에 비추어 보면, 원고가 스스로 비품·원자재나 작업도구 등을 소유하거나 제3자를 고용하여 업무를 대행하게 하는 등 독립하여 원고의 계산으로 사업을 영위하였다고 보기 어렵다."
"이유","앞서 본 바와 같이 피고가 원고에게 사무실 및 비품, 운영비 등을 제공하는 점 등에 비추어 지점의 운영에 따른 손실의 위험을 원고 스스로 부담한다고 보기도 어렵다."
"이유","1개의 조직유공을 부여받은 지점장은 10년간 수수료 지급 시 500만 원을 보장하는 우대를 받는다.’고 기재되어 있으므로, 위 보장에 따른 수수료를 고정급으로 볼 여지도 있다."
"이유","원고는 1년 단위로 위촉계약을 갱신하여 오면서 피고의 위임직 지점장으로 약 3년 9개월 남짓 계속 근무하였으므로 근로 제공의 계속성을 인정할 수 있다."
"이유","위촉계약의 내용 등에 비추어 볼 때 원고가 독립적으로 자유롭게 다른 업무를 수행할 수 있었다고 볼 수 없을 뿐만 아니라, 달리 겸업 등의 사정을 인정할 만한 정황도 없다."
"이유","원심판결 이유를 앞서 본 법리에 비추어 살펴보면, 원심의 위와 같은 판단에 상고이유 주장과 같이 근로기준법상 근로자에 관한 법리를 오해하거나 이유가 모순되는 등의 잘못이 없다."
