"판결요지","그와 같은 자료들이 충분히 증명되지 아니하거나 오히려 반대되는 사실의 자료가 많을 때에는 이를 인정하여서는 안된다."
"판결요지","임야에 공동 선조의 분묘가 있다거나 위토 또는 종산이라는 사실만으로는 이를 종중 소유로 볼 수 없다."
"이유","그와 같은 자료들이 충분히 증명되지 아니하거나 오히려 반대되는 사실의 자료가 많을 때에는 이를 인정하여서는 아니되며, 계쟁 임야에 공동 선조의 분묘가 있다거나 위토 또는 종산이라는 사실만으로는 이를 종중 소유로 볼 수 없다고 할 것이다."
"이유","관계 증거를 기록에 의하여 살펴보면 위와 같은 원심의 사실인정 및 판단은 정당한 것으로 수긍이 간다."
"이유","거기에 상고이유로서 지적하는 바와 같이 종중재산의 소유관계에 관한 법리를 오해하거나 심리를 제대로 하지 아니하고, 채증법칙을 어겨 사실을 오인함으로써 판결에 영향을 미친 위법이 있다고 할 수 없다. 논지는 모두 이유 없다."
"이유","그러므로 상고를 기각하고 상고비용은 패소자의 부담으로 하기로 하여 관여 법관의 일치된 의견으로 주문과 같이 판결한다."
