"판시사항","등기부상 소유자로 되어 있는 상태에서는 주민등록이 주택임대차보호법 제3조 제1항 소정의 대항력 인정의 요건이 되는 적법한 공시방법으로서의 효력이 없다고 본 사례"
"판시사항","후순위 저당권의 실행으로 주택이 경락된 경우, 선순위 저당권과 후순위 저당권 사이에 대항력을 갖춘 임차인이 경락인에 대하여 그 임차권의 효력을 주장할 수 있는지 여부"
"이유","소외 1 앞으로 소유권이전등기가 경료됨으로써 등기부상의 소유자와 임차인이 실제로 달라지게 된 1994. 3. 9.에야 비로소 피고가 위 법 소정의 임차인으로서의 대항력을 취득한 것으로 보아야 할 것이다."
"이유","주민등록에 의하여 표상되는 점유관계가 임차권을 매개로 하는 점유임을 제3자가 인식할 수 있는 정도는 되어야 한다 할 것이다."
"이유","거기에 상고이유에서 지적하는 바와 같이 주택임대차보호법 제3조 제2항 소정의 양수인의 범위 내지 대항력 있는 임차권의 취득시기에 관한 법리를 오해한 위법이 없다."
"이유","거기에 상고이유에서 지적하는 바와 같은 대항력을 갖춘 임차인의 경락인에 대한 대항력의 유무 내지 그 우열에 대한 법리를 오해한 위법이 있다고 할 수 없다."
"이유","그러므로 상고를 기각하고, 상고비용은 상고인인 피고의 부담으로 하기로 관여 법관의 의견이 일치되어 주문과 같이 판결한다."
