"판결요지","구 주택건설촉진법 제32조는 사업주체와 주택을 공급받고자 하는 자는 건설교통부령이 정하는 주택의 공급조건·방법 및 절차 등에 따라 주택을 건설·공급하거나 주택을 공급받아야 한다고 규정하고 있다."
"이유","원심이 이와 같은 취지로 판단한 것은 정당하고, 거기에 상고이유에서 주장하는 바와 같은 위 규칙 제26조 제4항에 대한 법리오해의 위법이 없다."
"이유","위 규칙에 의하면, 사업주체가 입주자를 모집하고자 할 때에는 시장 또는 군수로부터 착공확인 또는 공정확인을 받은 다음, 입주자모집공고안에 대한 승인신청을 받도록 되어 있고, 입주자모집공고에는 분양가격 및 임대보증금, 임대료와 청약금, 계약금, 중도금 등의 납입시기 및 납부방법, 입주예정일을 정하도록 규정되어 있다."
"이유","위 규칙의 관련 규정과 기록을 함께 검토하여 보면, 원·피고 사이에 체결된 이 사건 분양계약상의 중도금 납입시기와 연체료의 산정 및 납부방법에 대한 약정은 위 규칙에 따른 것으로 정당하다 할 것이다."
"이유","피고가 분양계약 이후 건축공정을 지체하여 중도금의 절반이 넘는 제4차 중도금 지급시기에 분양아파트 옥상층의 철근배치를 완료하지 못하였다는 사정만으로 위 약정이 불공정하여 무효로 된다고는 볼 수 없다."
"이유","원심이 같은 취지에서 이 사건 분양계약상의 중도금 납입시기와 연체료 산정 및 납입방법에 대한 약정이 위 규칙에 위반되어 약관의규제에관한법률 소정의 고객에게 불리한 조항으로서 무효라는 원고의 주장을 배척한 조치는 정당하고, 거기에 상고이유로 내세우는 바와 같은 위법이 없다."
"이유","그러므로 상고를 기각하고 상고비용은 패소자의 부담으로 하기로 하여 관여 대법관의 일치된 의견으로 주문과 같이 판결한다."
