"판시사항","연고항존자가 종중규약 제정이나 대표자 선임에 관한 종중총회가 개최된 바 없다고 다투고 있는데도 적법한 대표권 유무를 심리하지 아니하였다는 이유로 원심판결을 파기한 사례."
"이유","위 일시경 총회를 소집한 일이 없었으며, 위 갑 제6호증 및 갑 제7호증의 기재 자체에 의하더라도 한 사람이 동시에 작성한 것으로 보이므로, 위 각 문서는 이 사건 소를 위하여 사후에 조작된 것임이 명백하다고 주장하였다."
"이유","그러나 원심은 피고의 위 진술 및 원고의 단순한 부인답변만을 듣고서 더 이상의 심리 없이 그 날로 변론을 종결한 다음 이 점에 관하여 아무런 판단을 한 바 없는 제1심판결의 이유를 원용하여 피고의 항소를 기각한 사실을 알 수 있다."
"이유","종중은 공동선조의 후손 중 성년 이상의 남자를 종원으로 하여 구성되는 종족의 자연발생적 집단이므로, 그 성립을 위하여 특별한 조직행위를 필요로 하는 것이 아니고, 다만 그 목적인 공동선조의 분묘수호, 제사봉행, 종원 상호간의 친목을 규율하기 위하여 규약을 정하는 경우가 있다."
"이유","또 대외적인 행위를 할 때는 대표자를 정할 필요가 있는 것에 지나지 아니하며, 반드시 특별한 명칭의 사용 및 서면화된 중중규약이 있어야 하거나 종중의 대표자가 선임되어 있는 등 조직을 갖추어야 성립하는 것은 아니라 할 것이다."
"이유","기록상 달리 피고가 원고 종중의 실체 자체를 다툰 흔적이 없으므로, 원심이 원고 종중의 실체가 존재하는지의 여부에 관하여 따로 판단하지 아니하였다 하여 거기에 논지가 지적하는 위법사유가 있다고 할 수는 없다."
"이유","그러나 피고의 위 주장내용은 적법한 종중규약의 제정이나 대표자 선임에 관한 적법한 결의 없이 종원의 일부가 원고 종중의 명의로 이 사건 소를 제기하는 데 사용하기 위하여 문서를 위조하였다는 것이므로,결국 종중 대표자의 자격을 다투는 취지라 할 것이다."
"이유","따라서 원심으로서는 본안에 앞서 피고의 이러한 항변의 당부를 판단하였어야 할 것임에도 이점에 관하여 아무런 판단을 하지 아니함으로써 당사자의 주장에 관한 판단을 유탈한 위법을 범한 것이라 아니할 수 없다."
"이유","한편 당원은 종중이 당사자인 사건에 있어 그 종중의 대표자에게 적법한 대표권이 있는지의 여부는 소송요건에 관한 것으로서 법원의 직권조사사항이다."
"이유","그러므로 나머지 상고이유에 대한 판단을 생략한 채 원심판결을 파기하고 이 사건을 원심법원에 환송하기로 관여 법관의 의견이 일치되어 주문과 같이 판결한다."
