"판시사항","교통사고 피해자가 자동차 수리에 필요한 일정한 기간 동안 동종·동급의 다른 자동차를 대차한 비용을 가해자나 보험사업자에게 손해배상금이나 보험금으로 청구하는 경우, 그 청구를 인용하기 위한 요건 및 그에 관한 증명책임의 소재"
"이유","그리고 확인의 소의 피고는 원고의 권리 또는 법률관계를 다툼으로써 원고의 법률적 지위에 불안을 초래할 염려가 있는 자, 다시 말하면 원고의 보호법익과 대립 저촉되는 이익을 주장하고 있는 자이어야 하고 그와 같은 피고를 상대로 하여야 확인의 이익이 있게 된다."
"이유","2010. 12. 27.부터 2011. 1. 8.까지 12일 동안 피고 회사로부터 OOO를 기준으로 산정한 대차요금인 1일당 154,000원으로  OOO 자동차를 대차하여 사용한 후, 2011. 1. 11. 피고 회사에게 12일간의 대차요금으로 합계 1,848,000원을 지급한 사실을 알 수 있다."
"이유","피고 2로부터 보험금청구권을 양도받아 원고에 대하여 그 대차요금의 전부 또는 일부를 보험금으로 청구할 위험성이 있다는 등의 특별한 사정이 없는 한, 이 사건 교통사고로 인한 대차요금과 관련하여 원고의 보호법익과 대립 저촉되는 이익을 주장하고 있는 자에 해당한다고 보기 어렵다."
"이유","그럼에도 원심은 이와 달리 그 판시와 같은 사정을 들어 원고가 피고 회사를 상대로 위와 같은 채무부존재확인을 구할 이익이 있다고 본 후 본안으로 나아가 판단한 끝에 그 청구를 기각하였다."
"이유","이 부분의 원심판결에는 소의 이익에 관한 법리를 오해하여 판결에 영향을 미친 위법이 있으므로, 이를 그대로 유지할 수 없다."
"이유","이에 따라 원고는 피고 회사를 상대로 이 사건 교통사고로 인한 원고의 대차요금 관련 보험금 지급채무가 872,240원을 초과하여서는 존재하지 아니한다는 확인을 구할 이익이 없다."
"이유","그리고 대차의 필요성과 대차비용 액수의 상당성에 관하여 당사자 사이에 다툼이 있다면 그에 대한 주장·증명책임은 자동차를 대차한 피해자에게 있다."
"이유","별도의 조건 없이 대형 3사가 관할 관청에 신고한 대차요금에서 30% 내지 40% 할인된 요금으로 자동차를 대차할 수 있었던 사실, 그리고 대형 3사의 인터넷회원으로 가입하기 위해서는 신상정보를 입력하는 것 이외에 특별한 요건이나 절차를 필요로 하지 아니하였다."
"이유","피고 2가 피해차량과 동종·동급의 자동차를 대차하기 위하여 쉽게 이용할 수 있었던 저렴한 대차요금들로서 상당한 대차비용에 해당한다고 볼 수 있다."
"이유","그러므로 원고가 대형 3사의 OOO 자동차에 대한 1일 평균 인터넷 할인요금 72,687원을 기준으로 산정한 12일간의 대차요금 합계 872,240원이 상당한 대차비용에 해당한다고 자인하고 있는 이 사건에서, 위 872,240원을 적정한 손해배상의 범위에 해당한다고 본 원심의 판단은 그 결론에 있어 수긍할 수 있다."
"이유","거기에 상고이유로 주장하는 사고와 상당인과관계 있는 대차비용에 관한 법리 등을 오해하여 판결에 영향을 미친 위법이 없다."
"이유","위 파기 부분에 관한 제1심판결을 취소하여 원고의 이 부분에 관한 소를 각하하며, ② 피고 2의 상고를 기각하기로 하되, 원고와 피고 회사 사이의 소송총비용은 원고의 부담으로 한다."
"이유","원고와 피고 2 사이의 상고비용은 피고 2의 부담으로 하기로 하여 관여 대법관의 일치된 의견으로 주문과 같이 판결한다."
"이유","확인의 소에 있어서는 권리보호요건으로서 확인의 이익이 있어야 하고 그 확인의 이익은 원고의 권리 또는 법률상의 지위에 현존하는 불안, 위험이 있고 그 불안, 위험을 제거함에는 피고를 상대로 확인판결을 받는 것이 가장 유효적절한 수단일 때에만 인정된다."
