"판시사항","근로자에 대하여 산업재해보상보험법에 의한 치료종결이 있은 후 근로자가 같은 업무상 재해로 인한 상해로 국민건강보험법에 의하여 치료를 받은 경우, 사용자가 국민건강관리공단에게 건강보험급여를 부당이득으로 반환하여야 하는지 여부"
"이유","피고의 종업원인 OOO은 1991. 12. 2. 23:00경 대구 동구 신천3동에 있는 피고 사업장 2층 난간에서 연탄재를 버리다 실족하여 바닥으로 떨어져 늑골 및 흉추골 골절 등의 상해를 입었다."
"이유","OOO의 위 상해는 업무상 재해에 해당됨에 따라 OOO은 당시 피고가 가입한 산업재해보상보험에 따라 치료 및 요양을 받아 왔는데, 근로복지공단은 1998. 6. 30. OOO에 대하여 계속 치료를 하더라도 의학적인 효과를 기대할 수 없다."
"이유","그런데 OOO은 1998. 7. 1.부터 지역의료보험 피보험자 자격을 취득하여 건강보험으로 2001. 5. 2.까지 원고의 지정요양기관인 OOOO병원, OO의원, O약국 등에서 위 상해에 대한 치료를 받았다."
"이유","이에 대하여 원고는 OOO에 대한 치료비로 1998. 11. 16. 1,280,280원을, 1999. 3. 26. 2,678,080원을, 2000. 1. 4. 1,390,750원을, 2000. 12. 9. 424,510원을, 2001. 9. 7. 463,250원을 위 지정요양기관에게 각 지급하였다."
"이유","그 후 OOO이 근로복지공단에 대하여 재요양 신청을 함에 따라 근로복지공단은 2001. 6. 8. OOO에 대하여 요양기간을 2001. 5. 12.부터 현재까지로 하여 재요양 승인을 하였다."
"이유","근로기준법 제81조 제1항은 근로자가 업무상 재해 또는 질병에 걸린 경우에는 사용자는 그 비용으로 필요한 요양을 행하거나 필요한 요양비를 부담하여야 한다고 규정한다."
"이유","국민건강보험법 제48조 제1항 제4호는 업무상 또는 공무상 질병 부상 재해로 인하여 다른 법령에 의한 보험급여나 보상 또는 보상을 받게 되는 때에는 보험급여를 하지 아니한다고 규정하고 있다."
"이유","한편 산업재해보상보험법 제48조 제1항은 수급권자가 이 법에 의하여 보험급여를 받았거나 받을 수 있는 경우에는 보험가입자는 동일한 사유에 대하여 근로기준법에 의한 재해보상책임이 면제된다라고 규정하고 있다."
"이유","원고는 OOO의 위 상해가 업무상 재해로 인한 부상이어서  국민건강보험법 제48조 제1항 제4호에 의하여 위 기간동안 OOO에 대한 치료비 부분에 대하여 보험급여를 하지 않아도 됨에도 불구하고 위 보험급여를 지급함으로써 위 보험급여에 해당하는 손해를 입었다고 할 것이다."
"이유","OOO에 대하여 요양보상책임이 있는 피고는 원고가 위 보험급여를 함으로써 그 한도 내에서 법률상 원인 없이 그 책임을 면하는 이득을 얻었다고 할 것이므로 피고는 원고에게 위 보험급여에 해당하는 금원을 부당이득으로 반환하여야 할 것이다."
"이유","원고의 이 사건 청구는 OOO의 피고에 대한 재해보상청구권을 대위 행사하는 것이 아니라 업무상 재해로 인한 OOO의 위 상해에 대하여 보험급여를 하지 않아도 됨에도 불구하고 보험급여를 함으로써 피고가 법률상 원인 없이 얻은 이득에 대하여 민법 제741조에 의하여 부당이득의 반환을 구하는 것이다."
"이유","민법상 부당이득반환청구권의 소멸시효기간은 10년이므로 위 보험급여 지급일로부터 이 사건 소제기시까지 10년이 경과하지 않았음은 기록상 명백하므로 피고의 이 주장은 이유 없다."
"이유","제41조에서는 가입자의 부상 등의 경우에 치료 등의 요양급여를 실시하도록 하되, 일정 부분을 본인 부담으로 하도록 하고 있으며, 같은 법 제43조에서는 요양기관의 건강보험심사평가원에 대한 심사청구에 따른 위 평가원의 심사결과에 따라 원고가 지체 없이 요양기관에 건강보험금을 지급하도록 되어 있는 바이다."
"이유","같은 법 제48조 제1항 제4호에 따라 업무상 재해로 인한 부상으로 건강보험급여가 제한되는 부상에 대하여 원고가 보험급여를 하였다고 하더라도 원고로서는 보험급여의무가 없음을 알면서도 보험급여를 하였다고 볼 수는 없을 것이다."
"이유","원심판결은 이와 결론을 일부 달리하여 부당하므로 원심판결 중 위에서 인정한 부분을 초과하여 피고에게 지급을 명한 피고 패소 부분을 취소한다."
"이유","그 취소 부분에 해당하는 원고의 청구를 기각하며, 피고의 나머지 항소는 이유 없어 이를 기각하기로 하여 주문과 같이 판결한다."
