"판시사항","1동의 건물에 대하여 구분소유가 성립하기 위한 요건 및 집합건물이 아닌 일반건물로 등기된 기존의 건물이 구분건물로 변경등기되기 전이라도 그와 같은 요건을 갖추면 구분소유권이 성립하는지 여부"
"판시사항","일반건물로 등기되었던 기존의 건물에 관하여 실제로 건축물대장의 전환등록절차를 거쳐 구분건물로 변경등기까지 마쳐진 경우, 전환등록 시점에는 구분행위가 있었던 것으로 볼 수 있는지 여부"
"판결요지","1동의 건물에 대하여 구분소유가 성립하기 위해서는 객관적·물리적인 측면에서 1동의 건물이 존재하고, 구분된 건물부분이 구조상·이용상 독립성을 갖추어야 할 뿐 아니라, 1동의 건물 중 물리적으로 구획된 건물부분을 각각 구분소유권의 객체로 하려는 구분행위가 있어야 한다."
"판결요지","여기서 구분행위는 건물의 물리적 형질에 변경을 가함이 없이 법률관념상 건물의 특정 부분을 구분하여 별개의 소유권의 객체로 하려는 일종의 법률행위로서, 시기나 방식에 특별한 제한이 있는 것은 아니고 처분권자의 구분의사가 객관적으로 외부에 표시되면 인정된다."
"판결요지","따라서 집합건물이 아닌 일반건물로 등기된 기존의 건물이 구분건물로 변경등기되기 전이라도, 구분된 건물부분이 구조상·이용상 독립성을 갖추고 건물을 구분건물로 하겠다는 처분권자의 구분의사가 객관적으로 외부에 표시되는 구분행위가 있으면 구분소유권이 성립한다."
"판결요지","그리고 일반건물로 등기되었던 기존의 건물에 관하여 실제로 건축물대장의 전환등록절차를 거쳐 구분건물로 변경등기까지 마쳐진 경우라면 특별한 사정이 없는 한 전환등록 시점에는 구분행위가 있었던 것으로 봄이 타당하다."
"이유","원심판결 이유를 앞서 본 법리와 기록에 비추어 살펴보면, 원심의 위와 같은 판단은 정당하고, 거기에 상고이유 주장과 같이 구분행위 및 구분소유권의 성립시점에 관한 법리를 오해한 위법이 없다."
"이유","그리고 원고가 주장하는 사정만으로 선정자 3과 원고의 위 지분 취득이 집합건물법 제20조 제2항 본문에 반하여 무효라는 피고의 주장이 신의칙에 반하여 허용될 수 없는 것이라고 볼 수 없으므로, 이와 관련된 상고이유 주장도 받아들일 수 없다."
