"이유","원고가 이 사건 소송의 청구원인으로 주장하는 바의 요지는 별지목록에 기재된 이사건 부동산은 원고의 소유인데 아무런 등기원인도 없이 위 부동산에 관하여 피고의 명의로 소유권이전등기가 경유되었으므로 피고에 대하여 그 원인이 무효인 위 소유권이전등기의 말소등기절차의 이행을 청구한다는 것이다."
"이유","그러나 원래 독립당사자참가는 소송의 목적의 전부나 일부가 자기의 권리임을 주장하거나 소송의 결과에 의하여 권리의 침해를 받을 것을 주장하는 제3자가 당사자로서 소송에 참가하여 세 당사자사이에 서로 대립되는 권리 또는 법률관계를 하나의 판결로써 서로 모순됨이 없이 일시에 해결하려는 것인 바이다."
"이유","이 인정에 배치되는 을 제4 내지 제6 각호증의 1,2의 각 기재내용이나 원심증인 소외 5의 각 증언은 위에서 채택한 증거들에 비추어 믿기 어려우며 위 인정을 좌우할만한 다른 증거는 없다."
"이유","그렇다면 달리 특별한 사정이 없는한 피고 명의의 위 부동산에 관한 위 소유권이전등기는 그 원인이 무효인 등기라고 할 수 밖에 없다."
"이유","그러나 앞서 믿기 어렵다하여 배척한 증거들 이외에는 위 재단법인의 대표자나 이사회가 원로원운영위원들에게 위 부동산의 처분권을 수여하였음을 인정할만한 증거가 달리 아무것도 없는 바이다."
"이유","그러므로 참가인의 독립당사자참가신청은 부적법한 것이어서 이를 각하하기로 하고, 피고에 대하여 그 원인이 무효인 피고명의의 위 부동산에 관한 위 소유권이전등기의 말소등기절차의 이행을 구하는 원고의 본소청구는 이유가 있어 이를 인용할 것인 바이다."
"이유","원판결은 이와 결론을 달리하여 부당하므로 민사소송법 제386조에 따라 원판결을 취소하여 원고의 청구를 인용하기로 하고, 소송비용의 부담에 관하여는 같은법 제96조, 제89조, 제94조를 각 적용하여 주문과 같이 판결한다."
