"이유","다음의 각 사실은 당사자 사이에 다툼이 없거나, 갑 제1, 2, 3, 6호증, 갑 제7호증의 1, 을나 제1, 2, 3호증의 각 기재에 변론 전체의 취지를 종합하면 이를 각 인정할 수 있다."
"이유","이 사건 아파트의 조합원분양세대 중 해지된 32평형 1세대를 분양대금 4억 8000만 원에 분양받기로 하는 계약을 체결하였고, 같은 날 소외 회사에 계약금으로 금 1억 3000만 원을 지급하였다."
"이유","원고가 이 사건 분양계약에 따라 조합원 해지 세대를 분양받음에 있어 위 제1심 공동피고는 계약금과 잔금 및 소유권이전등기까지의 절차에 대해 모든 책임을 진다."
"이유","소유권이전등기 경료 전 조합원세대 추첨을 통해 동·호수 배정이 되고, 1, 2층 세대분은 모두 입주가 완료된 상태이므로 3층 이상의 세대에 대해서만 배정을 받게 된다."
"이유","만일 위 사항들이 이행되지 못할 때에는 납입한 매매대금에 대하여 위 제1심 공동피고가 책임지는 것으로 한다."
"이유","원고는 2008. 4. 11. 소외 회사에 금 3억 5000만 원을 지급함으로써 이 사건 분양계약상의 대금을 완납하였다."
"이유","소외 회사는 원고의 경우와 같이 분양 희망자들에게 조합 설립일에 소급하여 조합원 지위를 부여하는 방법으로 이 사건 아파트의 미분양 세대수를 초과하여 분양계약을 체결하였다."
"이유","이로 인하여 현재 이 사건 아파트에 관하여 동·호수 추첨이 모두 이루어졌으나, 원고는 동·호수를 배정받지 못하여 이 사건 아파트 중 32평형 세대에 관한 소유권을 취득하지 못하게 되었다."
"이유","제1심 공동피고와 사이에 이 사건 공제계약을 체결한 공제사업자로서 위 제1심 공동피고와 각자 원고에게 위 금 4억 8000만 원 및 이에 대한 지연손해금을 지급할 의무가 있다고 주장한다."
"이유","첫째로 위  제1심 공동피고가 이 사건 분양계약을 알선한 행위가 이 사건 공제계약상 보장 대상인 공인중개사법이 정한 중개대상물의 중개행위에 해당하지 아니한다."
"이유","제1심 공동피고에게 손해배상책임이 있다고 하더라도, 피고 협회가 원고에게 지급할 공제금은 이 사건 공제계약에 따른 공제금의 한도금액인 금 5000만 원의 범위 내로 제한되어야 한다."
"이유","제1심 공동피고가 원고에게 이미 손해의 일부를 배상하였으므로 피고 협회가 원고에게 지급할 공제금에서 이를 공제하여야 한다고 주장한다."
"이유","제1심 공동피고가 원고와 소외 회사 사이에 이 사건 분양계약을 중개한 행위가 공인중개사법상의 중개대상물의 중개행위에 해당하는지에 관하여 보건대, 공인중개사법상 “중개”라 함은 중개대상물에 대하여 거래당사자간의 매매·교환·임대차 그 밖의 권리의 득실변경에 관한 행위를 알선하는 것을 말한다."
"이유"," “중개대상물”에는 토지,건축물 그 밖의 토지의 정착물,그 밖에 대통령령이 정하는 재산권 및 물건이 포함되는 바이다."
"이유","원고가 이 사건 아파트의 조합원분양세대 중 해지된 32평형 1세대를 분양받기로 하는 이 사건 분양계약을 중개한 위 제1심 공동피고의 행위는 공인중개사법상 중개대상물의 중개행위라고 할 것이다. "
"이유","위 제1심 공동피고의 손해배상책임 유무 공인중개사법 제33조 제7호는 공인중개사에 대하여 전매 등 권리의 변동이 제한된 부동산의 매매를 중개하는 등 부동산투기를 조장하는 행위를 금지하고 있다. "
"이유","주택법 제39조는 같은 법 제32조에 의하여 주택을 공급받을 수 있는 지위, 즉 조합원의 지위를 양도 또는 양수하거나 이를 알선하는 행위를 금지하고 있다."
"이유","공인중개사법 제25조 제1항은 중개업자에 대하여 중개대상물에 관한 권리를 취득하고자 하는 사람으로부터 중개를 의뢰받은 경우 중개가 완성되기 전에 당해 중개대상물의 상태·입지 및 권리관계와 법령의 규정에 의한 거래 또는 이용제한사항 등을 확인하여 중개의뢰인에게 성실·정확하게 설명할 의무를 부여하고 있다."
"이유","위 제1심 공동피고는 공인중개사로서 원고에게 이 사건 아파트 중 미분양 세대 분양권을 중개함에 있어 원고에게 주택법상 양도·양수가 금지되어 있는 이 사건 분양권 매수를 중개하지 말았어야 한다. "
"이유","제1심 공동피고와 피고 협회가 이 사건 공제계약을 통하여 피고 협회의 공제금 한도금액을 금 5000만 원으로 약정한 사실은 앞서 인정한 바와 같은 바이다."
"이유","피고 협회가 이 사건 공제계약에 따라 원고에게 지급할 공제금은 위와 같은 한도금액의 범위 내로 제한된다고 할 것이므로, 피고 협회의 이 부분 주장은 이유 있다."
"이유","동·호수 추첨일에 이 사건 아파트를 차질 없이 분양받을 수 있는 것인지 등을 확인하여야 하였음에도 불구하고 이를 게을리 함으로써 원고의 손해가 발생 또는 확대되었는 바이다."
"이유","원고의 위와 같은 과실은 참작하여 피고 협회가 지급할 공제금을 원고가 입은 손해의 50% 정도로 제한함이 상당하다고 할 것이므로 피고 협회의 이 부분 주장은 이유 있다."
"이유","위   제1심 공동피고가 원고에게 이 사건 분양계약의 중개로 인한 원고의 손해 중 일부를 배상하였음을 인정할 증거가 없으므로 피고 협회의 이 부분 주장은 이유 없다."
"이유","그 다음날부터 다 갚는 날까지는 소송촉진 등에 관한 특례법이 정한 연 20%의 각 비율로 계산한 지연손해금을 지급할 의무가 있다 할 것이다."
"이유","원고의 피고 협회에 대한 이 사건 청구는 이유 있어 이를 인용할 것인바, 제1심 판결은 이와 결론을 같이하여 정당하므로 피고 협회의 항소는 이유 없어 이를 기각하기로 하여, 주문과 같이 판결한다."
"이유","위 제1심 공동피고는 원고에게 자신의 중개행위로 인하여 원고가 입은 손해를 배상할 책임이 있다 할 것이다."
