"판시사항","퇴직금 등 체불로 인한 근로기준법 제109조 위반죄의 성립 시기 및 사업주가 법인일 경우 퇴직금 등의 지급사유 발생일로부터 14일이 경과하기 전에 지급권한을 상실하게 된 대표자가 그 죄책을 지는지 여부"
"판시사항","퇴직금 등을 지급할 수 없었던 불가피한 사정에 대한 피고인의 주장을 배척한 원심판결에 퇴직금 등 체불로 인한 근로기준법 제109조 위반죄의 책임조각사유에 관한 법리를 오해하여 심리를 미진한 위법이 있다고 한 사례"
"판결요지","따라서 사업주가 법인일 경우에는 위 14일이 경과할 당시에 퇴직금 등의 지급권한을 갖는 대표자가 그 체불로 인한 죄책을 짐이 원칙이고 14일이 경과하기 전에 퇴직 등의 사유로 그 지급권한을 상실하게 된 대표자는 특별한 사정이 없는 한 그 죄책을 지지 않는다."
"이유","그렇다면 피고인들의 판시 근로기준법위반죄가 피고인별로 각기 실체적 경합의 관계에 있다고 보아 하나의 형을 선고한 원심판결은 이 점에서 벌써 위법하여 그대로 유지될 수 없다고 할 것이다."
"이유","그럼에도 불구하고 퇴직자들과 퇴직금 지불에 관한 기일 연장의 합의도 전혀 하지 아니한 사실이 인정되는 바이다."
"이유","그러므로 원심판결을 파기하고 사건을 다시 심리·판단하게 하기 위하여 원심법원에 환송하기로 관여 법관들의 의견이 일치되어 주문과 같이 판결한다."
