"판결요지","개정 인사규정에서 근로자의 정년은 만 60세에 도달하는 날 퇴직하는 것으로 변경되어 전체적으로 정년은 연장되었다는 이유로, 이와 달리 정년해직 기준일을 정한 조항만을 비교하여 취업규칙이 근로자에게 불리하게 변경되었다고 보아 공소사실을 유죄로 인정한 원심판단에 취업규칙의 불이익변경에 관한 법리오해의 잘못이 있다고 한 사례"
"이유","사용자는 취업규칙의 작성 또는 변경에 관하여 해당 사업 또는 사업장에 근로자의 과반수로 조직된 노동조합이 있는 경우에는 그 노동조합, 근로자의 과반수로 조직된 노동조합이 없는 경우에는 근로자의 과반수의 의견을 들어야 한다."
"이유","즉, 이 사건 개정 전 인사규정은 근로자가 만 58세 되는 해의 6월 30일 또는 12월 31일에 퇴직하는 것으로 규정하고 있었으나 이 사건 개정으로 만 60세에 도달하는 날에 퇴직하는 것으로 변경된 것이다."
"이유","따라서 이 사건 개정 인사규정에서 근로자의 정년은 만 60세에 도달하는 날 퇴직하는 것으로 변경되어 전체적으로 정년은 연장되었음에도, 원심이 취업규칙인 인사규정이 근로자에게 불리하게 변경되었다고 판단하여 이 부분 공소사실을 유죄로 인정한 것은 취업규칙의 불이익변경에 관한 법리를 오해하여 판결에 영향을 미친 잘못이 있다."
"이유","그렇다면 원심판결 중 위 공소사실 부분은 파기되어야 하고, 이와 택일적으로 공소제기된 근로자 과반수 의견청취 의무위반으로 인한 근로기준법 위반 부분도 일죄로 공소제기되어 한꺼번에 심판되어야 하므로 함께 파기되어야 한다."
"이유","그러므로 원심판결 중 근로기준법 위반 부분을 파기하고, 이 부분 사건을 다시 심리·판단하도록 원심법원에 환송하기로 하여, 관여 대법관의 일치된 의견으로 주문과 같이 판결한다."
