"판시사항","선거운동기간 전에 개최된 걷기대회에서 지방자치단체장 선거 출마예비자에 관한 홍보성 기사가 게재된 잡지를 참가자들에게 배부한 행위가 공직선거법 제95조 제1항에서 금지하는 선거에 관한 간행물의 통상방법 외의 배부행위에 해당한다고 한 사례"
"판결요지","선거운동기간에 관계없이 공직선거법 제95조 제1항에 따라 선거에 관한 간행물을 통상방법 외의 방법으로 배부하는 행위가 금지되는지 여부 [2] 공직선거법 제115조에 정한 ‘당해 선거에 관하여’의 의미 및 ‘후보자가 되고자 하는 자’의 범위"
"이유","공직선거법 제95조 제1항은 ‘누구든지 공직선거법의 규정에 의한 경우를 제외하고는 선거에 관한 기사를 게재한 신문ㆍ통신ㆍ잡지 또는 기관ㆍ단체ㆍ시설의 기관지 기타 간행물을 통상방법 외의 방법으로 배부하거나 그 기사를 복사하여 배부할 수 없다’고 규정하고 있을 뿐 그 시기를 제한하는 규정을 두고 있지 않은 바이다."
"이유","나아가 차기 지방자치단체장 선거에 관하여 ‘후보자가 되고자 하는 자’인 공소외인을 위하여 기부행위를 한 것으로서 공직선거법 제257조 제1항 제1호, 제115조에 해당한다고 인정하여 피고인의 이 부분 공소사실을 유죄로 인정한 제1심판결이 정당하다고 판단하였다."
"이유","원심판결 이유를 위와 같은 법리와 기록에 비추어 살펴보면, 원심의 이와 같은 사실 인정 및 판단은 정당한 것으로 수긍할 수 있다."
"이유","원심판결에는 상고이유에서 주장하는 바와 같이 공직선거법 제95조의 구성요건 및 제115조의 선거관련성에 관한 법리 등을 오해한 위법이 없다."
"이유","한편 공직선거법 제115조에 정한 ‘당해 선거에 관하여’라 함은 당해 선거를 위한 선거운동이 되지 아니하더라도 당해 선거를 동기로 하거나 빌미로 하는 등 당해 선거와 관련이 있으면 족하다고 할 것이다."
