"판시사항","특정경제범죄가중처벌등에관한법률 제5조 제1항 소정의 '금융기관 임·직원이 직무에 관하여'의 의미 [3] 금융기관의 임직원이 그 지위를 이용하여 금융기관으로부터 자금을 대출받아 이를 타인에게 대여한 후 그로부터 대여금에 대한 이자 또는 사례금을 수수한 행위는 특정경제범죄가중처벌등에관한법률 제5조 제1항 소정의 수재죄에 해당하지 않는다고 한 사례"
"판결요지","금융기관의 임직원이 그 지위를 이용하여 금융기관으로부터 자금을 대출받아 이를 타인에게 대여한 후 그로부터 대여금에 대한 이자 또는 사례금을 수수한 행위는 특정경제범죄가중처벌등에관한법률 제5조 제1항 소정의 수재죄에 해당하지 않는다고 한 사례."
"이유","사실관계가 위와 같다면 피고인은 금융기관 임직원으로서 그 지위를 이용하여 자기의 이익을 위하여 자기의 계산으로 금전을 대부한 경우에 해당하므로 특정경제범죄가중처벌등에관한법률 제8조 소정의 사금융알선 등의 죄에 해당한다."
"이유","피고인이 공소외인에게 금전을 대여한 것은 피고인이 개인 명의로, 개인의 이익을 위하여, 개인의 계산으로 한 것이다."
"이유","피고인이 그와 같이 금품을 수수하였다 하더라도 금융기관 임·직원이 직무와 관련하여 금품을 수수한 것으로 볼 수는 없다. "
"이유","피고인이 지소장의 지위에 있음을 이용하여 위 지소로부터 자금을 대출받아 이를 대여자금으로 사용하였다 하여 달리 볼 것은 아니다."
"이유","이와 달리 판단한 원심판결에는 판결에 영향을 미친 채증법칙 위배나 금융기관 임직원의 수재죄에 관한 법리오해의 위법이 있다."
"이유","그러므로 이 사건 공소사실을 모두 유죄로 인정하여 형법 제37조 전단의 경합범으로 보아 하나의 형을 선고한 원심판결을 모두 파기하고, 사건을 원심법원에 환송하기로 하여 주문과 같이 판결한다."
