"판시사항","조합원 중 한 사람이 조합재산 처분으로 얻은 대금을 임의로 소비한 경우 횡령죄 성립 여부 및 이른바 ‘내적 조합’의 경우에도 동일한 법리가 적용되는지 여부"
"판시사항","익명조합원이 영업을 위하여 출자한 금전 기타 재산에 대하여 상대편인 영업자가 타인의 재물을 보관하는 자의 지위에 있는지 여부 및 영업자가 영업이익금 등을 임의로 소비한 경우 횡령죄 성립 여부"
"판결요지","조합재산은 조합원의 합유에 속하므로 조합원 중 한 사람이 조합재산 처분으로 얻은 대금을 임의로 소비하였다면 횡령죄의 죄책을 면할 수 없다."
"판결요지","조합 또는 내적 조합과 달리 익명조합의 경우에는 익명조합원이 영업을 위하여 출자한 금전 기타의 재산은 상대편인 영업자의 재산이 되므로 영업자는 타인의 재물을 보관하는 자의 지위에 있지 않다."
"판결요지","어떠한 법률관계가 내적 조합에 해당하는지 아니면 익명조합에 해당하는지는, 당사자들의 내부관계에 공동사업이 있는지, 조합원이 업무검사권 등을 가지고 조합의 업무에 관여하였는지, 재산의 처분 또는 변경에 전원의 동의가 필요한지 등을 모두 종합하여 판단하여야 한다."
"이유","이러한 조합 또는 내적 조합과는 달리 익명조합의 경우에는 익명조합원이 영업을 위하여 출자한 금전 기타의 재산은 상대편인 영업자의 재산으로 되는 것이므로 그 영업자는 타인의 재물을 보관하는 자의 지위에 있지 않고 따라서 영업자가 영업이익금 등을 임의로 소비하였다고 하더라도 횡령죄가 성립할 수는 없다."
"이유","피해자와 피고인 사이의 약정은 조합 또는 내적 조합에 해당하는 것이 아니라 익명조합과 유사한 무명계약에 해당하는 것으로 보아야 할 것이다."
"이유","거기에 상고이유에서 주장하는 바와 같이 횡령죄의 성립에 관한 법리를 오해한 위법이 있다고 할 수 없다."
