query,translated_query,언어,ground_truth_id,category,source,작성자,비고,소스,translated_4o_mini,mongo_query_4o_mini,answer,retrieved_doc_ids,correctness,recall_at_k
"제 여자친구가 단속으로 출입국 보호소에 있습니다. 월급이 아직 들어오지 않았는데, 태국으로 가버리면 밀린 월급은 어떻게 받죠..",แฟนของผมถูกจับกุมและอยู่ที่ศูนย์กักตัวตรวจคนเข้าเมือง ตอนนี้ยังไม่ได้รับเงินเดือนเลย ถ้าต้องกลับประเทศไทยแล้ว จะได้รับเงินเดือนที่ค้างอยู่ได้อย่างไรครับ..,태국어,"['689b3a86ffd306c1cd3c09a4', '689b3a86ffd306c1cd3c071e', '689b3a86ffd306c1cd3c074b', '689b3a86ffd306c1cd3c0789', '689b3a86ffd306c1cd3c07d3', '689b3a86ffd306c1cd3c0819', '689b3a86ffd306c1cd3c084e', '689b3a86ffd306c1cd3c0855', '689b3a86ffd306c1cd3c0874', '689b3a86ffd306c1cd3c087d', '689b3a86ffd306c1cd3c087f', '689b3a86ffd306c1cd3c0887', '689b3a86ffd306c1cd3c08dc', '689b3a86ffd306c1cd3c093b']",임금체불,경기도외국인지원센터_상담사례,황예원,,https://gmhr.or.kr/case/1529?sca=%EC%9E%84%EA%B8%88%EC%B2%B4%EB%B6%88&page=2,"제 여자친구가 체포되어 이민 구금 센터에 있습니다. 지금 급여를 받지 못하고 있는데, 태국으로 돌아가야 한다면 밀린 급여를 어떻게 받을 수 있을까요?","[{'$search': {'index': 'text', 'compound': {'should': [{'text': {'query': ['임금체불', '체불임금', '급여 미지급', '임금 청구'], 'path': ['title', 'contents'], 'fuzzy': {'maxEdits': 1, 'prefixLength': 2}}}, {'phrase': {'query': '임금 체불', 'path': 'title', 'slop': 2}}], 'minimumShouldMatch': 1}, 'highlight': {'path': ['title', 'contents']}}}, {'$project': {'_id': 1, 'title': 1, 'contents': 1, 'url': 1, 'score': {'$meta': 'searchScore'}, 'highlights': {'$meta': 'searchHighlights'}}}, {'$limit': 20}]","안녕하세요! 여자친구분이 이민 구금 센터에 계셔서 걱정이 많으시겠어요. 급여를 받지 못하는 상황도 매우 어려운 일이네요. 밀린 급여를 받을 수 있는 방법에 대해 알려드리겠습니다.

1. **대표자 지정**: 여자친구분이 급여를 받을 수 있게 미리 위임장을 작성하여 당신이 대신 수령할 수 있도록 할 수 있습니다. 법적으로 근로자의 권리를 대리해서 주장할 수 있는 방법입니다.

2. **관할 노동청에 상담**: 여자친구분의 근무지 관할 노동청에 방문하거나 전화로 상담을 받으며, 그녀의 상황을 설명하고 어떻게 급여를 수령할 수 있는지 문의하세요. 노동청에서는 체불임금에 대한 구제절차를 안내해 줄 것입니다.

3. **진정서 제출**: 급여 지급이 지연되거나 체불된 경우, 관할 노동청에 진정서를 제출하여 도움을 요청할 수 있습니다. 진정서 제출은 방문 또는 인터넷을 통해 가능하며, 사건 조사를 통해 밀린 급여를 청구할 수 있습니다.

4. **민사소송 고려**: 급여가 지급되지 않은 이유가 사용자에게 있다면 민사소송을 통하여 법원에 이를 해결해 달라고 요청할 수도 있습니다. 다만, 이 경우에는 법률적 절차가 필요하므로 전문 변호사와 상담하는 것이 좋습니다.

5. **대한법률구조공단 도움 요청**: 경제적으로 어려운 상황이라면 대한법률구조공단에서 무료 법률 상담을 받을 수 있습니다. 여기서 지원을 통해 추가적인 법적 절차를 진행할 수 있습니다.

6. **소통**: 그녀가 구금된 센터 내에서도 가능한 경우, 구금 센터의 관계자에게 근로조건과 급여 관련 상황을 설명하고 지원을 요청할 할 수 있습니다.

이런 방법들을 고려하여 조치를 취해보세요. 상황이 잘 해결되기를 바랍니다. 추가적으로 궁금한 점이 있으시면 언제든지 질문해 주세요.","['689b3a86ffd306c1cd3c09a4', '689b3a86ffd306c1cd3c081a', '689b3a86ffd306c1cd3c0960', '689b3a86ffd306c1cd3c0987', '689b3a86ffd306c1cd3c07e6', '689b3a86ffd306c1cd3c07c5', '689b3a86ffd306c1cd3c0744', '689b3a86ffd306c1cd3c06c8', '689b3a86ffd306c1cd3c0979', '689b3a86ffd306c1cd3c0685', '689b3a86ffd306c1cd3c0874', '689b3a86ffd306c1cd3c0819', '689b3a86ffd306c1cd3c087f', '689b3a86ffd306c1cd3c071e', '689b3a86ffd306c1cd3c0790', '689b3a86ffd306c1cd3c07b9', '689b3a86ffd306c1cd3c0823', '689b3a86ffd306c1cd3c0772', '689b3a86ffd306c1cd3c0789', '689b3a86ffd306c1cd3c0894']",1,0.42857142857142855
"안녕하세요, 건설 현장에서 일하고 있는 사람인데, 사장님이 월급을 안줘서 계좌가 압류될 것 같습니다. 이런 경우 어떻게 해야 하나요?",你好，我是在建筑工地工作的，但老板没有发工资，我的账户可能会被查封。遇到这种情况该怎么办呢？,중국어,"['689b3a86ffd306c1cd3c06e8', '689b3a86ffd306c1cd3c0744', '689b3a86ffd306c1cd3c09a4', '689b3a86ffd306c1cd3c071e', '689b3a86ffd306c1cd3c074b', '689b3a86ffd306c1cd3c0789', '689b3a86ffd306c1cd3c07d3', '689b3a86ffd306c1cd3c0819', '689b3a86ffd306c1cd3c084e', '689b3a86ffd306c1cd3c0855', '689b3a86ffd306c1cd3c0874', '689b3a86ffd306c1cd3c087d', '689b3a86ffd306c1cd3c087f', '689b3a86ffd306c1cd3c0887', '689b3a86ffd306c1cd3c08dc', '689b3a86ffd306c1cd3c093b']",임금체불,경기도외국인지원센터_상담사례,황예원,"임금체불 및 ""압류방지 통장"" (=임금채권 전용통장) 관련 데이터 필요",https://gmhr.or.kr/case/1493?sca=%EC%9E%84%EA%B8%88%EC%B2%B4%EB%B6%88&page=2,"저는 건설 현장에서 일하고 있지만, 사장이 급여를 지급하지 않았습니다. 제 계좌가 압류될 수 있는 상황인데, 이런 경우 어떻게 해야 하나요?","[{'$search': {'index': 'text', 'compound': {'should': [{'text': {'query': ['임금체불', '급여 미지급', '계좌 압류', '임금 청구'], 'path': ['title', 'contents'], 'fuzzy': {'maxEdits': 1, 'prefixLength': 2}}}, {'phrase': {'query': '임금 체불', 'path': 'title', 'slop': 2}}], 'minimumShouldMatch': 1}, 'highlight': {'path': ['title', 'contents']}}}, {'$project': {'_id': 1, 'title': 1, 'contents': 1, 'url': 1, 'score': {'$meta': 'searchScore'}, 'highlights': {'$meta': 'searchHighlights'}}}, {'$limit': 20}]","급여를 지급받지 못한 것은 매우 심각한 문제입니다. 급여가 지급되지 않는 상황에서는 다음과 같은 조치를 취할 수 있습니다:

1. **고용노동청에 신고하기**: 급여가 지급되지 않은 경우, 우선 해당 지역의 고용노동청에 진정서를 제출하여 도움을 요청할 수 있습니다. 신고 방법은 고용노동부 홈페이지를 통해 온라인으로 신청하거나, 관할 지방고용노동청에 직접 방문하여 제출할 수 있습니다.

2. **문서로 증거 나열하기**: 사장님과의 대화 내용이나 급여 지급에 대한 취소 또는 독촉의 기록을 포함하여, 임금을 지급받지 못한 사실을 명확히 하기 위해 필요한 모든 증거를 준비하세요. 이는 고용노동청에 제출할 때 도움이 됩니다.

3. **법적 조치 고려**: 만약 고용노동청의 도움으로도 문제가 해결되지 않는다면, 민사소송을 통해 임금 체불에 대한 법적 절차를 진행할 수 있습니다. 이 경우 대한법률구조공단을 통해 무료 법률 상담을 받고 도움을 요청할 수 있습니다.

4. **계좌 압류 방지**: 만약 급여가 압류될 상황에 처해져 있다면, 법원에 해당 상황을 설명하고 임금 체불로 인해 급여가 들어오지 않고 있다는 사실을 주장하여 강제 집행을 막는 조치를 취하는 것이 중요합니다.

5. **외국인 근로자권리 보호**: 외국인 근로자로서의 권리를 보장받기 위해 반드시 법적 지원을 요청하고, 필요한 경우 통역 서비스를 활용하여 명확한 소통이 이루어질 수 있도록 하세요.

이와 같은 방법을 통해 급여 체불 문제를 해결할 수 있도록 노력해보세요. 추가적인 도움이 필요하면 언제든지 문의해 주세요.","['689b3a86ffd306c1cd3c0960', '689b3a86ffd306c1cd3c0994', '689b3a86ffd306c1cd3c09a4', '689b3a86ffd306c1cd3c098b', '689b3a86ffd306c1cd3c08a7', '689b3a86ffd306c1cd3c071e', '689b3a86ffd306c1cd3c08d7', '689b3a86ffd306c1cd3c0976', '689b3a86ffd306c1cd3c0971', '689b3a86ffd306c1cd3c0995', '689b3a86ffd306c1cd3c0992', '689b3a86ffd306c1cd3c0993', '689b3a86ffd306c1cd3c09a8', '689b3a86ffd306c1cd3c0997', '689b3a86ffd306c1cd3c0987', '689b3a86ffd306c1cd3c0880', '689b3a86ffd306c1cd3c0744', '689b3a86ffd306c1cd3c0861', '689b3a86ffd306c1cd3c087f', '689b3a86ffd306c1cd3c0688']",1,0.25
"안녕하세요, 저는 필리핀에서 온 노동자입니다. 5년 동안 근무를 하고 이제 제 나라로 돌아가려 해요. 그런데 회사가 망해서 월급을 못받았습니다. 제 월급을 돌려받을 방법이 없나요?","Magandang araw, ako ay isang manggagawang mula sa Pilipinas. Nagtatrabaho ako nang 5 taon at ngayon ay babalik na sana ako sa aking bansa. Ngunit nalugi ang kompanya kaya hindi ko natanggap ang aking sahod. Wala po ba talagang paraan para mabawi ko ang aking sahod?",필리핀어 (타갈로그어),['689b3a86ffd306c1cd3c09a4'],임금체불,경기도외국인지원센터_상담사례,황예원,체당금 관련 데이터 필요,https://gmhr.or.kr/case/1667?sca=%EC%9E%84%EA%B8%88%EC%B2%B4%EB%B6%88,"안녕하세요, 저는 필리핀에서 온 근로자입니다. 5년 동안 일했으며 이제 제 나라로 돌아가고 싶습니다. 하지만 회사가 파산하여 제 급여를 받지 못했습니다. 제 급여를 회수할 방법이 정말 없나요?","[{'$search': {'index': 'text', 'compound': {'should': [{'text': {'query': ['임금체불', '체불임금', '급여 미지급', '임금 청구'], 'path': ['title', 'contents'], 'fuzzy': {'maxEdits': 1, 'prefixLength': 2}}}, {'phrase': {'query': '급여 회수', 'path': 'title', 'slop': 2}}], 'minimumShouldMatch': 1}, 'highlight': {'path': ['title', 'contents']}}}, {'$project': {'_id': 1, 'title': 1, 'contents': 1, 'url': 1, 'score': {'$meta': 'searchScore'}, 'highlights': {'$meta': 'searchHighlights'}}}, {'$limit': 20}]","안녕하세요! 말씀해 주신 상황은 매우 안타깝습니다. 회사가 파산한 경우라도 급여를 받을 방법이 있습니다. 다음의 절차를 고려해 보시기 바랍니다.

1. **체불임금 신고**: 파산한 회사에서 일한 경우에도 노동청에 체불임금을 신고할 수 있습니다. 관할 지방고용노동청에 진정서를 제출하여 도움을 요청할 수 있습니다. 이 과정에서 회사의 파산 사실을 증명하는 서류가 필요할 수 있습니다.

2. **근로복지공단의 도움 요청**: 만약 회사가 파산하여 재산이 없다면, 근로복지공단의 '임금채권 보장 제도'를 통해 지원을 받을 수 있습니다. 조건을 충족한다면 임금 보장을 통해 일부 금액을 받을 수 있습니다.

3. **법률 상담 이용하기**: 대한법률구조공단(☎ 132)과 같은 기관에 문의하여 무료 법률 상담을 받아볼 수 있습니다. 구체적인 상황에 따라 어떤 법적 절차를 밟아야 할지 조언을 받을 수 있습니다.

4. **파산관재인에게 문의**: 회사가 공식적으로 파산하였다면, 파산관재인에게 접촉해 보시고 본인의 체불임금에 대한 청구를 진행할 수 있는지 알아보세요.

이 모든 절차를 통해 진행하실 수 있는 구체적인 방법에 대해 근로복지공단이나 관련 법률 상담 서비스에 문의해 주시면 보다 자세한 정보를 얻으실 수 있을 것입니다. 힘내세요, 상황이 빨리 해결되기를 바랍니다!","['689b3a86ffd306c1cd3c0960', '689b3a86ffd306c1cd3c09a4', '689b3a86ffd306c1cd3c0987', '689b3a86ffd306c1cd3c0815', '689b3a86ffd306c1cd3c091b', '689b3a86ffd306c1cd3c0928', '689b3a86ffd306c1cd3c08d7', '689b3a86ffd306c1cd3c0861', '689b3a86ffd306c1cd3c071e', '689b3a86ffd306c1cd3c09a8', '689b3a86ffd306c1cd3c0744', '689b3a86ffd306c1cd3c0801', '689b3a86ffd306c1cd3c087f', '689b3a86ffd306c1cd3c0949', '689b3a86ffd306c1cd3c081a', '689b3a86ffd306c1cd3c0872', '689b3a86ffd306c1cd3c098b', '689b3a86ffd306c1cd3c0991', '689b3a86ffd306c1cd3c0773', '689b3a86ffd306c1cd3c0819']",1,1.0
"사업장 변경 신청 이후 제가 불법체류자가 될 수 있다는 우편이 날아왔어요. 8월 22일까지만 체류가 허가되어있고, 9월부터는 쫓겨날 수도 있대요. 어떡하죠?",在申请变更工作单位之后，我收到了一封信，说我可能会变成非法滞留者。只被允许停留到8月22日，从9月开始可能会被驱逐。我该怎么办呢？,중국어,"['689b3a86ffd306c1cd3c0680', '689b3a86ffd306c1cd3c0683', '689b3a86ffd306c1cd3c06d2', '689b3a86ffd306c1cd3c072a', '689b3a86ffd306c1cd3c072b', '689b3a86ffd306c1cd3c074a', '689b3a86ffd306c1cd3c07b1', '689b3a86ffd306c1cd3c0831', '689b3a86ffd306c1cd3c0840', '689b3a86ffd306c1cd3c08d6', '689b3a86ffd306c1cd3c093f', '689b3a86ffd306c1cd3c072a', '689b3a86ffd306c1cd3c081f', '689b3a86ffd306c1cd3c082b', '689b3a86ffd306c1cd3c0837', '689b3a86ffd306c1cd3c088c', '689b3a86ffd306c1cd3c092f', '689b3a86ffd306c1cd3c0930', '689b3a86ffd306c1cd3c092c', '689b3a86ffd306c1cd3c0831']",체류자격,경기도외국인지원센터_상담사례,황예원,,https://gmhr.or.kr/case/1679?sca=%EC%B2%B4%EB%A5%98%EC%9E%90%EA%B2%A9,"제가 직장 변경을 신청한 후, 불법 체류자가 될 수 있다는 편지를 받았습니다. 8월 22일까지만 체류가 허용되며, 9월부터는 추방될 수 있다고 합니다. 저는 어떻게 해야 하나요?","[{'$search': {'index': 'text', 'compound': {'should': [{'text': {'query': ['불법 체류', '추방', '비자 문제', '체류 허가'], 'path': ['title', 'contents'], 'fuzzy': {'maxEdits': 1, 'prefixLength': 2}}}, {'phrase': {'query': '불법 체류', 'path': 'title', 'slop': 2}}], 'minimumShouldMatch': 1}, 'highlight': {'path': ['title', 'contents']}}}, {'$project': {'_id': 1, 'title': 1, 'contents': 1, 'url': 1, 'score': {'$meta': 'searchScore'}, 'highlights': {'$meta': 'searchHighlights'}}}, {'$limit': 20}]","직장 변경 신청 후 불법 체류자가 될 상황에 처한 것은 매우 심각한 문제입니다. 우선 아래의 단계를 따라 상황을 해결해 보시기 바랍니다.

1. **즉시 출입국관리사무소에 방문**: 현재의 체류 자격을 연장하거나 변경하기 위해 출입국관리사무소에 직접 방문하여 상황을 설명하고 도움을 요청해 보세요. 개인의 상황에 따라 법적 조치를 취할 수 있는 방법을 안내받을 수 있습니다.

2. **직장 변경에 대한 서류 준비**: 새로운 직장에서의 고용 계약서와 필요한 서류를 미리 준비하여 제출하시기 바랍니다. 이 서류들은 변경 요청의 근거가 될 수 있습니다.

3. **법률 상담 받기**: 즉각적인 상황에 대응하기 위해 법률 상담을 받는 것이 좋습니다. 전문 변호사나 법률구조공단에 문의하여 구체적인 조언을 받으세요.

4. **재신청 고려**: 만약 현재의 신청이 거절된 경우, 새롭게 체류 자격 변경 신청을 고려해야 할 수 있습니다. 이 경우, 이전 신청의 사유를 잘 정리하고, 그에 대한 보완 자료를 준비하여 제출해야 합니다.

5. **불법 체류가 되지 않도록 조치**: 만약 새로운 직장을 찾을 수 없다면, 가능한 빨리 본국으로 돌아가는 것을 고려하는 것이 가장 안전한 방법일 수 있습니다. 귀국 후에 변호사와 상담하여 한국에서의 체류 문제를 해결할 수 있는 방법을 모색할 수 있습니다.

6. **기한 준수**: 8월 22일까지의 기한을 반드시 지켜야 하므로, 그 이전에 위의 조치를 취하는 것이 중요합니다.

상황이 복잡할 수 있으니, 조속히 행동하시고 필요한 도움이 많이 있으면 꼭 참고해 주세요.","['689b3a86ffd306c1cd3c08a1', '689b3a86ffd306c1cd3c096f', '689b3a86ffd306c1cd3c074d', '689b3a86ffd306c1cd3c096d', '689b3a86ffd306c1cd3c09a5', '689b3a86ffd306c1cd3c0912', '689b3a86ffd306c1cd3c097a', '689b3a86ffd306c1cd3c06fc', '689b3a86ffd306c1cd3c0913', '689b3a86ffd306c1cd3c0779', '689b3a86ffd306c1cd3c0914', '689b3a86ffd306c1cd3c098b', '689b3a86ffd306c1cd3c0885', '689b3a86ffd306c1cd3c0917', '689b3a86ffd306c1cd3c0916', '689b3a86ffd306c1cd3c06f3', '689b3a86ffd306c1cd3c0915', '689b3a86ffd306c1cd3c0802', '689b3a86ffd306c1cd3c06dc', '689b3a86ffd306c1cd3c06f1']",0,0.0
"제가 중간에 퇴직을 하게 되었는데, 소득세가 체납되어 비자 연장이 안된대요. 그런데 안내 사항을 못알아듣겠어요.",我中途离职了，但是因为拖欠所得税，签证无法延期。可是我听不懂相关的通知内容。,중국어,"['689b3a86ffd306c1cd3c08f8', '689b3a86ffd306c1cd3c08f0', '689b3a86ffd306c1cd3c085a']",체류자격,경기도외국인지원센터_상담사례,황예원,,https://gmhr.or.kr/case/1703?sca=%EC%B2%B4%EB%A5%98%EC%9E%90%EA%B2%A9,"저는 중간에 퇴사했지만, 소득세 체납 때문에 비자를 연장할 수 없습니다. 관련 통지 내용을 이해하지 못합니다.","[{'$search': {'index': 'text', 'compound': {'should': [{'text': {'query': ['소득세 체납', '비자 연장', '퇴사', '통지 내용'], 'path': ['title', 'contents'], 'fuzzy': {'maxEdits': 1, 'prefixLength': 2}}}, {'phrase': {'query': '소득세 체납', 'path': 'title', 'slop': 2}}], 'minimumShouldMatch': 1}, 'highlight': {'path': ['title', 'contents']}}}, {'$project': {'_id': 1, 'title': 1, 'contents': 1, 'url': 1, 'score': {'$meta': 'searchScore'}, 'highlights': {'$meta': 'searchHighlights'}}}, {'$limit': 20}]","안녕하세요! 비자 연장에 대한 문제로 걱정이 많으시군요. 소득세 체납으로 인해 비자 연장이 불가능하다는 것은 한국 정부에서 세금을 체납하고 있는 외국인 근로자에게 비자를 제한하는 정책에 따른 것입니다. 아래에서 구체적인 절차와 해결 방안을 안내해 드리겠습니다.

1. **체납 확인**: 우선 본인의 소득세 체납 내역을 확인해야 합니다. 국세청 홈페이지(국세청(126) 고객센터)나 직접 가까운 세무서에 문의하여 확인할 수 있습니다.

2. **납부 안내**: 세금을 체납하고 있는 경우, 출입국관리공무원이 안내를 통해 체납액을 납부하도록 요청합니다. 체납 금액을 모두 납부하지 않으면 비자 연장이 제한되므로, 가능한 빨리 체납 세금을 정리하는 것이 중요합니다.

3. **세금 납부 후 재신청**: 체납액을 모두 납부한 후, 비자 연장을 다시 신청할 수 있습니다. 비자 연장 신청 시 체납액이 완납되었음을 증명하는 서류(납부 영수증 등)를 제출해야 합니다.

4. **상담 받기**: 상황이 복잡하거나 추가 도움이 필요하다면 관할 고용센터나 외국인 종합 안내센터(1345)에 문의하여 전문적인 상담을 받는 것도 좋습니다.

5. **비자 연장 조건**: 비자 연장 조건은 체류자격에 따라 다를 수 있으므로, 본인의 체류자격에 맞는 필요한 서류를 갖춰 제출하시기 바랍니다.

위의 절차를 참고하셔서 문제를 해결해 나가시길 바라며, 추가적으로 궁금하신 사항이 있다면 언제든지 문의해 주세요!","['689b3a86ffd306c1cd3c08f8', '689b3a86ffd306c1cd3c09a5', '689b3a86ffd306c1cd3c085a', '689b3a86ffd306c1cd3c09a4', '689b3a86ffd306c1cd3c0813', '689b3a86ffd306c1cd3c0725', '689b3a86ffd306c1cd3c06de', '689b3a86ffd306c1cd3c090c', '689b3a86ffd306c1cd3c07b1', '689b3a86ffd306c1cd3c0758', '689b3a86ffd306c1cd3c0994', '689b3a86ffd306c1cd3c09a2', '689b3a86ffd306c1cd3c0982', '689b3a86ffd306c1cd3c097d', '689b3a86ffd306c1cd3c06ca', '689b3a86ffd306c1cd3c090b', '689b3a86ffd306c1cd3c06e4', '689b3a86ffd306c1cd3c0979', '689b3a86ffd306c1cd3c090d', '689b3a86ffd306c1cd3c0842']",1,0.6666666666666666
"회사에서 갑자기 나오지 말라고 해서, 체류 자격이 박탈될 것 같습니다. 저는 어떻게 해야 하나요?","Công ty đột ngột bảo tôi đừng đến nữa, nên có thể tôi sẽ bị tước tư cách lưu trú. Tôi phải làm thế nào?",베트남어,"['689b3a86ffd306c1cd3c06dc', '689b3a86ffd306c1cd3c06de', '689b3a86ffd306c1cd3c06ef', '689b3a86ffd306c1cd3c06f0', '689b3a86ffd306c1cd3c06f3', '689b3a86ffd306c1cd3c072b', '689b3a86ffd306c1cd3c0910', '689b3a86ffd306c1cd3c0912']",부당해고,경기도외국인지원센터_상담사례,황예원,,,"회사가 갑자기 더 이상 출근하지 말라고 해서, 제가 체류 자격을 잃을 수 있습니다. 어떻게 해야 하나요?","[{'$search': {'index': 'text', 'compound': {'should': [{'text': {'query': ['체류 자격', '비자 문제', '이민 상담', '체류 허가'], 'path': ['title', 'contents'], 'fuzzy': {'maxEdits': 1, 'prefixLength': 2}}}, {'phrase': {'query': '체류 자격', 'path': 'title', 'slop': 2}}], 'minimumShouldMatch': 1}, 'highlight': {'path': ['title', 'contents']}}}, {'$project': {'_id': 1, 'title': 1, 'contents': 1, 'url': 1, 'score': {'$meta': 'searchScore'}, 'highlights': {'$meta': 'searchHighlights'}}}, {'$limit': 20}]","회사가 갑자기 출근을 중단하라고 통보한다면, 먼저 현재 상황을 잘 기록해 두는 것이 중요합니다. 다음과 같은 단계를 참고하여 문제를 해결해보세요:

1. **근로계약서 검토**: 회사와 체결한 근로계약서에 명시된 내용, 특히 고용 조건과 해지 규정들을 다시 확인하세요. 계약서에 명시된 절차를 따라야 합니다.

2. **인사팀 또는 관리자와 대화**: 회사의 인사팀이나 관리자와 만나서 상황을 명확히 하세요. 출근 중단의 이유와 향후 계획에 대해 질문하고, 어떤 조치를 취해야 하는지 논의하세요.

3. **근로내용 증명 요청**: 근무 일수, 근로 조건 등을 증명할 수 있는 서류를 요청하세요. 이 서류는 나중에 체류자격 연장이나 관련 문제를 해결하는 데 필요할 수 있습니다.

4. **출입국 관리소에 문의**: 체류자격에 대한 불안 요소가 있다면, 가까운 출입국 관리소에 방문하여 상담받는 것이 좋습니다. 상황을 설명하고, 어떤 조치를 취해야 하는지 확인하세요.

5. **체류자격 연장 신청 고려**: 만약 회사의 고용이 종료되면, 체류자격 연장을 위한 신청 절차를 서둘러야 합니다. 통상적으로 체류 자격이 만료되는 날짜 전에 연장 신청을 해야 하므로, 빠르게 움직이세요.

6. **법률 상담 받기**: 만약 상황이 복잡해지거나 더 심각한 문제가 발생할 경우, 법률 전문가의 도움을 받는 것이 좋습니다. 외국인 근로자 관련 법률에 대한 전문 지식을 가지고 있는 변호사에게 상담을 요청하세요.

이러한 단계를 통해 문제를 해결할 수 있기를 바랍니다. 어려움이 있으면 언제든지 도움을 요청하세요.","['689b3a86ffd306c1cd3c0918', '689b3a86ffd306c1cd3c0913', '689b3a86ffd306c1cd3c06fc', '689b3a86ffd306c1cd3c0917', '689b3a86ffd306c1cd3c0914', '689b3a86ffd306c1cd3c0915', '689b3a86ffd306c1cd3c0916', '689b3a86ffd306c1cd3c096d', '689b3a86ffd306c1cd3c0999', '689b3a86ffd306c1cd3c06e1', '689b3a86ffd306c1cd3c0695', '689b3a86ffd306c1cd3c06db', '689b3a86ffd306c1cd3c0911', '689b3a86ffd306c1cd3c07ff', '689b3a86ffd306c1cd3c06f3', '689b3a86ffd306c1cd3c06d9', '689b3a86ffd306c1cd3c0912', '689b3a86ffd306c1cd3c06de', '689b3a86ffd306c1cd3c067d', '689b3a86ffd306c1cd3c0779']",1,0.375
