query,translated_query,언어,ground_truth_id,category,source,작성자,비고,소스,translated_4o_mini,mongo_query_4o_mini,answer,retrieved_doc_ids,correctness,recall_at_k
"E-9 비자를 가진 외국인근로자가 근무 조건이 근로계약서와 다르다고 주장할 경우, 사업장 변경 사유로 인정받을 수 있나요? 그리고 이 경우 어떤 절차를 거쳐야 하나요?",持有E-9签证的外国劳动者，如果主张工作条件与劳动合同不符，这种情况能被认可为变更工作单位的理由吗？如果可以，需要经过哪些程序呢？,중국어,"['689b3a86ffd306c1cd3c06f2', '689b3a86ffd306c1cd3c094e']",사업장변경,"https://www.easylaw.go.kr/CSP/UnScOnhunListRlt.laf?onhunqnaAstSeq=&curPage=1&outmax=10&sch=%EC%99%B8%EA%B5%AD%EC%9D%B8&fsort=%5C, https://www.workinkorea.org/",홍석주,,,"E-9 비자를 가진 외국인 노동자가 근무 조건이 노동 계약과 다르다고 주장할 경우, 이는 근무지 변경 사유로 인정될 수 있나요? 가능하다면 어떤 절차를 거쳐야 하나요?","[{'$search': {'index': 'text', 'compound': {'should': [{'text': {'query': ['E-9 비자', '근무 조건', '노동 계약', '근무지 변경'], 'path': ['title', 'contents'], 'fuzzy': {'maxEdits': 1, 'prefixLength': 2}}}, {'phrase': {'query': '근무 조건 불일치', 'path': 'title', 'slop': 2}}], 'minimumShouldMatch': 1}, 'highlight': {'path': ['title', 'contents']}}}, {'$project': {'_id': 1, 'title': 1, 'contents': 1, 'url': 1, 'score': {'$meta': 'searchScore'}, 'highlights': {'$meta': 'searchHighlights'}}}, {'$limit': 20}]","E-9 비자를 가진 외국인 노동자가 근무 조건이 노동 계약과 다르다고 주장할 경우, 이는 근무지 변경 사유로 인정될 수 있습니다. 이 경우의 절차는 다음과 같습니다:

1. **상황 확인**: 먼저, 실제적으로 근무 조건이 근로 계약서에 명시된 내용과 다른지 확인해야 합니다. 예를 들어, 근무 시간, 임금, 휴일 등의 차이점이 있는지 점검하세요.

2. **사용자와 합의**: 사용자는 외국인 노동자와 이러한 차이에 대해 충분히 대화하고, 문제 해결을 위한 노력을 기울여야 합니다. 가능하다면 사용자와의 합의를 통해 상황을 조정할 수 있습니다.

3. **표준근로계약서 재작성**: 합의가 이루어질 경우, 새로운 근로 조건을 반영한 표준 근로계약서를 작성해야 합니다. 이 계약서는 반드시 근로자와 사용자가 모두 서명해야 합니다.

4. **관할 고용센터 신고**: 작성된 근로계약서를 관할 고용센터에 신고해야 합니다. 이 과정에서 기존의 계약을 근거로 정확한 정보가 제공되어야 하며, 고용센터에서 필요한 추가 문서를 요청할 수 있습니다.

5. **사업장 변경 신청**: 근로계약 조건이 다르게 운영되고 있음을 문서화한 후, 이를 바탕으로 사업장 변경 신청을 제출할 수 있습니다. 사업장 변경 신청은 근로계약 종료 후 1개월 이내에 이루어져야 하며, 신청서에는 이전 근무 조건과 변경 사항을 명시해야 합니다.

이러한 절차를 통해 근무 조건의 차이로 인한 근무지 변경이 이루어질 수 있습니다. 고용센터의 지침과 요구사항을 잘 준수하여 진행하시기 바랍니다.","['689b3a86ffd306c1cd3c094e', '689b3a86ffd306c1cd3c06f2', '689b3a86ffd306c1cd3c074d', '689b3a86ffd306c1cd3c092b', '689b3a86ffd306c1cd3c092c', '689b3a86ffd306c1cd3c0912', '689b3a86ffd306c1cd3c0990', '689b3a86ffd306c1cd3c093e', '689b3a86ffd306c1cd3c0931', '689b3a86ffd306c1cd3c06da', '689b3a86ffd306c1cd3c0929', '689b3a86ffd306c1cd3c091e', '689b3a86ffd306c1cd3c0930', '689b3a86ffd306c1cd3c096f', '689b3a86ffd306c1cd3c0925', '689b3a86ffd306c1cd3c08f0', '689b3a86ffd306c1cd3c07fa', '689b3a86ffd306c1cd3c09a5', '689b3a86ffd306c1cd3c072a', '689b3a86ffd306c1cd3c092e']",1,1.0
"비자 만료 전에 연장을 신청하려고 할 때, 어떤 기관에 방문해야 하고 온라인으로도 신청할 수 있나요?","Viza muddati tugashidan oldin uzaytirishga ariza bermoqchi bo‘lsam, qaysi idoraga borishim kerak va onlayn tarzda ham ariza topshirish mumkinmi?",우즈베크어,['689b3a86ffd306c1cd3c06de'],체류자격,https://www.workinkorea.org/,홍석주,,,비자 만료 전에 연장을 신청하고 싶습니다. 어떤 기관에 가야 하며 온라인으로도 신청할 수 있나요?,"[{'$search': {'index': 'text', 'compound': {'should': [{'text': {'query': ['비자 연장', '비자 신청', '비자 만료', '온라인 신청'], 'path': ['title', 'contents'], 'fuzzy': {'maxEdits': 1, 'prefixLength': 2}}}, {'phrase': {'query': '비자 연장 신청', 'path': 'title', 'slop': 2}}], 'minimumShouldMatch': 1}, 'highlight': {'path': ['title', 'contents']}}}, {'$project': {'_id': 1, 'title': 1, 'contents': 1, 'url': 1, 'score': {'$meta': 'searchScore'}, 'highlights': {'$meta': 'searchHighlights'}}}, {'$limit': 20}]","비자 연장을 원하신다면, 출입국·외국인청 또는 관할 출입국·외국인사무소에 가셔야 합니다. 비자 연장 허가는 본인이 직접 신청해야 합니다. 온라인으로도 신청이 가능합니다.

1. **온라인 신청**: 하이코리아 홈페이지를 통해 전자민원 서비스로 비자 연장 신청이 가능합니다.
   - 필요한 경우 '민원신청' 메뉴에서 '전자민원신청'을 선택하시면 됩니다.

2. **방문 신청**: 출입국·외국인청 또는 사무소에 방문하려면 온라인 방문 예약이 필요합니다.
   - 하이코리아 홈페이지의 '방문예약' 메뉴에서 예약 후 해당 기관을 방문하시면 됩니다.

연장 신청을 하실 때는 체류자격에 따라 요구되는 서류를 준비하셔야 합니다. 비자 연장을 신청하기 전에 필요한 서류와 절차를 미리 확인하시는 것이 좋습니다. 도움이 필요하시다면 외국인종합 안내센터(☎1345)에 문의하셔도 됩니다.","['689b3a86ffd306c1cd3c06de', '689b3a86ffd306c1cd3c087a', '689b3a86ffd306c1cd3c06e0', '689b3a86ffd306c1cd3c07c8', '689b3a86ffd306c1cd3c090a', '689b3a86ffd306c1cd3c08f8', '689b3a86ffd306c1cd3c0910', '689b3a86ffd306c1cd3c090b', '689b3a86ffd306c1cd3c0909', '689b3a86ffd306c1cd3c090c', '689b3a86ffd306c1cd3c06dc', '689b3a86ffd306c1cd3c08d6', '689b3a86ffd306c1cd3c0927', '689b3a86ffd306c1cd3c08ee', '689b3a86ffd306c1cd3c07b1', '689b3a86ffd306c1cd3c090e', '689b3a86ffd306c1cd3c090f', '689b3a86ffd306c1cd3c06f0', '689b3a86ffd306c1cd3c0870', '689b3a86ffd306c1cd3c090d']",1,1.0
세금이나 건강보험료를 체납한 경우에도 비자 연장이 가능한가요? 만약 미납 상태라면 어떤 제재가 따르나요?,"Kung may hindi nabayarang buwis o kontribusyon sa health insurance, posible pa rin ba ang pag-renew ng visa? At kung may utang pa, anong uri ng parusa ang ipapataw?",필리핀어 (타갈로그어),"['689b3a86ffd306c1cd3c0758', '689b3a86ffd306c1cd3c08f8']",체류자격,"https://www.immigration.go.kr/, https://www.moj.go.kr/",홍석주,,,만약 세금이나 건강 보험 기여금이 미납된 경우 비자를 갱신할 수 있나요? 그리고 만약 채무가 있다면 어떤 종류의 처벌이 부과되나요?,"[{'$search': {'index': 'text', 'compound': {'should': [{'text': {'query': ['비자 갱신', '세금 미납', '건강 보험', '처벌'], 'path': ['title', 'contents'], 'fuzzy': {'maxEdits': 1, 'prefixLength': 2}}}, {'phrase': {'query': '비자 갱신', 'path': 'title', 'slop': 2}}], 'minimumShouldMatch': 1}, 'highlight': {'path': ['title', 'contents']}}}, {'$project': {'_id': 1, 'title': 1, 'contents': 1, 'url': 1, 'score': {'$meta': 'searchScore'}, 'highlights': {'$meta': 'searchHighlights'}}}, {'$limit': 20}]","비자 갱신을 위해서는 세금이나 건강보험료가 미납된 경우 정상적으로 갱신이 어렵습니다. 한국에서는 '외국인 비자연장 전 세금체납 확인제도'가 운영되고 있어, 체납 사실이 확인되면 비자 연장이 제한됩니다.

세금이나 건강보험료를 미납한 경우, 출입국관리소에서 체납액을 모두 납부하라는 안내를 받게 되며, 그 후 정상적으로 비자가 연장될 수 있습니다. 만약 미납된 상태에서 비자 연장을 신청하면, 원칙적으로 6개월 이하의 제한적인 체류 연장이 허용될 수 있습니다.

또한, 세금 체납이나 건강보험료 미납의 경우 형사처벌이나 행정적 제재가 부과될 수 있습니다. 특히 반복적인 체납이나 법적인 조치를 회피하려는 시도가 있을 경우, 불이익(예: 출국 금지, 형사 고발 등)의 우려가 있습니다. 따라서, 체납 문제는 가능한 한 빨리 해결하는 것이 좋습니다.

궁극적으로, 비자를 갱신하고 원활한 체류를 위해서는 미납된 세금 및 건강보험료를 반드시 납부하는 것이 중요합니다. 만약 추가적인 조언이나 도움이 필요하면 관련 부서에 문의하여 보다 구체적인 상담을 받으시기 바랍니다.","['689b3a86ffd306c1cd3c08f8', '689b3a86ffd306c1cd3c098d', '689b3a86ffd306c1cd3c0758', '689b3a86ffd306c1cd3c090d', '689b3a86ffd306c1cd3c06ec', '689b3a86ffd306c1cd3c09a5', '689b3a86ffd306c1cd3c068d', '689b3a86ffd306c1cd3c06f0', '689b3a86ffd306c1cd3c090a', '689b3a86ffd306c1cd3c06c4', '689b3a86ffd306c1cd3c090c', '689b3a86ffd306c1cd3c06c3', '689b3a86ffd306c1cd3c06c6', '689b3a86ffd306c1cd3c0909', '689b3a86ffd306c1cd3c07b1', '689b3a86ffd306c1cd3c06af', '689b3a86ffd306c1cd3c090b', '689b3a86ffd306c1cd3c09c1', '689b3a86ffd306c1cd3c0748', '689b3a86ffd306c1cd3c08f0']",1,1.0
"근무하다가 작업 중 다쳐서 병원 치료를 받게 된 경우, 고용주가 산재보험에 가입하지 않았다면 재해보상을 받을 수 있나요? 그리고 어디에 문의해야 하나요?","Ish jarayonida jarohat olib, shifoxonada davolanishga to‘g‘ri kelgan taqdirda, agar ish beruvchi ishlab chiqarishdagi baxtsiz hodisalar sug‘urtasiga qo‘shilmagan bo‘lsa, men jarohat uchun tovon olishim mumkinmi? Shuningdek, bu borada qayerga murojaat qilishim kerak?",우즈베크어,"['689b3a86ffd306c1cd3c099b', '689b3a86ffd306c1cd3c09a7']",산재,"https://kin.naver.com/userinfo/answerList.naver?, https://easylaw.go.kr/CSP/CnpClsMain.laf?popMenu=ov&csmSeq=570&ccfNo=1&cciNo=1&cnpClsNo=1&search_put=isSearch=true&isWorry=false&u=LozJsi3cGuRd5Y5PklLl8GwBQI1V%2BpaEnpueNikIQss%3D&section=qna&sd=answer&query=%EC%99%B8%EA%B5%AD%EC%9D%B8&x=0&y=0",홍석주,,,"이 과정에서 부상을 입고 병원에서 치료를 받아야 하는 경우, 만약 고용주가 산업재해 보험에 가입하지 않았다면, 저는 부상에 대한 보상을 받을 수 있나요? 또한, 이와 관련하여 어디에 문의해야 하나요?","[{'$search': {'index': 'text', 'compound': {'should': [{'text': {'query': ['산업재해 보상', '부상 보상', '고용주 보험 미가입', '부상 치료'], 'path': ['title', 'contents'], 'fuzzy': {'maxEdits': 1, 'prefixLength': 2}}}, {'phrase': {'query': '부상 보상', 'path': 'title', 'slop': 2}}], 'minimumShouldMatch': 1}, 'highlight': {'path': ['title', 'contents']}}}, {'$project': {'_id': 1, 'title': 1, 'contents': 1, 'url': 1, 'score': {'$meta': 'searchScore'}, 'highlights': {'$meta': 'searchHighlights'}}}, {'$limit': 20}]","산업재해 보험에 가입하지 않은 고용주 아래에서 근무하면서 부상을 당한 경우, 법적으로 보상을 받는 것이 매우 복잡해질 수 있습니다. 일반적으로 산업재해 보험 가입이 필수인 사업장에서 근무하던 중 발생한 사고에 대해서는 법적으로 보상을 받을 권리가 있습니다. 그러나 고용주가 보험에 가입하지 않았다면, 해당 고용주에게 직접 손해배상을 청구해야 합니다.

현재 상황에서 다음의 조치를 고려해보세요:

1. **고용주와의 협상**: 부상에 따른 치료비 및 보상에 대해 고용주와 직접 대화하여 해결을 시도해보세요. 고용주가 보험에 가입하지 않았다면, 직접적인 보상 의무가 있습니다.

2. **상담 기관 문의**: 한국에서는 근로복지공단에 문의하여 필요한 정보를 얻을 수 있습니다. 그들은 산업재해와 관련한 상담을 제공하며, 구체적인 절차에 대한 안내를 받을 수 있습니다. 대표 전화는 ☎ 1588-0075입니다.

3. **법률 상담**: 만약 고용주가 적절히 보상하지 않거나 협상이 되지 않는 경우, 법률 전문가와 상담하여 손해배상을 청구하는 방법에 대해 알아보는 것이 좋습니다. 법무법인이나 변호사에게 상담받으면 더 정확한 정보를 제공받을 수 있습니다.

4. **노동부 신고**: 고용주가 산업재해 보험 가입 의무를 이행하지 않은 경우, 고용노동부에 신고할 수 있습니다. 이는 해당 고용주에 대한 조치를 촉구하는 역할을 할 수 있습니다.

불행히도, 고용주가 보험에 가입하지 않은 경우 보상받지 못할 경우가 많기 때문에, 이러한 상황에 대비해 법적 조치를 고려하는 것이 중요합니다.","['689b3a86ffd306c1cd3c0956', '689b3a86ffd306c1cd3c09a8', '689b3a86ffd306c1cd3c09c8', '689b3a86ffd306c1cd3c09b7', '689b3a86ffd306c1cd3c09a6', '689b3a86ffd306c1cd3c09b2', '689b3a86ffd306c1cd3c09af', '689b3a86ffd306c1cd3c09b3', '689b3a86ffd306c1cd3c06f1', '689b3a86ffd306c1cd3c09b4', '689b3a86ffd306c1cd3c09a9', '689b3a86ffd306c1cd3c09a7', '689b3a86ffd306c1cd3c09b6', '689b3a86ffd306c1cd3c09ab', '689b3a86ffd306c1cd3c099b', '689b3a86ffd306c1cd3c09c6', '689b3a86ffd306c1cd3c09b5', '689b3a86ffd306c1cd3c09c1', '689b3a86ffd306c1cd3c09c7', '689b3a86ffd306c1cd3c09c3']",1,1.0
"업무 중 감염병에 걸렸을 때, 이를 업무상 질병으로 인정받으려면 어떤 기준이 적용되나요?","Kapag nahawa ng nakakahawang sakit habang nagtatrabaho, anong pamantayan ang ginagamit para ito ay kilalanin bilang sakit na dulot ng trabaho?",필리핀어 (타갈로그어),"['689b3a86ffd306c1cd3c09b7', '689b3a86ffd306c1cd3c09bc']",산재,"https://easylaw.go.kr/CSP/CnpClsMain.laf?popMenu=ov&csmSeq=570&ccfNo=1&cciNo=1&cnpClsNo=1&search_put=, https://easylaw.go.kr/CSP/CnpClsMain.laf?popMenu=ov&csmSeq=570&ccfNo=1&cciNo=1&cnpClsNo=1&search_put=",홍석주,,,"근무 중 전염병에 감염되었을 때, 이를 직업병으로 인정하기 위해 어떤 기준이 사용되나요?","[{'$search': {'index': 'text', 'compound': {'should': [{'text': {'query': ['직업병', '감염병', '근무 중 감염', '전염병'], 'path': ['title', 'contents'], 'fuzzy': {'maxEdits': 1, 'prefixLength': 2}}}, {'phrase': {'query': '직업병 기준', 'path': 'title', 'slop': 2}}], 'minimumShouldMatch': 1}, 'highlight': {'path': ['title', 'contents']}}}, {'$project': {'_id': 1, 'title': 1, 'contents': 1, 'url': 1, 'score': {'$meta': 'searchScore'}, 'highlights': {'$meta': 'searchHighlights'}}}, {'$limit': 20}]","근무 중 전염병에 감염되었을 때, 이를 직업병으로 인정하기 위한 기준은 다음과 같습니다:

1. **임상적 기준**: 먼저, 감염된 질병이 B형 간염, C형 간염, 매독, 후천성면역결핍증 같은 혈액전파성 질병이거나 결핵, 풍진, 홍역, 인플루엔자 같은 공기전파성 질병일 수 있습니다. 이러한 질병은 특정 직종에서 근무하는 동안 발생해야 합니다.

2. **업무 관련성**: 근로자가 해당 전염병에 감염되었음을 의학적으로 인정받아야 하며, 감염이 업무 수행 과정에서 발생했음을 입증해야 합니다. 예를 들어, 의료 종사자나 집단시설 근로자가 환자와의 접촉으로 인해 감염된 경우, 그 인과관계를 입증하는 자료가 필요합니다.

3. **감염 경로**: 감염된 경로가 업무와 밀접하게 관련이 있는 경우에만 인정됩니다. 예를 들어, 병원이나 의료시설에서 업무 중 감염된 경우 해당됩니다.

이러한 기준을 충족하는 경우, 근로자는 해당 전염병을 업무상 질병으로 인정받을 수 있으며, 산업재해보상보험을 통한 보상 등을 받을 수 있습니다. 만약 이러한 기준에 대한 구체적인 사례나 더 자세한 정보가 필요하시다면, 근로복지공단에 문의하시거나 상담을 받는 것이 좋습니다.","['689b3a86ffd306c1cd3c09bc', '689b3a86ffd306c1cd3c09bf', '689b3a86ffd306c1cd3c09bb', '689b3a86ffd306c1cd3c09bd', '689b3a86ffd306c1cd3c09b7', '689b3a86ffd306c1cd3c09ba', '689b3a86ffd306c1cd3c09be', '689b3a86ffd306c1cd3c0929', '689b3a86ffd306c1cd3c08b6', '689b3a86ffd306c1cd3c070e', '689b3a86ffd306c1cd3c08fb', '689b3a86ffd306c1cd3c09b5', '689b3a86ffd306c1cd3c0994', '689b3a86ffd306c1cd3c096c', '689b3a86ffd306c1cd3c067f', '689b3a86ffd306c1cd3c06fc', '689b3a86ffd306c1cd3c0728', '689b3a86ffd306c1cd3c0720', '689b3a86ffd306c1cd3c0954', '689b3a86ffd306c1cd3c0979']",1,1.0
"출국만기보험금을 신청하려면 어떤 자격 요건을 충족해야 하고, 신청 시기는 언제부터 가능한가요?",申请出国满期保险金需要符合哪些资格条件？从什么时候开始可以申请呢？,중국어,"['689b3a86ffd306c1cd3c0744', '689b3a86ffd306c1cd3c0831']",보험,"https://eps.hrdkorea.or.kr/, https://www.moel.go.kr/minwon/fastcounsel/fastcounselView.do?inetDcssMngId=202207041501442181000",홍석주,,,출국 만기 보험금을 신청하려면 어떤 자격 조건을 충족해야 하나요? 언제부터 신청할 수 있나요?,"[{'$search': {'index': 'text', 'compound': {'should': [{'text': {'query': ['출국 보험금', '만기 보험금', '보험금 신청 자격', '보험금 신청 시기'], 'path': ['title', 'contents'], 'fuzzy': {'maxEdits': 1, 'prefixLength': 2}}}, {'phrase': {'query': '보험금 신청', 'path': 'title', 'slop': 2}}], 'minimumShouldMatch': 1}, 'highlight': {'path': ['title', 'contents']}}}, {'$project': {'_id': 1, 'title': 1, 'contents': 1, 'url': 1, 'score': {'$meta': 'searchScore'}, 'highlights': {'$meta': 'searchHighlights'}}}, {'$limit': 20}]","출국 만기 보험금을 신청하려면 다음과 같은 자격 조건을 충족해야 합니다:

1. **1년 이상 근무**: 보험금 신청을 하기 위해서는 동일 사업장에서 1년 이상 근무해야 합니다.
2. **출국 사유 발생**: 출국이 필요해야 하며, 이는 체류 기간 만료, 자진 출국, 또는 강제 출국 등 다양한 사유가 포함됩니다.

신청 시기는 출국 전과 후 모두 가능합니다. 만약 출국 전 보험금을 신청하지 못한 경우, 출국한 후에도 신청할 수 있습니다. 신청은 해당 고용센터에 외국인노동자 고용변동 신고서를 제출한 후, 한국산업인력공단 또는 삼성화재해상보험에 보험금 신청서를 제출하여 진행됩니다.

추가적인 질문이나 도움이 필요하시면 언제든지 말씀해 주세요!","['689b3a86ffd306c1cd3c09d5', '689b3a86ffd306c1cd3c0938', '689b3a86ffd306c1cd3c0937', '689b3a86ffd306c1cd3c0775', '689b3a86ffd306c1cd3c09d0', '689b3a86ffd306c1cd3c0744', '689b3a86ffd306c1cd3c0858', '689b3a86ffd306c1cd3c0936', '689b3a86ffd306c1cd3c093b', '689b3a86ffd306c1cd3c0809', '689b3a86ffd306c1cd3c09db', '689b3a86ffd306c1cd3c0935', '689b3a86ffd306c1cd3c096f', '689b3a86ffd306c1cd3c093a', '689b3a86ffd306c1cd3c07bf', '689b3a86ffd306c1cd3c089b', '689b3a86ffd306c1cd3c08ab', '689b3a86ffd306c1cd3c09d4', '689b3a86ffd306c1cd3c0939', '689b3a86ffd306c1cd3c08e8']",1,0.5
"본국으로 돌아갈 때, 귀국비용보험은 언제부터 신청할 수 있으며, 어떤 서류를 준비해야 하나요?","When returning to my home country, from when can I apply for the return cost insurance, and what documents do I need to prepare?",영어,"['689b3a86ffd306c1cd3c0831', '689b3a86ffd306c1cd3c0744']",보험,"https://www.moel.go.kr/minwon/fastcounsel/fastcounselView.do?inetDcssMngId=202207041501442181000, https://eps.hrdkorea.or.kr/",홍석주,,,"내 고국으로 돌아갈 때, 언제부터 귀국 비용 보험을 신청할 수 있으며, 어떤 서류를 준비해야 하나요?","[{'$search': {'index': 'text', 'compound': {'should': [{'text': {'query': ['귀국 비용 보험', '보험 신청', '서류 준비', '귀국 절차'], 'path': ['title', 'contents'], 'fuzzy': {'maxEdits': 1, 'prefixLength': 2}}}, {'phrase': {'query': '귀국 비용 보험', 'path': 'title', 'slop': 2}}], 'minimumShouldMatch': 1}, 'highlight': {'path': ['title', 'contents']}}}, {'$project': {'_id': 1, 'title': 1, 'contents': 1, 'url': 1, 'score': {'$meta': 'searchScore'}, 'highlights': {'$meta': 'searchHighlights'}}}, {'$limit': 20}]","귀국 비용 보험을 신청할 수 있는 시점은 출국 예정일의 1개월 전부터 가능합니다. 만약 대체인력을 신청하는 경우에는 6개월 전부터 신청할 수 있습니다.

준비해야 할 서류는 다음과 같습니다:
1. 귀국 비용 보험 신청서
2. 항공권 사본
3. 외국인 등록증
4. 여권 사본

신청은 가까운 고용센터를 방문하거나, 온라인(EPS 홈페이지 www.eps.go.kr) 또는 모바일 앱을 통해 할 수 있습니다. 귀국 비용 보험을 통해 귀국 시 필요한 비용을 지원받을 수 있으니, 잊지 말고 신청하시기 바랍니다.","['689b3a86ffd306c1cd3c0831', '689b3a86ffd306c1cd3c0744', '689b3a86ffd306c1cd3c09d5', '689b3a86ffd306c1cd3c09d4', '689b3a86ffd306c1cd3c0941', '689b3a86ffd306c1cd3c089a', '689b3a86ffd306c1cd3c0742', '689b3a86ffd306c1cd3c0940', '689b3a86ffd306c1cd3c06e2', '689b3a86ffd306c1cd3c090b', '689b3a86ffd306c1cd3c09d6', '689b3a86ffd306c1cd3c0743', '689b3a86ffd306c1cd3c093b', '689b3a86ffd306c1cd3c0735', '689b3a86ffd306c1cd3c090c', '689b3a86ffd306c1cd3c072f', '689b3a86ffd306c1cd3c090a', '689b3a86ffd306c1cd3c0972', '689b3a86ffd306c1cd3c072e', '689b3a86ffd306c1cd3c0909']",1,1.0
