query,translated_query,언어,ground_truth_id,category,source,작성자,비고,소스,translated_4o_mini,mongo_query_4o_mini,answer,retrieved_doc_ids,correctness,recall_at_k
"E-9 비자를 가진 외국인근로자가 근무 조건이 근로계약서와 다르다고 주장할 경우, 사업장 변경 사유로 인정받을 수 있나요? 그리고 이 경우 어떤 절차를 거쳐야 하나요?",持有E-9签证的外国劳动者，如果主张工作条件与劳动合同不符，这种情况能被认可为变更工作单位的理由吗？如果可以，需要经过哪些程序呢？,중국어,"['689b3a86ffd306c1cd3c06f2', '689b3a86ffd306c1cd3c094e']",사업장변경,"https://www.easylaw.go.kr/CSP/UnScOnhunListRlt.laf?onhunqnaAstSeq=&curPage=1&outmax=10&sch=%EC%99%B8%EA%B5%AD%EC%9D%B8&fsort=%5C, https://www.workinkorea.org/",홍석주,,,"E-9 비자를 가진 외국인 노동자가 근무 조건이 노동 계약과 다르다고 주장할 경우, 이는 근무지 변경 사유로 인정될 수 있나요? 가능하다면 어떤 절차를 거쳐야 하나요?","[{'$search': {'index': 'text', 'compound': {'should': [{'text': {'query': ['E-9 비자', '근무 조건', '노동 계약', '근무지 변경'], 'path': ['title', 'contents'], 'fuzzy': {'maxEdits': 1, 'prefixLength': 2}}}, {'phrase': {'query': '근무 조건 불일치', 'path': 'title', 'slop': 2}}], 'minimumShouldMatch': 1}, 'highlight': {'path': ['title', 'contents']}}}, {'$project': {'_id': 1, 'title': 1, 'contents': 1, 'url': 1, 'score': {'$meta': 'searchScore'}, 'highlights': {'$meta': 'searchHighlights'}}}, {'$limit': 20}]","E-9 비자를 가진 외국인 노동자가 근무 조건이 노동 계약과 다르다고 주장할 경우, 이는 근무지 변경 사유로 인정될 수 있습니다. 한국의 법령에 따르면 근로계약 조건과 사업장에서의 근로 조건에 차이가 있을 경우, 외국인 노동자는 사업장 변경을 신청할 수 있습니다.

이 경우의 구체적인 절차는 다음과 같습니다:

1. **근로계약서 확인**: 먼저, 본인이 체결한 근로계약서를 다시 한번 확인하여 근로 조건이 어떻게 명시되어 있는지를 확인합니다.

2. **사용자와의 대화**: 사용자(고용주)와의 대화를 통해 상황에 대한 논의를 시도합니다. 계약서에 명시된 조건과 실제 근로 조건 차이에 대해 충분히 설명하고 합의를 시도합니다.

3. **근로 계약 종료**: 만약 합의가 이루어지지 않거나 사용자와의 관계가 지속될 수 없다고 판단되면, 근로계약을 종료하는 절차를 밟아야 합니다.

4. **사업장 변경 신청**:
   - 사용자가 근로계약 기간 중 근로계약을 해지하거나, 근로조건 위반이 있을 경우 이를 명시하며 사업장 변경 신청서를 관할 고용센터에 제출합니다.
   - 근로계약 종료 후 **1개월 이내**에 사업장 변경 신청서를 제출해야 합니다.

5. **필요 서류 준비**: 변경 신청 시 다음과 같은 서류가 필요합니다:
   - 여권 및 외국인등록증
   - 근로계약서 사본
   - 이전 사업장의 사업자등록증 사본
   - 근로 조건이 변경됨을 입증할 수 있는 증빙자료(예: 통신 기록, 문자 메시지 등)

6. **고용센터의 심사**: 제출한 서류를 바탕으로 고용센터에서 심사 후, 사업장 변경 여부가 결정됩니다. 이 과정은 보통 **14일 이내**에 처리됩니다.

7. **새로운 사업장 선택 및 계약 체결**: 새로운 사업장이 정해지면, 해당 사업장과 다시 근로계약을 체결하고 이를 고용센터에 신고합니다.

이러한 절차를 통해 근로조건이 다르다고 주장하는 경우에 대한 대응을 할 수 있으며, 사업장 변경이 승인될 경우 새로운 근무지에서 다시 일할 수 있게 됩니다.","['689b3a86ffd306c1cd3c094e', '689b3a86ffd306c1cd3c06f2', '689b3a86ffd306c1cd3c074d', '689b3a86ffd306c1cd3c092b', '689b3a86ffd306c1cd3c092c', '689b3a86ffd306c1cd3c0912', '689b3a86ffd306c1cd3c0990', '689b3a86ffd306c1cd3c093e', '689b3a86ffd306c1cd3c0931', '689b3a86ffd306c1cd3c06da', '689b3a86ffd306c1cd3c0929', '689b3a86ffd306c1cd3c091e', '689b3a86ffd306c1cd3c0930', '689b3a86ffd306c1cd3c096f', '689b3a86ffd306c1cd3c0925', '689b3a86ffd306c1cd3c08f0', '689b3a86ffd306c1cd3c089f', '689b3a86ffd306c1cd3c07fa', '689b3a86ffd306c1cd3c09a5', '689b3a86ffd306c1cd3c072a']",1,1.0
"비자 만료 전에 연장을 신청하려고 할 때, 어떤 기관에 방문해야 하고 온라인으로도 신청할 수 있나요?","Viza muddati tugashidan oldin uzaytirishga ariza bermoqchi bo‘lsam, qaysi idoraga borishim kerak va onlayn tarzda ham ariza topshirish mumkinmi?",우즈베크어,['689b3a86ffd306c1cd3c06de'],체류자격,https://www.workinkorea.org/,홍석주,,,비자 만료 전에 연장을 신청하고 싶습니다. 어떤 기관에 가야 하며 온라인으로도 신청할 수 있나요?,"[{'$search': {'index': 'text', 'compound': {'should': [{'text': {'query': ['비자 연장', '비자 신청', '비자 만료', '온라인 신청'], 'path': ['title', 'contents'], 'fuzzy': {'maxEdits': 1, 'prefixLength': 2}}}, {'phrase': {'query': '비자 연장 신청', 'path': 'title', 'slop': 2}}], 'minimumShouldMatch': 1}, 'highlight': {'path': ['title', 'contents']}}}, {'$project': {'_id': 1, 'title': 1, 'contents': 1, 'url': 1, 'score': {'$meta': 'searchScore'}, 'highlights': {'$meta': 'searchHighlights'}}}, {'$limit': 20}]","비자 연장을 원하신다면, 출입국·외국인청이나 출입국·외국인사무소에 직접 방문하셔야 합니다. 또한, 온라인으로도 신청이 가능하니, 하이코리아 홈페이지를 통해 전자민원 신청을 이용하실 수 있습니다. 비자 연장을 위해서는 필요한 서류를 준비해 주셔야 하며, 방문 예약이 필요할 수 있습니다. 온라인 신청을 하실 경우, 하이코리아의 전자민원 메뉴를 통해 진행하시면 됩니다.

비자 연장을 신청하시기 전, 체류 자격에 따라 필요한 서류가 다를 수 있으니, 구체적인 요구 사항을 확인하기 위해 하이코리아 홈페이지를 참조하시거나 외국인종합안내센터(☎1345)로 문의하시길 권장합니다.","['689b3a86ffd306c1cd3c06de', '689b3a86ffd306c1cd3c087a', '689b3a86ffd306c1cd3c06e0', '689b3a86ffd306c1cd3c07c8', '689b3a86ffd306c1cd3c090a', '689b3a86ffd306c1cd3c08f8', '689b3a86ffd306c1cd3c0910', '689b3a86ffd306c1cd3c090b', '689b3a86ffd306c1cd3c0909', '689b3a86ffd306c1cd3c07cf', '689b3a86ffd306c1cd3c090c', '689b3a86ffd306c1cd3c06dc', '689b3a86ffd306c1cd3c08d6', '689b3a86ffd306c1cd3c0883', '689b3a86ffd306c1cd3c0927', '689b3a86ffd306c1cd3c08ee', '689b3a86ffd306c1cd3c07b1', '689b3a86ffd306c1cd3c090e', '689b3a86ffd306c1cd3c090f', '689b3a86ffd306c1cd3c06f0']",1,1.0
세금이나 건강보험료를 체납한 경우에도 비자 연장이 가능한가요? 만약 미납 상태라면 어떤 제재가 따르나요?,"Kung may hindi nabayarang buwis o kontribusyon sa health insurance, posible pa rin ba ang pag-renew ng visa? At kung may utang pa, anong uri ng parusa ang ipapataw?",필리핀어 (타갈로그어),"['689b3a86ffd306c1cd3c0758', '689b3a86ffd306c1cd3c08f8']",체류자격,"https://www.immigration.go.kr/, https://www.moj.go.kr/",홍석주,,,만약 세금이나 건강 보험 기여금이 미납된 경우 비자를 갱신할 수 있나요? 그리고 만약 채무가 있다면 어떤 종류의 처벌이 부과되나요?,"[{'$search': {'index': 'text', 'compound': {'should': [{'text': {'query': ['비자 갱신', '세금 미납', '건강 보험', '처벌'], 'path': ['title', 'contents'], 'fuzzy': {'maxEdits': 1, 'prefixLength': 2}}}, {'phrase': {'query': '비자 갱신', 'path': 'title', 'slop': 2}}], 'minimumShouldMatch': 1}, 'highlight': {'path': ['title', 'contents']}}}, {'$project': {'_id': 1, 'title': 1, 'contents': 1, 'url': 1, 'score': {'$meta': 'searchScore'}, 'highlights': {'$meta': 'searchHighlights'}}}, {'$limit': 20}]","비자를 갱신할 때 세금이나 건강보험 기여금이 미납된 경우, 비자 연장이 제한될 수 있습니다. 한국에서는 외국인의 체류 연장 신청 시 세금 및 건강보험료 체납 여부를 확인하고, 미납이 있을 경우 체납액을 납부해야 정상적인 비자 연장이 가능합니다. 미납 시에는 비자 연장이 거부되거나 제한적인 연장(대개 6개월 이하)만 허가될 수 있습니다.

체납에 대한 처벌로는 비자 연장 거부 외에도 강제퇴거 조치가 있을 수 있으며, 이는 일정 기간 내에 체납액을 납부하지 않으면 출국을 요구받거나 미등록외국인으로 분류될 위험이 있습니다. 따라서, 세금 및 건강보험료는 반드시 기한 내에 납부하는 것이 중요합니다.

해결 방안으로는 체납된 금액을 가능한 한 빨리 납부하고, 납부 후에는 관련 증명서를 보관하여 비자 연장 신청 시 함께 제출하는 것이 좋습니다. 만약 채무가 있다면, 관련 기관에 문의하여 상환 계획을 수립하고, 재정적인 문제를 해결하는 것이 후속 조치를 위해 필요할 수 있습니다.","['689b3a86ffd306c1cd3c08f8', '689b3a86ffd306c1cd3c098d', '689b3a86ffd306c1cd3c0758', '689b3a86ffd306c1cd3c090d', '689b3a86ffd306c1cd3c06ec', '689b3a86ffd306c1cd3c09a5', '689b3a86ffd306c1cd3c068d', '689b3a86ffd306c1cd3c06f0', '689b3a86ffd306c1cd3c090a', '689b3a86ffd306c1cd3c06e9', '689b3a86ffd306c1cd3c06c4', '689b3a86ffd306c1cd3c090c', '689b3a86ffd306c1cd3c06c3', '689b3a86ffd306c1cd3c06c6', '689b3a86ffd306c1cd3c0909', '689b3a86ffd306c1cd3c06b9', '689b3a86ffd306c1cd3c07b1', '689b3a86ffd306c1cd3c090f', '689b3a86ffd306c1cd3c06af', '689b3a86ffd306c1cd3c090b']",1,1.0
"근무하다가 작업 중 다쳐서 병원 치료를 받게 된 경우, 고용주가 산재보험에 가입하지 않았다면 재해보상을 받을 수 있나요? 그리고 어디에 문의해야 하나요?","Ish jarayonida jarohat olib, shifoxonada davolanishga to‘g‘ri kelgan taqdirda, agar ish beruvchi ishlab chiqarishdagi baxtsiz hodisalar sug‘urtasiga qo‘shilmagan bo‘lsa, men jarohat uchun tovon olishim mumkinmi? Shuningdek, bu borada qayerga murojaat qilishim kerak?",우즈베크어,"['689b3a86ffd306c1cd3c099b', '689b3a86ffd306c1cd3c09a7']",산재,"https://kin.naver.com/userinfo/answerList.naver?, https://easylaw.go.kr/CSP/CnpClsMain.laf?popMenu=ov&csmSeq=570&ccfNo=1&cciNo=1&cnpClsNo=1&search_put=isSearch=true&isWorry=false&u=LozJsi3cGuRd5Y5PklLl8GwBQI1V%2BpaEnpueNikIQss%3D&section=qna&sd=answer&query=%EC%99%B8%EA%B5%AD%EC%9D%B8&x=0&y=0",홍석주,,,"이 과정에서 부상을 입고 병원에서 치료를 받아야 하는 경우, 만약 고용주가 산업재해 보험에 가입하지 않았다면, 저는 부상에 대한 보상을 받을 수 있나요? 또한, 이와 관련하여 어디에 문의해야 하나요?","[{'$search': {'index': 'text', 'compound': {'should': [{'text': {'query': ['산업재해 보상', '부상 보상', '고용주 보험 미가입', '부상 치료'], 'path': ['title', 'contents'], 'fuzzy': {'maxEdits': 1, 'prefixLength': 2}}}, {'phrase': {'query': '부상 보상', 'path': 'title', 'slop': 2}}], 'minimumShouldMatch': 1}, 'highlight': {'path': ['title', 'contents']}}}, {'$project': {'_id': 1, 'title': 1, 'contents': 1, 'url': 1, 'score': {'$meta': 'searchScore'}, 'highlights': {'$meta': 'searchHighlights'}}}, {'$limit': 20}]","부상을 입고 병원에서 치료를 받아야 하는 경우, 고용주가 산업재해 보험에 가입하지 않았다면 보상을 받는 것이 어렵습니다. 그러나 귀하가 근로자의 지위를 가지고 있다면, 근로기준법에 따라 고용주에게 손해배상을 청구할 수 있습니다. 이 경우, 사고의 발생과 부상 사이에 인과관계를 입증해야 할 책임이 있습니다.

먼저, 부상으로 인한 치료 비용이나 휴업 손실 등을 보상받기를 원하신다면, 고용주에게 요청하시되, 그가 응하지 않을 경우에는 노동부나 근로복지공단에 상담을 요청할 수 있습니다. 또한, 법률적 조언을 받고 싶으시면 가까운 법률구조공단이나 변호사에게 상담하시길 추천드립니다.

문의할 곳:
- **근로복지공단**: ☎ 1588-0075
- **대한법률구조공단**: ☎ 132

이 기관들은 산업재해 관련 사항에 대해 전문적인 상담을 제공하며, 귀하의 상황에 맞는 안내를 받을 수 있습니다.","['689b3a86ffd306c1cd3c0956', '689b3a86ffd306c1cd3c09a8', '689b3a86ffd306c1cd3c0939', '689b3a86ffd306c1cd3c09c8', '689b3a86ffd306c1cd3c09b7', '689b3a86ffd306c1cd3c09a6', '689b3a86ffd306c1cd3c09b2', '689b3a86ffd306c1cd3c09af', '689b3a86ffd306c1cd3c09b3', '689b3a86ffd306c1cd3c06f1', '689b3a86ffd306c1cd3c09b4', '689b3a86ffd306c1cd3c09a9', '689b3a86ffd306c1cd3c09a7', '689b3a86ffd306c1cd3c09b6', '689b3a86ffd306c1cd3c09ab', '689b3a86ffd306c1cd3c099b', '689b3a86ffd306c1cd3c09c6', '689b3a86ffd306c1cd3c09b5', '689b3a86ffd306c1cd3c09c1', '689b3a86ffd306c1cd3c09c7']",1,1.0
"업무 중 감염병에 걸렸을 때, 이를 업무상 질병으로 인정받으려면 어떤 기준이 적용되나요?","Kapag nahawa ng nakakahawang sakit habang nagtatrabaho, anong pamantayan ang ginagamit para ito ay kilalanin bilang sakit na dulot ng trabaho?",필리핀어 (타갈로그어),"['689b3a86ffd306c1cd3c09b7', '689b3a86ffd306c1cd3c09bc']",산재,"https://easylaw.go.kr/CSP/CnpClsMain.laf?popMenu=ov&csmSeq=570&ccfNo=1&cciNo=1&cnpClsNo=1&search_put=, https://easylaw.go.kr/CSP/CnpClsMain.laf?popMenu=ov&csmSeq=570&ccfNo=1&cciNo=1&cnpClsNo=1&search_put=",홍석주,,,"근무 중 전염병에 감염되었을 때, 이를 직업병으로 인정하기 위해 어떤 기준이 사용되나요?","[{'$search': {'index': 'text', 'compound': {'should': [{'text': {'query': ['직업병', '감염병', '근무 중 감염', '전염병'], 'path': ['title', 'contents'], 'fuzzy': {'maxEdits': 1, 'prefixLength': 2}}}, {'phrase': {'query': '직업병 기준', 'path': 'title', 'slop': 2}}], 'minimumShouldMatch': 1}, 'highlight': {'path': ['title', 'contents']}}}, {'$project': {'_id': 1, 'title': 1, 'contents': 1, 'url': 1, 'score': {'$meta': 'searchScore'}, 'highlights': {'$meta': 'searchHighlights'}}}, {'$limit': 20}]","근무 중 전염병에 감염되었을 경우 이를 직업병으로 인정받기 위해서는 몇 가지 기준이 있습니다. 한국의 산업재해보상보험법에 따르면, 다음과 같은 감염성 질병이 업무상 질병으로 인정됩니다:

1. **감염성 질병의 종류**: 보건의료 또는 집단수용시설에 종사하는 근로자에 해당하는 질병으로, 예를 들어 B형 간염, C형 간염, 결핵, 인플루엔자 등이 있습니다.

2. **업무와의 인과관계**: 근로자가 감염성 질병에 걸린 것이 업무 수행과 직접적인 관련이 있어야 합니다. 예를 들어, 해당 전염병이 근로자가 일하는 직종의 특성상 발생한 경우라면 그 인과관계를 입증할 수 있습니다.

3. **전문가의 의학적 확인**: 직업병으로 인정되기 위해서는 해당 질병이 근로자의 업무 또는 환경의 유해 요인과 관련이 있는 것으로 의학적으로 입증되어야 합니다.

4. **노출 경과**: 감염성 질병으로 인한 증상이 발생하기 전, 해당 업무와 연관된 유해한 환경이나 노출이 있었음을 보여줄 필요가 있습니다.

위 조건들이 충족되면, 근로자는 발생한 질병을 직업병으로 인정받고 관련 보상을 청구할 수 있습니다.
추가적으로 전문가의 진단서와 관련 문서 등을 준비하는 것이 좋습니다. 필요한 경우, 근로복지공단이나 관련 기관에 상담을 요청하는 것도 좋은 방법입니다.","['689b3a86ffd306c1cd3c09bc', '689b3a86ffd306c1cd3c09bf', '689b3a86ffd306c1cd3c09bb', '689b3a86ffd306c1cd3c09bd', '689b3a86ffd306c1cd3c09b7', '689b3a86ffd306c1cd3c09ba', '689b3a86ffd306c1cd3c09be', '689b3a86ffd306c1cd3c0929', '689b3a86ffd306c1cd3c08b6', '689b3a86ffd306c1cd3c070e', '689b3a86ffd306c1cd3c08fb', '689b3a86ffd306c1cd3c06a1', '689b3a86ffd306c1cd3c09b5', '689b3a86ffd306c1cd3c07ac', '689b3a86ffd306c1cd3c0994', '689b3a86ffd306c1cd3c096c', '689b3a86ffd306c1cd3c067f', '689b3a86ffd306c1cd3c0691', '689b3a86ffd306c1cd3c06fc', '689b3a86ffd306c1cd3c06f2']",1,1.0
"출국만기보험금을 신청하려면 어떤 자격 요건을 충족해야 하고, 신청 시기는 언제부터 가능한가요?",申请出国满期保险金需要符合哪些资格条件？从什么时候开始可以申请呢？,중국어,"['689b3a86ffd306c1cd3c0744', '689b3a86ffd306c1cd3c0831']",보험,"https://eps.hrdkorea.or.kr/, https://www.moel.go.kr/minwon/fastcounsel/fastcounselView.do?inetDcssMngId=202207041501442181000",홍석주,,,출국 만기 보험금을 신청하려면 어떤 자격 조건을 충족해야 하나요? 언제부터 신청할 수 있나요?,"[{'$search': {'index': 'text', 'compound': {'should': [{'text': {'query': ['출국 보험금', '만기 보험금', '보험금 신청 자격', '보험금 신청 시기'], 'path': ['title', 'contents'], 'fuzzy': {'maxEdits': 1, 'prefixLength': 2}}}, {'phrase': {'query': '보험금 신청', 'path': 'title', 'slop': 2}}], 'minimumShouldMatch': 1}, 'highlight': {'path': ['title', 'contents']}}}, {'$project': {'_id': 1, 'title': 1, 'contents': 1, 'url': 1, 'score': {'$meta': 'searchScore'}, 'highlights': {'$meta': 'searchHighlights'}}}, {'$limit': 20}]","출국 만기 보험금을 신청하기 위해서는 다음과 같은 조건을 충족해야 합니다:

1. **근무 기간**: 사업장에서 최소 1년 이상 근무해야 합니다. 2014년 7월 30일 이후에 근로개시된 외국인 근로자가 해당됩니다.

2. **출국 사유**: 출국 만기 보험금은 체류 기간 만료, 자진 출국, 강제 출국 등의 사유로 인한 출국 시에 신청할 수 있습니다.

보험금 신청은 출국 전에 신청하는 것이 원칙이지만, 출국 후에도 신청할 수 있습니다. 출국하기 전에 보험금을 신청하셨다면, 출국 후 14일 이내에 지급받게 됩니다. 신청은 한국산업인력공단 본부나 삼성화재해상보험에 할 수 있습니다.

즉, 출국 만기 보험금을 신청하시려면 1년 이상 근무하셨고, 출국 사유가 확인되어야 합니다. 신청 방법이 궁금하시면 관련 기관에 문의하시기 바랍니다!","['689b3a86ffd306c1cd3c09d5', '689b3a86ffd306c1cd3c0938', '689b3a86ffd306c1cd3c0937', '689b3a86ffd306c1cd3c0775', '689b3a86ffd306c1cd3c09d0', '689b3a86ffd306c1cd3c0744', '689b3a86ffd306c1cd3c0858', '689b3a86ffd306c1cd3c0936', '689b3a86ffd306c1cd3c093b', '689b3a86ffd306c1cd3c0809', '689b3a86ffd306c1cd3c09db', '689b3a86ffd306c1cd3c0935', '689b3a86ffd306c1cd3c09d1', '689b3a86ffd306c1cd3c096f', '689b3a86ffd306c1cd3c093a', '689b3a86ffd306c1cd3c07bf', '689b3a86ffd306c1cd3c089b', '689b3a86ffd306c1cd3c08ab', '689b3a86ffd306c1cd3c09d4', '689b3a86ffd306c1cd3c0971']",1,0.5
"본국으로 돌아갈 때, 귀국비용보험은 언제부터 신청할 수 있으며, 어떤 서류를 준비해야 하나요?","When returning to my home country, from when can I apply for the return cost insurance, and what documents do I need to prepare?",영어,"['689b3a86ffd306c1cd3c0831', '689b3a86ffd306c1cd3c0744']",보험,"https://www.moel.go.kr/minwon/fastcounsel/fastcounselView.do?inetDcssMngId=202207041501442181000, https://eps.hrdkorea.or.kr/",홍석주,,,"내 고국으로 돌아갈 때, 언제부터 귀국 비용 보험을 신청할 수 있으며, 어떤 서류를 준비해야 하나요?","[{'$search': {'index': 'text', 'compound': {'should': [{'text': {'query': ['귀국 비용 보험', '보험 신청', '서류 준비', '귀국 절차'], 'path': ['title', 'contents'], 'fuzzy': {'maxEdits': 1, 'prefixLength': 2}}}, {'phrase': {'query': '귀국 비용 보험', 'path': 'title', 'slop': 2}}], 'minimumShouldMatch': 1}, 'highlight': {'path': ['title', 'contents']}}}, {'$project': {'_id': 1, 'title': 1, 'contents': 1, 'url': 1, 'score': {'$meta': 'searchScore'}, 'highlights': {'$meta': 'searchHighlights'}}}, {'$limit': 20}]","귀국 비용 보험을 신청하려면, 출국 예정일의 1개월 이전부터 가능합니다. 만약 대체 인력을 신청하는 경우, 6개월 전부터 신청할 수 있습니다.

필요한 서류는 다음과 같습니다:

1. **출국 예정 신고서** - 해당 양식을 작성해야 합니다.
2. **항공권 사본** - 귀국할 항공권의 사본을 제출해야 합니다.
3. **외국인 등록증** - 본인의 외국인 등록증 사본을 준비하세요.
4. **여권 사본** - 유효한 여권의 사본을 첨부해야 합니다.

이 서류들을 지참하여 인근 고용센터에 방문하거나, 온라인으로 신청할 수 있습니다. 온라인 신청은 EPS 홈페이지나 외국인고용관리 앱을 통해 가능합니다.

궁금한 점이 있으면 언제든지 물어보세요!","['689b3a86ffd306c1cd3c0831', '689b3a86ffd306c1cd3c0744', '689b3a86ffd306c1cd3c09d5', '689b3a86ffd306c1cd3c09d4', '689b3a86ffd306c1cd3c0941', '689b3a86ffd306c1cd3c089a', '689b3a86ffd306c1cd3c0742', '689b3a86ffd306c1cd3c0940', '689b3a86ffd306c1cd3c0937', '689b3a86ffd306c1cd3c06f0', '689b3a86ffd306c1cd3c06e2', '689b3a86ffd306c1cd3c090b', '689b3a86ffd306c1cd3c09d6', '689b3a86ffd306c1cd3c0743', '689b3a86ffd306c1cd3c093b', '689b3a86ffd306c1cd3c0735', '689b3a86ffd306c1cd3c090c', '689b3a86ffd306c1cd3c09ad', '689b3a86ffd306c1cd3c072f', '689b3a86ffd306c1cd3c090a']",1,1.0
