query,translated_query,언어,ground_truth_id,category,source,작성자,비고,소스,translated_4o_mini,mongo_query_4o_mini,answer,retrieved_doc_ids,correctness,recall_at_k
"제 여자친구가 단속으로 출입국 보호소에 있습니다. 월급이 아직 들어오지 않았는데, 태국으로 가버리면 밀린 월급은 어떻게 받죠..",แฟนของผมถูกจับกุมและอยู่ที่ศูนย์กักตัวตรวจคนเข้าเมือง ตอนนี้ยังไม่ได้รับเงินเดือนเลย ถ้าต้องกลับประเทศไทยแล้ว จะได้รับเงินเดือนที่ค้างอยู่ได้อย่างไรครับ..,태국어,"['689b3a86ffd306c1cd3c09a4', '689b3a86ffd306c1cd3c071e', '689b3a86ffd306c1cd3c074b', '689b3a86ffd306c1cd3c0789', '689b3a86ffd306c1cd3c07d3', '689b3a86ffd306c1cd3c0819', '689b3a86ffd306c1cd3c084e', '689b3a86ffd306c1cd3c0855', '689b3a86ffd306c1cd3c0874', '689b3a86ffd306c1cd3c087d', '689b3a86ffd306c1cd3c087f', '689b3a86ffd306c1cd3c0887', '689b3a86ffd306c1cd3c08dc', '689b3a86ffd306c1cd3c093b']",임금체불,경기도외국인지원센터_상담사례,황예원,,https://gmhr.or.kr/case/1529?sca=%EC%9E%84%EA%B8%88%EC%B2%B4%EB%B6%88&page=2,"제 여자친구가 체포되어 이민 구금 센터에 있습니다. 지금 급여를 받지 못하고 있는데, 태국으로 돌아가야 한다면 밀린 급여를 어떻게 받을 수 있을까요?","[{'$search': {'index': 'text', 'compound': {'should': [{'text': {'query': ['임금체불', '체불임금', '급여 미지급', '임금 청구'], 'path': ['title', 'contents'], 'fuzzy': {'maxEdits': 1, 'prefixLength': 2}}}, {'phrase': {'query': '임금 체불', 'path': 'title', 'slop': 2}}], 'minimumShouldMatch': 1}, 'highlight': {'path': ['title', 'contents']}}}, {'$project': {'_id': 1, 'title': 1, 'contents': 1, 'url': 1, 'score': {'$meta': 'searchScore'}, 'highlights': {'$meta': 'searchHighlights'}}}, {'$limit': 20}]","여자친구분이 현재 이민 구금 센터에 계신 상황에서 밀린 급여를 받는 것은 어려운 일이지만, 몇 가지 방법을 통해 시도해볼 수 있습니다.

1. **관할 노동청에 진정 제기**: 여자친구분의 근무지가 있는 곳의 관할 지방고용노동청에 임금체불 진정을 제기할 수 있습니다. 진정서는 인터넷을 통해 제출하거나 직접 방문하여 작성할 수 있습니다. 이를 위해 필요한 서류(근로계약서, 임금지급 관련 자료 등)를 준비하는 것이 중요합니다.

2. **대리인 지정**: 여자친구분이 구금 상태이기 때문에, 그녀의 동의를 받아서 대리인을 지정할 수 있습니다. 이 대리인은 진정서 제출이나 기타 필요한 업무를 대행할 수 있습니다.

3. **민사소송 고려**: 만약 위의 방법이 원활히 진행되지 않는다면 민사소송을 통해 지급받을 수도 있습니다. 이 경우에는 비용이 발생할 수 있으므로 사전 상담이 필요합니다.

4. **법률 지원 활용**: 대한법률구조공단에 문의하여 무료 법률 상담을 받을 수 있습니다. 법률 전문가의 조언을 받으면 보다 적절한 조치를 취하는 데 도움이 될 것입니다.

5. **국민신문고 활용**: 한국행정안전부의 국민신문고 웹사이트를 통해 임금체불 신고도 가능합니다. 이 방법도 고려해보세요.

여자친구분이 빨리 구금에서 풀리시기를 바랍니다. 밀린 급여를 받기 위한 모든 절차가 순조롭게 진행될 수 있도록 최선을 다해 도와주실 것을 권장합니다. 추가적으로 더 궁금하신 점이 있으시면 언제든지 문의해 주세요.","['689b3a86ffd306c1cd3c09a4', '689b3a86ffd306c1cd3c0960', '689b3a86ffd306c1cd3c07e6', '689b3a86ffd306c1cd3c07c5', '689b3a86ffd306c1cd3c0744', '689b3a86ffd306c1cd3c06c8', '689b3a86ffd306c1cd3c0685', '689b3a86ffd306c1cd3c0874', '689b3a86ffd306c1cd3c0819', '689b3a86ffd306c1cd3c087f', '689b3a86ffd306c1cd3c071e', '689b3a86ffd306c1cd3c0790', '689b3a86ffd306c1cd3c0823', '689b3a86ffd306c1cd3c0772', '689b3a86ffd306c1cd3c0789', '689b3a86ffd306c1cd3c0894', '689b3a86ffd306c1cd3c098b', '689b3a86ffd306c1cd3c07e5', '689b3a86ffd306c1cd3c07d3', '689b3a86ffd306c1cd3c0898']",1,0.5
"안녕하세요, 건설 현장에서 일하고 있는 사람인데, 사장님이 월급을 안줘서 계좌가 압류될 것 같습니다. 이런 경우 어떻게 해야 하나요?",你好，我是在建筑工地工作的，但老板没有发工资，我的账户可能会被查封。遇到这种情况该怎么办呢？,중국어,"['689b3a86ffd306c1cd3c06e8', '689b3a86ffd306c1cd3c0744', '689b3a86ffd306c1cd3c09a4', '689b3a86ffd306c1cd3c071e', '689b3a86ffd306c1cd3c074b', '689b3a86ffd306c1cd3c0789', '689b3a86ffd306c1cd3c07d3', '689b3a86ffd306c1cd3c0819', '689b3a86ffd306c1cd3c084e', '689b3a86ffd306c1cd3c0855', '689b3a86ffd306c1cd3c0874', '689b3a86ffd306c1cd3c087d', '689b3a86ffd306c1cd3c087f', '689b3a86ffd306c1cd3c0887', '689b3a86ffd306c1cd3c08dc', '689b3a86ffd306c1cd3c093b']",임금체불,경기도외국인지원센터_상담사례,황예원,"임금체불 및 ""압류방지 통장"" (=임금채권 전용통장) 관련 데이터 필요",https://gmhr.or.kr/case/1493?sca=%EC%9E%84%EA%B8%88%EC%B2%B4%EB%B6%88&page=2,"저는 건설 현장에서 일하고 있지만, 사장이 급여를 지급하지 않았습니다. 제 계좌가 압류될 수 있는 상황인데, 이런 경우 어떻게 해야 하나요?","[{'$search': {'index': 'text', 'compound': {'should': [{'text': {'query': ['임금체불', '급여 미지급', '계좌 압류', '임금 청구'], 'path': ['title', 'contents'], 'fuzzy': {'maxEdits': 1, 'prefixLength': 2}}}, {'phrase': {'query': '임금 체불', 'path': 'title', 'slop': 2}}], 'minimumShouldMatch': 1}, 'highlight': {'path': ['title', 'contents']}}}, {'$project': {'_id': 1, 'title': 1, 'contents': 1, 'url': 1, 'score': {'$meta': 'searchScore'}, 'highlights': {'$meta': 'searchHighlights'}}}, {'$limit': 20}]","급여를 지급받지 못하는 상황은 매우 심각하며, 반드시 해결해야 합니다. 다음과 같은 단계로 진행해 보시기를 권장합니다.

1. **급여 지급 요구**: 우선, 사장에게 급여를 지급해 달라고 정중하게 요청하세요. 서면으로 요청하는 것이 좋으며, 다음과 같은 내용을 포함해야 합니다.
   - 근로 계약서에 따른 급여 지급 약속
   - 미지급 급여의 총액
   - 급여 지급 요청의 날짜

2. **증거 수집**: 급여 미지급과 관련하여 이메일, 문자 메시지, 근로 계약서 등의 증거 자료를 모아 두세요. 이 자료는 나중에 필요할 수 있습니다.

3. **관할 노동청에 진정 제기**: 급여 지급 요청에도 불구하고 사장이 지급하지 않는다면, 근무지의 관할 지방고용노동청에 진정을 제기할 수 있습니다. 이 과정에서 필요한 서류는 다음과 같습니다.
   - 진정서 (고용노동부 홈페이지에서 다운받을 수 있음)
   - 근로 계약서 및 급여와 관련된 증거 자료

4. **법적 조치 고려**: 만약 노동청에서 해결되지 않거나 사장이 계속 무시할 경우, 민사소송을 제기하는 방법도 있습니다. 이 경우 대한법률구조공단에서 무료 법률 상담을 받을 수 있으니 필요 시 문의하세요.

5. **계좌 압류 방지 조치**: 급여가 지급되지 않고 계좌가 압류될 경우, 법원에 긴급조치를 요청할 수 있습니다. 하지만 이는 복잡한 법적 절차가 필요하므로, 전문 변호사의 조언을 받는 것이 좋습니다.

마지막으로, 이러한 사안에 대해 법률적인 지원이 필요하다면 고용노동부 고객 상담센터(1350) 또는 대한법률구조공단(132)을 통해 추가 도움을 받을 수 있습니다. 힘내세요!","['689b3a86ffd306c1cd3c0960', '689b3a86ffd306c1cd3c0994', '689b3a86ffd306c1cd3c09a4', '689b3a86ffd306c1cd3c098b', '689b3a86ffd306c1cd3c08a7', '689b3a86ffd306c1cd3c071e', '689b3a86ffd306c1cd3c0971', '689b3a86ffd306c1cd3c0995', '689b3a86ffd306c1cd3c0992', '689b3a86ffd306c1cd3c09a8', '689b3a86ffd306c1cd3c0997', '689b3a86ffd306c1cd3c0880', '689b3a86ffd306c1cd3c0861', '689b3a86ffd306c1cd3c087f', '689b3a86ffd306c1cd3c0688', '689b3a86ffd306c1cd3c0819', '689b3a86ffd306c1cd3c087d', '689b3a86ffd306c1cd3c07b9', '689b3a86ffd306c1cd3c0801', '689b3a86ffd306c1cd3c0887']",1,0.375
"안녕하세요, 저는 필리핀에서 온 노동자입니다. 5년 동안 근무를 하고 이제 제 나라로 돌아가려 해요. 그런데 회사가 망해서 월급을 못받았습니다. 제 월급을 돌려받을 방법이 없나요?","Magandang araw, ako ay isang manggagawang mula sa Pilipinas. Nagtatrabaho ako nang 5 taon at ngayon ay babalik na sana ako sa aking bansa. Ngunit nalugi ang kompanya kaya hindi ko natanggap ang aking sahod. Wala po ba talagang paraan para mabawi ko ang aking sahod?",필리핀어 (타갈로그어),['689b3a86ffd306c1cd3c09a4'],임금체불,경기도외국인지원센터_상담사례,황예원,체당금 관련 데이터 필요,https://gmhr.or.kr/case/1667?sca=%EC%9E%84%EA%B8%88%EC%B2%B4%EB%B6%88,"안녕하세요, 저는 필리핀에서 온 근로자입니다. 5년 동안 일했으며 이제 제 나라로 돌아가고 싶습니다. 하지만 회사가 파산하여 제 급여를 받지 못했습니다. 제 급여를 회수할 방법이 정말 없나요?","[{'$search': {'index': 'text', 'compound': {'should': [{'text': {'query': ['임금체불', '체불임금', '급여 미지급', '임금 청구'], 'path': ['title', 'contents'], 'fuzzy': {'maxEdits': 1, 'prefixLength': 2}}}, {'phrase': {'query': '급여 회수', 'path': 'title', 'slop': 2}}], 'minimumShouldMatch': 1}, 'highlight': {'path': ['title', 'contents']}}}, {'$project': {'_id': 1, 'title': 1, 'contents': 1, 'url': 1, 'score': {'$meta': 'searchScore'}, 'highlights': {'$meta': 'searchHighlights'}}}, {'$limit': 20}]","안녕하세요! 필리핀에서 오신 근로자분이시군요. 현재 상황이 많이 어렵겠네요. 급여를 받지 못한 것은 매우 심각한 문제입니다. 다음과 같은 방법으로 해결할 수 있습니다.

1. **관할 노동청에 진정 제기하기**: 귀하의 사업장이 위치한 지역의 지방 고용노동청에 진정을 제기할 수 있습니다. 이는 체불된 급여를 청구하는 공식적인 절차입니다. 진정서는 직접 방문하시거나 고용노동부 홈페이지를 통해 온라인으로 제출할 수 있습니다.
   - **온라인 신청**: 고용노동부 홈페이지([www.moel.go.kr](http://www.moel.go.kr))에 접속하여, 민원 신청 메뉴에서 '체불임금 진정신고서'를 작성하시면 됩니다.
   - **방문 신청**: 해당 노동청에 직접 가셔서 진정서를 제출하실 수 있습니다.

2. **법률 상담 받기**: 대한법률구조공단(☎ 132)에서 무료로 법률 상담을 받을 수 있습니다. 법률 전문가와 상담을 통해 구체적인 조언과 지원을 받을 수 있습니다.

3. **민사소송 제기**: 만약 위의 방법으로 해결이 어려운 경우, 민사소송을 통해 임금 청구 소송을 제기할 수 있습니다. 이 경우 법률 서비스의 도움을 받는 것이 좋습니다.

파산한 회사의 경우, 공정거래위원회나 법원에 파산 신청이 되어 있을 수 있으며, 이 경우에도 급여 지불 관련 법적 절차가 있을 수 있습니다. 반드시 빠른 시간 안에 조치를 취하시고, 필요할 경우 전문적인 법률 상담을 받는 것이 중요합니다. 상황이 잘 해결되기를 바랍니다!","['689b3a86ffd306c1cd3c0960', '689b3a86ffd306c1cd3c09a4', '689b3a86ffd306c1cd3c0815', '689b3a86ffd306c1cd3c091b', '689b3a86ffd306c1cd3c0861', '689b3a86ffd306c1cd3c071e', '689b3a86ffd306c1cd3c09a8', '689b3a86ffd306c1cd3c0744', '689b3a86ffd306c1cd3c0801', '689b3a86ffd306c1cd3c087f', '689b3a86ffd306c1cd3c0949', '689b3a86ffd306c1cd3c0872', '689b3a86ffd306c1cd3c098b', '689b3a86ffd306c1cd3c0991', '689b3a86ffd306c1cd3c0819', '689b3a86ffd306c1cd3c07c5', '689b3a86ffd306c1cd3c0874', '689b3a86ffd306c1cd3c096f', '689b3a86ffd306c1cd3c0898', '689b3a86ffd306c1cd3c078e']",1,1.0
"사업장 변경 신청 이후 제가 불법체류자가 될 수 있다는 우편이 날아왔어요. 8월 22일까지만 체류가 허가되어있고, 9월부터는 쫓겨날 수도 있대요. 어떡하죠?",在申请变更工作单位之后，我收到了一封信，说我可能会变成非法滞留者。只被允许停留到8月22日，从9月开始可能会被驱逐。我该怎么办呢？,중국어,"['689b3a86ffd306c1cd3c0680', '689b3a86ffd306c1cd3c0683', '689b3a86ffd306c1cd3c06d2', '689b3a86ffd306c1cd3c072a', '689b3a86ffd306c1cd3c072b', '689b3a86ffd306c1cd3c074a', '689b3a86ffd306c1cd3c07b1', '689b3a86ffd306c1cd3c0831', '689b3a86ffd306c1cd3c0840', '689b3a86ffd306c1cd3c08d6', '689b3a86ffd306c1cd3c093f', '689b3a86ffd306c1cd3c072a', '689b3a86ffd306c1cd3c081f', '689b3a86ffd306c1cd3c082b', '689b3a86ffd306c1cd3c0837', '689b3a86ffd306c1cd3c088c', '689b3a86ffd306c1cd3c092f', '689b3a86ffd306c1cd3c0930', '689b3a86ffd306c1cd3c092c', '689b3a86ffd306c1cd3c0831']",체류자격,경기도외국인지원센터_상담사례,황예원,,https://gmhr.or.kr/case/1679?sca=%EC%B2%B4%EB%A5%98%EC%9E%90%EA%B2%A9,"제가 직장 변경을 신청한 후, 불법 체류자가 될 수 있다는 편지를 받았습니다. 8월 22일까지만 체류가 허용되며, 9월부터는 추방될 수 있다고 합니다. 저는 어떻게 해야 하나요?","[{'$search': {'index': 'text', 'compound': {'should': [{'text': {'query': ['불법 체류', '추방', '비자 문제', '체류 허가'], 'path': ['title', 'contents'], 'fuzzy': {'maxEdits': 1, 'prefixLength': 2}}}, {'phrase': {'query': '불법 체류', 'path': 'title', 'slop': 2}}], 'minimumShouldMatch': 1}, 'highlight': {'path': ['title', 'contents']}}}, {'$project': {'_id': 1, 'title': 1, 'contents': 1, 'url': 1, 'score': {'$meta': 'searchScore'}, 'highlights': {'$meta': 'searchHighlights'}}}, {'$limit': 20}]","현재 직장 변경 신청과 관련하여 불법 체류자로 간주될 수 있다는 통지를 받으셨군요. 이런 경우에는 신속하게 다음 단계에 대한 조치를 취하는 것이 중요합니다.

1. **출입국관리사무소에 문의하기**: 가장 먼저 현 상황에 대한 정확한 정보를 얻기 위해 관할 출입국관리사무소에 직접 연락하는 것이 필요합니다. 왜 불법 체류자로 간주되는지, 어떻게 해결할 수 있는지를 문의하세요.

2. **비자 재신청 가능성 확인**: 직장 변경이 허가되지 않았을 경우, 현재의 체류자격이나 비자를 연장할 수 있는지 여부를 확인해 보세요. 상황에 따라 체류자격 변경을 신청할 수있는 경우도 있습니다.

3. **법적 상담 받기**: 필요하다면 법률 상담을 받는 것도 좋은 방법입니다. 대한법률구조공단 또는 이민변호사 등을 통해 권리와 옵션을 확인할 수 있습니다.

4. **신속한 행동**: 고지된 체류 기간이 임박하므로, 가능한 빨리 조치를 취하는 것이 중요합니다. 출국권고 이후에는 강제퇴거의 절차가 진행될 수 있기 때문에, 즉각적인 행동이 필요합니다.

5. **기타 지원 요청**: 어려운 상황에 처해있다면, 외국인 지원 단체나 비영리기관에 도움을 요청하실 수 있습니다.

반드시 본인의 상황에 맞는 정확한 정보를 바탕으로 결정하시기 바랍니다.","['689b3a86ffd306c1cd3c08a1', '689b3a86ffd306c1cd3c096f', '689b3a86ffd306c1cd3c074d', '689b3a86ffd306c1cd3c096d', '689b3a86ffd306c1cd3c09a5', '689b3a86ffd306c1cd3c0912', '689b3a86ffd306c1cd3c097a', '689b3a86ffd306c1cd3c0913', '689b3a86ffd306c1cd3c0914', '689b3a86ffd306c1cd3c098b', '689b3a86ffd306c1cd3c0917', '689b3a86ffd306c1cd3c0916', '689b3a86ffd306c1cd3c06f3', '689b3a86ffd306c1cd3c0915', '689b3a86ffd306c1cd3c0802', '689b3a86ffd306c1cd3c06dc', '689b3a86ffd306c1cd3c06f1', '689b3a86ffd306c1cd3c0688', '689b3a86ffd306c1cd3c0911', '689b3a86ffd306c1cd3c0775']",0,0.0
"제가 중간에 퇴직을 하게 되었는데, 소득세가 체납되어 비자 연장이 안된대요. 그런데 안내 사항을 못알아듣겠어요.",我中途离职了，但是因为拖欠所得税，签证无法延期。可是我听不懂相关的通知内容。,중국어,"['689b3a86ffd306c1cd3c08f8', '689b3a86ffd306c1cd3c08f0', '689b3a86ffd306c1cd3c085a']",체류자격,경기도외국인지원센터_상담사례,황예원,,https://gmhr.or.kr/case/1703?sca=%EC%B2%B4%EB%A5%98%EC%9E%90%EA%B2%A9,"저는 중간에 퇴사했지만, 소득세 체납 때문에 비자를 연장할 수 없습니다. 관련 통지 내용을 이해하지 못합니다.","[{'$search': {'index': 'text', 'compound': {'should': [{'text': {'query': ['소득세 체납', '비자 연장', '퇴사', '통지 내용'], 'path': ['title', 'contents'], 'fuzzy': {'maxEdits': 1, 'prefixLength': 2}}}, {'phrase': {'query': '소득세 체납', 'path': 'title', 'slop': 2}}], 'minimumShouldMatch': 1}, 'highlight': {'path': ['title', 'contents']}}}, {'$project': {'_id': 1, 'title': 1, 'contents': 1, 'url': 1, 'score': {'$meta': 'searchScore'}, 'highlights': {'$meta': 'searchHighlights'}}}, {'$limit': 20}]","비자 연장에 대한 체납 문제는 매우 중요한 사항입니다. 특히 외국인 근로자와 관련하여 세금 체납은 비자 연장에 직접적인 영향을 줄 수 있습니다. 아래 내용은 이해를 돕기 위한 설명입니다.

1. **체납 통지 이해**: 세금이나 건강보험료 등을 체납하게 되면, 출입국 관리 당국에서 이를 확인하게 됩니다. 이 경우, 체납 사실을 알리는 통지서를 받을 수 있습니다. 통지서에는 체납 금액, 납부 방법, 그리고 기한 등이 기재되어 있습니다.

2. **체납액 납부**: 비자 연장을 원하시는 경우, 체납된 세금이나 건강보험료를 모두 납부하셔야 합니다. 납부 후에는 영수증을 보관하시고, 비자 연장 신청 시 이를 첨부하는 것이 좋습니다.

3. **비자 연장 신청**: 체납액을 정리한 후 비자 연장 신청을 하실 수 있습니다. 이때 필요한 서류와 절차는 해당하는 출입국 관리사무소에서 확인하셔야 하며, 예방 차원에서 소지하신 모든 관련 서류를 준비하시는 것이 좋습니다.

4. **비자 연장 제한**: 지불하지 않은 체납액이 있는 경우, 비자 연장이 제한될 수 있으며, 이 경우 통상적으로 6개월 이하로만 허가되는 경우가 많습니다. 따라서 지체 없이 납부하시고 비자 연장을 신청하는 것이 중요합니다.

이와 같은 절차를 따르시면 체납 문제로 인한 비자 연장 불허 상황을 극복할 수 있습니다. 추가적인 질문이 있으시거나 도움이 필요하시면 가까운 출입국관리사무소나 외국인 종합안내센터(1345)에 문의하시는 것도 좋은 방법입니다.","['689b3a86ffd306c1cd3c08f8', '689b3a86ffd306c1cd3c09a5', '689b3a86ffd306c1cd3c085a', '689b3a86ffd306c1cd3c0813', '689b3a86ffd306c1cd3c0725', '689b3a86ffd306c1cd3c06de', '689b3a86ffd306c1cd3c090c', '689b3a86ffd306c1cd3c07b1', '689b3a86ffd306c1cd3c0758', '689b3a86ffd306c1cd3c0994', '689b3a86ffd306c1cd3c09a2', '689b3a86ffd306c1cd3c0982', '689b3a86ffd306c1cd3c097d', '689b3a86ffd306c1cd3c06ca', '689b3a86ffd306c1cd3c06e4', '689b3a86ffd306c1cd3c0979', '689b3a86ffd306c1cd3c09a3', '689b3a86ffd306c1cd3c0837', '689b3a86ffd306c1cd3c0865', '689b3a86ffd306c1cd3c068e']",1,0.6666666666666666
"회사에서 갑자기 나오지 말라고 해서, 체류 자격이 박탈될 것 같습니다. 저는 어떻게 해야 하나요?","Công ty đột ngột bảo tôi đừng đến nữa, nên có thể tôi sẽ bị tước tư cách lưu trú. Tôi phải làm thế nào?",베트남어,"['689b3a86ffd306c1cd3c06dc', '689b3a86ffd306c1cd3c06de', '689b3a86ffd306c1cd3c06ef', '689b3a86ffd306c1cd3c06f0', '689b3a86ffd306c1cd3c06f3', '689b3a86ffd306c1cd3c072b', '689b3a86ffd306c1cd3c0910', '689b3a86ffd306c1cd3c0912']",부당해고,경기도외국인지원센터_상담사례,황예원,,,"회사가 갑자기 더 이상 출근하지 말라고 해서, 제가 체류 자격을 잃을 수 있습니다. 어떻게 해야 하나요?","[{'$search': {'index': 'text', 'compound': {'should': [{'text': {'query': ['체류 자격', '비자 문제', '이민 상담', '체류 허가'], 'path': ['title', 'contents'], 'fuzzy': {'maxEdits': 1, 'prefixLength': 2}}}, {'phrase': {'query': '체류 자격', 'path': 'title', 'slop': 2}}], 'minimumShouldMatch': 1}, 'highlight': {'path': ['title', 'contents']}}}, {'$project': {'_id': 1, 'title': 1, 'contents': 1, 'url': 1, 'score': {'$meta': 'searchScore'}, 'highlights': {'$meta': 'searchHighlights'}}}, {'$limit': 20}]","회사가 갑자기 출근하지 말라고 통보받은 상황에 대해 매우 걱정이 많으실 것 같습니다. 체류 자격을 잃지 않기 위해서는 몇 가지 조치를 취해야 합니다.

1. **근로계약서 확인**: 먼저, 귀하의 근로계약서와 관련하여 해고 또는 근로관계의 종료를 명확히 확인해야 합니다. 기업이 근로자를 해고하려면 근로기준법에 따라 정당한 사유와 절차를 따라야 하므로, 임의로 출근을 중지하라는 것은 법적으로 문제가 있을 수 있습니다.

2. **고용센터에 상담**: 관할 고용센터에 문의하여 현재 상황에 대한 상담을 받는 것이 중요합니다. 이곳에서 귀하의 권리와 의무에 대한 안내를 받을 수 있습니다.

3. **체류자격 변경 신청**: 회사에서의 근로가 중단되었으므로, 빠르게 새로운 취업처를 찾아야 합니다. 특정 체류 자격에 따라 새로운 근로계약을 체결하거나 체류 자격을 변경하려면, 관련 서류를 준비하고 출입국관리사무소에 서둘러 신청해야 합니다.

4. **법적 상담**: 상황이 복잡하거나 회사와의 갈등이 있을 경우, 법률 전문가와 상담하여 조언을 받는 것이 좋습니다. 특히, 해고의 정당성과 체류 자격에 대한 법적인 측면에서 도움을 받을 수 있습니다.

5. **취업 허가**: 새로 취업할 회사 및 직무에 맞는 체류 자격으로 변경하거나 연장해야 합니다. 이때 필요한 서류(새로운 근로계약서, 외국인등록증 등)를 준비해야 합니다.

이런 조치를 통해 체류 자격을 유지하고, 법적 권리를 보호할 수 있습니다. 추가 도움이 필요하시거나 궁금한 점이 있다면 언제든지 질문해 주세요.","['689b3a86ffd306c1cd3c0913', '689b3a86ffd306c1cd3c06fc', '689b3a86ffd306c1cd3c0917', '689b3a86ffd306c1cd3c0914', '689b3a86ffd306c1cd3c0915', '689b3a86ffd306c1cd3c0916', '689b3a86ffd306c1cd3c096d', '689b3a86ffd306c1cd3c06e1', '689b3a86ffd306c1cd3c0695', '689b3a86ffd306c1cd3c06db', '689b3a86ffd306c1cd3c07ff', '689b3a86ffd306c1cd3c06f3', '689b3a86ffd306c1cd3c06d9', '689b3a86ffd306c1cd3c0912', '689b3a86ffd306c1cd3c06de', '689b3a86ffd306c1cd3c067d', '689b3a86ffd306c1cd3c0885', '689b3a86ffd306c1cd3c090b', '689b3a86ffd306c1cd3c06dc', '689b3a86ffd306c1cd3c06f0']",1,0.625
